bank,subreddit,title,selftext,score,num_comments,url,permalink,created_utc,created_date,author,id
ENBD,TradingViewSignals,All flights to and from Dubai have been temporarily suspended. Emirates Airlines $ENBD is currently facing challenges.,"Emirates airline just posted: 

Please do not go to the airport.

Emirates will share updates when available. We would like to thank our customers for their understanding and patience.

The safety of our passengers and crew is our highest priority and will not be compromised.",1,1,https://i.redd.it/hzvrpldc9cpg1.jpeg,https://www.reddit.com/r/TradingViewSignals/comments/1rv0bud/all_flights_to_and_from_dubai_have_been/,1773636976.0,2026-03-16 04:56:16,Ubersicka,1rv0bud
ENBD,UAE,Security breach using Emirates NBD Liv app,"I'm sure you some of you are aware of the Botim app developer controversy where Botim app was able to access everything on your phone including passwords. Once google and apple was notified they deplatformed the app. 

When things got weirder. I was using my Emirates NBD and Liv account both had a benefitary listed on my account who I never added and knew nothing about. When I approach the bank I was pushed to multiple support teams and they always respond a day later and ask to explain something I previously explained. Then pushed to WhatsApp support number and the support on WA asked to send them an email to explain and the email support sends me back to WhatsApp. 

So I decided to pen test the app because I knew this was not normal. Upon testing I found out that the banking app takes screen shot and camera photos which you are logging in. 

I can't share my pen testing tool as it's illegal in UAE. 

I have submitted my findings to UAE central bank and tra. Do far they can't decide who is responsible for checking these things.

If I don't get a response from the bank I will be closing my account and I welcome alternatives. ",15,20,https://www.reddit.com/r/UAE/comments/1rubx2s/security_breach_using_emirates_nbd_liv_app/,https://www.reddit.com/r/UAE/comments/1rubx2s/security_breach_using_emirates_nbd_liv_app/,1773574894.0,2026-03-15 11:41:34,waseembelushi,1rubx2s
ENBD,UAE,Travel to Oman by car (with a car loan enbd),"Hi there, my understanding is that I would need a NOC from the bank but currently they are not providing any. 

How likely to be asked when crossing the border? 

Thanks",1,10,https://www.reddit.com/r/UAE/comments/1rubar3/travel_to_oman_by_car_with_a_car_loan_enbd/,https://www.reddit.com/r/UAE/comments/1rubar3/travel_to_oman_by_car_with_a_car_loan_enbd/,1773572806.0,2026-03-15 11:06:46,reckor-usa,1rubar3
ENBD,dubaiclassifieds,"[WTS] MacBook Pro M5 16/1TB 14"" USA version","I want to sell MacBook Pro M5 16/1TB 14"" USA verison. Brand New, Sealed, Non Active. 

No trade in.

Price: AED6800
Location: Dubai",1,7,https://www.reddit.com/gallery/1ru9ash,https://www.reddit.com/r/dubaiclassifieds/comments/1ru9ash/wts_macbook_pro_m5_161tb_14_usa_version/,1773565439.0,2026-03-15 09:03:59,spd_dubai,1ru9ash
ENBD,u_UT_1982,How safe us IBKR given the situation in ME? (Advice Needed),"Hi All,

Have been a long time resident of UAE and given the situation am considering to move funds into IBKR. I have a very minimal amount already invested in ibkr at the moment as most savings are in India but given the currency devaluations planning to move all the funds to IBKR. I did a few trades previously and transferring from enbd and back into enbd with ibkr was easy. 

\- Wanted to understand if peple have had any difficulties previously with amounts of usd 500k and more to move into ibkr and withdraw from enbd?

\- Is it safe to have huge sums in ibkr?

Thanks in advance.",1,2,https://www.reddit.com/r/u_UT_1982/comments/1ru71lf/how_safe_us_ibkr_given_the_situation_in_me_advice/,https://www.reddit.com/r/u_UT_1982/comments/1ru71lf/how_safe_us_ibkr_given_the_situation_in_me_advice/,1773556914.0,2026-03-15 06:41:54,UT_1982,1ru71lf
ADCB,HungryArtists,"[For Hire] I'm a Multimedia Designer TouchDesigner/CGI/3D Character Rig, MoCap, Animation, Textures/VFX Pro","Hello, I'm a multimedia designer and independent artist that has worked for a little more than 5 years in various industry projects. 
If you need a set of visuals for a live performance that must run in real time, 3D art for a game or project. Develop a narrative with animation and storytelling. Design and realize a VFX heavy scene. Anything I can do, you can count on me.

We can create:

Optimized 3D: Modeling, Retopology, Texturing. Character Rigging, Animation & MoCap Clean up. Animation Sets. Delivered in any file format you need. 

VFX Development & Integration: Develop your idea for a VFX oriented composition in your scene or project. 

Set of Visuals(Live): Create a set of visuals (clips, animation, motion graphics) for your content or live performances. I can work using tools like TouchDesigner/Resolume to help you create a set of live visuals that can react to your audio input, be controlled in real time and synch with your set. 

Motion graphics/2D-3D Animation: I will help you in making a motion graphic, or 2D/3D animation for your brand. 

3D Rendering & Product Animation: I will help you develop interesting 3D renders for your products or environments. So you can showcase what you make yo your clients. 

Portfolio: https://linktr.ee/ivangeraldo

Hourly Rate: $12/hr

You can reach out to me via email:
ivan.geraldo.nu@gmail.com
",1,0,https://www.reddit.com/gallery/1ruzen7,https://www.reddit.com/r/HungryArtists/comments/1ruzen7/for_hire_im_a_multimedia_designer/,1773633995.0,2026-03-16 04:06:35,IvanGeraldo,1ruzen7
ADCB,Artistsforhire,"[For Hire] I'm a Multimedia Designer TouchDesigner/CGI/3D Character Rig, MoCap, Animation, Textures/VFX Pro | $12/hr","Hello, I'm a multimedia designer and independent artist that has worked for a little more than 5 years in various industry projects. 
If you need a set of visuals for a live performance that must run in real time, 3D art for a game or project. Develop a narrative with animation and storytelling. Design and realize a VFX heavy scene. Anything I can do, you can count on me.

We can create:

Optimized 3D: Modeling, Retopology, Texturing. Character Rigging, Animation & MoCap Clean up. Animation Sets. Delivered in any file format you need. 

VFX Development & Integration: Develop your idea for a VFX oriented composition in your scene or project. 

Set of Visuals(Live): Create a set of visuals (clips, animation, motion graphics) for your content or live performances. I can work using tools like TouchDesigner/Resolume to help you create a set of live visuals that can react to your audio input, be controlled in real time and synch with your set. 

Motion graphics/2D-3D Animation: I will help you in making a motion graphic, or 2D/3D animation for your brand. 

3D Rendering & Product Animation: I will help you develop interesting 3D renders for your products or environments. So you can showcase what you make yo your clients. 

Portfolio: https://linktr.ee/ivangeraldo

Hourly Rate: $12/hr

You can reach out to me via email:
ivan.geraldo.nu@gmail.com",1,0,https://www.reddit.com/gallery/1ruz24s,https://www.reddit.com/r/Artistsforhire/comments/1ruz24s/for_hire_im_a_multimedia_designer/,1773632950.0,2026-03-16 03:49:10,IvanGeraldo,1ruz24s
ADCB,UAEcreditcards,Is foreclosure of payment plans mandatory for closing ADCB CC. even though balance is zero,"I’m trying to close my ADCB CC.  Paid a big portion of the utilized amount from another bank (now it’s Zero). So when i went to their branch in the same payment date. They told me that its showing 4k AED

So i don’t know if it’s due the time needed to be reflected in the bank system or is it related to the several payment plans ?

Also if there’s a way to cancel it using the app or customer service. Would be appreciated ",2,1,https://www.reddit.com/r/UAEcreditcards/comments/1ruvzpm/is_foreclosure_of_payment_plans_mandatory_for/,https://www.reddit.com/r/UAEcreditcards/comments/1ruvzpm/is_foreclosure_of_payment_plans_mandatory_for/,1773624255.0,2026-03-16 01:24:15,First-Emergency6278,1ruvzpm
ADIB,dubai,ADIB bank online banking is down?,"Trying to loginto ADIB bank online banking. Its say “ the requested URL was rejected…”

Anyone else facing same issue?",1,0,https://www.reddit.com/r/dubai/comments/1rv1mvk/adib_bank_online_banking_is_down/,https://www.reddit.com/r/dubai/comments/1rv1mvk/adib_bank_online_banking_is_down/,1773641478.0,2026-03-16 06:11:18,liquiddxb,1rv1mvk
ADIB,RokuHacks,Will this Roku Streaming Stick Plus allow decent Apple Airplay and Windows Miracast?,Wanna get this for my gf who has a google tv and therefore can't cast her iPhone or Windows laptop (natively at least). Will this do the trick?,2,3,https://i.redd.it/ib2y1troz6pg1.png,https://www.reddit.com/r/RokuHacks/comments/1rubf3l/will_this_roku_streaming_stick_plus_allow_decent/,1773573214.0,2026-03-15 11:13:34,how_do_change_my_dns,1rubf3l
ADIB,Roku,Will this Roku Streaming Stick Plus allow decent Apple Airplay and Windows Miracast?,Wanna get this for my gf who has a google tv and therefore can't cast her iPhone or Windows laptop (natively at least). Will this do the trick?,9,10,https://i.redd.it/5e3vku9hl6pg1.png,https://www.reddit.com/r/Roku/comments/1rua3zd/will_this_roku_streaming_stick_plus_allow_decent/,1773568494.0,2026-03-15 09:54:54,how_do_change_my_dns,1rua3zd
FAB,UAEcreditcards,"Best Backup card for Travel: With low or zero FX fees, low to zero Annual fees and no Min spend criteria. Citi cash back or Fab Z Card or Wio Card? Which is better ?","Hi. I am looking for a card only to use for Travel. 

I have a SIB cashback card and I recently used for travel (outside UAE). But it incurred heavy FX fees. Earlier, I have used HSBC card as well, which incurred heavy FX fees. So I am looking for a credit card, with virtually no FX fees and hopefully little to none annual fees. 

I am planning to travel to South east Asia and eventually around Europe and would not like to be carrying large amounts cash around at the same time, not spend a lot on FX fees. 

I have narrowed down to 3 options: 

1. Citi Cash Back Card 

2. FAB Z Card 

3. Wio Card 

Currently I am leaning towards the FAB Z Card, considering the Annual fees is only 100 Dhs but I would like to go with the Citi Bank card, considering the cashback and also the lounge access which comes with it, but I am avoiding it because of the 300dhs annual fees. 

What would you recommend ? Which would be a better option or would you recommend another card? ",7,17,https://www.reddit.com/gallery/1ruhlp6,https://www.reddit.com/r/UAEcreditcards/comments/1ruhlp6/best_backup_card_for_travel_with_low_or_zero_fx/,1773590027.0,2026-03-15 15:53:47,Ni__Mo,1ruhlp6
