bank,subreddit,title,selftext,score,num_comments,url,permalink,created_utc,created_date,author,id
EI,Suomi,Ukrainan ja Iranin sota: Mihin Yhdysvalloilla on varaa?,"Osa on saattanut jo kuulla, että [Trumpin hallinto pyytää kongressilta 200 miljardia dollaria lisää rahaa Iranin sotaa varten](https://apnews.com/article/iran-war-us-pentagon-972ec1bd956a2c3633e6ab7fff389791). Osa saattaa myös muistaa, että yksi Trumpin vaaliaseista 2024 oli Ukrainan tuen lopettaminen, koska se oli liian kallista yhdysvaltalaisille. Mutta kuinka paljon Yhdysvallat tukivat Ukrainaa?

2022 sodan alettua [Ukraina on saanut tukea Yhdysvalloilta](https://www.cfr.org/articles/how-much-us-aid-going-ukraine) yhteensä noin 127 miljardin dollarin edestä. Tästä summasta aseellisen tuen osuus on 70 miljardia, rahallinen tuki 53 miljardia ja humanitaarinen tuki 4 miljardia.

https://preview.redd.it/oa4dtwitqfqg1.png?width=512&format=png&auto=webp&s=a1ad16296b033fb70c7ef88540bb3db876f93cac

Aseellisen tuen osuus on käsittääkseni hieman harhaanjohtava summa, koska käsittääkseni tämä kattaa Yhdysvaltojen antaman kaluston korvaamiseen kuluvan summan, ei kaluston tai ammusten tämän hetkistä arvoa. Tämä vastaa sitä, että sinä lahjottaisit minulle vanhan autosi, josta voisit parhaimmillaan saada 5000€ myytäessä. Mutta kun ostat vanhan auton tilalle uuden 50 000€ auton, niin voit sanoa tukeneesi minua 50 000€ edestä.

Tällä hetkellä Trump siis pyytää 57% enemmän Iranin sotaa varten kuin mitä Yhdysvallat ovat käyttäneet yhteensä Ukrainan tukemiseen viimeisen neljän vuoden aikana. Tässä ajassa Ukraina on todistetusti tuhonnut Venäjältä yli 4 000 panssarivaunua, yli 8 000 rynnäkkövaunua, 181 lentokonetta, 168 helikopteria, 29 sotalaivaa, ja valtavan määrän muuta kalustoa.

https://preview.redd.it/k3ntjdxxrfqg1.png?width=569&format=png&auto=webp&s=eda72894a33179db8bbf4b80bdef8e2bc6ab169a

Iranin sodan aikana Yhdysvallat ja Israel ovat tuhonneet Iranilta ilmeisesti [28 lentokonetta, 21 laivaa, 300 ohjusalustaa](https://www.theguardian.com/world/2026/mar/21/middle-east-iran-conflict-environment-climate), ja [yhden koulun](https://www.bbc.com/news/articles/c1l7rvqq51eo).

Mutta suorat menot eivät ole kaikki kaikessa. Yhdysvaltalaiset joutuvat maksamaan Epstein Fury operaation suorat kustannusten verojen kautta tietenkin, mutta tämän lisäksi siitä on seurannut ja tulee seuraamaan muita kustannuksia. Etenkin öljyn hinnan nousu nostaa sodan kokonaishintaa FIFA:n rauhanpalkinnon saajan kannattajien osalta. [Yhdysvallat kuluttavat raakaöljyä noin 100 miljoonaa barrelia päivittäin](https://en.wikipedia.org/wiki/List_of_countries_by_oil_consumption). Iranin sodan alettua öljyn hinta on noussut nopeasti, ja tämä hinnan nousu valuu lopulta kuluttajien maksettavaksi.

https://preview.redd.it/x2scyx8ztfqg1.png?width=740&format=png&auto=webp&s=1851e20afd54f46d44be752efabe20d753b029ca

Ennen sotaa öljyn hinta pyöri jossain 60-70 dollarin paikkeilla, kun nyt se on lähemmäs 100 dollaria. 30 dollarin hinnan nousu tarkoittaa amerikkalaisten kulutusten perusteella 3 miljardin dollarin lisäkustannuksia jokaiselta päivältä. Iranin sota on kestänyt nyt noin 3 viikkoa, jolloin yhteensä lisäkuluja on kertynyt noin 63 miljardin dollarin edestä. Jo yksistään tämä on samaa suuruusluokkaa kuin Yhdysvaltojen aseellinen tuki Ukrainalle 4 vuoden aikana. Jos öljyn hinta pysyisi näin korkealla elokuuhun asti, niin siitä seuranneet lisäkustannukset kuluttajille olisivat tämän yksinkertaisen arvion perusteella päälle 400 miljardia dollaria, eli yli 1000 dollaria per amerikkalainen. Jos tähän lisätään Pentagonin lisärahoitus, niin hinta olisi yhteensä jotain 1 700 dollaria per nuppi siitä ilosta, että Irania pommitetaan hieman. Ukrainaa puolestaan tuettiin noin 360 dollarin edestä. Toki Ukrainan sotakin nosti öljyn hintaa, etenkin aluksi. Tämä on kuitenkin minusta eri asia, koska tämä hinnan nousu oli lopulta Putinin hyökkäyksen vika, ei esimerkiksi Bidenin.



En ole vakaa nero kuten Trump, joten minun mielipiteeni ei tietenkään ole kaikki kaikessa. Mutta uskaltaisin väittää, että objektiivisesti mitattuna Yhdysvallat saivat paljon enemmän aikaiseksi Ukrainan tuella (heikentämällä geopoliittista vastustajaa) kuin nykyisen Iranin sodan rahoituksella (heikennetään jo valmiiksi heikompaa geopoliittista vastustajaa). Ja oman arvioni mukaan iskut Iraniin on nyt helpompi toteuttaa, kun Venäjä on vaikeuksissa Ukrainan kanssa (sama homma miksi Venäjä ei auttanut Assadia Syyriassa).",68,23,https://www.reddit.com/r/Suomi/comments/1rzyqzj/ukrainan_ja_iranin_sota_mihin_yhdysvalloilla_on/,https://www.reddit.com/r/Suomi/comments/1rzyqzj/ukrainan_ja_iranin_sota_mihin_yhdysvalloilla_on/,1774117409.0,2026-03-21 18:23:29,aibrony,1rzyqzj
EI,bloxfruits,Trading 2 permanent Dragon,Dm with offers ,3,5,https://i.redd.it/vcdo2uawxfqg1.jpeg,https://www.reddit.com/r/bloxfruits/comments/1rzyqw3/trading_2_permanent_dragon/,1774117403.0,2026-03-21 18:23:23,Few-Chain-6015,1rzyqw3
EI,learnwelsh,Spotted on the Guildford to Reading trundler,,2,1,https://i.redd.it/rzkhra7rxfqg1.jpeg,https://www.reddit.com/r/learnwelsh/comments/1rzyqkd/spotted_on_the_guildford_to_reading_trundler/,1774117380.0,2026-03-21 18:23:00,naifliccon,1rzyqkd
EI,gameverifying,Is this one real?,,3,3,https://www.reddit.com/gallery/1rzyq4r,https://www.reddit.com/r/gameverifying/comments/1rzyq4r/is_this_one_real/,1774117350.0,2026-03-21 18:22:30,BlueTheHobo,1rzyq4r
EI,u_blajzho,Any free games on pc about f1 or la mans?,,1,0,https://i.redd.it/8p4s05lexfqg1.jpeg,https://www.reddit.com/r/u_blajzho/comments/1rzyojg/any_free_games_on_pc_about_f1_or_la_mans/,1774117240.0,2026-03-21 18:20:40,blajzho,1rzyojg
EI,Kenya,Flood App ( Mvuakenya.com ),"I made this experimental app to check if area can be prone to floods. 

https://mvuakenya.com/",2,0,https://i.redd.it/qxb90l5dxfqg1.png,https://www.reddit.com/r/Kenya/comments/1rzyoaq/flood_app_mvuakenyacom/,1774117226.0,2026-03-21 18:20:26,simpleCoder254,1rzyoaq
EI,Calgary,Do we sell Cucumber Arazona in Calgary?,I had some in Asia and it was really good.  I was wondering if there was somewhere i could pick more up ,0,9,https://i.redd.it/wqfs8k3wwfqg1.png,https://www.reddit.com/r/Calgary/comments/1rzylsn/do_we_sell_cucumber_arazona_in_calgary/,1774117064.0,2026-03-21 18:17:44,Puzzleheaded-Mud7288,1rzylsn
EI,TheBusinessMix,"Prison guard told FBI about 'suspicious' document shredding after Epstein's death, report says","[https://www.msn.com/en-us/news/crime/prison-guard-told-fbi-about-suspicious-document-shredding-after-epstein-s-death-report-says/ar-AA1Z7OPN?ocid=msedgntp&pc=HCTS&cvid=69bee04a6c0a440d92317e9f917992f1&ei=13](https://www.msn.com/en-us/news/crime/prison-guard-told-fbi-about-suspicious-document-shredding-after-epstein-s-death-report-says/ar-AA1Z7OPN?ocid=msedgntp&pc=HCTS&cvid=69bee04a6c0a440d92317e9f917992f1&ei=13)

SOURCE: Ty Roush & Forbes Staff - via MSN ",4,0,https://www.reddit.com/r/TheBusinessMix/comments/1rzyllh/prison_guard_told_fbi_about_suspicious_document/,https://www.reddit.com/r/TheBusinessMix/comments/1rzyllh/prison_guard_told_fbi_about_suspicious_document/,1774117053.0,2026-03-21 18:17:33,Next-Particular1476,1rzyllh
EI,LiberalGooseGroup,「鹅组傻事」“工签？什么工签？”——天了噜！上贴原OP已确认被跨国拐卖！,"前情：

[「鹅组傻事」都被跨国拐卖了还想着交流拳法呢？](https://www.reddit.com/r/LiberalGooseGroup/comments/1rx9gru/鹅组傻事都被跨国拐卖了还想着交流拳法呢/)

时隔一周原OP总算出来回帖，本刊第一时间总结要点如下：

1.老板娘明着对原OP说了不给工签，此事性质确定为跨国拐卖劳工；

2.鉴于老板夫妻威胁原OP找大使馆也没用，本刊高度怀疑是原OP把求助计划傻傻透露给了他们；

3.楼下有多人劝原OP先联系使馆再说，但原OP一直纠结自己证件都没强行没收了，显然还在犹豫（这本就足够报警找使馆求助了）；

4.原OP不确定自己自愿坐飞机来算不算人口贩卖，以这个常识程度本刊合理怀疑老板一家非法雇用未成年劳工；

5.原OP目前最纠结的问题是——红迪无法改她那男味爆表的用户名（如图3）；

6.老板一家是客家人。

从原OP回帖间隔长达一周可以看出她平时很可能无法自由接触手机，加之所有证件被收，人身自由已严重受限。她明显对跨国务工缺乏基本常识，也缺乏基本的警觉性，在人身自由受限的情况下还踟蹰不定。原贴下不少人贴心给出正确建议，可她一直在强调自己的困难，俨然奢望素不相识的网友能帮她摆平一切，在孤身一人的情况下，这种幼稚极其致命。

本刊在这里温馨提醒各位，跨国务工需谨慎，请优先确认雇主的资质及信誉度再做决定。在异国遇到任何限制人身自由或签证不合规等异常现象请第一时间联系当地警方及使馆。遇到意外请务必保持头脑冷静，用一切可能的渠道先脱困，人身安全高于一切。

最后，就不能等他爹的心智成熟了再出国工作吗！

——鹅组傻事反国际人口贩卖组",5,0,https://www.reddit.com/gallery/1rzylb7,https://www.reddit.com/r/LiberalGooseGroup/comments/1rzylb7/鹅组傻事工签什么工签天了噜上贴原op已确认被跨国拐卖/,1774117034.0,2026-03-21 18:17:14,FamousChair9366,1rzylb7
EI,Multifandom,Updated with some added fandoms and other fandoms I forgot about last time,,5,3,https://i.redd.it/g028dfhlwfqg1.jpeg,https://www.reddit.com/r/Multifandom/comments/1rzyk93/updated_with_some_added_fandoms_and_other_fandoms/,1774116966.0,2026-03-21 18:16:06,amatyestv_123846,1rzyk93
EI,Suomi,Hyvä prepaid/internet Tokioon? (EI eSim),"Oma puhelin ei eSimiä tue, joten se on ikävä kyllä poissa pelistä. Ens kuussa oisi tulossa Tokion reissu (ensimmäistä kertaa) ja itsellä ois jaettu vastuu mitä tulee navigoimiseen ja yleensäkin muuhun tiedonhakuun, mutta en oikein tiedä että mikä olisi hyvä prepaid (?) sitä varten vai kannattaako hommata joku mokkula vai miten olisi paras. Löysin myös sovelluksen nimeltä ""Japan Wi-Fi auto-connect"" mikä ilmeisesti automaattisesti yhdistää lähimpään wifiin, mutta onko tuo sitten miten luotettava saati turvallinen?

Kovimmassa käytössä varmasti olisi Google Maps ja Pokemon Go (ja satunnaiset sovellukset metroista, ruokapaikoista, vessojen sijainnista yms yms). Ei oo ennen ollut tarvetta internetille ulkomailla hotelli-wifin ulkopuolella, joten olisin kovin kiitollinen mikäli joku osaisi vinkkiä heittää!",0,18,https://www.reddit.com/r/Suomi/comments/1rzyk08/hyvä_prepaidinternet_tokioon_ei_esim/,https://www.reddit.com/r/Suomi/comments/1rzyk08/hyvä_prepaidinternet_tokioon_ei_esim/,1774116951.0,2026-03-21 18:15:51,Ohh-Deer,1rzyk08
EI,AcaciaKerseySnark,Alphabet Game Day 25 🐞 Y is for:,"One letter per day, so comment what you think it's the best choice. The top-voted comment gets on the list!",3,6,https://i.redd.it/sr2mvvbcwfqg1.jpeg,https://www.reddit.com/r/AcaciaKerseySnark/comments/1rzyiww/alphabet_game_day_25_y_is_for/,1774116880.0,2026-03-21 18:14:40,nolastnamer,1rzyiww
EI,CriarSites,Como criar uma landing page,"Seu negócio merece um site profissional.

Crie com IA em minutos e fortaleça sua presença online com mais credibilidade.",1,0,https://i.redd.it/xj1c1i7uvfqg1.png,https://www.reddit.com/r/CriarSites/comments/1rzyhe4/como_criar_uma_landing_page/,1774116782.0,2026-03-21 18:13:02,LinkFLComBr,1rzyhe4
EI,Miata,what more could a guy want,,9,4,https://i.redd.it/865n9p20wfqg1.jpeg,https://www.reddit.com/r/Miata/comments/1rzyh55/what_more_could_a_guy_want/,1774116766.0,2026-03-21 18:12:46,lookingforagamergirl,1rzyh55
EI,buildapc,Any reason I should talk myself out of picking up this 5080?,"[https://www.newegg.com/gigabyte-windforce-gv-n5080wf3-16gd-geforce-rtx-5080-16gb-graphics-card-triple-fans/p/N82E16814932780](https://www.newegg.com/gigabyte-windforce-gv-n5080wf3-16gd-geforce-rtx-5080-16gb-graphics-card-triple-fans/p/N82E16814932780)  

I havent bought a card since my 3080 back 5 years ago. Is this a decent price for this or is there a better 5080 out ther eI should consider? Also like that it comes with a PSU and RE9 😁",1,2,https://www.reddit.com/r/buildapc/comments/1rzygjk/any_reason_i_should_talk_myself_out_of_picking_up/,https://www.reddit.com/r/buildapc/comments/1rzygjk/any_reason_i_should_talk_myself_out_of_picking_up/,1774116726.0,2026-03-21 18:12:06,krinkov,1rzygjk
EI,VoiceWork,Looking For Work,"My portfolio:

[Demo's 1](https://1drv.ms/f/c/7a152652d94bf272/IgBe7YnX8aqsTJUW6Z3rb6x-ATJ05XHki31f2s892T_Y-x8?e=EiIXaW)

My Rate is $5 an hour and My contact information is:  
[joeymccall822@gmail.com](mailto:joeymccall822@gmail.com) and my discord is:

\_jokes\_

Thank you.",0,0,https://www.reddit.com/r/VoiceWork/comments/1rzyg4u/looking_for_work/,https://www.reddit.com/r/VoiceWork/comments/1rzyg4u/looking_for_work/,1774116699.0,2026-03-21 18:11:39,Illustrious_Wait_677,1rzyg4u
EI,kiastinger,anyone else got a weekend car in rotation?,,3,7,https://i.redd.it/rv4ezywqvfqg1.jpeg,https://www.reddit.com/r/kiastinger/comments/1rzyfuc/anyone_else_got_a_weekend_car_in_rotation/,1774116680.0,2026-03-21 18:11:20,lookingforagamergirl,1rzyfuc
EI,fut,Need help,I dont ve a good rb and i got russo toty st whom should i choose?,0,1,https://i.redd.it/nfmhzhe9vfqg1.jpeg,https://www.reddit.com/r/fut/comments/1rzydb0/need_help/,1774116518.0,2026-03-21 18:08:38,metalstone02,1rzydb0
EI,stealabrainrot,dj panda naturally spawned????? whats it worth,,1,2,https://i.redd.it/hmlq8mc3vfqg1.png,https://www.reddit.com/r/stealabrainrot/comments/1rzycfb/dj_panda_naturally_spawned_whats_it_worth/,1774116463.0,2026-03-21 18:07:43,LeftChocolate9897,1rzycfb
EI,CURRENCY,Funky Dollars,Im guessing hodl right?,5,2,https://www.reddit.com/gallery/1rzyc8g,https://www.reddit.com/r/CURRENCY/comments/1rzyc8g/funky_dollars/,1774116452.0,2026-03-21 18:07:32,Shtevezzz,1rzyc8g
EI,AlexandriaEgy,فحل المرج,"حوار فحل المرج و فحل نزله السمان ده بقي بضان فشخ 

من ضمن الاسكرينات اللي شوفتها استفزتني فشخ انه العلق بيحلل و يحرم علي مزاجه مهو الدين بقي لعبه لمجرد انك هيجان و submissive ",9,11,https://i.redd.it/mdp3eofvufqg1.jpeg,https://www.reddit.com/r/AlexandriaEgy/comments/1rzyb7f/فحل_المرج/,1774116386.0,2026-03-21 18:06:26,Economy-Raisin-4975,1rzyb7f
EI,touhou,我该怎么办 what do I do,"我刚下载并打开游戏，都会显示乱码，我不懂关于电脑的事情，也不知道是哪里出了问题。

When I download and open the game, it displays garbled characters. I don't know anything about computers and I don't know what's wrong.",8,2,https://i.redd.it/7w97k0ihufqg1.jpeg,https://www.reddit.com/r/touhou/comments/1rzy97w/我该怎么办_what_do_i_do/,1774116258.0,2026-03-21 18:04:18,ShameimaruMomiji,1rzy97w
EI,Without_The_Hijab,Response to 23 Questions - Part 8 - Veil (Parda) - Javed Ahmed Ghamidi,,1,0,https://www.youtube.com/watch?v=vJx8K0c7irE,https://www.reddit.com/r/Without_The_Hijab/comments/1rzy5xg/response_to_23_questions_part_8_veil_parda_javed/,1774116054.0,2026-03-21 18:00:54,AutoModerator,1rzy5xg
EI,skoda,Carplay,"Hello everyone,

I recently bought a 2014 Škoda Octavia Mk3 and installed a CarPlay box because my original system doesn’t support Apple CarPlay.

I connected everything according to the instructions, but unfortunately the screen stays black and nothing is displayed.

Has anyone here installed a similar CarPlay box before and could help me with:

	•	what the problem might be, or

	•	which settings or DIP switches need to be activated?

I would really appreciate any help. Thanks! 👍",2,1,https://i.redd.it/tshq7nhutfqg1.jpeg,https://www.reddit.com/r/skoda/comments/1rzy5o9/carplay/,1774116041.0,2026-03-21 18:00:41,Brave-Fix2309,1rzy5o9
EI,drawing,PATIENCE (Explanation of artwork in body text),"This doodle captures a man caught between time and expectation. He sits still, composed on the surface, yet the repeated word ""patience"" around him feels more like pressure than guidance. It reflects how people are constantly told to wait, even when answers are nowhere in sight. The empty window behind him symbolizes some good possibilities of future. His stillness is not peace, but restraint. This artwork shows that patience is not passive, it demands strength and control. The man is enduring, not because it is easy, but because he must making patience a quiet, ongoing test of resilience. 
",2,2,https://i.redd.it/7jbvzwdjsfqg1.jpeg,https://www.reddit.com/r/drawing/comments/1rzxz3f/patience_explanation_of_artwork_in_body_text/,1774115601.0,2026-03-21 17:53:21,cos2ub,1rzxz3f
EI,Roumanie,"Călin Georgescu, în 2020, pe când pregătea lovitura de stat: „Pandemia prostiei, a fricii și a ignoranței.”",,11,11,https://i.redd.it/3pkyk09dsfqg1.jpeg,https://www.reddit.com/r/Roumanie/comments/1rzxyxn/călin_georgescu_în_2020_pe_când_pregătea_lovitura/,1774115590.0,2026-03-21 17:53:10,Valuable_Slide_1171,1rzxyxn
EI,sketches,PATIENCE ( Explanation of artwork in body text ),"This doodle captures a man caught between time and expectation. He sits still, composed on the surface, yet the repeated word ""patience"" around him feels more like pressure than guidance. It reflects how people are constantly told to wait, even when answers are nowhere in sight. The empty window behind him symbolizes some good possibilities of future. His stillness is not peace, but restraint. This artwork shows that patience is not passive, it demands strength and control. The man is enduring, not because it is easy, but because he must making patience a quiet, ongoing test of resilience. 
",1,1,https://i.redd.it/y4rx7mzcsfqg1.jpeg,https://www.reddit.com/r/sketches/comments/1rzxy6p/patience_explanation_of_artwork_in_body_text/,1774115542.0,2026-03-21 17:52:22,cos2ub,1rzxy6p
EI,bucuresti,De ce un contract de închiriere de regulă nu are valoare și mai tare te încurcă?,"Salutare la toată lumea! Am mai scris postări pe subiectul ăsta al chiriilor, cine este interesat le găsește rapid în contul meu. 

Piața chiriilor în București e un fel de vestul sălbatic. Proprietari și chiriași care la început sunt prieteni apoi pe parcursul chiriei ajung să se urască și într-un final devin care pe care, cine să țăpuiscă mai tare pe celălalt. Rareori ajung să-și strângă mâna la final.

Avem chiriași care nu-si plătesc datoriile, lasă mizerie și stricăciuni sau proprietari care nu fac reparații și nu returnează garanția. Despre reparații și garanție o să fac altă postare, că e multă confuzie și aici, dar de regulă am văzut că lucrurile astea se întâmplă când chiriașii închiriază fără contract și plătesc chirie numerar. 

Am scris de multe ori și în postări și prin comentarii că este esențial înainte să închiriezi să faci niște minime verificări. Mulți au scris, siderați, că vezi Doamne încalci dreptul la viață privată, dreptul de confidențialitate, gdpr bla bla bla.... De parcă atunci când îți lasă chiriașul varză casa și cu datorii, fix de drepturile lui protejate te mai interesează. Chiar și așa eu accept și varianta unei garanții mai mare dacă totuși pare de treabă, dar nu vrea să dea detalii despre el sau dovezi privind veniturile.

Pe scurt, dacă un chiriaș care nu are venituri, nu are bunuri pe numele său, nu are pe cineva care să garanteze pentru el, nu achită o garanție mai mare, dacă îl accepți doar pe vorbe, pe încredere, e ca și cum tu garantezi pentru el că își va respecta obligațiile (plata chiriei, a utilităților, păstrarea  apartamentului curat etc).

Contractul te ajută doar în măsură în care chiriașul este o persoană care are de pierdut în cazul în care este dat în judecată, evacuat prin instanță sau direct prin executor (nu stau să plictisesc cu detalii dar, depinde după cum e împlinit sau nu termenul contractului). Dacă el lucrează la negru (destul de frecvent in ziua de azi din cauza taxelor mari pe care le plătesc anagajatorii) si nu are bunuri ce pot fi urmărite silit, îl va durea în cot de contractul tău. Va trage de timp cat mai mult, va avea un consum mare, iar când o să te vezi până la urmă cu hotărârea în mână după luni bune sau chiar ani, o să vezi că nu ai ce să-i faci. În afară de a-l scoate de acolo, tot ce înseamnă chirie, datorii la utilități, cheltuilei de judecată, cheltuilei cu avocat, cheltuilei cu executarea etc rămân în sarcina ta. 

În ultimul rând, mai sunt unii de zic că riscurile sunt doar in cazurilor în care ai apartamente în zone proaste, neamenajate, unde îți vin tot felul de chiriași.  

Pe de-o parte așa este. Locuințele bune atrag chiriași mai de calitate sa zicem. Dar asa cum văd eu lucrurile, riscurile sunt chiar mai mari. Pentru că in cazul unui apartament într-o zonă rău famată, chiria e mai mică, chiriașii nu stau să se judece cu anii, de regulă se sperie mai ușor și nu așteaptă să vină proprietarul să le arunce lucrurile în stradă că pleacă ei singuri. 

Dar ce te faci în cazul unui apartament in zonă bună unde și chiria e mai mare, iar paguba la final ajunge să fie mult mai mare dacă dai de un chiriaș care știe să exploateze la maximum în favoarea lui sistemul ăsta stricat. Dacă ai un apartament într-o zonă bună, nu înseamnă că ești ferit de riscuri, din contră, pagubele pot fi mult, mult mai mari. 

Deci dacă nu vrei să te complici să faci niște minime verificări sau dacă chiriașul refuză, cum am scris mai sus, că are principii și nu acceptă verificări, dar nici garantie mai mare nu vrea să plătească, mai bine nu faci contract că sunt toate șansele să nu te ajute cu nimic. Doar vor face instanțele, avocații și executorii bani pe seama ta, iar tu rămâi cu ochii în soare.

Legat de verificări, nu ar fi idee rea și chiriașii să le facă, pentru că nu de puține ori s-au trezit că au dat bani grei chirie si garantie, au semnat contract, iar ""proprietarii"" erau niste puștani ce aveau cheile fiindcă închiriaseră în regim hotelier 😐",0,5,https://www.reddit.com/r/bucuresti/comments/1rzxxzt/de_ce_un_contract_de_închiriere_de_regulă_nu_are/,https://www.reddit.com/r/bucuresti/comments/1rzxxzt/de_ce_un_contract_de_închiriere_de_regulă_nu_are/,1774115529.0,2026-03-21 17:52:09,alxalx89,1rzxxzt
EI,comicbookgrading,Do the staples hurt the grade?,I bought this in the '90s for $100. It was labeled VF/NM. I'm glad to have it but always wondered about the grade.,7,4,https://www.reddit.com/gallery/1rzxxxo,https://www.reddit.com/r/comicbookgrading/comments/1rzxxxo/do_the_staples_hurt_the_grade/,1774115525.0,2026-03-21 17:52:05,cheesemonger2501,1rzxxxo
EI,TwentiesIndia,PATIENCE ( Explanation of artwork in body text),"This doodle captures a man caught between time and expectation. He sits still, composed on the surface, yet the repeated word ""patience"" around him feels more like pressure than guidance. It reflects how people are constantly told to wait, even when answers are nowhere in sight. The empty window behind him symbolizes some good possibilities of future. His stillness is not peace, but restraint. This artwork shows that patience is not passive, it demands strength and control. The man is enduring, not because it is easy, but because he must making patience a quiet, ongoing test of resilience. 
",1,0,https://i.redd.it/guur3ws7sfqg1.jpeg,https://www.reddit.com/r/TwentiesIndia/comments/1rzxxh5/patience_explanation_of_artwork_in_body_text/,1774115493.0,2026-03-21 17:51:33,cos2ub,1rzxxh5
