bank,subreddit,title,selftext,score,num_comments,url,permalink,created_utc,created_date,author,id
EI,Roumanie,De ce e lumea asa panicata de Rusia?,"Salutare reditori. As vrea sa deschid si eu un schimb de idei civilizat. Am obssrvat la marea majoritate ca sunt impotriva ideii de a avea Rusia la granita. Dar totusi nu inteleg motivul si va zic si de ce:
1. Daca Ucraina castiga razboiul, mai devreme sau mai tarziu va intra in UE pentru ca asta le este intentia potrivit lui Zelensky. Daca Rusia este atat de invadatoare insemna ca o va ataca oricum nu? Ceea ce implicit inseamna razboi si pentru noi.
2. Daca nu castiga razboiul, poate Rusia se limiteaza la ce a castigat din Ucraina si ne lasa impace pentru ca nu ar mao avea clar nici un sens sa mai intre in razboi cu Nato.

Totusi nu inteleg de ce ar fi atat de rau sa ii avem la granita. Schimbul comercial ar fi foarte bun, ei nefiind in UE ar avea preturi mult mai mici la multe chestii. Combustibilul ar fi mai ieftin, si daca relatiile ar fi bune chiar si energia. Per total cred ca traiul ar fi mai bun pentru cetateanul de rand.

Mi se pare putin cam SF sa credem ca Rusia ar mai dori sa mai cucereasca ceva... doar nu o sa mearga pana in Spania nu?😅


Astept parerile voastre dar sper ca putem pastra un ton civilizat😘",0,57,https://www.reddit.com/r/Roumanie/comments/1rx2eqz/de_ce_e_lumea_asa_panicata_de_rusia/,https://www.reddit.com/r/Roumanie/comments/1rx2eqz/de_ce_e_lumea_asa_panicata_de_rusia/,1773836592.0,2026-03-18 12:23:12,IonNord,1rx2eqz
EI,HENRYUK,"What to do when you feel stuck? Financially comfortable, but not enjoying life","30M, single and run my own small business.

Since leaving education, I have essentially been a workaholic, which has been to my detriment thinking back now.

I am careful with my money and haven’t really wasted it over the years, so any money that I have had I’ve either invested it into the business, put into savings, pension, ISA, premium bonds, GIA account, VCT, EIS etc.

I have around £150k saved up and my NW is a good amount.

I earn around £140k a year that I take out from the business and I don’t really have many expenses as I live with my parents, we all get on well and I pay my fair share, but I’m at the point now where I need to make a change and I don’t know what to do next.

I don’t enjoy work anymore and realistically the business is too reliant on me. If I go, the majority of the business will go and the employees who work at the company are not experienced enough to takeover. Others have said to employ more staff and hand it over, but I have lost that motivation entirely.

I was looking back at photos over the past few years and I have not really enjoyed life. Whereas the majority of my friends have travelled and have had fun. I did kind of alienate my friends because I was so work orientated and all they wanted to do was get drunk which is not for me, so we have drifted over time. Granted financial wise I’m steps ahead of them which doesn't mean anything if you haven't really had much fun as I don’t really have any experiences that I can look back on.

Outside of work I’m very sporty – I’m a regular at the gym, love playing football, and meet up with a few friends every now and then, so I guess it’s not all just work.

So what do I do? The most obvious step is to move out, but if I just buy a house in my hometown / nearby, I will be in the same situation I’m in now, still not enjoying work and I will have a mortgage and will continue to feel stuck.

I could try London out, but do I really want to pay £2,500 - £4,000 per month on rent, when I’ll be in the same situation that I’m in now, but at least I’ll be able to meet more people at a similar age to me and it should get me out of my comfort zone.

This has all come about because I recently came back from holiday and those couple of weeks off were superb, even though I was working part of the time, I did just shut off while I was away, and it made me think, I would love to just have a year off, but then what happens to the business, I can’t just leave it after putting all that work in.

I know I’m in a fortunate position, but I need to make a change and I need to do it soon before another few years pass by.

Any advice on where to move to / what to do next would be appreciated, thanks!",6,10,https://www.reddit.com/r/HENRYUK/comments/1rx2ef1/what_to_do_when_you_feel_stuck_financially/,https://www.reddit.com/r/HENRYUK/comments/1rx2ef1/what_to_do_when_you_feel_stuck_financially/,1773836566.0,2026-03-18 12:22:46,Unable-Leg3044,1rx2ef1
EI,brainrot,İ found... this while scrolling in my reddit folder🤮,,3,5,https://i.redd.it/a3lvguuqqspg1.jpeg,https://www.reddit.com/r/brainrot/comments/1rx2e3m/i_found_this_while_scrolling_in_my_reddit_folder/,1773836540.0,2026-03-18 12:22:20,QualityOdd1392,1rx2e3m
EI,japan_insoul,F2p jamais serão viciados,,22,4,https://i.redd.it/9xqq4h2apspg1.jpeg,https://www.reddit.com/r/japan_insoul/comments/1rx27wr/f2p_jamais_serão_viciados/,1773836046.0,2026-03-18 12:14:06,Kyuss37,1rx27wr
EI,Wikigacha,Erm what,The wiki has no body text and no references,1,0,https://i.redd.it/s1m4k5vgospg1.jpeg,https://www.reddit.com/r/Wikigacha/comments/1rx24i8/erm_what/,1773835773.0,2026-03-18 12:09:33,smumby14,1rx24i8
EI,bloodpressure,High systolic and super low diastolic… is this normal?? 23M,"CONTEXT:

I’m 23M, 6’2 tall and around 103kg. Heart issues run in my family unfortunately, but I don’t think anyone had high BP at this age. 

I’ve had consistently high blood pressure for at least a year now. Started off with panic attacks last year and would also have periodic chest tightness and left arm numbness. Had several ECGs (during A&E visits and other doctor visits) and they were all normal. Travelled to India to see my cardiologist uncle. At India, I did a treadmill stress test, a 2d echo, some ultrasounds and all were normal. Urine tests found that I had protein in my urine though. Also blood tests showed some irregular numbers for plasma renin activity (if I remember correctly). 

Was prescribed nebivolol 2.5mg and have been taking that for a couple months. Initially it felt like it worked well to reduce my BP, but I feel like it’s not working as well now. Back in the UK now and they don’t prescribe this medicine here so I’ve been asked to wean off of it, meaning I’ve been taking it alternative days. Had an MRI a couple weeks ago for aorta but don’t know what the result is. I feel like I don’t know what the outlook is for my blood pressure and what I need to do besides losing weight and exercising. ",3,0,https://i.redd.it/x7xi53ljnspg1.jpeg,https://www.reddit.com/r/bloodpressure/comments/1rx20lo/high_systolic_and_super_low_diastolic_is_this/,1773835464.0,2026-03-18 12:04:24,pranskiiii,1rx20lo
EI,Dhurandhar,Delayed but not cancelled,,27,7,https://i.redd.it/y1tuhx18nspg1.jpeg,https://www.reddit.com/r/Dhurandhar/comments/1rx1z91/delayed_but_not_cancelled/,1773835357.0,2026-03-18 12:02:37,Fast_Ad255,1rx1z91
EI,TokusatsuBr,Gente eu jurava que hoje era sexta feira,,1,0,https://www.reddit.com/gallery/1rx1yzu,https://www.reddit.com/r/TokusatsuBr/comments/1rx1yzu/gente_eu_jurava_que_hoje_era_sexta_feira/,1773835333.0,2026-03-18 12:02:13,Dalila_Bunny,1rx1yzu
EI,snappijuorutofftopic,Stp video hakusessa,"Mun kaverilla on tulossa synttärit ja haluisin omista videopätkistä tehdä sinätuubapaska videon sille lahjaksi. Oon tässä jonkun vuoden liittynyt erinäisiin ryhmiin mistä oon kyselly ja oon kans kattonu ihan joitakin firmoja mutta niissäkin puhutaan lähinnä markkinointi tarkoitukseen tehdyistä videoista ja hyvin tuntus hintaa niilläkin olevan, oon tietenkin valmis maksamaan siitä mutten iha mitään tonneja oo tähän aatellu laittaa xd Iteltä ei lähe videon teko eikä lähipiirissäkään oo ketään jolta onnistus. Stp videot oli meidän koko teiniajan juttu niin siks olis niin tärkeetä (:",1,0,https://www.reddit.com/r/snappijuorutofftopic/comments/1rx1y6r/stp_video_hakusessa/,https://www.reddit.com/r/snappijuorutofftopic/comments/1rx1y6r/stp_video_hakusessa/,1773835269.0,2026-03-18 12:01:09,That-Ad-6403,1rx1y6r
EI,bookhaul,It was the equivalent of just under $15 USD for this lot of astronomy and cosmology books and magazines!,,8,0,https://i.redd.it/1m4pq5okmspg1.jpeg,https://www.reddit.com/r/bookhaul/comments/1rx1xg2/it_was_the_equivalent_of_just_under_15_usd_for/,1773835220.0,2026-03-18 12:00:20,this_time_i_mean_it,1rx1xg2
EI,kamerstukken,"Antwoord op vragen van de leden Boswijk, Zwinkels en Paternotte over mogelijke plaatsing van Chinese laadpalen bij gebouwen van de Rijksoverheid","

Antwoord van Staatssecretaris Van der Burg (Binnenlandse Zaken en Koninkrijksrelaties) (ontvangen 13 maart 2026)

#Vraag 1

Bent u bekend met het bericht dat het Rijksvastgoedbedrijf mogelijk honderden laadpalen van een Chinees bedrijf wil laten plaatsen bij gebouwen van de rijksoverheid, ondanks groeiende zorgen over strategische afhankelijkheid en veiligheid?1

#Antwoord 1

Ja, ik ben bekend met het bericht. Het bericht gaat over een raamovereenkomst die het Rijksvastgoedbedrijf op 7 oktober 2025 heeft gegund. Deze overeenkomst gaat over het beheer van bestaande laadinfrastructuur en, als dat nodig is, de levering en plaatsing van nieuwe laadpalen bij Rijksvastgoed.

Een raamovereenkomst heeft geen afnameverplichting. Dat betekent dat er niet automatisch een vast aantal laadpalen wordt geplaatst. Per locatie wordt beoordeeld of plaatsing nodig is en hoe dit past binnen de geldende technische en beveiligingskaders.

Het kabinet vindt het belangrijk om veiligheid goed mee te wegen. Daarom worden bij dit soort aanbestedingen vooraf eisen gesteld voor functie, techniek en beveiliging. Voor locaties met een hoger risico kunnen extra eisen gelden.

#Vraag 2

Klopt het dat bij aanbestedingen voor laadinfrastructuur voor overheidsgebouwen het uitgangspunt is dat waar mogelijk gebruik wordt gemaakt van Europese of Nederlandse bedrijven en technologieën? Zo ja, hoe verhoudt de mogelijke keuze voor Chinese leveranciers zich tot dit uitgangspunt?

#Antwoord 2

Aanbestedingen moeten passen binnen de geldende regels op nationaal, Europees en internationaal niveau. Die regels gaan uit van gelijke behandeling en non-discriminatie. Daarnaast is er aandacht voor beveiligingseisen en het beperken van risico’s voor de nationale veiligheid.

Binnen die regels worden aanbestedingen ingericht met duidelijke, objectieve en wettelijke eisen. Het gaat dan om functionele eisen, technische eisen en beveiligingseisen. Inschrijvingen worden op basis van die eisen beoordeeld. Dat geldt ook voor deze raamovereenkomst.

Het kabinetsstandpunt over een Europees voorkeursprincipe in publieke aanbestedingen is met uw Kamer gedeeld.2

#Vraag 3

Op welke wijze zijn bij deze aanbesteding nationale veiligheidsrisico’s, waaronder cyberveiligheid, databeveiliging en mogelijke ongewenste toegang tot systemen van overheidsgebouwen, meegewogen?

#Antwoord 3

Bij deze aanbesteding zijn vooraf eisen vastgesteld voor functie, techniek en beveiliging. Deze eisen gaan onder meer over informatiebeveiliging en gegevensbescherming. Ook gaan ze over een veilige aansluiting op bestaande energie- en netwerkinfrastructuur.

Daarbij wordt aangesloten op de Rijksbrede kaders voor informatiebeveiliging en op de geldende wet- en regelgeving. Het denken staat op dit punt niet stil: als het nodig is scherpen we geldende wet- en regelgeving aan.

#Vraag 4

In hoeverre acht u het risico reëel dat slimme laadpalen – die verbonden zijn met digitale netwerken en energie-infrastructuur – kunnen worden misbruikt voor spionage, sabotage of verstoring van vitale infrastructuur?

#Antwoord 4

Slimme en verbonden apparatuur kan cyberrisico’s met zich meebrengen. Dit geldt ook voor slimme laadpalen. Het gaat daarbij niet alleen om de aansluiting op het energienet, maar ook om gegevensverwerking en de systemen waarmee laadpalen worden beheerd en gemonitord.

In de aanbesteding van het Rijksvastgoedbedrijf zijn daarom beveiligingseisen opgenomen voor digitale veiligheid en voor een veilige aansluiting op het energienetwerk. Deze eisen sluiten aan op de Rijksbrede beveiligingskaders. Per locatie wordt bekeken of aanvullende maatregelen nodig zijn, passend bij het risicoprofiel.

#Vraag 5

Wordt bij de beoordeling van dergelijke technologieën rekening gehouden met het feit dat Chinese bedrijven onder Chinese wetgeving verplicht kunnen worden om informatie te delen met de Chinese overheid? Zo ja, hoe is dit risico beoordeeld?

#Antwoord 5

Bij de beoordeling van technologie en leveranciers wordt gekeken naar de manier waarop gegevens worden verwerkt en beschermd. Ook wordt gekeken naar afspraken in contracten en naar naleving van Nederlandse en Europese regelgeving. Verder wordt gekeken naar de inrichting van systemen, gegevensstromen en maatregelen om risico’s te beheersen.

Systemen die bij Rijksvastgoed worden toegepast moeten voldoen aan de nationale en Europese regels voor gegevensbescherming en informatiebeveiliging. De beoordeling richt zich daarom op concrete risico’s en maatregelen.

#Vraag 6

In hoeverre bestaat het risico dat door de inzet van Chinese technologie bij laadinfrastructuur een structurele economische afhankelijkheid ontstaat, bijvoorbeeld door onderhoud, software-updates of vervangingsonderdelen, en hoe wordt dit risico gewogen?

#Antwoord 6

Bij de inrichting van laadinfrastructuur wordt ook gekeken naar uitwisselbaarheid en beheerbaarheid. Denk aan interoperabiliteit, onderhoud, ondersteuning en vervangbaarheid. Zo wordt de continuïteit geborgd. In de raamovereenkomst is als eis opgenomen dat de software moet zijn gebaseerd op open standaarden.

#Vraag 7

Hoe verhoudt deze mogelijke keuze zich tot het bredere kabinetsbeleid om strategische afhankelijkheden van China te verminderen en technologische en economische veiligheid te versterken?

#Antwoord 7

Het kabinet voert actief beleid om de afhankelijkheid van derde landen te verminderen en zo onze veiligheid te vergroten3. Dit beleid wordt uitgevoerd binnen de geldende Europese en nationale wet- en regelgeving.

In dat kader gelden aanvullende beveiligingseisen voor overheidsopdrachten met veiligheidsrisico’s. Sinds 1 januari 2026 geldt Rijksbreed het kader Algemene Beveiligingseisen voor Rijksoverheidsopdrachten (ABRO) voor opdrachten met risico’s voor de nationale veiligheid.

Bij aanbestedingen wordt altijd een zorgvuldige afweging gemaakt tussen marktwerking, aanbestedingsregels en veiligheidsbelangen. Waar nodig worden extra eisen gesteld, passend bij het risicoprofiel van de opdracht.

#Vraag 8

Bent u bereid te onderzoeken of voor vitale of gevoelige overheidslocaties een «Europees, tenzij»-benadering kan worden toegepast bij de inkoop van energie- en laadinfrastructuur, en de Kamer hierover te informeren?

#Antwoord 8

Het kabinet beziet voortdurend hoe open strategische autonomie en veiligheid kunnen worden versterkt binnen de geldende Europese en nationale kaders. Daarbij wordt ook gekeken naar de samenhang tussen aanbestedingsregels en bredere veiligheids- en afhankelijkheidsvraagstukken.

Eventuele beleidswijzigingen moeten passen binnen het Europese aanbestedingsrecht en internationale verplichtingen. Bij aanbestedingen kunnen partijen alleen worden uitgesloten op wettelijke gronden, bijvoorbeeld bij sancties. Daarnaast gelden internationale afspraken over toegang tot overheidsopdrachten, zoals de WTO-overeenkomst inzake overheidsopdrachten (GPA) en EU-handelsovereenkomsten. Daardoor kunnen partijen niet zomaar worden uitgesloten alleen vanwege herkomst.

De Europese aanbestedingsregels worden op dit moment herzien. Binnen het kabinet coördineert het Ministerie van Economische Zaken de Nederlandse inbreng. In dat verband wordt in Europees verband ook gesproken over een mogelijk EU-voorkeursprincipe. Het kabinetsstandpunt over een Europees voorkeursprincipe in publieke aanbestedingen is met uw Kamer gedeeld.4

Uw Kamer wordt over de voortgang en eventuele keuzes geïnformeerd via Kamerbrieven en voortgangsbrieven over economische veiligheid, open strategische autonomie en aanbestedingsbeleid.


&nbsp;

----

&nbsp;

**NR** 2026D11701

**Datum** 13 maart 2026

**Ondertekenaars**

- E. van der Burg, staatssecretaris van Binnenlandse Zaken en Koninkrijksrelaties

&nbsp;

**Bron** [tweedekamer.nl](https://www.tweedekamer.nl/kamerstukken/kamervragen/detail?id=2026D11701&did=2026D11701), [document](https://www.tweedekamer.nl/downloads/document?id=2026D11701)",1,0,https://www.reddit.com/r/kamerstukken/comments/1rx1x6t/antwoord_op_vragen_van_de_leden_boswijk_zwinkels/,https://www.reddit.com/r/kamerstukken/comments/1rx1x6t/antwoord_op_vragen_van_de_leden_boswijk_zwinkels/,1773835204.0,2026-03-18 12:00:04,kamerstukken-bot,1rx1x6t
EI,antarctica,Got a nice map for my room!,,42,1,https://i.redd.it/2ght1vsomspg1.jpeg,https://www.reddit.com/r/antarctica/comments/1rx1wx4/got_a_nice_map_for_my_room/,1773835183.0,2026-03-18 11:59:43,OkCraft5146,1rx1wx4
EI,RoGenZ,RoGenZ traieste rent free in mintea multora,,0,12,https://i.redd.it/i9gv2rutlspg1.jpeg,https://www.reddit.com/r/RoGenZ/comments/1rx1tcw/rogenz_traieste_rent_free_in_mintea_multora/,1773834887.0,2026-03-18 11:54:47,DependentFeature3028,1rx1tcw
EI,snappisensuroimat0n,Se kaunein/Emppu0222 ja hänen stalkkaaminen,"Siis onkohan joku muka oikeesti tarkkaillut tän liikkeitä, mitä tää ostaa kaupasta tai missä tää käy yms? 

Vai luuleeko Emppu olevansa niin ”tunnettu”, et joku häntä tarkkailisi..😅",19,19,https://i.redd.it/tfa7xl7rkspg1.jpeg,https://www.reddit.com/r/snappisensuroimat0n/comments/1rx1p29/se_kauneinemppu0222_ja_hänen_stalkkaaminen/,1773834525.0,2026-03-18 11:48:45,ZealousidealSugar3,1rx1p29
EI,Watchexchange,[WTS] Limited Edition (1 of 888) Bucherer Tissot PRX [Repost],,0,4,https://www.reddit.com/gallery/1rx1lhs,https://www.reddit.com/r/Watchexchange/comments/1rx1lhs/wts_limited_edition_1_of_888_bucherer_tissot_prx/,1773834228.0,2026-03-18 11:43:48,SpaceOpposite1119,1rx1lhs
EI,arkisuomi,Salijäsenyyden peruminen salin konkurssin alla,"P&T salit ovat Suomessa kuulemma menemään konkkaan. Menin ostamaan 6kk määräaikasien sopimuksen salille. Onko mitään järkeä jatkaa määräaikaisen sopimuksen maksamista, koska saleille ei edes enään pääse?",0,13,https://www.reddit.com/r/arkisuomi/comments/1rx1kvq/salijäsenyyden_peruminen_salin_konkurssin_alla/,https://www.reddit.com/r/arkisuomi/comments/1rx1kvq/salijäsenyyden_peruminen_salin_konkurssin_alla/,1773834181.0,2026-03-18 11:43:01,itsmds,1rx1kvq
EI,TarihiSeyler,"Bir Türk zabitinden Anzak askerlerine : “Ananızı avradınızı si**yim, sizi geberdecez. Bu kağıdı alın ana** a**na sokun”",,282,44,https://i.redd.it/6z425hcejspg1.jpeg,https://www.reddit.com/r/TarihiSeyler/comments/1rx1jia/bir_türk_zabitinden_anzak_askerlerine_ananızı/,1773834068.0,2026-03-18 11:41:08,jorahmormmnt,1rx1jia
EI,RomaniaPrima,"Mai fac suveranistii altceva in afara sa depuna motiuni de cenzura care sunt majoritar respinse? Opozitie opozitie, dar treaba pentru cetateni cand mai fac?","Nu vi se pare penibil cum singura realizare a suveranistilor e sa faca aproape saptamanal cate o motiune de cenzura impotriva cuiva si ea sa fie de obicei respinsa? Ei au fost trimisi acolo sa propuna legi, sa faca reforme, sa schimbe ceva in tara asta, si tot ce fac ei e circ si motiuni de cenzura absolut inutile?",1,0,https://www.reddit.com/r/RomaniaPrima/comments/1rx1ig0/mai_fac_suveranistii_altceva_in_afara_sa_depuna/,https://www.reddit.com/r/RomaniaPrima/comments/1rx1ig0/mai_fac_suveranistii_altceva_in_afara_sa_depuna/,1773833976.0,2026-03-18 11:39:36,piouel,1rx1ig0
EI,MonsterHunterWorld,100 dps vs Safi Jiva.,"Last night I ran into a player who managed to get almost 90k Damage in 15 minuites vs safi Jiva.

Iv'e since mostly copied his build with some changes to armor skills I thought would better increase damage but am only able to hit just over 40k dmg in over 14 mins.

[90k Damage build](https://preview.redd.it/8yb7ul6aispg1.png?width=1965&format=png&auto=webp&s=60505bd87065afd0efac20a3cd55ac1f6eedb943)

In my own build I have removed the skills partbreaker, razor shot and ammo up and instead have Agitator and coelesense, also resentment is level 4 not 5.

For shot placement im usually aiming to fire peircing water shots through one limb and out the other (i.e hand to hand, hand to leg, leg to leg etc)

Is there anything else I should be doing that im not? less than half dps with the same build is a crazy difference.",5,7,https://www.reddit.com/r/MonsterHunterWorld/comments/1rx1hru/100_dps_vs_safi_jiva/,https://www.reddit.com/r/MonsterHunterWorld/comments/1rx1hru/100_dps_vs_safi_jiva/,1773833920.0,2026-03-18 11:38:40,Commanduf,1rx1hru
EI,CBMOblivion,"HR Giger's designs and commentary for ""Killer Condom"" (1996) [from the book ""WWW HR GIGER COM""]",,2,0,https://www.reddit.com/gallery/1rx1fpf,https://www.reddit.com/r/CBMOblivion/comments/1rx1fpf/hr_gigers_designs_and_commentary_for_killer/,1773833748.0,2026-03-18 11:35:48,Sivasubramanian,1rx1fpf
EI,banci_credite_ro,Parere BCR pentru credit ipotecar,"Buna! 

Cineva care are in prezent credit ipotecar la BCR si mi-ar putea da o parere legata de colaborarea cu ei/posibilitatea de a rambursa anticipat din aplicatie?

Multumesc! ",2,6,https://www.reddit.com/r/banci_credite_ro/comments/1rx1el7/parere_bcr_pentru_credit_ipotecar/,https://www.reddit.com/r/banci_credite_ro/comments/1rx1el7/parere_bcr_pentru_credit_ipotecar/,1773833653.0,2026-03-18 11:34:13,oanette23,1rx1el7
EI,flightradar24,Alerte 7700 avec l'avion Cessna UC-35A Citation Ultra,,3,8,https://i.redd.it/zokdrfn1ispg1.png,https://www.reddit.com/r/flightradar24/comments/1rx1e72/alerte_7700_avec_lavion_cessna_uc35a_citation/,1773833618.0,2026-03-18 11:33:38,SwimmingWild1603,1rx1e72
EI,Eesti,Bakalaureusetöö küsimustik,"Hei!

Kirjutan oma bakalaureusetööd ja oleks väga vaja vastajaid ☺️

Ei tea, kas siit päris minu sihtgruppi leian, aga proovin ikka 😅

Kui kasutad kosmeetika- või ilutooteid, siis

oleks mega abi, kui leiaksid \~10 minutit vastamiseks

https://survey.ut.ee/index.php/956294?lang=et

Aitäh ette! ",0,1,https://survey.ut.ee/index.php/956294?lang=et,https://www.reddit.com/r/Eesti/comments/1rx1bls/bakalaureusetöö_küsimustik/,1773833398.0,2026-03-18 11:29:58,Estty,1rx1bls
