bank,subreddit,title,selftext,score,num_comments,url,permalink,created_utc,created_date,author,id
EI,antiai,"LMAO, Let’s Be Real—AI Is Just a Bunch of Hype & Copy-Paste Chaos","[This is a Chinese news thread—basically, Cusor straight-up ripped off China’s Kimi model and won’t even admit it.](https://preview.redd.it/1y888a9tceqg1.png?width=2610&format=png&auto=webp&s=e405f9bf1115436f5c91564b578d00f363a972a7)

Y’all really gonna sit here and act like AI isn’t just the biggest group project of “fake it till you make it” we’ve ever seen? 😂 I swear every week there’s a new “revolutionary” AI tool dropping, and 9 times out of 10 it’s just another company slapping a fresh logo on someone else’s open-source model, calling it “自研” (self-developed), and charging 10x more for it.",3,2,https://www.reddit.com/r/antiai/comments/1rzr07f/lmao_lets_be_realai_is_just_a_bunch_of_hype/,https://www.reddit.com/r/antiai/comments/1rzr07f/lmao_lets_be_realai_is_just_a_bunch_of_hype/,1774098377.0,2026-03-21 13:06:17,No-Acanthisitta-6254,1rzr07f
EI,PokemonTCG,My first SAR ever!,,2,0,https://i.redd.it/eaviktq0deqg1.jpeg,https://www.reddit.com/r/PokemonTCG/comments/1rzqyu0/my_first_sar_ever/,1774098275.0,2026-03-21 13:04:35,MaxCook1e,1rzqyu0
EI,BeautyDE,Wie fühlt man sich gepflegter und sieht auch so aus?,"Moin! 

Ich weiß nicht, wo ich die Frage sonst stellen soll:

Ich bin männlich und Ende 30, ich hab schon immer auf mich geachtet, aber in meinen 30ern das Thema Körperpflege sehr viel ernster genommen.

Mein Problem ist etwas weird:

ich bin sehr groß, sehr sportlich, habe gut sitzende und hochwertige Kleidung, mein Bart ist immer gestutzt und gepflegt, meine Haare werden immer in Form gehalten.

Ich mach:

1. Masken

2. sauna

3. Bodylotion 

4. Feuchtigkeitscreme 

5. Zahnpflege usw

als GF eines Software Unternehmens begegne ich vielen Menschen und vor allem Männern, die aber irgendwie den Dreh bEsser raus haben.

Die sehen IMMER aus wie aus dem Ei gepellt und ich fühle mich trotz allem immer irgendwie „dusty“.

ich kann das gar nicht anders beschreiben. Trotz allem sehe ich auf Fotos neben denen immer irgendwie so aus, als würde ich zwar auf mich achten, aber mehr auch nicht. 

was machen die anders?",4,43,https://www.reddit.com/r/BeautyDE/comments/1rzqyr2/wie_fühlt_man_sich_gepflegter_und_sieht_auch_so/,https://www.reddit.com/r/BeautyDE/comments/1rzqyr2/wie_fühlt_man_sich_gepflegter_und_sieht_auch_so/,1774098269.0,2026-03-21 13:04:29,PinocchiosWoodBalls,1rzqyr2
EI,EInkTerminal,Housing Options and Potential BOM,"I've been working on a similar project inspired by this [Mechanical Keyboard/Raspi](https://www.printables.com/model/993043-portable-pi-80) project found on printables/hackaday/etc. For those with a 3d printer it's very handy to print off the enclosure and features the space for a 48-key mechanical keyboard, which I think is a nice touch. The project author intended their device to be used with a GUI and regular LCD/touch screen, which necessitates a few other externals eg a mouse, a speaker, etc. 

  
I've included my [WIP BOM](https://docs.google.com/spreadsheets/d/1iIN5ibMFlk8bmBUGk6xoqizdlxdot4hqsAK7z1vbEiE/edit?usp=sharing). Excluding Amazon links, which my dear reader may feel free to salt and pepper in as much as they like, the only items missing are certain hardware items and-- most crucially-- driver software for the terminal. This is where my knowledge drops off.

One thing that's nice about what I've put together is that it runs off of USBC, or 2x 18650 LiPOs, or a solar panel for (hopefully) long life and prosperity. I would greatly appreciate CC with regards to the power supply setup to extend battery life and safety. I can provide pictures of my current build if desired, but it's not pretty lol.  

I'd especially love to hear any advice from you Wizards about driver design. I'm a decent software developer but primarily in Functional Java/Clojure, and for the web, so hardware and hardware drivers are out of my wheelhouse. If any would care to share learning resources to roll my own, or share an example, I'd be much obliged. ",2,0,https://www.reddit.com/r/EInkTerminal/comments/1rzqvir/housing_options_and_potential_bom/,https://www.reddit.com/r/EInkTerminal/comments/1rzqvir/housing_options_and_potential_bom/,1774098036.0,2026-03-21 13:00:36,jollyblondgiant,1rzqvir
EI,BrawlsTRars,El primo hangi oyun modun da 1000 kupa yapılır,,3,6,https://i.redd.it/yfj8undybeqg1.jpeg,https://www.reddit.com/r/BrawlsTRars/comments/1rzqtwf/el_primo_hangi_oyun_modun_da_1000_kupa_yapılır/,1774097917.0,2026-03-21 12:58:37,TangerineSad5325,1rzqtwf
EI,RecomandariCarti_RO,Clasici,Care sunt clasicii voștri preferați? De ce și ce carti de la ei recomandați? În ultimul timp toată lumea vorbește doar de Dostoevsky și câțiva filozofi dar mi-ar plăcea sa aud despre o paleta mai larga,6,12,https://www.reddit.com/r/RecomandariCarti_RO/comments/1rzqt5u/clasici/,https://www.reddit.com/r/RecomandariCarti_RO/comments/1rzqt5u/clasici/,1774097857.0,2026-03-21 12:57:37,Flaky_Specialist1143,1rzqt5u
EI,HWSEVERLERTR,beylikdüzü küçükçekmece civarı elden almak istiyorum. kutu ve araç hatasız arıyorum. sizde varsa lütfen fiyatınızı yoruma veya özelden yazın,,1,1,https://i.redd.it/lsdvbtfobeqg1.png,https://www.reddit.com/r/HWSEVERLERTR/comments/1rzqssc/beylikdüzü_küçükçekmece_civarı_elden_almak/,1774097827.0,2026-03-21 12:57:07,Mess3450,1rzqssc
EI,Caldruki,WTF did he do? Did he diddle Enrique?!,,3,4,https://i.redd.it/2axv13enbeqg1.jpeg,https://www.reddit.com/r/Caldruki/comments/1rzqspo/wtf_did_he_do_did_he_diddle_enrique/,1774097821.0,2026-03-21 12:57:01,Plane-Taste386,1rzqspo
EI,HotWheelsSatisTakasTR,beylikdüzü küçükçekmece civarı elden almak istiyorum. kutu ve araç hatasız arıyorum. sizde varsa lütfen fiyatınızı yoruma veya özelden yazın,,1,1,https://i.redd.it/ln4s38pjbeqg1.png,https://www.reddit.com/r/HotWheelsSatisTakasTR/comments/1rzqsbq/beylikdüzü_küçükçekmece_civarı_elden_almak/,1774097788.0,2026-03-21 12:56:28,Mess3450,1rzqsbq
EI,cs2,"Violet beadwork, cheap and cool 🔥😎",Go buy on steam market these gloves 🔥🔥🔥,0,1,https://i.redd.it/ec13ttrbbeqg1.jpeg,https://www.reddit.com/r/cs2/comments/1rzqrav/violet_beadwork_cheap_and_cool/,1774097709.0,2026-03-21 12:55:09,csmarket,1rzqrav
EI,csgo,"Violet beadwork, cheap and cool 😎",Go buy these gloves from steam market 🔥🔥,0,2,https://i.redd.it/9prttwjuaeqg1.png,https://www.reddit.com/r/csgo/comments/1rzqpd6/violet_beadwork_cheap_and_cool/,1774097558.0,2026-03-21 12:52:38,csmarket,1rzqpd6
EI,wroteabook,The Task - YA Fantasy - Available on Amazon/Kindle/Barnes&Noble,"[The Task](https://www.amazon.com/Task-Book-One-Justin-Duncan/dp/B0GR45JCMQ/ref=tmm_pap_swatch_0?_encoding=UTF8&dib_tag=se&dib=eyJ2IjoiMSJ9.Tg0uz1ZRRKPp7MUSzGVEWX3DOOiDdAqH5y-elYZdF4twrcCaUNo_vbLdLsyGuxug1SeoznsiWkkat_SGK73V_gMHss8VfYecrlB6zynKed90aYjzieErWIgM-TTbOI_JRhrv8Jb_qgPL4W4BzXwn1zqijFO7E1u_VzNVaAdRJcCBGSKqx1nKxNCiy_t2CyuwDCXHHxNlcyX2yImXYwXtyFWJo1Gpdy3K-5VQTqaDboA.3j8_KBR-cRPhKwVwn8zdIKdChPTu6T5URKDdYlEiAVQ&qid=1773100235&sr=8-1)

Two people lost in the wilderness connected to one another seemingly by fate have to help one another get back home.

Burb ~ The Family Omorithan is facing upheaval and ruin, possibly worse. It is up to the young and inexperienced Heiress to save them and accept The Task, a quest to retrieve an ancient mystical artifact that was stolen from the family a thousand years ago. To do so she must travel to a strange and inhospitable land and find her own way.

In a moment of weakness Wes abandoned his home and family and is looking for a way to make amends, only his shame for having failed them to such a great degree is keeping him from doing it. The past he abandoned, though, is the only clue Heiress has to find her family’s salvation.


Together they form an unlikely friendship to overcome a challenging world of vicious dragons, dangerous people, and magical problems neither of them could have foreseen. Wes, determined to see Heiress succeed, puts his life at risk to help her. In return, Heiress gives Wes the courage to face his past.

Their journey will do more than test their strength and their wits, it will test the people they choose to become.

Trigger warnings:  I may have some ""triggering"" things in the book but I'm not sure what they would be.  I wrote the story with the YA audience in mind but I put a lot of effort into making it something everyone could read and find something they like.  I mean if you're six or require gore or eroticism in your story then you're probably going to be bored but I think most everyone else who likes fantasy can find something in it.  It's dragons and magic, some unnamed characters die but not a great deal of time is spent on explaining those deaths.  I think it should be a safe read for everyone.",1,0,https://www.reddit.com/r/wroteabook/comments/1rzqlft/the_task_ya_fantasy_available_on/,https://www.reddit.com/r/wroteabook/comments/1rzqlft/the_task_ya_fantasy_available_on/,1774097235.0,2026-03-21 12:47:15,makenzie71,1rzqlft
EI,ProgressionFantasy,Lord of Mysteries episode ratings,,8,5,https://www.reddit.com/gallery/1rzqkvs,https://www.reddit.com/r/ProgressionFantasy/comments/1rzqkvs/lord_of_mysteries_episode_ratings/,1774097190.0,2026-03-21 12:46:30,hls22throwaway,1rzqkvs
EI,Beepbox,made a soundtrack for a friends game,"[Bombala](https://ultraabox.github.io/#u5N07Bombalan810s1k42l08e0vt4ia7g0Fj0hr4O_U000000000000000000i0o21144534T9v0ru09f161q1D010q6000O075b9d000w20h6MoooooooooooMMMMMMMMMMoooooMMMMMMMMMMMMMMMMoooooMMMMMMMMMMMMMMMMoE1c0bpT9v0gu09f020872o000qaB010q100c00O00d030w20h0MxmrxJCi5ensGBEeen2JdAltHeL2l0hLd93Jv4ghvH4cGFs7fafo7bBcpLcw6BCaJE0c0T9v0nu09f030972o010300qaB010q100c00O00d030w20h0MxmrxJCi5ensGBEeen2JdAltHeL2l0hLd93Jv4ghvH4cGFs7fafo7bBcpLcw6BCaJE1c01hT9v0uu09f161q1D010q6000O075b9d000w20h2MoooooooooooMMMMMMMMMMoooooMMMMMMMMMMMMMMMMoooooMMMMMMMMMMMMMMMMoE1c0bpTbv0uu0bf191q2A030n41682da0000O0d020AsF9BaQ225004Pceeff3R5241015E4c0bx6557A12T7v0du07f030kd15d2ee00q150Oa0n0d040HZqa1ahgiiirh89h5IeE0c0T6v0su06f030p71512dc00qh400O06bd040WN00h2E0c0T7v0su07f030kd15d2ee00q150Oa0n0d040HZqa1ahgiiirh89h5IeE0c0T2v0su02f00010q8D1a000Oa40d000w4h0E1c01mb28p0y6g8xA28p0y6g8xA28p0y6g8xA28p000000y6g8xA28p0y6g8xA28p0y6g8xA28p000000y6g8xA28p0y6g8xA28p0y6g8xA28p0000000008wz288My2c8wz288My2c8wz288M0000000000000036ewNzEcoW36ewNzEcoW0000000000000000000000coW36ew000000000000000000000000000000000008wz288M000000000000000000000coW36ew000000000001z6goNA6cp1z6goNA6cp1z6goNA6cp00p2b8FAu34t2whQ2-wnQ2-h8Z4hQa17gbW1vhbWV7wh7gE4t0LE5Z0Lwifl4t2whQ2-EnQ2-whw05cZ7MrgUdjeDR4200kPQv1J3wRcWvkg801j8Y6bUxbVczy0LEBYyhWoLG5ZczFBZczF5-ybWpviFBZ8zF4tczqgzEk2ewnQ2-hbXp7wh7gE4t0LE5Z0Lwifp4t2whQ2-EnQ2-whw0FDE-9ljf5ZRZ1xQPzZ11FCLwuikIBjfhZbjcLg9BeCaChWapvEzFwW8d06w3g1O5mFG2fo5-gSgd06w3g1E0Q0sxhEUchX4LOeR1E0Q0q0d06w3IadezkG01j8YIbUxbVczy0LEBYyhWoLG5ZczFBZczF5-ybWpviFBZ8zF4tczapBW1cFN0bIkO_h7j1Qgq0d06w3AaY3Hyfo5-g8ZA3g1E0V2zhMozS9vAtG3g1E0Q0q0d07okqt6Fk02ChUB5YgBYChN2nQi-h8ZcnR2-ChQO-ChQy_h5ZcLFkO-AhQyeChw02ChUcnN2nOp741vhbV4zQNvkbWp7jbWp7ibZ4nQO-BjbWh7i8Wp6kPbQypjEyX5cLQhQMt46w3g1E0V2JkR17I2_84uO1E0Q0sxhEUchX4LOeR1E0Q0q0d06w3IadezkG01j8NohMd4zEQiezgEGoGa89AoyhQidw1viEAt4zEQiexh8W97Ey-zh8W97hEAt2zhFRM00)

[Commander Lufta](https://ultraabox.github.io/#u5N0hCommander%20Luftan620s2kb2l00e0it29a7g0ij08r1O_U0000000000000000i0o223332T6v0ru06f030p71512dc00qh400O065d080WN00h2E0c0T9v0ou09f020872o000qaB010q100c00O0ed030w20h5MxmrxJCi5ensGBEeen2JdAltHeL2l0hLd93Jv4ghvH4cGFs7fafo7bBcpLcw6BCaJE0c0T0v0mu00f020o72j600q26o0O03d050wl1h3y0000000000000z000000E0c0T0v0ju00f020l92ja00q24c0O0d050wl1h3y0000000000000z000000E0c0T3v0pu03f030q51582g900q150O05bnd0a0Sw8pfg7pVEUdgi22h9E0c0T6v0ru06f030o816a2dc00qh400O065d050WN00h2E0c0T2v0pu02f00010q8D1a000Oa40d000w4h0E1c01mT2v0pu02f030na2i612e010q8D1a000Oa40d000w4h0E1c01mb4z8Qkz8Qkz8Qk18id18id18id00000290029000id5oid5oid5o10g810g810g810000000000000h4h4h4h4h4h414h4h4h4h4h4gp25PIwZ7wwd5cni4t4zwye18WUI0bl8WF7l8WF7k5GyWEzGAtkzGAtgmGbm8Wx7k5B2eyhRhtohQie18Xp70yM0JszGAtkzGAtgmGbH2eGhRieGhR1qEJwzEAt8mGhQieEa5cZ7OGCtfEkPnMc3OqzFciIwIIZ7OIkZA7E-BajAFiSmtfFiBppHWchp4h7BqnlqlRHmoBOZ2dXbeD5rpDj-sqjsz6kWuOPQvaNjSmtfFiBppHW4gE487JGSZBanoNJmHrBqnlqlRHmoBOZ2dNpp7yo6MYXRgHzPI1p1Wfx0q02ChyMlckkOd78M16MOchAhX4noV6zAqh7Ip4o1j5417g5Ek1q1jg5E2Q2ewbgE2Q1q0J0mwa00)

[Dogfight Darlings](https://ultraabox.github.io/#u5N0jDogfight%20Darlingsn820s2k42l0ce0rt4ia7g0Dj0sr1O_U00000000000000000000i0o32333433T9v0pu09f161q1D010q6000O075b9d000w20h2MoooooooooooMMMMMMMMMMoooooMMMMMMMMMMMMMMMMoooooMMMMMMMMMMMMMMMMoE1c0bpT5v0pu05f0000qwB11210Oa3d030H_RIBJAAAzrrrqhh0E0c0T5v0pu05f162qE7020Oa66d040HVIrc3h88819981h0E0c0T5v0pua1f062ge2ec2f02j01960me00q8740O07ld380HT-Iqijriiiih99h0E0c0T7v0pu07f020r81dd00q170O073b1d0a0HCJIzrisBIK_-zrh0I4E0c0T5v0su05f020f817400q1D010tb000Oa3077d030H-8j0q89hh91109h0E1c0b2T1v0pu40f0000qwB19110O00d080A4F2B6Q44cePf624R0000E2c0b878T5v0pua5f060lc2dd2j02e02fd17800q8540O0ad260HK_Sziiirrqih99h0E0c0T2v0pu02f00010q8D1a000Oa40d000w4h0E1c01mT3v0pufaf0000qwB1a110O00d080SjPrrW9V800ah0a0h0E1c0b9b6gp1A6gp1A6gp1A6gp1A6gp1A6gp1A6gp00008gy6cp0x28oNA248iBakNz6et20x2400048gO48kgx38gxh248Nz6esVQ8iBiBa000000000000000000000000000000000000000000000000000000000000000000000000000008xAaoW7Mv1Y7Mv1YaRLxaAH000000000000000000000000000000000000000000000000000000000000000000000000000008gx248gx248gx248gx248gx0000000000000000000000000000000000p28kap7E2-AnQi-AnQie82fh5Z8LEBY8nQie28M0005cZ7QdcWvgMn0v8qf4-NM7iw002CuzW2OPQvg2BIIWvgz9hA5M46TAFiRqRUC5vqpWfGk2VOF1HvqLs7KSLU0000000000002CoKx5jbZ0zE4t0zjat0mh5V4hQ2ewhV0n84qp7wyfAh7g8W17g8W5bh4t0zO17AyewhV0zU28W17g8W17I1tyhZy8ZwkVgzwyf8yX4zYg2Yg8ZwhVozE4ug8_4gGoKwaCpuxPaDhFktchRieyhQyeBjQN7j8W97k8Wdnh4tczEAtczFO0Zj2VgzGAuh5VGbl5XghQOeEhQifa2QxgXcbIifpyVczEAtbIMKh8ZAbAyeAhV8nEwnpAteChQieBFyeyhQGt6FhSh78AsyhVonq2Icnm0j5QieaCnWV7p8XgJIzjatMlcngj8Z4mbN8mChYk5YayQhkOfi8-j2-l2eziE-kxsG0000000002ChyMLEQidxAoz4zj8Nj9i8WcIAhQyc0000000000)

[General Stuka](https://ultraabox.github.io/#u5N0fGeneral%20Stukan910s6k62l0ge0vt49a7g0_j0ir1O_U00000000000000000000i0o314343333T0v0pu00f022ia2c800q9420O05bd060wq0h8y00000000000006000000E0c0T8v0uu08f030m22i628b00qM702c00O030d040x493WO00E0c0T0v0zu00f020e22aa00qx710Oa3650d000wl0h0y0000000000000w000000E0c0T1v0tu01f0000q2D15000Oa60d080A9F3B6Qa86ePaa74R0000E3c0bd63c76T7v0au07f040k81b92j42ab00q1Q166110O075d160HTZAzrjqiaai999h2I7E1c0bsT3v0qud8f191q050O00d350SU006050woha9999h0E0c0T1v0zu01f0000q3D15000Oa77n0d040A9F3B6Qa86ePaa74R0000E3c0bd63c76T0v0qu00f022ia2c800qb4c20O05bd060wq0h5y00000000000006000000E0c0T1v0pu01f0000q2D15000Oa60d080A9F3B6Qa86ePaa74R0000E3c0bd63c76T2v0pu02f00010q8D1a000Oa40d000w4h0E1c01mb288My2c8wz288My2c8wz288My2c8wz288My2c8wz000000000000000000002080w2g8h324gMx4c8h324gMx4c8h324gM0000000000000000288My2c8wz288My2c8wz288My2c8wz288My2c000000000000000000000000000w4c81320gMw4c81320gMw4c8130000000000000000000000000008wz288My2c8wz288My2c8wz288M0000000000000000000000000000000000000000y6g8xA28p0y6g000000000000000000002w0000000000000000000g004001000g00000000000000000000000000000000000y2c8wz288My2c8wz288M0000000000000000000000000424gMx4c8h324gMx4c8h324gMx4c00000000000000000x248gx248gx248gx248gx248gx248gx248gx00000000000000p25fFAuwbUCbVkRWxv94sOWFv26LkbWF7cKCnQPnFBYAhw01jfhZ3xChjFQTFZyo00FAuwbWhvi8Wpvc9v8AuEbWFvj8Wpvj8WhvEy-CnQGFv94t4zG4o00mo7mVQexaOP0WveDMN2Rcygd000ap7E2-AnQyeCnP2nO97G2-GnQOeCnQOeAnW8LFBZaGnOh7h8Wx6005cZ7R5jf5ZRZ2uCsvE8hcRZnABb9002OO_gB8unw00kOfg5Yj5YGqZgLAyeptkLx3nG5ZkzCnjbWpHQO-i8M00IIZ7Q9mUoxqCh86xeDprQ-INIug01j8Mw8WJ6DiFkieziFkGd8z000)

[Gui](https://ultraabox.github.io/#u5N03Guin610s0k02l05e0ft2Ja7g0mj0dr3O_U00000000000000i0o434352T0v0su00f020o32i000qx400O045d040wA0h3y00000000000004000000E0c0T0v0que2f0000q8C010m70020O07d080w50h3y0000000000000w000000E1c0baT3v0ku03f030q51582g900q150O06bhd0a0Sw8pfg7pVEUdgi22h9E0c0T6v0nu06f130q9720Oa538kd1a0WL00h0E1c02cT0v0nu00f163qbD172c10Oa43gdd020w20h1y00000000000002000000E1c0btT7v0ku07f020o12p100q060Oa7d030HT_IArrjrAJSRJzh8I8E0c0T2v0mu02f00010q8D1a000Oa50d000w4h0E1c01mb0z8Ocz8Ocz8Ocz0a8Ocz8Ocz955Dm00000000g410w42004000000000000000003gQ18QlDyqL03g004zgid5pUCHM00h4h4h4h4h4h4h00p27FkNs65wNo4UCwbh5G6X82W8FF2Qhqhj95dkW7k5dkmyblaqpjhex02OPNv48GpBCLEh1IIZ7ORbegzn9y8IIWvmJrIoSqKwBBDdW70zb8ZqTecVFWBanGApszir9PBFiBJWTnJqzqlA7E-D6obb8Y78cutUeEoYX00I0Z7MoE01jefORczRE70szhFB-yOl78OqpQ-FUwUBjjerRczV29ASyCgquNEZQZMthFpj8Quko3oU1M78QIzXxOeOOmiFVaCq-xjbZdcFQNkNtclczQ4O3k2S8KMEV4mwbYEf2dncp6BYpIzh8W17AczhEFASygr2CpuEHkGnBeBGv6gnz8zE4uMOdaLCadcRNsubWiPiduCuzVpjdvmiqpQ-BS3IBbptwFDy-Aj8Z5cOZ7EboX60CsRwkOf0FB-ziEQGpPu1tiYq_27OHVGVBP7ISOjbZ6ACiqap5EYjHk3Qvkap6452yhQieyhQq56ziEQyc00)

[Junebug](https://ultraabox.github.io/#u5N07Junebugna10s2k52l04e0Dt4aa7g0Nj0er1O_U0000000000000000000000i0o3313333333T9v0qu09f161q1D010q6000O075b9d000w20h2MoooooooooooMMMMMMMMMMoooooMMMMMMMMMMMMMMMMoooooMMMMMMMMMMMMMMMMoE1c0bpT6v0ru06f030qa1a928400q1S010r400000O074bd160WM00h2E2c0bu2wT9v0lu09f020872o000qaB010q100c00O03d030w20h0MxmrxJCi5ensGBEeen2JdAltHeL2l0hLd93Jv4ghvH4cGFs7fafo7bBcpLcw6BCaJE0c0T6v0pu06f020hb29300q0k110O0d400WM00h0E0c0T6v0pub8f0000q0B1820O00d230WO00h0E2c0bc26T1v0pu17f0000q040O0d030A0F0B0Q4444Pff00R0000E1c0619T3v0pu03f010tc00q2B011p600c0O0ad130SU0010508whhaa9hh0E2c0c0812T3v0ou03f010tc00q2B011p600c0O0ad130SU0010508whhaa9hh6E2c0c0812T1v0pub6f182q050O00d230A5F4BbQ4445Peec8R0000E3c06246357cT9v0pu1cf010s500q040O0d030w20h0M00001111222233334444555566667777MMMMLLLLKKKKJJJJIIIIHHHHGGGGFFFFE0c0T2v0su02f00010q8D1a000Oa40d000w4h0E1c01mb4x8i4x8i4x8i4x8i4x8i4x8i4x8i4w0000004h4h4h4h4h4h4h4h4h4h4h4h4h4000002h8Q4zMid18WlDxmuN8Y4zFmu5pX00000000000000000000000000000000000000000000000000000000000000000000000000000000000000000000000000000000000000004xci4M00000i4N8j00000000000000000000000i4N8j0000018j4xc00000000000000000000000000000000000000000000000000000000000000000000000024h4h4Q4jghd14Q4jgh4h4Q4h4hc0000p24cFAuA8QPbQ4O_gj8Yzh8ZxIdzEyfor3oGqKqew6Cq-g00kOfi4t8zEQa97h8W97hEko800FDE-wMjikPLYyjbZ6iFZGOr0KSriJjDvGVvIuVuLqdcX_lrizkFDy-ykOfsLkFje_QDkph00000000FCLGasglt9jBE78GAzj00FCLGasglt9jBE78GAzj0000000FAog6n0lGRewhQO-xh8VTZ6xgEccz48FAozEzbEQWtewhQW52xA8V7A8zbOdeDjE4tcLEkic00)

[Map](https://ultraabox.github.io/#u5N03Mapn310sek32l00e03t2Ra7g0fj07r0O_U00000000i0o324T0v0qu00f020o32i000qx400O037d040wA0h3y00000000000004000000E0c0T5v0nu05f010p200q3C162c0O041cd040H-IsBBAziiih999hbE1c0b5T0v0iu00f163qbD172c10Oa44bdd020w20h1y00000000000002000000E1c0btT2v0ou02f00010q8D1a000Oa50d000w4h0E1c01mb4ic00000000h8M00000003d5000000004h400000000p23mFzW0DEzOcyfgEzM5cu2H3Qqhfk9Z0jQNWlguxh7GkNUa17EQyuCjWUDEzRGUZ2yfnFzRqMZ6AfkG4UapWfHc8O82MNZ2gPWciuh8hWkOuz4LEN9Wcivgyc-x4DFP7Fj9Wci-x4DEh9YiI0PW4iuh77FP9W4i-z4DEh9ZaoPW4iuHkuBcDENbWciuz4D5cD5wY2eCe8zQczh9W8-h7Ep4s0)

[Svetlana](https://ultraabox.github.io/#u5N08Svetlanan621s2k42l09e0ft2ga7g0oj0mr1O_U000000000000000000i0o421333T3v0su03f030n42d12ga00q9510O0281d000SU136o70EMU30gi0h8E0c0T0v0su00f184q8700Oa70d190w00h0y00000000000010000000E0c0T3v0qu03f030n42d12ga00q9510O0281d050SU136o70EMU30gi0h8E0c0T1v0pu96f173q070O070d350A9F3B5Qa86eP9973R0000E2c063c7aT9v0ru09f020872o000qaB010q100c00O0ed030w20h5MxmrxJCi5ensGBEeen2JdAltHeL2l0hLd93Jv4ghvH4cGFs7fafo7bBcpLcw6BCaJE0c0T0v0ku00f032n323d2eb00q0B010f8000Oa3d030w10h2y0000000000000w000000E1c0boT2v0pu02f00010q8D1a000Oa40d000w4h0E1c01mT2v0pu02f030na2i612e010q8D1a000Oa40d000w4h0E1c01mTav0pu0af0000q00d040E0c0b08p2y6gExAa8p2y6gExAakgO14cwh384gO14cwh3848000000000000000000000000000000000000000000000h384gO14cwh384gO000000008N22cgwz488N200000000h164whx44oi1600000000y2c90z288MA2c0g0000010000008000000p2bEI0Z7MklcFQioKgj8Z6BItBIqmxrboQJzIJzAGnqcDIquNSmNFXboX6DIZBIobJCNSdboXboQZBGeNGr7pr6DSroX6HItBIqSOSeNFXfpr6K001ppULG9ESmq-l3NppWfEiNXakKODfJHmmguzWJb000b0fhYpiiCkW9cn89AuziSeOSdbgJBIqmNSmNFt3rboQJzIJzjSmNSdfpXboMngmNSdboXboQZBGeNGr7pr6DSroX6HItBIqSOSeNFXfpr6K0000002CuzWSCubW5cRY5jfbY2jbZzOG000kNt11gdeDjFQWteDjFQWteDjFQWteDjFQWteDjFQZ50MdqDjFQWteDjFQWteDjFQWteDjFQWteDjFQZpmGRGteDjFQWteDjFQWteDjFQWteBiFlqteDj000ap6b1kNhj8Qsz04r38N6h6Chy8GoEzAqehF4uNAhZy5SehEV6AhX6h7IhtzAqaoUziFccsizgzhzS0nyehEV6AhYNAhX4noV6zP4uzP68Z2fo1u8V6zAqh7P6h7IhtzAqfcql9xxykq4uENENDjQ8QoQoQoQoQoQoX6zAozQ8w00kNh0hQ1q50mwkQ1q0J0zE2Qa0J0mwbg5E2W0zE2Qa0J0FE2Q1q17g5Ek1kNN2xgEka782ewbgE2Q2Cwbg5E4t0mxg5O0Z0uxgV0hQ1q50mwkQ1q0J0zE2Qa0KgEk4MN2xAa000001L_W0960GxVVg38Md0ff0000)

[The Chipmunks](https://ultraabox.github.io/#u5N0fThe%20Chipmunksn620s1k02l05e0nt2ha7g0sj0jr1O_U0000000000000000i0o422333T9v0yu09f030g21b827900q9410O045d060w20h2MooooooooooooMMMMMMMMMMMMooooooooooooMMMMMMMMMMMMooooooooooooMMMME0c0T1v0ou01f0000qbD181c20Oa5450d060AbF6B2Q4ad6P9995R0000E2c01219T5v0su05f010w700qiD010n300000O051d030HLZBszrqiiiiiiih6E1c0bbT5v0nu05f010w700qiD010n300000O051d030HLZBszrqiiiiiiih6E1c0bbT3v0ju03f1a0q040Oad060SW8h5pc8WOU7088oh6E0c0T0v0ku00f032n323d2eb00q0B010f8000Oa3d030w10h2y0000000000000w000000E1c0boT2v0nu02f00010q8D1a000Oa40d000w4h0E1c01mT2v0nu02f030na2i612e010q8D1a000Oa40d000w4h0E1c01mb28oxy68p2Ce8oxy68p2Ce8oxz288wy28xj7288wy28xj7288w0000gz4t2l12cwgz4t2l12cx0x688hyexawx688hyexawx680000000000000gBiSds-4pjE00000000000000000000000000001248gx248gx248gx248gw0000x248gx248gx248gx248gp2ejI0Z7Mr2FyW8zFAs2bi8Wh7i5F4t8zF2M8J8mAb8yWwzFAtcmAhQyeAbi8Wh7i5E2QNpgm15Rx70As2bi8Wh7i5H4t8zF2QyeAhQxt8hQieAbi8W97j5F4t4zF2QyeyhMgKW8W97l5EAt4zFyQieyhRhq97g8W0Kg4t0zE2Q2ewhQ1qx7g8W0J0zE4t0k01j5MozF4s2bi8Wh7i5F4t8zF2M8J8mAb8yWwzFAtcmAhQyeAbi8Wh7i5E2QNpgm15I0Z7RhD9yeChQNqh7i8WgIChQyeAbi8Wh7i5Qx7h8WgJ8zEAtcmAhQieAbi8W97l5RN7h8WEJ4zEAtcmyhQieGbh8W17g5O0zE4t0mwhQ2ewbk8W17g5E4t0zE2w0apWfwRcYnQ2pvFgdcWvhkuOqD0ZwjdvkAf5f5aDAhHdpH00FDE-9lcYnQ2pvAU6CtfH86wuzWzwyBG4PnR93RhGddFw0FyUchQye15F4t8zF2QyeAhQxo4mAbi5AhtghQOeCbi8Wh7i5F4t8zF2Q1qoIEb0yQOfh4t22KkF5cnjI9B-F8FCnFFAuDjbZlmORmzoIVOTAWs7jdv0H-lFVf9QI8jefMaoKzjje3RfaJmzj2QippFr5cLQGdvNLUZYFl0Xedvt9AuxtEQPCZdUkOCh-5CiOlfMHUlooKz9cngj8Z6BsFB-yOevAkPbQkO_iEOlcYbQOp7EQqipvFQPOfkrnrqX8V5cFS1kPIZCCnW9czQsziEVeBkOlmCtfx2pN-iSlcVLq9yXlH9VuLP38QkPnSrlcOZ5ijbZdczQqdiHmO-rFDE8O5E7E-mk3FZp0w00kOcm9yw1xyy4AOciEQkNhboiSl6zIJxbpkm6hydAOchO5yc001j54x7gE2Q1q17gE2Q1q17gE2Q2CwkQ1g000)

  
here's a link to the game if you're interested: [https://store.steampowered.com/app/4190870/Dogfight\_Darlings/](https://store.steampowered.com/app/4190870/Dogfight_Darlings/)",1,0,https://www.reddit.com/r/Beepbox/comments/1rzqj4g/made_a_soundtrack_for_a_friends_game/,https://www.reddit.com/r/Beepbox/comments/1rzqj4g/made_a_soundtrack_for_a_friends_game/,1774097044.0,2026-03-21 12:44:04,Dpdp03,1rzqj4g
EI,slamdunkfestival,Reworked Clashfinder,"For anyone who wants a version of the set times that actually line up as a clash finder. Irritates me every year, so figured others may want it too!",25,7,https://i.redd.it/devkvq419eqg1.jpeg,https://www.reddit.com/r/slamdunkfestival/comments/1rzqhrx/reworked_clashfinder/,1774096935.0,2026-03-21 12:42:15,emmah1294,1rzqhrx
EI,huonekasvit,Apua Isomaijalle,"Rakas isomaijani oli pitkän aikaa tosi hyvinvoiva. Noin kuukausi takaperin sen isoimmat lehdet käpertyi kasaan ja kuoli, ja nyt jäljellä olevat lehdet on varsista nuupahtaneita. Ennen pysyi ryhdikkäästi pystyssä, nyt ei. Kastelutavoissa eikä sijainnissa ole mikään muuttunut. Uusia lehtiä pukkaa joo, mutta jokin on kyllä vialla. Ei ole ötökäitä tms. Vaihdoin mullat ja ruukun nyt, mutta osaako joku neuvoa, mitä muuta olisi tehtävissä tämän pelastamiseksi?",2,2,https://www.reddit.com/gallery/1rzqh9p,https://www.reddit.com/r/huonekasvit/comments/1rzqh9p/apua_isomaijalle/,1774096893.0,2026-03-21 12:41:33,venomoussockss,1rzqh9p
EI,trumpet,"""Moliendo Cafe / Trompetas De Boca Juniors"" - Cover",,2,0,https://www.youtube.com/watch?v=W0EPWYoBxcU,https://www.reddit.com/r/trumpet/comments/1rzqfzv/moliendo_cafe_trompetas_de_boca_juniors_cover/,1774096790.0,2026-03-21 12:39:50,TheRealLardin,1rzqfzv
EI,webdev,"[Showoff Saturday] Built webaudits.dev in vanilla HTML/CSS/JS - website, SEO and AI visibility audits, looking for feedback","Been working on this for a while and finally launched about two weeks ago: [webaudits.dev](https://webaudits.dev)

It's a manual audit service - website, technical, SEO, and AI visibility audits (the last one maps whether and how a site shows up in ChatGPT, Perplexity, Claude, Google AI Overviews).

Built entirely in vanilla HTML/CSS/JS, no frameworks, wanted full control over performance and load times, and it felt wrong to have a slow site while selling audits.

Looking for feedback on:

* Is it clear what the service does and who it's for?
* What feels missing - anything you'd expect to see that isn't there?
* Any recommendations on what to add or change?

Also a genuine question for the room:

Thinking about building an AI-powered audit page, where the audit itself is performed by AI, not manually. The hesitation is that there are already a ton of tools doing this. Is it worth the time to build, or does it just become noise in an overcrowded space? Curious what people actually think.",1,2,https://i.redd.it/s10fh4b38eqg1.png,https://www.reddit.com/r/webdev/comments/1rzqfh1/showoff_saturday_built_webauditsdev_in_vanilla/,1774096748.0,2026-03-21 12:39:08,AlexIrvin,1rzqfh1
EI,ICoveredASong,"""Moliendo Cafe / Trompetas De Boca Juniors"" - Cover",,1,0,https://www.youtube.com/watch?v=W0EPWYoBxcU,https://www.reddit.com/r/ICoveredASong/comments/1rzqfd8/moliendo_cafe_trompetas_de_boca_juniors_cover/,1774096738.0,2026-03-21 12:38:58,TheRealLardin,1rzqfd8
EI,Letterboxd,"Four Films, Four Genres-Comedy 1980","https://boxd.it/SfUnC


Star Wars Episode V: The Empire Strikes Back has won best action film of 1980.


Today, we discuss the best comedy film of 1980.


Most votes wins.",4,4,https://i.redd.it/y3t6tgme8eqg1.jpeg,https://www.reddit.com/r/Letterboxd/comments/1rzqf6q/four_films_four_genrescomedy_1980/,1774096723.0,2026-03-21 12:38:43,ThePocketTaco2,1rzqf6q
