bank,subreddit,title,selftext,score,num_comments,url,permalink,created_utc,created_date,author,id
ENBD,UAE,Emirates NBD not returning the stolen money despite police catching the scammer and deporting him,"3 months ago, a transaction of AED7k  was taken from my fathers credit card via Google pay despite my dad not receiving even an OTP from the bank. 

The bank kept denying accountability, so he filed a police case and they arrested the individual who happened to live in UAE itself, the arrested individual confessed to his crime and was deported. 

But now Central bank rejected our request to get the money back saying it’s not the banks responsibility. What do I do in this situation? How can we trust our money in the bank when they offer 0 protection when funds are  stolen by frauds. ",3,12,https://www.reddit.com/r/UAE/comments/1rvcau3/emirates_nbd_not_returning_the_stolen_money/,https://www.reddit.com/r/UAE/comments/1rvcau3/emirates_nbd_not_returning_the_stolen_money/,1773674243.0,2026-03-16 15:17:23,No_Department1748,1rvcau3
ENBD,UAEcreditcards,LIV by ENBD Credit Card,"I have a Liv. credit card. Do you also experience that the minimum cashback you can redeem is AED 500, or am I mistaken?
",2,3,https://www.reddit.com/r/UAEcreditcards/comments/1rv8f4g/liv_by_enbd_credit_card/,https://www.reddit.com/r/UAEcreditcards/comments/1rv8f4g/liv_by_enbd_credit_card/,1773665094.0,2026-03-16 12:44:54,jerababy,1rv8f4g
ENBD,UAEcreditcards,Best credit card for my current expenditures?,"At the moment I have ENBD Duo and ADIB cashback card. I know ENBD duo isn't very good nowadays but I'm still keeping it because I have some items I purchased and converted into installments. So really I utilize mostly my ADIB cashback card since from what I know you need an minimum of 5k spend per month using the ENBD duo. 

Here are my main monthly expenditures:

DEWA

Etisalat

Tabby Payments

Fast food (Work Lunch)

Delivery apps like Keeta, Talabat, Noon

Is ADIB good enough or shall I cancel it and open another credit card like SIB ",1,8,https://www.reddit.com/r/UAEcreditcards/comments/1rv3r86/best_credit_card_for_my_current_expenditures/,https://www.reddit.com/r/UAEcreditcards/comments/1rv3r86/best_credit_card_for_my_current_expenditures/,1773649416.0,2026-03-16 08:23:36,Kolabear15,1rv3r86
ADCB,UAEcreditcards,ADCB Supplementary Credit Card,"If I understand, it'll be linked to my main and charged as a single balance per month with supplementary + main.   
  
Just want to understand how this card works with transaction verifications, will the other person be able to verify their own transactions? 

They don't have an ADCB account so will they be able to sign up onto the application for SecurePass? ",2,0,https://www.reddit.com/r/UAEcreditcards/comments/1rvp0ce/adcb_supplementary_credit_card/,https://www.reddit.com/r/UAEcreditcards/comments/1rvp0ce/adcb_supplementary_credit_card/,1773701285.0,2026-03-16 22:48:05,PureCamel,1rvp0ce
ADIB,PubTips,"[QCrit] FRIENDLY MATCH - Queer Contemporary Romance (86k, Second Attempt)","Hi everyone!

First, I want to thank everyone for the insightful feedback on my previous [baby behemoth here](https://www.reddit.com/r/PubTips/comments/1roqbxy/qcrit_friendly_match_queer_contemporary_romance/). I managed to cut the blurb section from 339 to 237 words + clarified the stakes, also ditched the prologue.

Below is the new version. Appreciate any and all feedback.

\*\*\*

\[Personalization\] FRIENDLY MATCH is a dual-POV queer contemporary romance in which a chronically awkward tech genius enlists his lifelong best friend to test his rival’s Duolingo-like dating app during a last-minute trip to Brazil. It's Elena Armas' *The American Roommate Experiment* meets Helen Hoang's *The Kiss Quotient*, in the summery, yearning vein of Carley Fortune. A standalone with potential of an interconnected series and complete at 86,000 words, FRIENDLY MATCH will be loved by fans of *The Charm Offensive* by Alison Cochrun, and *It Had To Be Him* by Adib Khorran.

Full-time overthinker Nick Morgan is the brain behind America's best dating app. (Sort of. He's the guy who exterminates bugs.) When a new competitor threatens their top spot, Nick jumps into the race for a promotion to build the next matchmaking model. With no romantic experience to draw ideas from, he signs up for said competitor’s scientifically programmed dates with best friend and roommate (and actual dating expert) Renan Moraes. The probability of them falling in love after nineteen years is 0.01%.

Ever since he immigrated to America, serial-hugger and soccer coach Renan has long forgotten what home feels like—until Nick joins him and his boisterous family for the holidays. Fake dating wasn’t on his itinerary, but it’s his best shot at making his workaholic friend slow down and fall a little in love with Brazil. (Just Brazil. Obviously.)

Through languid beach days, sweaty dancing nights, a full-house Christmas, and New Year’s fireworks over the ocean, Nick is (almost) sure the temptation to strip boundaries and swim trunks is an illusion manufactured by the app. Renan, however, has always known *exactly* how he feels about the only man who sees him past the charm, abs, and accent.

Caught between Nick's once-in-a-career opportunity and Ren's reawakened dream of moving back to Brazil, they must confront whether the trip was the final chapter of a friendship meant to be outgrown, or if their long-overdue endgame is worth playing for.

\[bio\]

\*\*\*

First \~300 words of Chapter 1, Nick's POV:

Gravity in this place doesn’t come from below.

On the dance floor, it’s the heat and pressure of the bodies keeping the orbit in motion through strobe-lit dark matter. Cosmic dust swirls in the air, sweet and salty from the smoke machine and sweat, while the bass ignites hands and hips and mouths to collide in a chain reaction of lust. Just another Thursday night in a New York nightclub, where time doesn’t exist.

It’s a beautiful, super gross phenomenon to be part of. I’m just watching from a distance because I’m a little busy with a more important matter at hand.

*Right, right, right,* I swipe on the dating app Sparkd, saying yes to every gay man within a ten-mile radius.

*Sparks fly! You and Ethan have matched*, the in-app banner notifies, but when I click on it, the app crashes.

Mission accomplished. Now that I know exactly where the bug lives in the user flow, I can deal with it later at home. Shoving my phone into my pocket, I go back to human-gazing.

And there he is.

In the galaxy of dancing bodies, he’s the brightest star, radiating the larger-than-life energy of someone who belongs right there, at the center. His hips sway right, then left. Right. Left. When I look up, he’s got a silly grin on his face, all proud of catching me staring, and winks over his shoulder.

I snort to myself and shake my head, picking at what’s left of the soggy napkin under my almost untouched drink. In my defense, I tried ordering something cute and sweet, but ended up with whatever this sad amber puddle is.

Across the room, the crowd parts to let him through, and he stops by the bar. With two drinks in hand, the hottest man at the party walks straight toward me in confident steps.

“Open your mouth, Nicky,"" he drawls, shoving the straw of the blue drink to my face.

\*\*\*

Thanks in advance!",3,0,https://www.reddit.com/r/PubTips/comments/1rvt7vo/qcrit_friendly_match_queer_contemporary_romance/,https://www.reddit.com/r/PubTips/comments/1rvt7vo/qcrit_friendly_match_queer_contemporary_romance/,1773711639.0,2026-03-17 01:40:39,SevenWavesAtMidnight,1rvt7vo
EI,Nightreign,6th souls platinum,"I didn't know if I was gonna platinum it or not, then I did. Anyway, 6 down 2 to go.",1,0,https://i.redd.it/9pm3uqelnjpg1.jpeg,https://www.reddit.com/r/Nightreign/comments/1rvy94e/6th_souls_platinum/,1773726517.0,2026-03-17 05:48:37,Advanced-Marketing87,1rvy94e
EI,snappijuorutofftopic,Telian netti pätkii (taas),"Oonko ainut kenellä ei tunnu toimivan toi telian netti? Mulla on pöytäkone ethernetilla, ja sain ""kivana yllätyksenä"" huomata että tänään netti ei näytäkkään toimivan jostain ihmeen syystä. En ole koskenut mihinkään johtoihin tms. ja vielä toissapäivänä pääsin käyttämään konetta ihan normaalisti??? 🫠",2,0,https://www.reddit.com/r/snappijuorutofftopic/comments/1rvy84c/telian_netti_pätkii_taas/,https://www.reddit.com/r/snappijuorutofftopic/comments/1rvy84c/telian_netti_pätkii_taas/,1773726420.0,2026-03-17 05:47:00,kalakukk0,1rvy84c
EI,memeexchangecommunism,What have you seen that makes you want to tell someone to get professional help?,,1,1,https://i.redd.it/fxevxpg9ijpg1.jpeg,https://www.reddit.com/r/memeexchangecommunism/comments/1rvxr5y/what_have_you_seen_that_makes_you_want_to_tell/,1773724806.0,2026-03-17 05:20:06,SweetZestyclose6610,1rvxr5y
EI,Salary,Salary Progression of a Software Engineer @Meta,,11,2,https://i.redd.it/h1b7fyz0ijpg1.png,https://www.reddit.com/r/Salary/comments/1rvxpin/salary_progression_of_a_software_engineer_meta/,1773724652.0,2026-03-17 05:17:32,paperclip_han,1rvxpin
EI,Football_Head_Coach,Need help with offensive formations and tactics,I’ve changed so much stuff around and could use some help with my tactics,2,0,https://i.redd.it/z2ljpbc0ijpg1.jpeg,https://www.reddit.com/r/Football_Head_Coach/comments/1rvxpda/need_help_with_offensive_formations_and_tactics/,1773724639.0,2026-03-17 05:17:19,Electronic-Log7443,1rvxpda
EI,kuzhongzuole,好好好,,1,0,https://i.redd.it/p38t8oszhjpg1.jpeg,https://www.reddit.com/r/kuzhongzuole/comments/1rvxpc3/好好好/,1773724636.0,2026-03-17 05:17:16,RanToTur,1rvxpc3
EI,writers,Made a short little comedy story and want to know if its any good,"How To Take Care of Your Anxiety-Ridden Demon 

The problem with summoning a demon in a one-bedroom apartment was mostly the smoke detector. The circle was carefully drawn, sigils were perfect, each candle was lit and anointed. But the incense smoke kept setting off the goddamn thing. 

Rowan groaned in frustration then finally put out the incense in defeat. They settled back down in the salt circle cross legged, grimoire balancing on their knee. They double checked the Latin for the third time. 

“Per ignem et sanguinem…” they muttered, brow furrowed. “No, that’s right. Definitely right.” 

Rowan adjusted the sleeves of their thrifted grandpa sweater, the silver of their necklaces catching in the candlelight.  

The apartment had been extra dark; the air felt thick and heavy, charged with the weird shit Rowan was doing that night. 

They raked their gaze over the setup. A salt circle etched with sigils, a pentagram carved at its heart, a bowl of herbs waiting in the center. 

They took a deep breath, picking up a sterilized needle—safety first—and pricked their finger, hissing softly. 

“Okay,” They whispered to no one in particular. “we’re doing this.” 

They let a drop of blood fall and mingle with the herbs. They took their grimoire in their hands and a lighter in the other, while lighting the herbs they chanted. 

“Impera eis, liga eos, ad me eos adduc. Per ignem et sanguinem!” 

For a heartbeat, nothing happened. Then everything did. 

The herbs surged upward in sapphire flames from the ceramic bowl. The shadows along the walls peeled back into thin wiry strips. Smoke twisted and curled into itself; tendrils wisped off in tiny strands. 

In one resounding swoosh, a figure stood inside the circle. Tall. Lean. 

Rowan’s gaze dropped to the sleek leather boots. Then upward—dark slacks and a long tailored coat, gloved hands heavy with silver rings. The smell of sulfur hung threaded through the air. 

Still higher, ghostly pale skin, piercing blue eyes and spiraling obsidian horns jutting out from the locks of long alabaster hair. 

“I am Valerian, the-"" the demon took a pause “fuck…” He reached into his coat, fishing out a stack of flash cards which he fumbled with and dropped like an idiot. “Shit- I- I don’t have a card… for this...” He crouched down trying to gather the little pieces of paper he had scattered all around.  

 Wide frantic eyes and fast desperate movements. “Sorry… Sorry…” he scrambled to clean up his mess. 

“Oh.” Rowan blinked. “Do you want chamomile tea? You look a bit anxious.” 

“A-anxious!? No, I’m not anxious!” Valerian shot upright. Then deflated. “Yes, I want chamomile…” he said quietly. 

“All right. Give me a sec,” Rowan said. 

They leaned forward and out of the salt circle. It was only to grab a mug of chamomile. 

Valerian flinched as if struck.  

Rowan took notice. “I'm not banishing you.” They said softly. 

“Good. Because that would’ve been painful.” His voice cracked on the last word.  

Valerian was quiet for a moment. 

“Uh. Right.” He straightened, squaring his shoulders. “I am Valerian, the Dark Lord of Serpents and the ruler of the ninth layer. I have heard your summons. What is it you require of me, mortal?” 

At some point during the speech, Rowan had pressed the mug of chamomile into his hands. 

He took a careful sip. “...Thank you.” 

Rowan tilted their head. 

“Can you help me pass my exams?”  

“What.” Valerian deadpanned. “You summoned a literal demon... to assist you in an academic assessment?”  

“Yes.” 

“You- I don't even know where to begin! I can barely be evil properly and I'm supposed to help you on an exam?! Heck, I barely passed mine!” Valerian clawed at his hair and began to pace around in the circle like a distressed cat in designer boots. Words tangled together as his breathing went thin and uneven. 

Rowan blinked. 

Valerian kept spiraling. 

“I failed Intro to Malevolent Manifestations twice,” he blurted. “Do you know how humiliating that is in the ninth layer? My cousin devours villages recreationally and I can’t even maintain a stable infernal portal without cue cards!” 

He gestured at the scattered cards on the floor. 

“Do you have any idea what family dinners are like. ‘Oh Valerian, how’s your portal stability these days?’ ‘Still collapsing under minor stress, thank you for asking, Aunt Belphegora.’” 

Valerian pressed a hand to his face. 

“I’m a disgrace to demonic academia.” 

Rowan took a slow slip of their own tea. 

“...So that's a maybe?” 

Valerian took a deep breath. Setting down the tea on a nearby stool. With a sharp snap of his fingers he summoned a pillow in his hands. He pressed his face into it and screamed. It came muffled to Rowan but still sounded distressed. 

This went on for a while. 

  
I feel like its kinda cringe tho. ",1,2,https://www.reddit.com/r/writers/comments/1rvxos9/made_a_short_little_comedy_story_and_want_to_know/,https://www.reddit.com/r/writers/comments/1rvxos9/made_a_short_little_comedy_story_and_want_to_know/,1773724584.0,2026-03-17 05:16:24,Competitive_Gift8378,1rvxos9
EI,kuzhongzuole,点赞,,1,0,https://i.redd.it/th1u4z4qhjpg1.jpeg,https://www.reddit.com/r/kuzhongzuole/comments/1rvxoe9/点赞/,1773724546.0,2026-03-17 05:15:46,RanToTur,1rvxoe9
EI,payrollsystem,Best HR Software with Reliable Customer Support in Malaysia for SMEs (2026 Guide),"When choosing HR software in Malaysia, customer support can make or break your experience, especially for small businesses without a dedicated HR team. You’re not just buying features; you’re investing in how quickly problems get solved when payroll errors, EPF submissions, or LHDN filings come up. The best HR tools should offer fast response times, local expertise, and support across multiple channels like chat, email, and onboarding sessions. Without this, even good software can become frustrating to use.

For Malaysian SMEs, local compliance knowledge is critical. Your HR software should understand EPF, SOCSO, EIS, and PCB requirements and guide you when regulations change. Many users in online communities highlight that responsive support is a key factor when choosing payroll software, especially during month-end processing or tax season. One user mentioned that having “responsive support” helped reduce payroll stress and avoid compliance issues. 

This is where QuickHR stands out for many businesses in Malaysia. It offers multi-channel, multilingual support along with continuous training and onboarding assistance, which is especially helpful for small teams getting started. Since QuickHR is built for the Malaysian market, its support team understands [local payroll](https://quickhr.my/features/payroll-software) requirements and can help resolve issues quickly without unnecessary back-and-forth.

Another reason SMEs consider QuickHR is its combination of automation and support. The platform handles statutory compliance like EPF, SOCSO, and LHDN automatically while still providing human support when needed. This balance is important because while automation saves time, having real people to assist you ensures nothing goes wrong during critical payroll cycles.

In short, don’t just compare features, evaluate the support experience. For Malaysian small businesses, tools like QuickHR offer a strong mix of local expertise, responsive service, and reliable automation, making HR and payroll much easier to manage as you grow.

",1,0,https://www.reddit.com/r/payrollsystem/comments/1rvxo8o/best_hr_software_with_reliable_customer_support/,https://www.reddit.com/r/payrollsystem/comments/1rvxo8o/best_hr_software_with_reliable_customer_support/,1773724531.0,2026-03-17 05:15:31,parker_adam916,1rvxo8o
EI,snes,My current set up,I'm currently using a retrotink 2x pro.,7,1,https://i.redd.it/trk3x4z2hjpg1.jpeg,https://www.reddit.com/r/snes/comments/1rvxm40/my_current_set_up/,1773724334.0,2026-03-17 05:12:14,Ill-Gear-1972,1rvxm40
EI,bangladesh,"HELP ME DECIDE: DU Finance vs. BRACU CSE for going abroad + ROI, BRACU CS difficulty","DU's admission deadline is 28 March so PLEASE HELP ME MAKE A DECISION!

I got into DU Finance, which is a BBA program, and I'm going to sit for Summer 2026 exam at BRACU. I'm honestly confused about which one I should pick.

I have ABSOLUTELY ZERO interest in staying in Bangladesh, I planned to go abroad for Bachelor's but decided the cost wasn't worth it so I'm gonna do my undergrad degree here and wanna get out right after I graduate. At the same time, I am risk averse and like to plan for the worst, so I wanna keep my options open in Bangladesh as well. But just to put it out there, I wanna leave Bangladesh for good, that's plan A, B and C with no room for error, I don't even care what country as long as it's not third-world and war-ridden. DU Finance is undoubtedly great for staying in Bangladesh, but I'm a Science background student and I don't know SHIT about Finance. I also heard that it closes doors for abroad.

Secondly, how rigorous is BRACU CS? I'd like to think I'm moderately good at mathematics and I even did coding competitions in high school, will I be able to keep up with CSE? A lot of people told me ""CSE porar moto brain thakle public ei chance paita"" but the thing is I did get CSE in a VERY reputed public university but my parents didn't let me go outside Dhaka because I'm a girl and they think I wouldn't be able to cope with the mofosshol environment. My PRIMARY goal is to keep my CGPA above 3.7, publish lots of quality research papers and do industry internships on the side, preferably while graduating a little early. Am I dreaming baselessly or is this possible? I'm willing to completely abandon my social life to get to my goals, not that I have much of it currently.

The cost is also a consideration for me, is spending 14 lacs extra for BRACU CS worth it over studying DU Finance for (practically) free?

Please help a girl out with some advice 🙏",1,3,https://www.reddit.com/r/bangladesh/comments/1rvxjyp/help_me_decide_du_finance_vs_bracu_cse_for_going/,https://www.reddit.com/r/bangladesh/comments/1rvxjyp/help_me_decide_du_finance_vs_bracu_cse_for_going/,1773724136.0,2026-03-17 05:08:56,Lazy_Ambassador_5728,1rvxjyp
EI,brandonherrara,"Well, isn't that interesting?",,88,7,https://i.redd.it/frxuu4xdgjpg1.jpeg,https://www.reddit.com/r/brandonherrara/comments/1rvxjjc/well_isnt_that_interesting/,1773724093.0,2026-03-17 05:08:13,Street-Top3449,1rvxjjc
EI,mtgmisprints,Miscut Pirates,,1,0,https://www.reddit.com/gallery/1rvxio9,https://www.reddit.com/r/mtgmisprints/comments/1rvxio9/miscut_pirates/,1773724009.0,2026-03-17 05:06:49,token_zombie,1rvxio9
EI,Firearms,"Well, isn't that interesting?",,187,23,https://i.redd.it/kiyeqnf0gjpg1.jpeg,https://www.reddit.com/r/Firearms/comments/1rvxi6c/well_isnt_that_interesting/,1773723967.0,2026-03-17 05:06:07,Street-Top3449,1rvxi6c
EI,femfragranceswap,[WTS] Selling/Trading Niche/Indie 1mL Samples (40+),"Hi all! Looking to reduce my sample collection a bit. Most samples are in **\~1mL dabbers, (a few labeled in atomizers).**   
Sourced primarily from ScentSplit or LuckyScent (indies directly from the source).

**$5 each + $4 shipping** (U.S. based): **PayPal preferred.**  
Most tested 1-2 times (\~90-100% full). Being perfectly honest, the dabber handle on some is a little jank, but pliers work like a charm.  
Open to bundles or offers. **5 for $22, 10 for $40. Want 40+ samples? You can have the whole list for $150 (\~$3.50 each). 10+ samples = free shipping!**

**Please DM for offers!**

**Niche/Designer Brands:**

Andrea Maack - Solstice  
Apoteker Tepe - The Peradam  
BeauFort London - Sirenide  
Byredo - Bal d’Afrique  
Cacharel - LouLou (atomizer)  
d’Annam - Pho Breakfast, Tokyo Nights  
Etat Libre d’Orange - Sécrétions Magnifiques  
Filippo Sorcinelli - Nebbia Spessa, Reliqvia (1mL Reliqvia has been transferred to a 2mL atomizer)  
Fragrance du Bois - Sirène  
Histoires de parfums - 1969 Parfum de Révolte  
Jorum Studio - Paradisi  
L’Artisan Parfumeur - Iris de Gris, Memoire de Roses, Timbuktu (atomizers)  
Maison Crivelli - Hibiscus Mahajad  
Mugler - Womanity (atomizer)  
Nasomatto - Fantomas  
Orto Parisi - Megamare  
Parfums de Marly - Delina, Pegasus  
Robert Piguet - Bandit, Fracas (atomizers)  
Serge Lutens - La Fille de Berlin  
The House of Oud - The Time  
Toskovat’ - Empty Wishes Well  
Trudon - Aphelie  
Xerjoff - Starlight

**Indie Houses:** 

Alkemia - Arabesque, Elixir of Aphrodite, Enchantee, Enigma, Gothique, Moss Maiden, Silken Tent, Writer’s Blood, Foret Mythiques  
BPAL - Scheherazade  
Siren Song Elixirs - Spellbind",1,0,https://i.redd.it/wjrzb12vejpg1.jpeg,https://www.reddit.com/r/femfragranceswap/comments/1rvxea1/wts_sellingtrading_nicheindie_1ml_samples_40/,1773723626.0,2026-03-17 05:00:26,BagelLoop,1rvxea1
EI,teenagers,my polcomp results,"i just put everything else in black so you can read better if
lowkey feel like this doesn't make sense but ok
it's like those flags with every symbol ",1,7,https://i.redd.it/ze6xvcdwdjpg1.png,https://www.reddit.com/r/teenagers/comments/1rvxa8n/my_polcomp_results/,1773723262.0,2026-03-17 04:54:22,lilyykyz_69,1rvxa8n
EI,povertyfinancecanada,Been over a month but my EI application is still under review..,"Hopefully this is the right subreddit for me to express this concern; I applied for medical EI on Feb 10th, because I got injured while out on a hike, and I've been consistently checking my MSCA account and submitting the biweekly reports, but they still haven't made a decision regarding my application. Anyone know anything about why it may be so delayed? It says 28 days processing time on their website, but yet it's certainly been longer than that now, and multiple bills are coming due very soon and it's starting to make me feel very anxious...
 
The hospital had only issued me medical leave for two weeks, meanwhile I was required to wear the walking boot for like four weeks then start to wean off, so I definitely had to get an extension on my medical leave because my job is physical labor, and so I did get that done by visiting a walk-in clinic, but now I may need to book a follow-up appointment with the orthopedic for an examination on my progress, apparently that isn't automatic, it's got to be specifically requested, well I got no choice because my gait is still off and I'm expected to get back to work soon somehow, meanwhile I'm waddling around trying to go for short walks.. 

I live in BC btw.. ",2,1,https://www.reddit.com/r/povertyfinancecanada/comments/1rvwvmg/been_over_a_month_but_my_ei_application_is_still/,https://www.reddit.com/r/povertyfinancecanada/comments/1rvwvmg/been_over_a_month_but_my_ei_application_is_still/,1773721970.0,2026-03-17 04:32:50,leMaverique,1rvwvmg
EI,vSeeBox_Support_Gurus,Thanks Derik. Just got my v6 plus and keyboard.,,1,0,https://www.reddit.com/gallery/1rvwtwu,https://www.reddit.com/r/vSeeBox_Support_Gurus/comments/1rvwtwu/thanks_derik_just_got_my_v6_plus_and_keyboard/,1773721821.0,2026-03-17 04:30:21,Frankiex2c,1rvwtwu
