bank,subreddit,title,selftext,score,num_comments,url,permalink,created_utc,created_date,author,id
ENBD,UAE,Emirates NBD not returning the stolen money despite police catching the scammer and deporting him,"3 months ago, a transaction of AED7k  was taken from my fathers credit card via Google pay despite my dad not receiving even an OTP from the bank. 

The bank kept denying accountability, so he filed a police case and they arrested the individual who happened to live in UAE itself, the arrested individual confessed to his crime and was deported. 

But now Central bank rejected our request to get the money back saying it’s not the banks responsibility. What do I do in this situation? How can we trust our money in the bank when they offer 0 protection when funds are  stolen by frauds. ",2,5,https://www.reddit.com/r/UAE/comments/1rvcau3/emirates_nbd_not_returning_the_stolen_money/,https://www.reddit.com/r/UAE/comments/1rvcau3/emirates_nbd_not_returning_the_stolen_money/,1773674243.0,2026-03-16 15:17:23,No_Department1748,1rvcau3
ENBD,UAEcreditcards,LIV by ENBD Credit Card,"I have a Liv. credit card. Do you also experience that the minimum cashback you can redeem is AED 500, or am I mistaken?
",2,2,https://www.reddit.com/r/UAEcreditcards/comments/1rv8f4g/liv_by_enbd_credit_card/,https://www.reddit.com/r/UAEcreditcards/comments/1rv8f4g/liv_by_enbd_credit_card/,1773665094.0,2026-03-16 12:44:54,jerababy,1rv8f4g
ENBD,UAEcreditcards,Best credit card for my current expenditures?,"At the moment I have ENBD Duo and ADIB cashback card. I know ENBD duo isn't very good nowadays but I'm still keeping it because I have some items I purchased and converted into installments. So really I utilize mostly my ADIB cashback card since from what I know you need an minimum of 5k spend per month using the ENBD duo. 

Here are my main monthly expenditures:

DEWA

Etisalat

Tabby Payments

Fast food (Work Lunch)

Delivery apps like Keeta, Talabat, Noon

Is ADIB good enough or shall I cancel it and open another credit card like SIB ",1,4,https://www.reddit.com/r/UAEcreditcards/comments/1rv3r86/best_credit_card_for_my_current_expenditures/,https://www.reddit.com/r/UAEcreditcards/comments/1rv3r86/best_credit_card_for_my_current_expenditures/,1773649416.0,2026-03-16 08:23:36,Kolabear15,1rv3r86
ENBD,TradingViewSignals,All flights to and from Dubai have been temporarily suspended. Emirates Airlines $ENBD is currently facing challenges.,"Emirates airline just posted: 

Please do not go to the airport.

Emirates will share updates when available. We would like to thank our customers for their understanding and patience.

The safety of our passengers and crew is our highest priority and will not be compromised.",1,1,https://i.redd.it/hzvrpldc9cpg1.jpeg,https://www.reddit.com/r/TradingViewSignals/comments/1rv0bud/all_flights_to_and_from_dubai_have_been/,1773636976.0,2026-03-16 04:56:16,Ubersicka,1rv0bud
ADCB,HungryArtists,"[For Hire] I'm a Multimedia Designer TouchDesigner/CGI/3D Character Rig, MoCap, Animation, Textures/VFX Pro","Hello, I'm a multimedia designer and independent artist that has worked for a little more than 5 years in various industry projects. 
If you need a set of visuals for a live performance that must run in real time, 3D art for a game or project. Develop a narrative with animation and storytelling. Design and realize a VFX heavy scene. Anything I can do, you can count on me.

We can create:

Optimized 3D: Modeling, Retopology, Texturing. Character Rigging, Animation & MoCap Clean up. Animation Sets. Delivered in any file format you need. 

VFX Development & Integration: Develop your idea for a VFX oriented composition in your scene or project. 

Set of Visuals(Live): Create a set of visuals (clips, animation, motion graphics) for your content or live performances. I can work using tools like TouchDesigner/Resolume to help you create a set of live visuals that can react to your audio input, be controlled in real time and synch with your set. 

Motion graphics/2D-3D Animation: I will help you in making a motion graphic, or 2D/3D animation for your brand. 

3D Rendering & Product Animation: I will help you develop interesting 3D renders for your products or environments. So you can showcase what you make yo your clients. 

Portfolio: https://linktr.ee/ivangeraldo

Hourly Rate: $12/hr

You can reach out to me via email:
ivan.geraldo.nu@gmail.com
",1,0,https://www.reddit.com/gallery/1ruzen7,https://www.reddit.com/r/HungryArtists/comments/1ruzen7/for_hire_im_a_multimedia_designer/,1773633995.0,2026-03-16 04:06:35,IvanGeraldo,1ruzen7
ADCB,Artistsforhire,"[For Hire] I'm a Multimedia Designer TouchDesigner/CGI/3D Character Rig, MoCap, Animation, Textures/VFX Pro | $12/hr","Hello, I'm a multimedia designer and independent artist that has worked for a little more than 5 years in various industry projects. 
If you need a set of visuals for a live performance that must run in real time, 3D art for a game or project. Develop a narrative with animation and storytelling. Design and realize a VFX heavy scene. Anything I can do, you can count on me.

We can create:

Optimized 3D: Modeling, Retopology, Texturing. Character Rigging, Animation & MoCap Clean up. Animation Sets. Delivered in any file format you need. 

VFX Development & Integration: Develop your idea for a VFX oriented composition in your scene or project. 

Set of Visuals(Live): Create a set of visuals (clips, animation, motion graphics) for your content or live performances. I can work using tools like TouchDesigner/Resolume to help you create a set of live visuals that can react to your audio input, be controlled in real time and synch with your set. 

Motion graphics/2D-3D Animation: I will help you in making a motion graphic, or 2D/3D animation for your brand. 

3D Rendering & Product Animation: I will help you develop interesting 3D renders for your products or environments. So you can showcase what you make yo your clients. 

Portfolio: https://linktr.ee/ivangeraldo

Hourly Rate: $12/hr

You can reach out to me via email:
ivan.geraldo.nu@gmail.com",1,0,https://www.reddit.com/gallery/1ruz24s,https://www.reddit.com/r/Artistsforhire/comments/1ruz24s/for_hire_im_a_multimedia_designer/,1773632950.0,2026-03-16 03:49:10,IvanGeraldo,1ruz24s
ADCB,UAEcreditcards,Is foreclosure of payment plans mandatory for closing ADCB CC. even though balance is zero,"I’m trying to close my ADCB CC.  Paid a big portion of the utilized amount from another bank (now it’s Zero). So when i went to their branch in the same payment date. They told me that its showing 4k AED

So i don’t know if it’s due the time needed to be reflected in the bank system or is it related to the several payment plans ?

Also if there’s a way to cancel it using the app or customer service. Would be appreciated ",2,2,https://www.reddit.com/r/UAEcreditcards/comments/1ruvzpm/is_foreclosure_of_payment_plans_mandatory_for/,https://www.reddit.com/r/UAEcreditcards/comments/1ruvzpm/is_foreclosure_of_payment_plans_mandatory_for/,1773624255.0,2026-03-16 01:24:15,First-Emergency6278,1ruvzpm
EI,snappijuorutofftopic,Itsensä ettiminen,"Miten te ootte löytänyt ittenne? Oon ite ihminen, joka saa joka päivä uuden idean mitä voisi harrastaa ja hankin siihen tarvikkeet ja sit se jää tai myös tuntuu, että ei oo ehkä ihmisiä itsellä ympärillä, jotka tajuaisivat minua tietyllä aaltopituudella. 

Mulla oli ennen yksi ihminen elämässä, joka ymmärsi mua jokaisella aaltopituudella ja juteltiin elämästä kuolemaan kaikilla tavoilla, mutta se onkin mun entinen ja iso nounou hänen kanssaan uudelleen jutteluun.  Itsellä ei oo oikeen ystäviä ympärillä ja nykyisen miehen kanssa ehkä jopa tuntuu et ei me jutella oikeen koskaan mitään ”syvällisiä” oon yrittänyt kyllä keskustella asioista, mutta vastaukset on ”en osaa sanoa” ”en tiedä” tai ”mitä sä nyt höpötät”.

Oon aika hukassa mun tyylini kanssa ja ulkonäön kanssa. Tuntuu et en oo ”oma itteni” tai et vaatteet tuntuu huonolle jos on vähänkin ”löysempää ja rennompaa”. Oon myös vähän ehkä sellanen et ”seuraan” muita. Oon esimerksiksi miettinyt taas ripsienpidennyksiä, mutta sit taas ihmiset puhuu ”naturaalista”. Tatuointia oon miettinyt, mutta pelkään et mieli muuttuu sen suhteen ja oon ahdistunut, kuinka haluan sen pois. 

hain opiskelemaan niinkun laidasta laitaan oleviin opintoihin, mitkä ehkä täyttää jotain tiettyjä osa-alueita mitä haluaisin tehdä. 

Käyn kyllä terapiassa, joka viikko ja keskustelen asioista, mutta nyt nääkin asiat on yks kaks kumpunnut viime viikosta just terapia istunnon jälkeen ja seuraava kerta on torstaina ja tuun jotenkin hulluks näitten ajatuksienkaa, kun puhuttavaa ja mietittävää riittää, mutta ei ihmisiä kelle puhua.",1,1,https://www.reddit.com/r/snappijuorutofftopic/comments/1rvclf4/itsensä_ettiminen/,https://www.reddit.com/r/snappijuorutofftopic/comments/1rvclf4/itsensä_ettiminen/,1773674889.0,2026-03-16 15:28:09,Horror_Letter_8866,1rvclf4
EI,Pachuca,"Banda me están tumbando las publicaciones denunciando lo que está pasando en la escuela, compartan por favor si es que de plano me tumban todo",,2,0,https://www.reddit.com/gallery/1rvclas,https://www.reddit.com/r/Pachuca/comments/1rvclas/banda_me_están_tumbando_las_publicaciones/,1773674882.0,2026-03-16 15:28:02,Plus-Expert-6615,1rvclas
EI,LTB_iel,LTB_iel,,5,2,https://i.redd.it/k6fafzevdfpg1.jpeg,https://www.reddit.com/r/LTB_iel/comments/1rvcl3v/ltb_iel/,1773674871.0,2026-03-16 15:27:51,Kewell86,1rvcl3v
EI,vinyl,"""Demons"" - ... Come Bursting Out! (1998)","..Come Bursting Out!  (1998) • 
""Demons"" • 
Released 2000 . US • 
Vinyl (12"", EP, Reissue) • 
Label Gearhead Records (# RPM013) • 

Six songs of high-voltage punk n roll from Sweden. Tones of garage rock and Detroit proto punk litter the 6 songs on here. Everything is slammed as loud as it will go, much like New Bomb Turks and other labelmates from Gearhead. This is action rock, made for cranking in the car while running from the law. I listened to this band a lot in the early 00s! I stumbled across this copy at a record show a week ago. ",4,0,https://i.redd.it/dhng27rsdfpg1.jpeg,https://www.reddit.com/r/vinyl/comments/1rvcjvy/demons_come_bursting_out_1998/,1773674795.0,2026-03-16 15:26:35,knuck666,1rvcjvy
EI,EgyDMs,والله ما كذب,,6,10,https://i.redd.it/yh8uxp5vcfpg1.jpeg,https://www.reddit.com/r/EgyDMs/comments/1rvcevk/والله_ما_كذب/,1773674485.0,2026-03-16 15:21:25,Over_Crow_9460,1rvcevk
EI,OccupationalTherapy,How much do you make in EI?,"If you’re comfortable, please share how much you make as an EI therapist and approx. how many hours per week you work. 

I have only done schools but have been thinking about making the switch to EI as my commute is an hour and a half one way and it’s becoming a lot. I love the school schedule and the consistent paycheck. I also have small kids (not school aged yet), but I love being able to have the summers off with them. 

My son also has heart issues and has frequent doctor’s appointments which my school job is flexible enough that I can take days when needed. ",1,1,https://www.reddit.com/r/OccupationalTherapy/comments/1rvcehg/how_much_do_you_make_in_ei/,https://www.reddit.com/r/OccupationalTherapy/comments/1rvcehg/how_much_do_you_make_in_ei/,1773674463.0,2026-03-16 15:21:03,dogmomxo,1rvcehg
EI,Hoyoverse_scaling,"Hot Take: Genshins Traveller is Stronger than Rover and I think Genshin Powerscaling is genuinely underrated in terms of scaling to Honkaiverse inverse scaling, (Atleast in terms of high tiers) and think that genshin very quickly gets into planetary ranges to even Universal with cross scaling","I think the Traveller is very Easily atleast getting into the Base Destruction path Trailblazer ranges in terms of strength and characters stronger then them are superior to that in some, there are more inconsistent statements via the star level arguments for Ei and There is the 4D Anemo statement since we know Teyvat's Time IS actual time, and that spacetime, time and space are independent of eachother but connected at the same time, (there are also the Universal Hutzilchopattli Args, I'm confused on this one since Its vague, and think its more comfortably planetary to high planetary or maybe even multi-planetary ranges with the scales off of the abysses nature & the abyss itself, if especially in the context of Irminsul which \*might\* just act as a mediator for the abysses nature, Alice in the new Quest implies Genshin operates or depending on how you see it blatantly states that Genshin works on a Many Worlds Interpretation of Quantum Physics with new branches reaching out into infinity, and the collective **WILL** of the **ABYSS** having a hatred for existence I separate the **RED** & the **PURPLE** abyss from eachother with the **RED ABYSS** being a destructive force of raw emotion that aims to destroy the greater Genshin universe, and the **PURPLE ABYSS** being more like a slow burning eldritch nightmare, I will be bringing up some vague comparisons or similarities and connects Here, so stick with me, and some of the evidence or statements here won't always be consistent so that's another issue.

  
In the recent Quest, there is a segment of a conversation between Alice, The Traveler and Paimon in which they communicate about the nature of the abyss, and in the conversation Alice mentions The Nature of the Abyss and brings up the closest example/understanding of it with references to Barbeloth, referring to it as ""Unfulfilled/Unchosen fates."" of which Paimon then refers to the Abyss as ""Collective Hatred of the Unchosen fates."" The Abyss itself has proven multiple times to act outside of or Interact with time in Unique Ways, in the Abyssal Domain skirk lives in, Time isn't stable and it acts unnatural, being faster drastically or slower drastically within it compared to outside of it, with the abyss Vedrfolnir was able to **SEE**  into the future -> back at the Traveller who was looking in from  the past, and they were able to see eachother, when we first encounter Crystal Ved in the caribert Archon Quest he Mentions how he will **""Look back at your life and shed a tear at the END OF TIME.""** this can be argued as either metaphorical or literal in which the Abyss has proven many times to not just effect time, or distort it in weird ways but Entirely either one, Ignore its effects, implied to exists beyond just it conceptually and has the capacity to sustain someones existence while Shattered and scattered throughout time, and I do think Rerir was being literal when he mentioned this.

I think this because Rerir in the future was Able to Sustain himself in the temporal Space of the moons reflection which IS conclusively atemporal, and can span across history, its also proven that ELEMENTAL power with Kuuvahki and with Anemo with Barbatos (Blew Mare Jivari off of the Timeline entirely - Time does not pass there, not even the sun rises or falls)  the Abyss is INCREDIBLY potent, and extremely all encompassing, and I can see the Args for The Annihilation Device in Natlan Erasing the Universe itself because it refers to it as a ""World of Endless White."" -> ""Time Does not pass/has lost meaning."" and a ""World where the darkness can never again touch.""  With World being Questionable because Hoyoverse uses Variable worlds between Universe, World, Galaxy, things like this are vague intentionally.

  
The Traveler has proven to be capable of Interaction beyond time, acts outside of fate and ignores the laws of the world naturally -> the Traveler (Abyss Twin) was brought as a tool to be capable of absorbing infinite abyssal power (I Think Light Realm Energy/Omni-Element is just Bright Abyss, This is because of the Abysses Connection to **Yog-Sothoth via Gosoythoth and the description of Yog-Sothoth**) I think the Abyss is very likely an aspect of Yog's Authority or presence, or is **at least** connected to **Finality**, most notably because of the shared qualities between the Abyss and the description of Yog with Yog in Lovecrafts Mythos, being an Evil(?)/Abyssal Light and Genshins consistant References to Lovecraft literature with rift hounds being references to Hounds of Tindaloss, parts of genshins story being connected to Lovecraft such as colors from space, journey into unknown Kadath Nyarlathothep (Ved) and the connections to other parts of lovecraftian mythos such as the Shoggoth etc, Traveler has Correlations with some characters from H.P. Lovecraft's works

Ex:  
Randolph Carter  
Some Parts of Nyarlathothep  
Etc)

as well as connections to other Lovecraft adjacent Media/ like Robert W Chambers The King in Yellow, with cruelty of the unknowable and its effects via forbidden knowledge which distorts, drives men mad and sickens them, I think **Red Abyss** is a Mindless Force of Chaos and Destruction (The Hatred) and I think **Purple Abyss** Is the ""Will"" of the abyss which allows it to have orderly invasion and action I also think Irminsul is a Model/Artificial Imaginary tree this is further supported by tree in Inazuma that also is grown and planet at different eras that contradict eachother.

  
Low tier Electro chars are at the Lowest Lightning timers, which is also inconsistent because even Low tiers can casually create multiple afterimages with motion alone

  
Natlan Traveler was fighting Rel to amped Mavuika even without the extra amp from Pyro due to her presence, I think the Whale can Devour entire world and do the same for stars - Childe fought it at max output for multiple days, traveler defeated that same max output individual and won in less than 1 day while weaker then they were in Fontaine.

Inazuma traveller is lowest Multi-Island into Planetary for being Rel with Ei in plane of Euthymiea even if you say she wasn't using full power the lowest Calc we have of a less powerful than modern day Ei, is the Island splitting feat and sky splitting statement, Travelers strength level is variable and unset I think you can consistantly get them into Multi-planetary ranges to star level or higher with 4D -> 5D haxes and resistances, or even more then that depending on how you scale the Imaginary tree, abyss and irminsul, 

I think that Genshins power level is Similiar to fate in that the characters are limited to a certain level of destructive capacity because of the setting, the characters in Genshin are capable of destroying planets star systems or even have universal to galaxy levels of strength, but the setting taking place on a planet prevents the destructive capacity in visuals to go beyond what is capable on one planet I think it would be the same for HSR if it wasn't about the greater universe up in your face, and they weren't allowed to just drop a universal threat onto the MC's head and make them fight a dog named Charles later on.",2,5,https://www.reddit.com/r/Hoyoverse_scaling/comments/1rvcegq/hot_take_genshins_traveller_is_stronger_than/,https://www.reddit.com/r/Hoyoverse_scaling/comments/1rvcegq/hot_take_genshins_traveller_is_stronger_than/,1773674462.0,2026-03-16 15:21:02,The_Special_Chicken1,1rvcegq
EI,ICSE,"Guys, will the topo sheet symbols be provided in the exam??",I was practicing topo sheets when I noticed these symbols. I hope they provide us the symbols in the  exam too.,2,3,https://i.redd.it/e9aqx0zpcfpg1.jpeg,https://www.reddit.com/r/ICSE/comments/1rvce0g/guys_will_the_topo_sheet_symbols_be_provided_in/,1773674435.0,2026-03-16 15:20:35,breloomee,1rvce0g
EI,kirjallisuus,Han Kang - Vegetaristi,"Hankin Vegetaristin omaan hyllyyn ja luin sen nyt toista kertaa, tässä muutama sana siitä:

Teoksen päähenkilö Yeong-hye on oman elämänsä sivuhenkilö. Hänen tarinansa kerrotaan koruttomasti, kuinka patriarkaalinen maailma nujertaa herkän sielun, musertaa tahdon ja jättää jälkeensä pelkän nuken, jota riepotella.

Kolmeen näytökseen jaettu kertomus alkaa Yeong-hyen päätöksestä ryhtyä vegetaristiksi, mutta tämä ei ole teos vegetarismista, vaan vapaudesta, naisen vapaudesta, kuinka häneltä on riistetty oikeus päättää omasta elämästään tai vartalostaan. Hänen päätöstään paheksutaan, haastetaan, ivataan ja kiistetään, mutta hän pitää siitä kiinni kynsin ja hampain tai muuten häneltä viedään kaikki.

Yeong-hyen totuutta nimitetään sairaudeksi, viallinen on se, joka ei kykene elämään totuttujen arvojen ja sääntöjen puitteissa. Mielenvikainen, yhteiskuntakelvoton, syö nyt vain sitä lihaa, esitä edes syöväsi.

Vegetaristi on ytimekäs, räiskyvä, inhottava, kaunis, haikea, raskas, surullinen - ja haluaisin kirjoittaa toiveikas, mutta sitä se ei ole. Se on raadollinen, mutta myös omalla tavallaan maaginen todellisuus, haikea sellainen. Se on jotain, mitä jokaisen pitäisi lukea, varsinkin miesten.

Oletko lukenut Vegetaristin, mitä pidit siitä?",7,1,https://i.redd.it/gxqfhd8ecfpg1.jpeg,https://www.reddit.com/r/kirjallisuus/comments/1rvcdmn/han_kang_vegetaristi/,1773674413.0,2026-03-16 15:20:13,jkuutonen,1rvcdmn
EI,tennis,What was it really like coaching and playing Marcelo Ríos?,"The handshake: 🕊️ The headline: 🔪  
  
Nothing ruins a bacon egg and cheese faster than finding out you’re a one trick pony...

What was it really like coaching and playing Marcelo Ríos? Catch the full episode with Larry Stefanki here! 🔗⬇️

[https://youtu.be/EiXz68SdfeA?si=Tt1V4aDqLzSGgoC9](https://youtu.be/EiXz68SdfeA?si=Tt1V4aDqLzSGgoC9)

https://reddit.com/link/1rvcd0z/video/mw3ar60fcfpg1/player

",1,0,https://www.reddit.com/r/tennis/comments/1rvcd0z/what_was_it_really_like_coaching_and_playing/,https://www.reddit.com/r/tennis/comments/1rvcd0z/what_was_it_really_like_coaching_and_playing/,1773674376.0,2026-03-16 15:19:36,ServedPodcast,1rvcd0z
EI,meirl,meirl,,3,0,https://i.redd.it/n37sx1vacfpg1.png,https://www.reddit.com/r/meirl/comments/1rvccce/meirl/,1773674333.0,2026-03-16 15:18:53,Euphoric_Issue_7125,1rvccce
EI,Brawlstars,"Real legendary ranked game stats, and it went for just 2 games only(Getting good Randoms feels so good)",,3,0,https://i.redd.it/pswt1f06cfpg1.png,https://www.reddit.com/r/Brawlstars/comments/1rvcazp/real_legendary_ranked_game_stats_and_it_went_for/,1773674252.0,2026-03-16 15:17:32,Fantastic-Suspect1,1rvcazp
EI,reclamacoesfuteis,Odeio que nunca vou ser a 10/10 de alguém,"Ser feia/mediana é muito ruim pq eu queria muito que um menino ficasse feliz se me conquistasse,  mas eu que tenho que conquistar ele;_; nenhum homem vai olhar pra mim na rua e eu ser inesquecível de tão bonita, é fd ",31,44,https://i.redd.it/vp297ug2cfpg1.jpeg,https://www.reddit.com/r/reclamacoesfuteis/comments/1rvcadj/odeio_que_nunca_vou_ser_a_1010_de_alguém/,1773674214.0,2026-03-16 15:16:54,mochimochicute,1rvcadj
EI,kannmandasnochessen,"Komisches Ei, MHD 21.03., im Kühlschrank gelagert, Schwimmtest bestanden","Irgendwie ist mir diese raue Textur nicht ganz geheuer aber ich weiß ehrlich gesagt auch nicht, was das zu bedeuten hat.",3,6,https://i.redd.it/2vp4nr2sbfpg1.jpeg,https://www.reddit.com/r/kannmandasnochessen/comments/1rvc8u9/komisches_ei_mhd_2103_im_kühlschrank_gelagert/,1773674117.0,2026-03-16 15:15:17,datdrgn,1rvc8u9
EI,bookshelf,Roman History shelves,"Here is my Roman history cases. The one on the right is mostly military history. The one the left is generally biographies of emperors.

If you look at the left shelf and look at the third shelf from the bottom, you will see a complete set of the Decline and Fall of the Roman Empire by Edward Gibbon. This edition is dated 1853. It's intact and is I'm great condition.

I hope y'all enjoy these new pics. ",2,0,https://i.redd.it/r9fpiqsqbfpg1.jpeg,https://www.reddit.com/r/bookshelf/comments/1rvc8q1/roman_history_shelves/,1773674109.0,2026-03-16 15:15:09,AgentIanCormac,1rvc8q1
