bank,subreddit,title,selftext,score,num_comments,url,permalink,created_utc,created_date,author,id
EI,RepDesignersQC,"7.6kg haul to the Netherlands (Lego, Stussy, Kaws, Jacquemus, Arte, Sweats Collective, Ralph)","Another month has passed, and another massive haul of goodies has arrived. This time, I utilized the Fishgoo forwarding service—and oh my, being right in the middle of peak season, the shipping costs were absolutely exorbitant. The actual weight of this shipment was 7.6 kg (though, because I decided to keep the original retail boxes, the volumetric weight came in closer to 11 kg). I opted for their basic ""Triangular Shipping"" route and ended up paying $150 for it; it was indeed quite pricey. The shipment was dispatched on March 1st and took 16 days to reach my doorstep.

Below is a detailed list of the items included in this haul:

LEGO Star Wars Series: Luke Skywalker's X-Wing Fighter

This building set is essentially identical to the authentic LEGO version; the only difference is that there is no brand logo printed on the packaging box. I had previously purchased a similar set as a gift for a friend, and according to his feedback, the build quality was outstanding—easily on par with the authentic LEGO Star Wars sets in his collection (yes, I did honestly inform him at the time that it was a replica).

Please note: this single item alone weighs nearly 3 kg. I specifically purchased the ""Ultra-High Quality"" version of this set.

Purchase Link (W2C): [https://weidian.com/item.html?itemID=7715136272](https://weidian.com/item.html?itemID=7715136272) (Alternatively, purchase via a proxy/agent platform link)

KAWS × Star Wars Collaboration: Boba Fett Action Figure/Model

Fragile Item. As soon as I removed the figure from its plastic packaging, a small piece on the wristguard snapped off. The actual weight of the figure (including its packaging box) is 640 grams; calculated by volumetric weight, it comes in at approximately 1 kg.  
Purchase Link (W2C): [https://weidian.com/item.html?itemID=7714969498](https://weidian.com/item.html?itemID=7714969498) or purchase via a proxy service link.

Jacquemus Off-White Knitted Sweater

Purchased from the seller ""Tophot,"" though I am certain you could find the exact same item for a lower price elsewhere. Typically, the brand badges (logos) on this type of replica are executed quite crudely, and this piece is no exception. The lettering on the badge appears overly thick, and there are some sloppy stitches on the reverse side—though these loose threads can simply be snipped away. The purchase link (W2C) I’ve provided is a ""stealth link"" (with branding removed), but you can locate the seller's main spreadsheet page by searching.  
Purchase Link: [https://weidian.com/item.html?itemID=7715028742](https://weidian.com/item.html?itemID=7715028742) or purchase via a proxy service link.

Arte Antwerp T-Shirt

I was unable to find this specific design at any online retailer; I strongly suspect it may be a ""fantasy piece"" (i.e., a fictional design that the brand never officially released). However, the garment itself is of good quality, on par with other Arte items available at the ""MICKEY"" store—though, again, it is highly probable that this is not a design the brand ever actually produced.  
Purchase Link: [https://weidian.com/item.html?itemID=7711333399](https://weidian.com/item.html?itemID=7711333399) or purchase via a proxy service link.

Stussy Straight-Leg Jeans

Purchased from ""MICKEY."" He carries a dark blue version of this exact style—which I previously bought and absolutely loved for its fit—so when he released this light blue version, I didn't hesitate to pick up another pair. Regrettably, the actual item appears to have a faint greenish tint. It is a very basic, standard-issue pair of straight-leg jeans.

Purchase Link: [https://weidian.com/item.html?itemID=7601683553](https://weidian.com/item.html?itemID=7601683553) or purchase via a proxy service link.

Unbranded Soufflé Knitted Sweaters

I purchased these last year, but they turned out to run small in size, so I ultimately ended up donating them. These sweaters bear a resemblance to Uniqlo’s ""Soufflé Yarn"" collection released last autumn (specifically referring to the Fall 2024 styles). Given that Uniqlo’s originals are predominantly made from synthetic fibers, why not opt ​​for this alternative—a ""dupe"" version priced at just one-third of the cost? Both the light and dark color options are available for purchase via the same link.  
Purchase Link: [https://weidian.com/item.html?itemID=7715070038](https://weidian.com/item.html?itemID=7715070038) (or purchase through a proxy service).

Ralph Lauren Half-Zip Pullover

Purchased from VINTEDREPS, this is genuinely a high-quality piece. It appears to be sold out at the moment, as the seller has taken down the product listing. The brand logo on the garment is executed flawlessly, though the neckline is cut quite wide—personally, I find the opening to be a bit too broad for my taste. The fabric texture is excellent—thick, structured, and featuring a soft fleece lining on the interior.  
Purchase Link: [https://weidian.com/item.html?itemID=755643532](https://weidian.com/item.html?itemID=755643532)

Sweats Collective Sweatpants

These are a pair of loose-fitting sweatpants purchased from ""Mickey."" The inseam runs a bit short, so be sure to consult the size chart carefully before placing your order. The brand branding on the pants is highly accurate and looks remarkably authentic. Even the metal buttons feature detailed embossed branding.  
Purchase Link: [https://weidian.com/item.html?itemID=7712015071](https://weidian.com/item.html?itemID=7712015071)

If you have any further questions regarding this haul, please feel free to ask in the comments section below!

None of the items featured in this showcase were sponsored by the sellers, nor did I receive any compensation",1,0,https://www.reddit.com/gallery/1rzjpaw,https://www.reddit.com/r/RepDesignersQC/comments/1rzjpaw/76kg_haul_to_the_netherlands_lego_stussy_kaws/,1774072261.0,2026-03-21 05:51:01,sizzlagotit,1rzjpaw
EI,campsnapcamera,V105 in color,First week with the v105 in color. ,1,1,https://www.reddit.com/gallery/1rzjo6v,https://www.reddit.com/r/campsnapcamera/comments/1rzjo6v/v105_in_color/,1774072151.0,2026-03-21 05:49:11,Knuckle_Zandwich,1rzjo6v
EI,pop_os,How do i fix this?,"I upgraded to pop\_os 24.04 and facing lot of issues, this time it was the browser not able to take the aspect ratio properly, earlier i tried to reduce the size of my window and browser wouldn't go full screen

TBH this was my worst upgrade so far. was very happy with pop\_os 22",4,0,https://i.redd.it/tas8jcfk5cqg1.png,https://www.reddit.com/r/pop_os/comments/1rzjjrb/how_do_i_fix_this/,1774071723.0,2026-03-21 05:42:03,Delicious-Magician22,1rzjjrb
EI,EidolaTheBand,El club,Seeing Eidola again was literally so perfect 🥹🩷 i love this band so much and i hope everyone is having a great time at the shows!! 😊,18,0,https://www.reddit.com/gallery/1rzjgwv,https://www.reddit.com/r/EidolaTheBand/comments/1rzjgwv/el_club/,1774071454.0,2026-03-21 05:37:34,Pierogi_pal,1rzjgwv
EI,MonopolyGoTrading,A little bit of everything. Sets 15 to 24,,1,12,https://www.reddit.com/gallery/1rzjfb0,https://www.reddit.com/r/MonopolyGoTrading/comments/1rzjfb0/a_little_bit_of_everything_sets_15_to_24/,1774071300.0,2026-03-21 05:35:00,AggressiveAdagio7151,1rzjfb0
EI,crushcrush,CC drawing,Had some free time and decided to draw Mio! ,3,0,https://i.redd.it/tpc2wuo04cqg1.jpeg,https://www.reddit.com/r/crushcrush/comments/1rzjcje/cc_drawing/,1774071034.0,2026-03-21 05:30:34,NotAStinkyRedditor,1rzjcje
EI,SurveyExchange,Influence of EI and Big 5 on Conflicts ( Students and Working professionals),"Academic Survey -Takes 3–5 mins, Looking for 300 responses, Anonymous & Voluntary",2,3,https://forms.gle/QaG2QT4sgeWxoFZh6,https://www.reddit.com/r/SurveyExchange/comments/1rzjb8l/influence_of_ei_and_big_5_on_conflicts_students/,1774070903.0,2026-03-21 05:28:23,Top-Word-9813,1rzjb8l
EI,EscoffierMains,Escoffier Best Artifact Set?,"So I just got Esco, and I don't know what artifact to put on her. This is my team, Citlali is on Scroll and Furina is on Golden. What artifact should I put on her?

https://preview.redd.it/4ex1ebi62cqg1.png?width=1920&format=png&auto=webp&s=8311385dfa5e1e70d4fbb233d6ac8b829b8a3564

",1,1,https://www.reddit.com/r/EscoffierMains/comments/1rzj6zd/escoffier_best_artifact_set/,https://www.reddit.com/r/EscoffierMains/comments/1rzj6zd/escoffier_best_artifact_set/,1774070492.0,2026-03-21 05:21:32,touchgrazs,1rzj6zd
EI,takemysurvey,Influence of EI and Big 5 on Conflicts (Students and working professionals),"Academic Survey- Takes 3–5 mins

Looking for 300 responses

Anonymous & Voluntary

Responses preferred from 18+ ",1,2,https://forms.gle/QaG2QT4sgeWxoFZh6,https://www.reddit.com/r/takemysurvey/comments/1rzj5v5/influence_of_ei_and_big_5_on_conflicts_students/,1774070385.0,2026-03-21 05:19:45,Top-Word-9813,1rzj5v5
EI,Gunpla,Backstory for the 1/60 scale Gouf in How To Build Gundam,"Finally unearthed the backstory for the 1/60 scale Gouf kit that appeared in the first How To Build Gundam, as no such commercial kit existed at the time.  
[https://www.forbes.com/sites/olliebarder/2026/03/20/max-watanabe-on-how-he-founded-max-factory-and-his-love-of-guyver/](https://www.forbes.com/sites/olliebarder/2026/03/20/max-watanabe-on-how-he-founded-max-factory-and-his-love-of-guyver/)",3,0,https://i.redd.it/zeaclpzv0cqg1.jpeg,https://www.reddit.com/r/Gunpla/comments/1rzj22s/backstory_for_the_160_scale_gouf_in_how_to_build/,1774070027.0,2026-03-21 05:13:47,Cacophanus,1rzj22s
EI,GREEK,Power is never free,"Κάθε δύναμη έχει κόστος.
Κάθε επιλογή αφήνει σημάδι.
Την Κυριακή 22 Μαρτίου,
στο Φεστιβάλ «Όψεις του Φανταστικού»,
θα βρίσκομαι στο Rockwood για την παρουσίαση του βιβλίου μου
«Το Μάτι του Γερακιού».
Αν αγαπάς το fantasy που δεν μένει μόνο στη μαγεία,
αλλά αγγίζει επιλογές, απώλεια και εσωτερικές συγκρούσεις,
θα χαρώ να σε γνωρίσω από κοντά.
📍 Rockwood – Αθήνα
🕒 20:00
 Jim Quorthon
",0,0,https://i.redd.it/vsvvh8km0cqg1.jpeg,https://www.reddit.com/r/GREEK/comments/1rzj0nq/power_is_never_free/,1774069894.0,2026-03-21 05:11:34,Jim_Quorthon,1rzj0nq
EI,fantasybooks,Power is never free,"Κάθε δύναμη έχει κόστος.
Κάθε επιλογή αφήνει σημάδι.
Την Κυριακή 22 Μαρτίου,
στο Φεστιβάλ «Όψεις του Φανταστικού»,
θα βρίσκομαι στο Rockwood για την παρουσίαση του βιβλίου μου
«Το Μάτι του Γερακιού».
Αν αγαπάς το fantasy που δεν μένει μόνο στη μαγεία,.
αλλά αγγίζει επιλογές, απώλεια και εσωτερικές συγκρούσεις,
θα χαρώ να σε γνωρίσω από κοντά.
📍 Rockwood – Αθήνα
🕒 20:00
 Jim Quorthon
",0,0,https://i.redd.it/if0ad86d0cqg1.jpeg,https://www.reddit.com/r/fantasybooks/comments/1rzizpc/power_is_never_free/,1774069806.0,2026-03-21 05:10:06,Jim_Quorthon,1rzizpc
EI,ArknightsEndfield,Tim Cook and Arknights Team,"Arknights: Endfield (Official Account) 👑

“We’re very honored to have the opportunity to meet and talk with Tim Cook at an Apple event. We’re grateful for Apple’s support of Arknights: Endfield. We will continue working hard to bring more game content to everyone, and we welcome all players to come and experience it.”",185,19,https://i.redd.it/m15fdnoxzbqg1.jpeg,https://www.reddit.com/r/ArknightsEndfield/comments/1rziy46/tim_cook_and_arknights_team/,1774069660.0,2026-03-21 05:07:40,Jumonji16,1rziy46
EI,RetroAchievements,Mastering the megadrive 88 columns. Harder then I remember. Pause buffer was a must once it gets too fast,I knocked most of this out in one or 2 goes but 300000 points is no joke lots of pausing just to line up the space you want it to go and sometimes you will still miss it's so fast,6,0,https://i.redd.it/yrjdoi5wzbqg1.png,https://www.reddit.com/r/RetroAchievements/comments/1rzixyc/mastering_the_megadrive_88_columns_harder_then_i/,1774069646.0,2026-03-21 05:07:26,newcreep,1rzixyc
EI,bathandbodyworks,New Wallflower PlugIns March 2026,"Hello all! Spotted a bunch of new plugins today at one of my stores and they’re all scent controlled. I couldn’t get a price on the last vegetables one.

Which one(s) do you like/want?

Also, confirming I saw the mini pink totes in store today in an under stock drawer an employee let me peek lol. Last year they were online only member exclusive if I’m not mistaken ",27,11,https://www.reddit.com/gallery/1rziwgi,https://www.reddit.com/r/bathandbodyworks/comments/1rziwgi/new_wallflower_plugins_march_2026/,1774069519.0,2026-03-21 05:05:19,OrangeClyde,1rziwgi
EI,starwarsbooks,EU Collection Update,Finally got my hands on a full set of the New Jedi Order hard covers. Have been after these for a long time and finally managed to get them. One big step closer to my goal of a full hardcover collection,44,2,https://i.redd.it/b9oxm3bhzbqg1.jpeg,https://www.reddit.com/r/starwarsbooks/comments/1rziwcs/eu_collection_update/,1774069508.0,2026-03-21 05:05:08,valka-sophie,1rziwcs
EI,opiniaoimpopular,Lei Felca: Censura e repressão nunca darão certas no Brasil. Eis o porquê,"Sou o homem que escreveu sobre o post do rock mais cedo.

Vim aqui fazer um texto baseado num vídeo do Linck Vargas (Quadrinhos na Sarjeta) entítulado ""O Brasil é um país esculhambado, e isso é bom"". 

Para defender o meu ponto de vista, devemos começar lembrando da nossa história e de um grande símbolo da resistência da negritude BR. A Capoeira. 
Para vocês que somente leram o título do meu último post e comentaram abobrinha por não entenderem de história, a arte marcial fora utilizada para disfarçar um meio de defesa muito forte entre os escravos, pois ela continha dança como um de seus elementos. E é aí o de eu quero chegar.

Desde os primórdios, nós brasileiros possuímos uma cultura que possui aversão a regras muito invasivas. Com isso, nós apenas seguimos esse tipo de regra de maneira mais ou menos certa, para caso tenhamos que desmontá-la, ela se desconstrói por completo rapidamente.

Isso se relaciona com a nossa esperteza e improvisação na hora de fazer determinadas gambiarras. Como por exemplo remendar uma Havaianas com um prego, ou pagar para tradutores freelancers pra traduzir seus trabalhos de tradutor freela, você alterar uma ou outra coisa, envia pro cliente e geral sai ganhando com isso (Vi um vídeo há anos atrás que ensina esse método ksksks). Aliás, Oswaldo de Andrade já comentava sobre esse fenômeno.

Assim como na ditadura, onde o Chico Buarque usava ""Cálice"" como um termo homófono para ""Cale-se"", ou quando 'derrubaram' o Twitter do Brasil, mas nem se quer vi alguém pagando multa, e tinha uma porrada de gente usando o X em protesto. A proibição foi revogada um mês depois. 

O próprio regime militar já foi ameno, se comparado com as ditaduras que os nossos vizinhos tiveram (Pinochet então!! 💀)

No fim, tudo volta ao normal. Nem mesmo o evangelistão que uma porrada de filhinho de papai socialista, que fala que vai ter no BR vai acontecer de verdade.  

Imagem ilustrativa, pois BR sempre soube driblar esse tipo de coisa. ",2,8,https://i.redd.it/azplewmlybqg1.jpeg,https://www.reddit.com/r/opiniaoimpopular/comments/1rzit16/lei_felca_censura_e_repressão_nunca_darão_certas/,1774069211.0,2026-03-21 05:00:11,Cheek_Sea,1rzit16
EI,nuzlocke,I’m onto Sabrina now team update plus what’s in the box (also deaths) any changes to be made or keep team as it is?,,3,8,https://www.reddit.com/gallery/1rzipyj,https://www.reddit.com/r/nuzlocke/comments/1rzipyj/im_onto_sabrina_now_team_update_plus_whats_in_the/,1774068933.0,2026-03-21 04:55:33,Either_Guest9129,1rzipyj
EI,mtgaltered,My first alters.,"Vallejo, Citadel paints. Water.",8,0,https://i.redd.it/kgho6laxwbqg1.jpeg,https://www.reddit.com/r/mtgaltered/comments/1rzimzi/my_first_alters/,1774068649.0,2026-03-21 04:50:49,EducationalBoss8929,1rzimzi
EI,thinkpad,Lenovo Thinkpad Ram Upgrade Topic,Can I upgrade my soldered ram with the technicians?  or It is recommended? I only have 8Gb of Ram and I want to upgrade it to 16Gb,5,1,https://i.redd.it/b10cw68vwbqg1.jpeg,https://www.reddit.com/r/thinkpad/comments/1rzimsr/lenovo_thinkpad_ram_upgrade_topic/,1774068631.0,2026-03-21 04:50:31,Sensitive-Problem962,1rzimsr
EI,sportscards,Bedard Rookie Cards,"2023-24 UPPER DECK SP GAME USED AUTHENTIC ROOKIE CONNOR BEDARD

\#014/199

Jersey Relic Card

$225 ask for both, willing to negotiate! can ship same day or deliver in chicago area. dm",2,1,https://www.reddit.com/gallery/1rzikwv,https://www.reddit.com/r/sportscards/comments/1rzikwv/bedard_rookie_cards/,1774068451.0,2026-03-21 04:47:31,jmedelson10,1rzikwv
EI,30_Minutes_Missions,Recent builds,"I now wish the other forestieri had the same helmet as this guy and were in darker colors. I'll probably repaint the other two forestieri types, cause man would I love a dark red one. 

The alto flight type...I regret getting it cause now I want the orange and white one even more, but can't seem to find any available in the US 😕
Absolutely beautiful and epically awesome mech ",12,0,https://i.redd.it/izbceah3wbqg1.jpeg,https://www.reddit.com/r/30_Minutes_Missions/comments/1rzik1j/recent_builds/,1774068369.0,2026-03-21 04:46:09,Wheather819,1rzik1j
EI,snappijuorutofftopic,bbia never die ripsiväri,"Tarvihtisin nyt appuu bbia never die ripsivärin kanssa.

Oon käyttäny tota ripsiväriä nyt ehkä 25 syksystä asti. Kumminki oon nyt huomannu että ylleensä ku laitan tuota ripsiväriä nii sen jölkeen tuntuu että silmässä ois jokkii roska, vaikka siellä ei näytä mittään olevan. 

Mistä tää pystyis johtummaan? Tykkään ripsiväristä mutta tuo alkaa ärsyttämmää ku tuntuu tuolle aina ku laittaa ripsiväriä ja vieläpä ku se tuntuu koko päivän ajan eikä lopu.",1,3,https://www.reddit.com/r/snappijuorutofftopic/comments/1rzij20/bbia_never_die_ripsiväri/,https://www.reddit.com/r/snappijuorutofftopic/comments/1rzij20/bbia_never_die_ripsiväri/,1774068280.0,2026-03-21 04:44:40,WaterKnown2601,1rzij20
EI,wbjee,SCORING 70-80 just after CBSE BOARDS,ami cbse boards dilaam ei year e ar last exam amar 27 march e ebar amar 12 er syllabus ses ar 11 tao porecilm but revision hoyni so sei hisabe pyq test dile ar revision korle ki atleast 60 hoye jabe?amar jee mains khub ekta valo hoyni ....ar ki ki kora uchit advance er question mains er questions naki wbjee pyqs,0,3,https://www.reddit.com/r/wbjee/comments/1rzi8se/scoring_7080_just_after_cbse_boards/,https://www.reddit.com/r/wbjee/comments/1rzi8se/scoring_7080_just_after_cbse_boards/,1774067366.0,2026-03-21 04:29:26,hulk_surya,1rzi8se
EI,DACA,Interesting findings on renewal,"This is probably nothing. I came across this question when i was reviewing my renewal, but it didn’t ask when i was filling it out. Was this an old question? ",9,1,https://i.redd.it/bocjzbu0tbqg1.jpeg,https://www.reddit.com/r/DACA/comments/1rzi8ga/interesting_findings_on_renewal/,1774067337.0,2026-03-21 04:28:57,gunnardangle69,1rzi8ga
EI,Colognes,i have prada l’homme edt what should be 2nd summer fragrance something creamy or fresh,,22,32,https://i.redd.it/lf6mhx00tbqg1.jpeg,https://www.reddit.com/r/Colognes/comments/1rzi8ch/i_have_prada_lhomme_edt_what_should_be_2nd_summer/,1774067329.0,2026-03-21 04:28:49,yuuuichikatagiri,1rzi8ch
