bank,subreddit,title,selftext,score,num_comments,url,permalink,created_utc,created_date,author,id
ENBD,StockMarketIndia,Decline in IDBI Bank Share Price as Privatisation Plans Face Roadblocks Amid Divestment Constraints,"The Government of India holds a stake of 45.48% in IDBI Bank along with the Life Insurance Corporation (LIC) owning a stake of 49.24%. Together, they own 94.72% of IDBI Bank. Earlier, the Press Trust of India issued a report stating the duo were planning to sell 60.72% (comprising 30.48% held by the government and 30.24% by LIC) of the total equity of IDBI Bank, leaving them with combined holdings of 33.99% (15% held by GOI and 19% held by LIC)

  
They had floated an Expression of Interest in Oct’22 and the Department of Investment and Public Asset Management (DIPAM) confirmed that the interested parties had bid by 6^(th) February 2026. Bidders included Fairfax Financial Holdings, Emirates NBD and Kotak Mahindra Bank. The three bidders were allowed to move to the final stage of the process after completing due diligence and clearing the technical bid stage.  
  
The government was pursuing the sale as part of its wider strategic divestment programme, aimed at boosting non-tax revenues and scaling back its involvement in non-core sectors. The divestment gained traction after IDBI exited the Reserve Bank of India’s Prompt Corrective Action (PCA) framework in March 2021, following improvements in asset quality, capital adequacy, and profitability. Exiting the PCA was seen as a crucial step to attract private investors and renew interest in the strategic sale.  
  
However, market sentiment made the share extremely volatile recently in response to reports about the divestment process. On Friday, 13th Mar 2026, IDBI Bank shares closed at 92.18. The share then opened at 82.12 and fell further to close at 76.31 on Monday, 16th Mar.  
  
The decline of close to 17% in a single day occurred after reports suggested that the government may reconsider or halt their decision to divest in the bank after the financial bids put in by the potential buyers were below the reserve price.  
  
IDBI Bank didn’t confirm or deny the reports, they commented that the divestment process is a confidential strategic process being undertaken by the Indian government and that they would immediately inform stock exchanges of all material developments and price-sensitive information in compliance with the Securities and Exchange Board of India’s Listing Obligations and Disclosure Requirements regulations. They also mentioned that the report to the bidding process and does not involve any regulatory or legal proceedings. A clarification was provided after a query from BSE seeking comments on a media report that the government may scrap the majority stake sale due to the low-price bids.  
  
Investors are likely to benefit from increased clarity once the government gives an official statement on the future of the disinvestment process which has been watched keenly by hawkish investors who have been expecting the operational efficiency to increase.  
  
Despite the bank’s total income declining to ₹8,282 crore in Q3 FY26 from ₹8,565 crore in Q3 FY25, and interest income fell to ₹7,074 crore from ₹7,816 crore a year ago, the earnings report showed the profitability of the lender increased by 1.42% from Q3 FY25’s earnings.

The gross non-performing asset (GNPA) ratio represents the total value of all loans and advances that have ceased to generate income for a bank, usually when interest or principal payments are overdue for over 90 days. The gross non-performing asset ratio improved to 2.57% as of December 31, 2025, from 3.57% in the year-ago period. This indicates better credit quality and lower risk as there is a lower chance of loan losses. However, the net non-performing asset remained at 0.18%. The net NPA shows the actual risk of loan losses to the bank as it reduces provisions made for losses from the GNPA and accrued interest on non-performing loans that the bank has not recognized as income (Interest suspense). The Net NPA of 0.18% shows minimal actual loan loss risk even if some loans are “non-performing” i.e. the borrower fails to pay interest or principal for 90 days or more and the bank cannot recognize the interest as income.  
  
The bank’s capital adequacy ratio (CAR) strengthened to 24.63% at the end of December 2025, up from 21.98% a year earlier. The CAR measures how well a bank can absorb losses while continuing operations. An improvement shows that the bank has a strong capital buffer making it safe to invest and deposit in due to the stability.  
  
On the other hand, return on assets (ROA) moderated to 1.83% in Q3 FY26, compared with 1.99% in Q3 FY25. The ROA measures how efficiently a bank is using its assets to generate profit. Here, we are able to notice that the bank has relatively become less efficient as the bank earned slightly less profit per ₹100 of assets than a year ago. The ROA may have declined despite flat profits because total assets may have grown faster than profits.



*Bibliography:*  
Press Trust of India: [https://www.ptinews.com/story/business/idbi-bank-strategic-sale-scrapped-as-financial-bids-below-reserve-price-sources/3464548](https://www.ptinews.com/story/business/idbi-bank-strategic-sale-scrapped-as-financial-bids-below-reserve-price-sources/3464548)

Economic Times: [https://economictimes.indiatimes.com/industry/banking/finance/banking/idbi-bank-divestment-scrapped-lic-govt-owned-bank-clarifies-after-stock-tanks/articleshow/129604537.cms?from=mdr](https://economictimes.indiatimes.com/industry/banking/finance/banking/idbi-bank-divestment-scrapped-lic-govt-owned-bank-clarifies-after-stock-tanks/articleshow/129604537.cms?from=mdr)

India Today: [https://www.indiatoday.in/business/market/story/idbi-bank-share-price-crashes-16-percent-why-is-the-stock-down-today-2882641-2026-03-16](https://www.indiatoday.in/business/market/story/idbi-bank-share-price-crashes-16-percent-why-is-the-stock-down-today-2882641-2026-03-16)  
  
MarketControl: [https://www.moneycontrol.com/news/business/economy/financial-bids-from-kotak-emirates-nbd-fairfax-received-for-idbi-bank-privatisation-13816353.html](https://www.moneycontrol.com/news/business/economy/financial-bids-from-kotak-emirates-nbd-fairfax-received-for-idbi-bank-privatisation-13816353.html?utm_source=chatgpt.com)",1,0,https://www.reddit.com/r/StockMarketIndia/comments/1rzp6u5/decline_in_idbi_bank_share_price_as_privatisation/,https://www.reddit.com/r/StockMarketIndia/comments/1rzp6u5/decline_in_idbi_bank_share_price_as_privatisation/,1774092788.0,2026-03-21 11:33:08,CarsAndCapital,1rzp6u5
ADCB,UAE,ADCB Touch points Redemption,"Hello Everyone, 
Eid Mubarak!

Wondering what is the best way to redeem ADCB touch points? Any suggestions to make the best use out of these points (mostly for retail shopping purposes)",2,7,https://www.reddit.com/r/UAE/comments/1rzqej3/adcb_touch_points_redemption/,https://www.reddit.com/r/UAE/comments/1rzqej3/adcb_touch_points_redemption/,1774096669.0,2026-03-21 12:37:49,Character-End-8178,1rzqej3
ADIB,UAETeenagers,Adib bank,"I wanted to create a new back account from the adib app but it says that i’ll have to open my account at the branch.. 

does anyone know what i could do other than going to one of adib’s branches ? ",1,3,https://www.reddit.com/r/UAETeenagers/comments/1rzu9n4/adib_bank/,https://www.reddit.com/r/UAETeenagers/comments/1rzu9n4/adib_bank/,1774106807.0,2026-03-21 15:26:47,savex_a,1rzu9n4
ADIB,ZeroTaxJobs,Abu Dhabi Islamic Bank is hiring a Application Assurance Specialist,"🏢 Company: [Abu Dhabi Islamic Bank](https://zerotaxjobs.com/companies/abu-dhabi-islamic-bank)  
📍 Location: Dubai, United Arab Emirates  
💸 Salary Guide: $60,000 USD - $100,000 USD Tax-Free!  
👉 Apply & More Details: [https://zerotaxjobs.com/jobs/application-assurance-specialist-lxejee6o](https://zerotaxjobs.com/jobs/application-assurance-specialist-lxejee6o)  

📈 Trending Job Searches:  
[Software Engineer Jobs in Dubai](https://zerotaxjobs.com/software-engineer-jobs-in-dubai)  
[Expatriate Jobs in Saudi Arabia](https://zerotaxjobs.com/expatriate-jobs-in-saudi-arabia)  
[IT Jobs in Dubai](https://zerotaxjobs.com/it-jobs-in-dubai)  
[Jobs in Abu Dhabi](https://zerotaxjobs.com/jobs-in-abu-dhabi)",1,0,https://www.reddit.com/r/ZeroTaxJobs/comments/1rztzcb/abu_dhabi_islamic_bank_is_hiring_a_application/,https://www.reddit.com/r/ZeroTaxJobs/comments/1rztzcb/abu_dhabi_islamic_bank_is_hiring_a_application/,1774106102.0,2026-03-21 15:15:02,samotsar,1rztzcb
ADIB,PHBookClub,Selling my Pre-Loved Books,Selling some of my pre-loved books. Already switched to e-reader and might need funds. Feel free to reach out and I might include freebies too for sure buyers.,1,0,https://i.redd.it/9zlq5whjedqg1.jpeg,https://www.reddit.com/r/PHBookClub/comments/1rznirl/selling_my_preloved_books/,1774086718.0,2026-03-21 09:51:58,hauntedhalogen,1rznirl
EI,BookshelvesDetective,Who do you think I am?,I mostly utilize the library. These are just some of the books that I own 😊 ,1,0,https://i.redd.it/qy0fl7fkcgqg1.jpeg,https://www.reddit.com/r/BookshelvesDetective/comments/1s00t08/who_do_you_think_i_am/,1774122337.0,2026-03-21 19:45:37,fake_tan,1s00t08
EI,ParlerWatch,Refusing to pay after work is completed is a consistent MAGA politician trait.,,2,1,https://i.redd.it/veuqjvrecgqg1.png,https://www.reddit.com/r/ParlerWatch/comments/1s00svd/refusing_to_pay_after_work_is_completed_is_a/,1774122327.0,2026-03-21 19:45:27,justalazygamer,1s00svd
EI,WhitePeopleTwitter,Refusing to pay after work is completed is a consistent MAGA politician trait.,,1,1,https://i.redd.it/enbc0qmecgqg1.png,https://www.reddit.com/r/WhitePeopleTwitter/comments/1s00srl/refusing_to_pay_after_work_is_completed_is_a/,1774122319.0,2026-03-21 19:45:19,justalazygamer,1s00srl
EI,Fusion360,Angled holes,"Hi.

Is there an easy way of creating angled holes in a circle?

I have tried using the pipe method but I can't get it to function all the way around. Thanks in advance.",1,0,https://www.reddit.com/gallery/1s00san,https://www.reddit.com/r/Fusion360/comments/1s00san/angled_holes/,1774122288.0,2026-03-21 19:44:48,Goldfire69,1s00san
EI,dashuju,这群香港的之娜🐖冷静一点，既然这样了还用英语发言呢,"https://preview.redd.it/lemog1s8cgqg1.png?width=1652&format=png&auto=webp&s=4639f5a1e99af7dc2ae0abf5641f7b3a530f56fc

",1,0,https://www.reddit.com/r/dashuju/comments/1s00rmk/这群香港的之娜冷静一点既然这样了还用英语发言呢/,https://www.reddit.com/r/dashuju/comments/1s00rmk/这群香港的之娜冷静一点既然这样了还用英语发言呢/,1774122243.0,2026-03-21 19:44:03,Inner-Frosting1715,1s00rmk
EI,snappijuorutofftopic,Vestiaire collective kokemuksia?,"Mulla on nyt tässä etsinnässä ed hardyn aurinkolasit ja ainot paikka mistä löysin(jos vintedii ei lasketa) on toi otsikon sivusto, onko tääl kellää kokemusta tai ajatusta kannattaisko tilata? Ja mietin kans muutenki sitä et jos aurinkolasit tilaa ni kuinka todennäkösesti menee rikki matkalla ja saako sit rahoja takasin ",1,0,https://www.reddit.com/r/snappijuorutofftopic/comments/1s00noi/vestiaire_collective_kokemuksia/,https://www.reddit.com/r/snappijuorutofftopic/comments/1s00noi/vestiaire_collective_kokemuksia/,1774121979.0,2026-03-21 19:39:39,theratg1rl,1s00noi
EI,BubbleGumSimulator,Is this W or L?,,1,8,https://www.reddit.com/gallery/1s00nm4,https://www.reddit.com/r/BubbleGumSimulator/comments/1s00nm4/is_this_w_or_l/,1774121975.0,2026-03-21 19:39:35,UnfairPractice4544,1s00nm4
EI,StealTheBrainrot,Good Start to heaven mutation,,1,0,https://i.redd.it/cphikyahbgqg1.jpeg,https://www.reddit.com/r/StealTheBrainrot/comments/1s00nkn/good_start_to_heaven_mutation/,1774121972.0,2026-03-21 19:39:32,Ok_Construction_3111,1s00nkn
EI,WomenRO,"Lipsa figurii paterne sau ""daddy issues""","Hellooo.Aș vrea să știu cum v-a afectat pe cele care vă aflați într-o situație similară - absența din punct de vedere emoțional a tatălui - în copilărie și mai departe în viața de adult. 

M-am tot gândit în ultimele luni la comportamentul meu, de ce sunt așa cum sunt în relațiile cu alți oameni - de prietenie sau romantice - si de ce mă simt ""blocată"" în aceleași pattern-uri chiar dacă încerc să ies din ele și ajung mereu la aceeași concluzie: caut în alte persoane iubirea pe care trebuia să o primesc de la tatăl meu. 

Și de aici se trag multe neajunsuri ale mele - stimă de sine scăzută, naivitate, nevoia de validare din partea bărbaților dar și o oarecare frică de ei, frica de abandon etc. 

Cred că nu voi putea avea vreodată o relație normală cu un bărbat din cauza faptului că mi-a fost frântă inima de cel care trebuia să îmi fie primul sprijin. Am un nod imens în gât când scriu asta și cred că se regăsesc și alte femei în aceste rânduri. 

Dragi femei, cum gestionați sentimentele astea? Cum vă influențează această lipsă relațiile romantice? 

Și pentru bărbați, ați avea răbdare cu o astfel de femeie? Cum vedeți lucrurile? 

Ca ultim lucru, urăsc termenii de ""fatherless behaviour"" si ""daddy issues"" folosiți pentru a muta vina pe care bărbatul ce nu era pregătit să fie tată o are, asupra femeii care a fost cândva un copil neiubit. ",3,0,https://www.reddit.com/r/WomenRO/comments/1s00n7o/lipsa_figurii_paterne_sau_daddy_issues/,https://www.reddit.com/r/WomenRO/comments/1s00n7o/lipsa_figurii_paterne_sau_daddy_issues/,1774121948.0,2026-03-21 19:39:08,Fun_Savings_651,1s00n7o
EI,PCOS,Magnesium Deficiency?,"I'm curious if anyone here takes magnesium? I believe magnesium deficiency is very common and could mess up hormones. I think there are some studies that show no effect on pcos and some that show it helps, but I don't know they have been done very well. They give one 250mg magnesium oxide a day. Magnesium oxide is known for not being very well absorbed and one should really take magnesium in no more than 100mg dosages. I think the study also wasn't for very long and I think it could take months to fix a magnesium deficiency.

Do you take magnesium?

AI overview for an idea of how common it may be:

Magnesium deficiency is highly common, with estimates suggesting that nearly 50% of Americans, and up to 60% of adults, do not consume the recommended daily amount.

Its used for a lot of functions in the body so I don't know how fast it would help with hormones:

google ai: Magnesium is an essential mineral involved in over 300 biochemical reactions, critical for [nerve function](https://www.google.com/search?q=nerve+function&sca_esv=93bf05b8ac35d58d&sxsrf=ANbL-n4lskazAuwjSwaAilBGLPGZ3TMgBw%3A1774104566932&source=hp&ei=9q--afjdNpiv0PEPna3rKA&iflsig=AFdpzrgAAAAAab6-Bv1mq2XTUr6qMo0U42E5df9E0gAS&ved=2ahUKEwiar6DInrGTAxW8IDQIHWuBL3IQgK4QegQIARAB&uact=5&oq=what+all+is+magneium+used+for+in+the+body&gs_lp=Egdnd3Mtd2l6Iil3aGF0IGFsbCBpcyBtYWduZWl1bSB1c2VkIGZvciBpbiB0aGUgYm9keTIGEAAYFhgeMgYQABgWGB4yBhAAGBYYHjIGEAAYFhgeMgYQABgWGB4yBhAAGBYYHjIGEAAYFhgeMgYQABgWGB4yBhAAGBYYHjIGEAAYFhgeSOYzUABYnzJwAHgAkAEBmAHRAaAB2CCqAQcyNy4xMi4yuAEDyAEA-AEBmAIooAKKIcICDhAAGIAEGLEDGIMBGIoFwgIOEC4YgAQYsQMY0QMYxwHCAgsQLhiABBixAxiDAcICCxAAGIAEGLEDGIMBwgIFEAAYgATCAgsQLhiABBjRAxjHAcICCBAAGIAEGLEDwgIEEAAYA8ICCBAuGIAEGLEDwgIFEC4YgATCAgcQABiABBgNwgIGEAAYDRgewgILEAAYgAQYhgMYigXCAggQABiABBiiBMICBRAAGO8FwgIHECEYoAEYCsICBxAhGAoYqwLCAggQABgWGAoYHpgDAJIHBzIxLjE3LjKgB5K1ArIHBzIxLjE3LjK4B4ohwgcJMC4xNS4xOC43yAe5AYAIAA&sclient=gws-wiz&mstk=AUtExfCysoXRKLkm8DGLzetC_xWsQgzZnPXLBUCgTHeYRbId4ugHyDqyKG73L9R89YZLNLzwwnglVl2uE1sOxMvECgROM1cSXREfZCnBZABeT9Ojz1Y0Xnwyet6aOPy_qZNHbhLOjLel1LTtOJzYz-BQp59P6-5jatcnlUqVm6-QK75jP-U&csui=3), [muscle contraction and relaxation](https://www.google.com/search?q=muscle+contraction+and+relaxation&sca_esv=93bf05b8ac35d58d&sxsrf=ANbL-n4lskazAuwjSwaAilBGLPGZ3TMgBw%3A1774104566932&source=hp&ei=9q--afjdNpiv0PEPna3rKA&iflsig=AFdpzrgAAAAAab6-Bv1mq2XTUr6qMo0U42E5df9E0gAS&ved=2ahUKEwiar6DInrGTAxW8IDQIHWuBL3IQgK4QegQIARAC&uact=5&oq=what+all+is+magneium+used+for+in+the+body&gs_lp=Egdnd3Mtd2l6Iil3aGF0IGFsbCBpcyBtYWduZWl1bSB1c2VkIGZvciBpbiB0aGUgYm9keTIGEAAYFhgeMgYQABgWGB4yBhAAGBYYHjIGEAAYFhgeMgYQABgWGB4yBhAAGBYYHjIGEAAYFhgeMgYQABgWGB4yBhAAGBYYHjIGEAAYFhgeSOYzUABYnzJwAHgAkAEBmAHRAaAB2CCqAQcyNy4xMi4yuAEDyAEA-AEBmAIooAKKIcICDhAAGIAEGLEDGIMBGIoFwgIOEC4YgAQYsQMY0QMYxwHCAgsQLhiABBixAxiDAcICCxAAGIAEGLEDGIMBwgIFEAAYgATCAgsQLhiABBjRAxjHAcICCBAAGIAEGLEDwgIEEAAYA8ICCBAuGIAEGLEDwgIFEC4YgATCAgcQABiABBgNwgIGEAAYDRgewgILEAAYgAQYhgMYigXCAggQABiABBiiBMICBRAAGO8FwgIHECEYoAEYCsICBxAhGAoYqwLCAggQABgWGAoYHpgDAJIHBzIxLjE3LjKgB5K1ArIHBzIxLjE3LjK4B4ohwgcJMC4xNS4xOC43yAe5AYAIAA&sclient=gws-wiz&mstk=AUtExfCysoXRKLkm8DGLzetC_xWsQgzZnPXLBUCgTHeYRbId4ugHyDqyKG73L9R89YZLNLzwwnglVl2uE1sOxMvECgROM1cSXREfZCnBZABeT9Ojz1Y0Xnwyet6aOPy_qZNHbhLOjLel1LTtOJzYz-BQp59P6-5jatcnlUqVm6-QK75jP-U&csui=3), [bone strength](https://www.google.com/search?q=bone+strength&sca_esv=93bf05b8ac35d58d&sxsrf=ANbL-n4lskazAuwjSwaAilBGLPGZ3TMgBw%3A1774104566932&source=hp&ei=9q--afjdNpiv0PEPna3rKA&iflsig=AFdpzrgAAAAAab6-Bv1mq2XTUr6qMo0U42E5df9E0gAS&ved=2ahUKEwiar6DInrGTAxW8IDQIHWuBL3IQgK4QegQIARAD&uact=5&oq=what+all+is+magneium+used+for+in+the+body&gs_lp=Egdnd3Mtd2l6Iil3aGF0IGFsbCBpcyBtYWduZWl1bSB1c2VkIGZvciBpbiB0aGUgYm9keTIGEAAYFhgeMgYQABgWGB4yBhAAGBYYHjIGEAAYFhgeMgYQABgWGB4yBhAAGBYYHjIGEAAYFhgeMgYQABgWGB4yBhAAGBYYHjIGEAAYFhgeSOYzUABYnzJwAHgAkAEBmAHRAaAB2CCqAQcyNy4xMi4yuAEDyAEA-AEBmAIooAKKIcICDhAAGIAEGLEDGIMBGIoFwgIOEC4YgAQYsQMY0QMYxwHCAgsQLhiABBixAxiDAcICCxAAGIAEGLEDGIMBwgIFEAAYgATCAgsQLhiABBjRAxjHAcICCBAAGIAEGLEDwgIEEAAYA8ICCBAuGIAEGLEDwgIFEC4YgATCAgcQABiABBgNwgIGEAAYDRgewgILEAAYgAQYhgMYigXCAggQABiABBiiBMICBRAAGO8FwgIHECEYoAEYCsICBxAhGAoYqwLCAggQABgWGAoYHpgDAJIHBzIxLjE3LjKgB5K1ArIHBzIxLjE3LjK4B4ohwgcJMC4xNS4xOC43yAe5AYAIAA&sclient=gws-wiz&mstk=AUtExfCysoXRKLkm8DGLzetC_xWsQgzZnPXLBUCgTHeYRbId4ugHyDqyKG73L9R89YZLNLzwwnglVl2uE1sOxMvECgROM1cSXREfZCnBZABeT9Ojz1Y0Xnwyet6aOPy_qZNHbhLOjLel1LTtOJzYz-BQp59P6-5jatcnlUqVm6-QK75jP-U&csui=3), and [cardiovascular health](https://www.google.com/search?q=cardiovascular+health&sca_esv=93bf05b8ac35d58d&sxsrf=ANbL-n4lskazAuwjSwaAilBGLPGZ3TMgBw%3A1774104566932&source=hp&ei=9q--afjdNpiv0PEPna3rKA&iflsig=AFdpzrgAAAAAab6-Bv1mq2XTUr6qMo0U42E5df9E0gAS&ved=2ahUKEwiar6DInrGTAxW8IDQIHWuBL3IQgK4QegQIARAE&uact=5&oq=what+all+is+magneium+used+for+in+the+body&gs_lp=Egdnd3Mtd2l6Iil3aGF0IGFsbCBpcyBtYWduZWl1bSB1c2VkIGZvciBpbiB0aGUgYm9keTIGEAAYFhgeMgYQABgWGB4yBhAAGBYYHjIGEAAYFhgeMgYQABgWGB4yBhAAGBYYHjIGEAAYFhgeMgYQABgWGB4yBhAAGBYYHjIGEAAYFhgeSOYzUABYnzJwAHgAkAEBmAHRAaAB2CCqAQcyNy4xMi4yuAEDyAEA-AEBmAIooAKKIcICDhAAGIAEGLEDGIMBGIoFwgIOEC4YgAQYsQMY0QMYxwHCAgsQLhiABBixAxiDAcICCxAAGIAEGLEDGIMBwgIFEAAYgATCAgsQLhiABBjRAxjHAcICCBAAGIAEGLEDwgIEEAAYA8ICCBAuGIAEGLEDwgIFEC4YgATCAgcQABiABBgNwgIGEAAYDRgewgILEAAYgAQYhgMYigXCAggQABiABBiiBMICBRAAGO8FwgIHECEYoAEYCsICBxAhGAoYqwLCAggQABgWGAoYHpgDAJIHBzIxLjE3LjKgB5K1ArIHBzIxLjE3LjK4B4ohwgcJMC4xNS4xOC43yAe5AYAIAA&sclient=gws-wiz&mstk=AUtExfCysoXRKLkm8DGLzetC_xWsQgzZnPXLBUCgTHeYRbId4ugHyDqyKG73L9R89YZLNLzwwnglVl2uE1sOxMvECgROM1cSXREfZCnBZABeT9Ojz1Y0Xnwyet6aOPy_qZNHbhLOjLel1LTtOJzYz-BQp59P6-5jatcnlUqVm6-QK75jP-U&csui=3). It is used to generate cellular energy, synthesize proteins and DNA, regulate blood pressure, and manage blood sugar. 

The theory on why we are getting less magnesium now it based on industrial farming depleting the soil.  Also it's not included in many multivitamins.  

google ai in regards to hormones:

Yes, magnesium plays a crucial role in balancing hormones by regulating the nervous system, reducing cortisol (stress hormone), aiding in estrogen metabolism, and supporting thyroid function. It acts as a cofactor for over 300 biochemical reactions, helping to alleviate symptoms of PMS, PCOS, and perimenopause. 

From what I have researched I think it would take 100mg/3 times a day of a good magnesium supplement to overcome a deficiency.  And it might take months.  I also don't think the tests for it are that good as most of it would be in your tissues, not your blood.  Curious if anyone has tried this and if it helped.  ",1,0,https://www.reddit.com/r/PCOS/comments/1s00g00/magnesium_deficiency/,https://www.reddit.com/r/PCOS/comments/1s00g00/magnesium_deficiency/,1774121454.0,2026-03-21 19:30:54,Down-Help,1s00g00
EI,Eesti,Mul on lahendusele probleem vist,"Elasin pmst terve oma täiskasvanu elu kaaslasega koos, paar aastat tagasi läksime lahku. Olen vahepeal teiste inimestega suhelnud, aga otsest suhet pole kellegagi tekkinud, sest pole olnud tunnet, et just tema on minu inimene.

Nüüd hakkab aga vaikselt selline tunne tekkima, et miks mul üldse suhet vaja peaks olema, kui olen üksigi õnnelik. Mul on hea töö, ilus kodu, mõnus rahulik elu. Suhtlemisvaegust ei ole, sest töö nõuab pidevat suhtlust ja õhtul tahaks vaikust, mitte mula. Kaisutada saan oma koduloomaga, orgasmiga saan ka ise hakkama.

Samas võiks ju keegi olla, aga selle keegi leidmiseks vaeva ei soovi näha ja oma elu ümber korraldada ka mitte...

Vanad inimesed ütlesid selliste murede peale, et heast elust lolliks läinud, aga noh.",16,11,https://www.reddit.com/r/Eesti/comments/1s00ejd/mul_on_lahendusele_probleem_vist/,https://www.reddit.com/r/Eesti/comments/1s00ejd/mul_on_lahendusele_probleem_vist/,1774121357.0,2026-03-21 19:29:17,Sensitive_Leek_5467,1s00ejd
