bank,subreddit,title,selftext,score,num_comments,url,permalink,created_utc,created_date,author,id
EI,APResearch,In need of college student participants! I will also reciprocate :),"Hi everyone! I am an AP Research student examining the associations between social media usage and self-perception (including self-esteem, body esteem, and eating attitudes) among college students.

If anyone knows any college students, would you be able to forward my survey to them? (I am in urgent need of participants). The survey takes 2-5 minutes to complete and will be completely anonymous. All responses will be extremely beneficial to my research project. I have attached the links below.

Consent Form (participants must fill out first): https://docs.google.com/forms/d/e/1FAIpQLSdEiDiW3burEzPDvYfn08YjkvRBNLDe7dMrfGN4BIhvXBgOrA/viewform?usp=dialog

Survey: https://docs.google.com/forms/d/e/1FAIpQLSfVkOfP9O2igaCkz1usHudaUPHaiLyo7btHJ5WPkWUvXnCbbQ/viewform?usp=dialog",1,0,https://www.reddit.com/r/APResearch/comments/1rzzdv5/in_need_of_college_student_participants_i_will/,https://www.reddit.com/r/APResearch/comments/1rzzdv5/in_need_of_college_student_participants_i_will/,1774118935.0,2026-03-21 18:48:55,Julia_ApResearch,1rzzdv5
EI,Edinburgh,Opium/Legends closing down,"Got this from an MSN link: [Edinburgh nightclub confirms closure after three decades in the Cowgate](https://www.msn.com/en-gb/entertainment/music/edinburgh-nightclub-confirms-closure-after-three-decades-in-the-cowgate/ar-AA1Z5i3W?ocid=msedgntp&pc=SCOODB&cvid=69bedcd654444627b583f2ecd667a2c4&ei=16)

""Legends, which for a while operated as Opium, was ‘a place where the alternative scene in Edinburgh could exist, grow and thrive.’ But earlier in the month staff at the rock bar were left ‘angry and heartbroken’ when it emerged [the rock bar would close](https://www.edinburghnews.scotsman.com/regions/edinburgh-fife-and-lothians/edinburgh-legends-to-close-5627657).

Following the news, hundreds of regulars expressed their shock at the loss of another live music venue in the capital, with many sharing their memories of the alternative nightclub from over the years.

On Friday, March 20, Legends staff said: “We have had confirmation that Monday, March 23 will be our last ever night, so please get down, raise a glass and have a final toast to this place we love so much.

“The outpouring of support over these last few weeks has been incredible and truly humbling, it means the world to us. Thank you for everything. Legends out.”

They added they will host ‘three final banger shows’ over the weekend. Friday’s lineup includes: High Noon, Nassau, Permacrisis, Skeptic, Hazed and The Lost Boys of Niddry Street.  
  
Another added: “I’ve met a lot of really great friends here over the years, it’s a place for everyone and anyone and that’s a beautiful thing.”

Writing to their loyal customers earlier in the month, staff said: “This is more than just a closure of a bar - it is a continuation of the total disregard of the alternative scene in Edinburgh and the loss of yet another live music venue.

“For more than 35 years it has been the home for people who don't always fit in the mainstream - a place where the alternative scene in Edinburgh could exist, grow and thrive. It has been a venue for live music, a space for artists, bands and fans to come together, let go and find friendship, and a sense of community that has helped people through some of their toughest times.""

  


Anyone know any more? Is it being bought by someone else and re-opening as something more gentrified?",0,6,https://www.reddit.com/r/Edinburgh/comments/1rzzc25/opiumlegends_closing_down/,https://www.reddit.com/r/Edinburgh/comments/1rzzc25/opiumlegends_closing_down/,1774118812.0,2026-03-21 18:46:52,QuietGoliath,1rzzc25
EI,snappijuorutofftopic,Yhdynnän aikanen kipu ja jälkeinen vuoto,"Heii.
Onko kellään kokemusta yhdynnän tai sormettamisen aikana olevasta alavatsan paineen tunteesta, aivan ku joku painaisi todella kovaa rakon päälle vaikka rakko ei olisikaan täynnä.
Tullut kans yhdynnän tai sormettamisen aikana ns kirvely, ei voi johtua kuivuudesta kun liukkaria aika urakalla on käytetty😅
Kerran yhdynnän jälkeen alkoi verinen vuoto ja toisella kerralla sormettamisen jälkeen alkoi ruskehtava vuoto, mistä voisi johtua?

Kolme vuotta sitten on gynellä löydetty kystoja, mutta niitä ei olla mitenkään vaarallisena pidetty, eikä ole haluttu jälkitaskastukseen. 2024 lopulla itse kävin yksityisellä tarkastamassa, eikä mitään uutta ollut.

Klamydia ja tippuri testit tehty viime kuussa, joten ei voi olla seksitaudista.

Onko kellään mitään kokemusta tällaisesta tai antaa neuvoa miten toimia?


",5,21,https://www.reddit.com/r/snappijuorutofftopic/comments/1rzzbsw/yhdynnän_aikanen_kipu_ja_jälkeinen_vuoto/,https://www.reddit.com/r/snappijuorutofftopic/comments/1rzzbsw/yhdynnän_aikanen_kipu_ja_jälkeinen_vuoto/,1774118795.0,2026-03-21 18:46:35,Slayyybitch,1rzzbsw
EI,MyaSmooveJones,The TRUTH 🥂🎶🌹💎,Official Video ITS 🥵 THE Truth by Mya https://youtu.be/eiBzZlmPpY4?si=JqI2QwPGVtk2XqX8,1,0,https://v.redd.it/doekjakv1gqg1,https://www.reddit.com/r/MyaSmooveJones/comments/1rzzb5d/the_truth/,1774118753.0,2026-03-21 18:45:53,MeekMilly18st,1rzzb5d
EI,IsMyPokemonCardFake,Is my Card legit?,"Hey guys,

lately I bought an ETB from „Ascendend Heroes“ in german. 

I pulled this card and now I want to verify, if it is legit.

In the bottom edge is written 

„@2026 Pokémon/Nintendo/Creatures/GAME FREAK“ but I unfortunatly wasn‘t able to make it visible in the photos.

So what do you think?

Thanks ahead ! :)",3,1,https://www.reddit.com/gallery/1rzzamc,https://www.reddit.com/r/IsMyPokemonCardFake/comments/1rzzamc/is_my_card_legit/,1774118719.0,2026-03-21 18:45:19,Ill-Assumption6919,1rzzamc
EI,ScottishFootball,"Unofficial Scottish Football Championship, Match No.5,575 - Hibs 0-0 Motherwell - Hibs retain the title!","Congratulations to Hibs, who have apparently committed to holding the title without scoring any goals

This is HIbs' 298th title win, only 30 more matches to go to catch 2026 Scottish Cup Embarrasment Aberdeen.

**Last 5 title matches:**

Match No. | Date | Title Holder | Challenger | Score | Venue | Competition
---------|---------|---------|---------|---------|---------|---------
5571 | 15/02/26 | Kilmarnock | Celtic | 2-3 | Rugby Park | SPFL Premiership
5572 | 22/02/26 | Celtic | Hibernian | 1-2 | Celtic Park | SPFL Premiership
5573 | 27/02/26 | Hibernian | Dundee | 3-3 | Dens Park | SPFL Premiership
5574 | 14/03/26 | Hibernian | Livingston | 0-0 | Easter Road | SPFL Premiership
5575 | 21/03/26 | Hibernian | Motherwell | 0-0 | Fir Park | SPFL Premiership
**Next fixture**:|
5575 | 04/04/26 | Hibernian | Kilmarnock | ?-? | Easter Road | SPFL Premiership

Next up, Hibs entertain Killie in Leith after the international break.

View the full list of results [here!](https://docs.google.com/spreadsheets/d/1Zo2OsxkwrJXhSVA07OvUyHY4AiCK78TZLY-QGuLyqEI/edit?usp=sharing) (Correct as of 17/03/2026)",2,2,https://www.reddit.com/r/ScottishFootball/comments/1rzzak0/unofficial_scottish_football_championship_match/,https://www.reddit.com/r/ScottishFootball/comments/1rzzak0/unofficial_scottish_football_championship_match/,1774118714.0,2026-03-21 18:45:14,i_pewpewpew_you,1rzzak0
EI,APStudents,"In need of College Student Participants! If anyone has an AP research survey, I’d also love to reciprocate :)! (got approval)","Hi everyone! I am an AP Research student examining the associations between social media usage and self-perception (including self-esteem, body esteem, and eating attitudes) among college students.

If anyone knows any college students, would you be able to forward my survey to them? (I am in urgent need of participants). The survey takes 2-5 minutes to complete and will be completely anonymous. All responses will be extremely beneficial to my research project. I have attached the links below.

Consent Form (participants must fill out first): [https://docs.google.com/forms/d/e/1FAIpQLSdEiDiW3burEzPDvYfn08YjkvRBNLDe7dMrfGN4BIhvXBgOrA/viewform?usp=dialog](https://docs.google.com/forms/d/e/1FAIpQLSdEiDiW3burEzPDvYfn08YjkvRBNLDe7dMrfGN4BIhvXBgOrA/viewform?usp=dialog)

Survey: [https://docs.google.com/forms/d/e/1FAIpQLSfVkOfP9O2igaCkz1usHudaUPHaiLyo7btHJ5WPkWUvXnCbbQ/viewform?usp=dialog](https://docs.google.com/forms/d/e/1FAIpQLSfVkOfP9O2igaCkz1usHudaUPHaiLyo7btHJ5WPkWUvXnCbbQ/viewform?usp=dialog)",1,0,https://www.reddit.com/r/APStudents/comments/1rzza4o/in_need_of_college_student_participants_if_anyone/,https://www.reddit.com/r/APStudents/comments/1rzza4o/in_need_of_college_student_participants_if_anyone/,1774118687.0,2026-03-21 18:44:47,Julia_ApResearch,1rzza4o
EI,bilgisayar,2. el ryzen 5 7600,Sahibnden de gördüm ilanı baya bi testleri yapılmıştı işlemcinin adamla da aynı ildeydik 1 hafta sonra otogarda buluşup elden almaya anlaştık 5400tlye sizce alınır mı bence uygulamadaki diğer ilanlardan daha uygun ve güvenilir ama testlerden vs. pek anlamadıgım icin buraya atmak istedim,1,9,https://www.reddit.com/gallery/1rzz7wf,https://www.reddit.com/r/bilgisayar/comments/1rzz7wf/2_el_ryzen_5_7600/,1774118537.0,2026-03-21 18:42:17,AdPretty8597,1rzz7wf
EI,letterboxdcirclejerk,"These are 16 pieces of media I may or may not have seen. Recommend me a dry, high-acidity white wine with pronounced minerality.",,5,2,https://i.redd.it/km1ny7321gqg1.jpeg,https://www.reddit.com/r/letterboxdcirclejerk/comments/1rzz6wb/these_are_16_pieces_of_media_i_may_or_may_not/,1774118466.0,2026-03-21 18:41:06,101_Ozymandias,1rzz6wb
EI,eestitutvused,M30 otsib vestlusi naistega 18+ teemadel,"Kui sulle sobib, siis kirjuta. Kui ei sobi, ära kirjuta. Nii lihtne ongi.

See võib jääda täiesti anonüümseks vestluseks, aga võib areneda millekski enamaks - vaatame, kuidas kulgeb. Kellelegi midagi peale suruma ma ei hakka.",0,0,https://www.reddit.com/r/eestitutvused/comments/1rzz5ni/m30_otsib_vestlusi_naistega_18_teemadel/,https://www.reddit.com/r/eestitutvused/comments/1rzz5ni/m30_otsib_vestlusi_naistega_18_teemadel/,1774118383.0,2026-03-21 18:39:43,Mysterious_Place5670,1rzz5ni
EI,Costco,Snagged the 7 cu ft chest freezer for $199!!!,There were only two left !!,675,87,https://i.redd.it/s6jj3yro0gqg1.jpeg,https://www.reddit.com/r/Costco/comments/1rzz527/snagged_the_7_cu_ft_chest_freezer_for_199/,1774118344.0,2026-03-21 18:39:04,BlinkingWlkr23,1rzz527
EI,RealRacing3,Cars seem to not repair or upgrade,Its in dutch sorry... but does anyone have a solution? Or do i just spend my coins? ,4,1,https://www.reddit.com/gallery/1rzz1nr,https://www.reddit.com/r/RealRacing3/comments/1rzz1nr/cars_seem_to_not_repair_or_upgrade/,1774118115.0,2026-03-21 18:35:15,bvb-brawlstars,1rzz1nr
EI,Cursive,Please hlp🙏,Would someone be able to tell me what this document says? I am TERRIBLE at reading cursive but need this for a university project.,2,1,https://i.redd.it/vdeuzk6lzfqg1.jpeg,https://www.reddit.com/r/Cursive/comments/1rzyzkg/please_hlp/,1774117972.0,2026-03-21 18:32:52,Wide_Lengthiness8789,1rzyzkg
EI,baseballcards,Stadium Club insane hits - Ohtani Skenes,I like Stadium Club for the photos but 99% of the time only pull junk — got crazy lucky with these SSPs in the same box! ,2,0,https://i.redd.it/8l0o95vezfqg1.jpeg,https://www.reddit.com/r/baseballcards/comments/1rzyyp3/stadium_club_insane_hits_ohtani_skenes/,1774117913.0,2026-03-21 18:31:53,sr37016,1rzyyp3
