bank,subreddit,title,selftext,score,num_comments,url,permalink,created_utc,created_date,author,id
EI,Roumanie,Ce parere aveti despre Darwinismul social? Este ideologia guvernului Bolojan,"[Poate nu ati auzit de termenul de ""Darwinism social"", insa cu siguranta cunoasteti mindset-ul. ](https://en.wikipedia.org/wiki/Social_Darwinism)Se poate rezuma intr-o singura fraza: **survival of the strongest.** De aici si diferenta cu Darwinismul clasic, care zice ""survival of the fittest"". Cand am facut in facultate despre darwinismul social, proful ne-a explicat diferenta dintre acesta si darwinismul clasic foarte simplu: Gandacii au supravietuit pana azi, mamutii nu, desi mamutii sunt mai puternici. De aici ideea ca ""survival of the fittest, nu strongest"". 

Chiar daca termenul a aparut in sec. XIX (si NU a fost inventat de Darwin, foarte important), ideile darwinismului social sunt cele care au construit lumea. Ganditi-va la chestii precum sclavia, colonizarile, imperiile, feudalismul - toate au avut conceptul de ""puternici vs. slabi"", si ca puternicii trebuie sa ii domine pe cei slabi pentru propria lor supravietuire. Sub astfel de gandiri au avut loc tot felul de genociduri, pe toate continentele. Era ""datoria"" celor puternici sa faca asta. Darwinismul social a stat si la baza fascismului si ideologiilor derivate din acestea, precum n@zismul sau legionarismul. Ba chiar si la comunism - chiar daca revolutia franceza si miscarile socialiste erau, teoretic, impotriva darwinismului social, comunistii tot pe ""survival of the strongest mergeau"", doar ca ziceau ca proletarii sunt cei mai puternici si e datoria lor sa ii extermine pe ""contrarevolutionari"". 

Ideea de darwinism social a fost discreditata masiv in Europa dupa ww2, ca mna, H1tler. Pana la ww2, mai toti intelectualii vremii, inclusiv de Romania, vorbeau despre ""ce mare chestie inteligenta e darwinismul social"". Daca tie iti pasa de pulime erai ""needucat si prost"". 

  
Ei bine, actuala putere pare ca merge tot pe ideea de ""survival of the strongest"". The strongest insemnand politicienii, securistii, pensionarii speciali si, in general, astia cu pile. Iar cei slabi (persoane cu handicap, pensionari nespeciali, elevi, studenti, mame gravide etc.) nu merita nimic. Nu sunt oameni, sunt ""pomanagii care SUG SANGELE statului"" (in loc sa fure ei). Nu merita NIMIC, in timp ce SRI merita totul. 

Mereu ni se zice ca ""taiem de la voi, ca sa o duca tara mai bine"". Dar cine e ""tara""? Niste grafice? Niste statistici? Nu noi suntem tara? Sau doar ei, cei de la putere si pilele lor, sunt ""tara""? 

Bolojan nu vorbeste despre cei care traiesc la limita saraciei, despre cei cu pensii mizere (desi au muncit pana la 65-70 de ani, nu ca magistratii sau securistii care se pensioneaza la 45 de ani) ca despre niste ""oameni"", ci ca niste cifre care incurca, asa ca mai bine le tai. Survival of the strongest. The strongest nu mai inseamna acum o rasa, ci cei cu puterea. Cei care au puterea merita tot, restul, ""cei slabi"", nu merita nimic. De aceea guvernul Bolojan este in razboi cu poporul si cu oamenii saraci. Pentru ca ei nu merita sa isi depaseasca conditia. Sa aiba impresia ca merita mai mult decat a trai din mila statului. Pentru ca sunt slabi si plebe. 

Spre deosebire de darwinismul clasic, care merge pe ""selectie naturala"", Darwinismul social, inclusiv Bolojanismul, propun o interventie a celor puternici pentru a grabi aceasta selectie ""naturala"". Adica fix ce face acum - greutati pentru saraci, usurari pentru puternici. Sau, cum zic economistii, ""socialism pentru bogati, capitalism salbatic pentru saraci"". 

",0,7,https://www.reddit.com/r/Roumanie/comments/1rvayx9/ce_parere_aveti_despre_darwinismul_social_este/,https://www.reddit.com/r/Roumanie/comments/1rvayx9/ce_parere_aveti_despre_darwinismul_social_este/,1773671281.0,2026-03-16 14:28:01,calin_georgesco,1rvayx9
EI,TrueChefKnives,Advice in keeping my new Kurosaki Bunka in shape,"I just bought the Yu Kurosaki Senko Ei Rosewood Bunka and I scheduled a wetstone sharpening coarse for later in the year.  
But I'd also like to buy supporting accessories to make it last as long as possible.

what kind of sharpening stones would be best for this?

what angle should I sharpen this on?

What kind of honing rod would be best?

advice on a nice cutting board to supplement this

any advice will be greatly appreciated!

edit to add: and what about a strop?",1,1,https://www.reddit.com/r/TrueChefKnives/comments/1rvayjf/advice_in_keeping_my_new_kurosaki_bunka_in_shape/,https://www.reddit.com/r/TrueChefKnives/comments/1rvayjf/advice_in_keeping_my_new_kurosaki_bunka_in_shape/,1773671257.0,2026-03-16 14:27:37,creckers,1rvayjf
EI,SpouseVisaUk,SOS - TLScontact website error/crash during document upload (Spouse Visa Extension) - Appointment on Thursday!,"Hello everyone, this is my first post here and I’m looking for some urgent advice/reassurance.

I’m currently applying for a Spouse Visa extension (FLR M) from within the UK. I have already submitted the application and paid both the IHS and visa fees. However, I’ve run into a major issue with the TLScontact portal.

While uploading my documents yesterday, the website started glitching and now I cannot upload any more information. I'm especially struggling with my husband's and my own passport scans; even after compressing them, the site keeps rejecting them or freezing. I cannot even see a list of what was submitted, and the interface is incredibly confusing.

My biometric appointment is this Thursday, March 19th. I’ve emailed TLS but they said it could take 10 working days to respond—which is obviously too late.
 
Could anybody help me with the question below:
Can I just bring my missing documents (printed) to the appointment and pay for the Assisted Scanning Service there?
If I do that, do I need to bring everything printed, or just the documents that I couldn't upload?
Does the scanning service handle large files better than the website?
 
Has anyone dealt with this before? Any tips on how to handle the situación?

Thank you very much!",1,0,https://i.redd.it/q72yq2xs2fpg1.jpeg,https://www.reddit.com/r/SpouseVisaUk/comments/1rvaw06/sos_tlscontact_website_errorcrash_during_document/,1773671098.0,2026-03-16 14:24:58,Giseldaysv,1rvaw06
EI,BadOmens,Press on Nails,I just finished by far one of my favorite sets,34,2,https://www.reddit.com/gallery/1rvavqs,https://www.reddit.com/r/BadOmens/comments/1rvavqs/press_on_nails/,1773671083.0,2026-03-16 14:24:43,httperror420334,1rvavqs
EI,artbookcollectors,Collection Update,"My collection grew quite a bit over the year and I'm very happy with all of them.
I bought a bunch of books from someone on here awhile ago (6th image). I know I'm terrible at replying to emails.. but if you see this post Elizabet, thank you SO MUCH for all of them!! I adore them all a ton and love using them whenever I can. The extra gifts were super sweet!!

The two How to draw birds booklets aren't really new additions but imo one of the best out there when it comes to drawing birds and understanding their anatomy. The artist has already released two more booklets if I remember correctly.

I'm waiting for a bunch of preorders still. And hopefully I can buy a few more on an event next month. 

I even found a manga store that sells Japanese Artbooks here. Tho I always have a hard time buying them (I think I'm not used to the artstyle, but I'll probably grow to love it more in the future). But I adore those books that have a lot of environmental artworks in them. If you guys have any recommendations I'd love to hear it! The Ghibli Artbook is too expensive for me to buy rn. Soon™

I've got far more digital artbooks on my pc tho. But I don't have a proper list for that.
",10,1,https://www.reddit.com/gallery/1rvau8u,https://www.reddit.com/r/artbookcollectors/comments/1rvau8u/collection_update/,1773670990.0,2026-03-16 14:23:10,Lo-Honko,1rvau8u
EI,hotwheelsmumbai,WTT F2F Chevrolet Silverado EV (West Mumbai),"I'm ISO any good castings. Shoot your offers, maybe we can make something work. ",1,0,https://i.redd.it/z4xnptrg2fpg1.jpeg,https://www.reddit.com/r/hotwheelsmumbai/comments/1rvau6h/wtt_f2f_chevrolet_silverado_ev_west_mumbai/,1773670986.0,2026-03-16 14:23:06,chandracorp,1rvau6h
FAB,UAEcreditcards,"Best Backup card for Travel: With low or zero FX fees, low to zero Annual fees and no Min spend criteria. Citi cash back or Fab Z Card or Wio Card? Which is better ?","Hi. I am looking for a card only to use for Travel. 

I have a SIB cashback card and I recently used for travel (outside UAE). But it incurred heavy FX fees. Earlier, I have used HSBC card as well, which incurred heavy FX fees. So I am looking for a credit card, with virtually no FX fees and hopefully little to none annual fees. 

I am planning to travel to South east Asia and eventually around Europe and would not like to be carrying large amounts cash around at the same time, not spend a lot on FX fees. 

I have narrowed down to 3 options: 

1. Citi Cash Back Card 

2. FAB Z Card 

3. Wio Card 

Currently I am leaning towards the FAB Z Card, considering the Annual fees is only 100 Dhs but I would like to go with the Citi Bank card, considering the cashback and also the lounge access which comes with it, but I am avoiding it because of the 300dhs annual fees. 

What would you recommend ? Which would be a better option or would you recommend another card? ",9,14,https://www.reddit.com/gallery/1ruhlp6,https://www.reddit.com/r/UAEcreditcards/comments/1ruhlp6/best_backup_card_for_travel_with_low_or_zero_fx/,1773590027.0,2026-03-15 15:53:47,Ni__Mo,1ruhlp6
Mashreq,UAE,Transferring AED funds to GIFT city in India,Hi - I am trying to transfer my AED funds from Mashreq to GIFT city India. Has anyone done this online (through app or through email approvals etc. )?,0,3,https://www.reddit.com/r/UAE/comments/1rvajdd/transferring_aed_funds_to_gift_city_in_india/,https://www.reddit.com/r/UAE/comments/1rvajdd/transferring_aed_funds_to_gift_city_in_india/,1773670302.0,2026-03-16 14:11:42,Certain_Anteater_643,1rvajdd
Mashreq,UAE,Mashreq bank app down ?,Title.,5,1,https://www.reddit.com/r/UAE/comments/1rv921i/mashreq_bank_app_down/,https://www.reddit.com/r/UAE/comments/1rv921i/mashreq_bank_app_down/,1773666764.0,2026-03-16 13:12:44,West_Vegetable9500,1rv921i
Mashreq,UAE,Mashreq Bank App Down?,,3,20,https://www.reddit.com/r/UAE/comments/1rv6k7v/mashreq_bank_app_down/,https://www.reddit.com/r/UAE/comments/1rv6k7v/mashreq_bank_app_down/,1773659557.0,2026-03-16 11:12:37,Future-Use-6302,1rv6k7v
Mashreq,u_mubishra03,Credit cards and quick cash loan,,1,0,https://www.reddit.com/gallery/1rv4c7g,https://www.reddit.com/r/u_mubishra03/comments/1rv4c7g/credit_cards_and_quick_cash_loan/,1773651665.0,2026-03-16 09:01:05,mubishra03,1rv4c7g
