bank,subreddit,title,selftext,score,num_comments,url,permalink,created_utc,created_date,author,id
ENBD,StockMarketIndia,Decline in IDBI Bank Share Price as Privatisation Plans Face Roadblocks Amid Divestment Constraints,"The Government of India holds a stake of 45.48% in IDBI Bank along with the Life Insurance Corporation (LIC) owning a stake of 49.24%. Together, they own 94.72% of IDBI Bank. Earlier, the Press Trust of India issued a report stating the duo were planning to sell 60.72% (comprising 30.48% held by the government and 30.24% by LIC) of the total equity of IDBI Bank, leaving them with combined holdings of 33.99% (15% held by GOI and 19% held by LIC)

  
They had floated an Expression of Interest in Oct’22 and the Department of Investment and Public Asset Management (DIPAM) confirmed that the interested parties had bid by 6^(th) February 2026. Bidders included Fairfax Financial Holdings, Emirates NBD and Kotak Mahindra Bank. The three bidders were allowed to move to the final stage of the process after completing due diligence and clearing the technical bid stage.  
  
The government was pursuing the sale as part of its wider strategic divestment programme, aimed at boosting non-tax revenues and scaling back its involvement in non-core sectors. The divestment gained traction after IDBI exited the Reserve Bank of India’s Prompt Corrective Action (PCA) framework in March 2021, following improvements in asset quality, capital adequacy, and profitability. Exiting the PCA was seen as a crucial step to attract private investors and renew interest in the strategic sale.  
  
However, market sentiment made the share extremely volatile recently in response to reports about the divestment process. On Friday, 13th Mar 2026, IDBI Bank shares closed at 92.18. The share then opened at 82.12 and fell further to close at 76.31 on Monday, 16th Mar.  
  
The decline of close to 17% in a single day occurred after reports suggested that the government may reconsider or halt their decision to divest in the bank after the financial bids put in by the potential buyers were below the reserve price.  
  
IDBI Bank didn’t confirm or deny the reports, they commented that the divestment process is a confidential strategic process being undertaken by the Indian government and that they would immediately inform stock exchanges of all material developments and price-sensitive information in compliance with the Securities and Exchange Board of India’s Listing Obligations and Disclosure Requirements regulations. They also mentioned that the report to the bidding process and does not involve any regulatory or legal proceedings. A clarification was provided after a query from BSE seeking comments on a media report that the government may scrap the majority stake sale due to the low-price bids.  
  
Investors are likely to benefit from increased clarity once the government gives an official statement on the future of the disinvestment process which has been watched keenly by hawkish investors who have been expecting the operational efficiency to increase.  
  
Despite the bank’s total income declining to ₹8,282 crore in Q3 FY26 from ₹8,565 crore in Q3 FY25, and interest income fell to ₹7,074 crore from ₹7,816 crore a year ago, the earnings report showed the profitability of the lender increased by 1.42% from Q3 FY25’s earnings.

The gross non-performing asset (GNPA) ratio represents the total value of all loans and advances that have ceased to generate income for a bank, usually when interest or principal payments are overdue for over 90 days. The gross non-performing asset ratio improved to 2.57% as of December 31, 2025, from 3.57% in the year-ago period. This indicates better credit quality and lower risk as there is a lower chance of loan losses. However, the net non-performing asset remained at 0.18%. The net NPA shows the actual risk of loan losses to the bank as it reduces provisions made for losses from the GNPA and accrued interest on non-performing loans that the bank has not recognized as income (Interest suspense). The Net NPA of 0.18% shows minimal actual loan loss risk even if some loans are “non-performing” i.e. the borrower fails to pay interest or principal for 90 days or more and the bank cannot recognize the interest as income.  
  
The bank’s capital adequacy ratio (CAR) strengthened to 24.63% at the end of December 2025, up from 21.98% a year earlier. The CAR measures how well a bank can absorb losses while continuing operations. An improvement shows that the bank has a strong capital buffer making it safe to invest and deposit in due to the stability.  
  
On the other hand, return on assets (ROA) moderated to 1.83% in Q3 FY26, compared with 1.99% in Q3 FY25. The ROA measures how efficiently a bank is using its assets to generate profit. Here, we are able to notice that the bank has relatively become less efficient as the bank earned slightly less profit per ₹100 of assets than a year ago. The ROA may have declined despite flat profits because total assets may have grown faster than profits.



*Bibliography:*  
Press Trust of India: [https://www.ptinews.com/story/business/idbi-bank-strategic-sale-scrapped-as-financial-bids-below-reserve-price-sources/3464548](https://www.ptinews.com/story/business/idbi-bank-strategic-sale-scrapped-as-financial-bids-below-reserve-price-sources/3464548)

Economic Times: [https://economictimes.indiatimes.com/industry/banking/finance/banking/idbi-bank-divestment-scrapped-lic-govt-owned-bank-clarifies-after-stock-tanks/articleshow/129604537.cms?from=mdr](https://economictimes.indiatimes.com/industry/banking/finance/banking/idbi-bank-divestment-scrapped-lic-govt-owned-bank-clarifies-after-stock-tanks/articleshow/129604537.cms?from=mdr)

India Today: [https://www.indiatoday.in/business/market/story/idbi-bank-share-price-crashes-16-percent-why-is-the-stock-down-today-2882641-2026-03-16](https://www.indiatoday.in/business/market/story/idbi-bank-share-price-crashes-16-percent-why-is-the-stock-down-today-2882641-2026-03-16)  
  
MarketControl: [https://www.moneycontrol.com/news/business/economy/financial-bids-from-kotak-emirates-nbd-fairfax-received-for-idbi-bank-privatisation-13816353.html](https://www.moneycontrol.com/news/business/economy/financial-bids-from-kotak-emirates-nbd-fairfax-received-for-idbi-bank-privatisation-13816353.html?utm_source=chatgpt.com)",1,0,https://www.reddit.com/r/StockMarketIndia/comments/1rzp6u5/decline_in_idbi_bank_share_price_as_privatisation/,https://www.reddit.com/r/StockMarketIndia/comments/1rzp6u5/decline_in_idbi_bank_share_price_as_privatisation/,1774092788.0,2026-03-21 11:33:08,CarsAndCapital,1rzp6u5
ADCB,UAEcreditcards,ADCB Traveller's Card with FD?,I'm on an investor visa. So only option for CC seems to be getting one secured against a FD. Does anyone know if I can get the ADCB Traveller's card with a small FD (like 10k)? What's the minimum FD amount?,1,0,https://www.reddit.com/r/UAEcreditcards/comments/1s0dddj/adcb_travellers_card_with_fd/,https://www.reddit.com/r/UAEcreditcards/comments/1s0dddj/adcb_travellers_card_with_fd/,1774157188.0,2026-03-22 05:26:28,NotSoCoolWaffle,1s0dddj
ADCB,UAE,ADCB Touch points Redemption,"Hello Everyone, 
Eid Mubarak!

Wondering what is the best way to redeem ADCB touch points? Any suggestions to make the best use out of these points (mostly for retail shopping purposes)",2,7,https://www.reddit.com/r/UAE/comments/1rzqej3/adcb_touch_points_redemption/,https://www.reddit.com/r/UAE/comments/1rzqej3/adcb_touch_points_redemption/,1774096669.0,2026-03-21 12:37:49,Character-End-8178,1rzqej3
ADIB,UAETeenagers,Adib bank,"I wanted to create a new back account from the adib app but it says that i’ll have to open my account at the branch.. 

does anyone know what i could do other than going to one of adib’s branches ? ",0,5,https://www.reddit.com/r/UAETeenagers/comments/1rzu9n4/adib_bank/,https://www.reddit.com/r/UAETeenagers/comments/1rzu9n4/adib_bank/,1774106807.0,2026-03-21 15:26:47,savex_a,1rzu9n4
ADIB,ZeroTaxJobs,Abu Dhabi Islamic Bank is hiring a Application Assurance Specialist,"🏢 Company: [Abu Dhabi Islamic Bank](https://zerotaxjobs.com/companies/abu-dhabi-islamic-bank)  
📍 Location: Dubai, United Arab Emirates  
💸 Salary Guide: $60,000 USD - $100,000 USD Tax-Free!  
👉 Apply & More Details: [https://zerotaxjobs.com/jobs/application-assurance-specialist-lxejee6o](https://zerotaxjobs.com/jobs/application-assurance-specialist-lxejee6o)  

📈 Trending Job Searches:  
[Software Engineer Jobs in Dubai](https://zerotaxjobs.com/software-engineer-jobs-in-dubai)  
[Expatriate Jobs in Saudi Arabia](https://zerotaxjobs.com/expatriate-jobs-in-saudi-arabia)  
[IT Jobs in Dubai](https://zerotaxjobs.com/it-jobs-in-dubai)  
[Jobs in Abu Dhabi](https://zerotaxjobs.com/jobs-in-abu-dhabi)",1,0,https://www.reddit.com/r/ZeroTaxJobs/comments/1rztzcb/abu_dhabi_islamic_bank_is_hiring_a_application/,https://www.reddit.com/r/ZeroTaxJobs/comments/1rztzcb/abu_dhabi_islamic_bank_is_hiring_a_application/,1774106102.0,2026-03-21 15:15:02,samotsar,1rztzcb
ADIB,PHBookClub,Selling my Pre-Loved Books,Selling some of my pre-loved books. Already switched to e-reader and might need funds. Feel free to reach out and I might include freebies too for sure buyers.,5,0,https://i.redd.it/9zlq5whjedqg1.jpeg,https://www.reddit.com/r/PHBookClub/comments/1rznirl/selling_my_preloved_books/,1774086718.0,2026-03-21 09:51:58,hauntedhalogen,1rznirl
EI,CrimsonDesert,Found a money bug completely by mistake and the NPCs knew...,"I was just selling stuff at the blacksmith and one Item let me just keep selling it so I thought ""Why not get a little coin boost to start my adventure."" (like 100 silver). Well about a day later (in game time) this guy comes running up to me dressed like a rich, highborn, banker and in a voice I have yet to hear from any other NPC goes. ""**mmmhmmm, Myesss,** seems your coin is not in order sir. How dare you."" then slaps this letter in my hand dramatic af... I apparently cant even escape the tax man in virtual worlds either. 

9/10 realism for me fellas... Would do it again.",1,0,https://i.redd.it/6jg1rbur5jqg1.jpeg,https://www.reddit.com/r/CrimsonDesert/comments/1s0demd/found_a_money_bug_completely_by_mistake_and_the/,1774157306.0,2026-03-22 05:28:26,Confident-Theory9897,1s0demd
EI,pokemonmemes,How do you think the characters of XY feel about the whole L thing? I think they still would want him arrested imo.,,1,1,https://i.redd.it/rps79y9r7jqg1.png,https://www.reddit.com/r/pokemonmemes/comments/1s0dcp8/how_do_you_think_the_characters_of_xy_feel_about/,1774157120.0,2026-03-22 05:25:20,LowSolution3084,1s0dcp8
EI,FUTMobile,META AF,Enough said. Absolute Badman,2,1,https://i.redd.it/kjenkbdk7jqg1.jpeg,https://www.reddit.com/r/FUTMobile/comments/1s0db8o/meta_af/,1774156975.0,2026-03-22 05:22:55,J_mcmillan10,1s0db8o
EI,fut,Evo feedback please,"How is this ? Would you change anything?
Mainly for B2B, sometimes as holding. It's says 94.8 rating and there areot of cards that go further up. ",2,1,https://i.redd.it/3z9bix937jqg1.jpeg,https://www.reddit.com/r/fut/comments/1s0d9p2/evo_feedback_please/,1774156819.0,2026-03-22 05:20:19,akshayraos,1s0d9p2
EI,JEE,Imp ques of vector and 3D of jee mains .. next which chapter??,"Guys I am sharing imp quest of vectors and 3D, I think In this ques all chapter is covered and u can practice them after doing 2026 pyqs for betterment.

Which chapter u want next u can comment and I will posting sooon, of which chapter and subject ..",7,1,https://www.reddit.com/gallery/1s0d6kb,https://www.reddit.com/r/JEE/comments/1s0d6kb/imp_ques_of_vector_and_3d_of_jee_mains_next_which/,1774156523.0,2026-03-22 05:15:23,sarthakk911,1s0d6kb
EI,fishing_hunting_deals,TODAY ONLY! (3/22) Buy 2 Get 1 Free Eagle Caw Starfire X Trolling Rods,,1,0,https://www.outdoorbacon.com/flash-deals/?fd=6219,https://www.reddit.com/r/fishing_hunting_deals/comments/1s0d1wb/today_only_322_buy_2_get_1_free_eagle_caw/,1774156085.0,2026-03-22 05:08:05,BaconDeals,1s0d1wb
EI,repollitos_criptidos,"Este sub no es de historia, pero aquí les dejo un mapa de México en 1825 :v",,5,1,https://i.redd.it/xfrdh79i4jqg1.png,https://www.reddit.com/r/repollitos_criptidos/comments/1s0d0ks/este_sub_no_es_de_historia_pero_aquí_les_dejo_un/,1774155962.0,2026-03-22 05:06:02,jetri07,1s0d0ks
EI,Eldar,Not hardest but longest assembly,Im gonna prime the heads separately,2,0,https://i.redd.it/miis6h7f4jqg1.jpeg,https://www.reddit.com/r/Eldar/comments/1s0d03o/not_hardest_but_longest_assembly/,1774155918.0,2026-03-22 05:05:18,7he0strich,1s0d03o
EI,ActionFigures,"I bought this Goku action figure for my office today, I’m really enjoying it",,1,1,https://www.reddit.com/gallery/1s0czbn,https://www.reddit.com/r/ActionFigures/comments/1s0czbn/i_bought_this_goku_action_figure_for_my_office/,1774155842.0,2026-03-22 05:04:02,DeletedMessiah,1s0czbn
EI,Colognes,My full bottle collection,this is my full bottle collection. I do have a ton of decants but besides all my decants these are the full bottles. I absolutely love every single one of these. it's a little bit of everything so I covered all occasions. please rate what could I add? what should I add? thank you ,0,2,https://i.redd.it/m0u82jpz3jqg1.jpeg,https://www.reddit.com/r/Colognes/comments/1s0cyn8/my_full_bottle_collection/,1774155778.0,2026-03-22 05:02:58,Big-Ship-3727,1s0cyn8
EI,vinyl,Found for ONE DOLLAR thrifting…….,I know nothing about it but too cheap to pass up.,11,2,https://i.redd.it/cq1qzvx33jqg1.jpeg,https://www.reddit.com/r/vinyl/comments/1s0cvay/found_for_one_dollar_thrifting/,1774155476.0,2026-03-22 04:57:56,johnwickonvhs,1s0cvay
EI,IndianTeenagers,How true is this?,,20,26,https://i.redd.it/iuj6t5hk1jqg1.jpeg,https://www.reddit.com/r/IndianTeenagers/comments/1s0cpz7/how_true_is_this/,1774154961.0,2026-03-22 04:49:21,jkkbnll,1s0cpz7
EI,Steelbooks,SALE PICK UPS!!!!,,9,3,https://www.reddit.com/gallery/1s0cp1k,https://www.reddit.com/r/Steelbooks/comments/1s0cp1k/sale_pick_ups/,1774154879.0,2026-03-22 04:47:59,Animefreak54,1s0cp1k
EI,Genshin_Impact,"All current Expies of the original ""core"" cast of Honkai Impact 3",,0,4,https://i.redd.it/3kqpogb51jqg1.png,https://www.reddit.com/r/Genshin_Impact/comments/1s0codv/all_current_expies_of_the_original_core_cast_of/,1774154819.0,2026-03-22 04:46:59,AlterMagna,1s0codv
EI,HonkaiStarRail,"All current Expies of the original ""core"" cast of Honkai Impact 3",,0,11,https://i.redd.it/qj42tdjz0jqg1.png,https://www.reddit.com/r/HonkaiStarRail/comments/1s0cnsv/all_current_expies_of_the_original_core_cast_of/,1774154766.0,2026-03-22 04:46:06,AlterMagna,1s0cnsv
EI,ZenlessZoneZero,"All current Expies of the original ""core"" cast of Honkai Impact 3",,0,7,https://i.redd.it/iak8ipuk0jqg1.png,https://www.reddit.com/r/ZenlessZoneZero/comments/1s0cn3s/all_current_expies_of_the_original_core_cast_of/,1774154706.0,2026-03-22 04:45:06,AlterMagna,1s0cn3s
EI,APlagueTale,Resonance: A Plague Tale Legacy Pre-order Bonus,Pre-orders for Resonance just went live in my country. I haven’t seen this posted here yet. ,22,3,https://i.redd.it/lqha9bfk0jqg1.jpeg,https://www.reddit.com/r/APlagueTale/comments/1s0cm4w/resonance_a_plague_tale_legacy_preorder_bonus/,1774154623.0,2026-03-22 04:43:43,Thomasthefirst,1s0cm4w
EI,mildlyinteresting,An old photo envelope dated 1977 from a now-defunct store blew into our yard today,,16,4,https://i.redd.it/d5fyyt8a0jqg1.jpeg,https://www.reddit.com/r/mildlyinteresting/comments/1s0cl2d/an_old_photo_envelope_dated_1977_from_a/,1774154527.0,2026-03-22 04:42:07,rileyjw90,1s0cl2d
EI,Splintercell,"Spies Vs Mercs, anyone? (PS3)",,6,0,https://i.redd.it/3wospfo60jqg1.jpeg,https://www.reddit.com/r/Splintercell/comments/1s0ckr0/spies_vs_mercs_anyone_ps3/,1774154497.0,2026-03-22 04:41:37,landyboi135,1s0ckr0
EI,espresso,[US] Giveaway – Quang Tri Liberica + Lam Dong Arabica | New Saigon Trading Co.,"Greetings r/espresso,

My name is Tommie. I'm a veteran (US Army) who moved to Vietnam, reconnected with my roots, and discovered a third wave specialty coffee scene that changed how I think about coffee entirely. Vietnamese coffee has a reputation for sweetened condensed milk and Robusta. What I found here was something else altogether. I started New Saigon Trading Co. to bring it to the US market, because premium Vietnamese specialty coffee hasn't had its moment yet.

I'm giving away one bag each to two winners, drawn at random. Here's what's in the box:

Quang Tri Liberica - Called Cà Phê Mít (jackfruit coffee) in Vietnam. Liberica represents roughly 1% of global coffee exports. It is a distinct species from Arabica and Robusta - different plant, larger berry, different flavor compounds entirely. Medium Roast.

Lam Dong Arabica - Sourced from Vietnam's Central Highlands - one of the few regions in the country with sufficient elevation for quality Arabica cultivation. Medium-dark roast. Flavor notes of chocolate, caramel, and plum. Selected to represent what Vietnamese Arabica looks like at its best.

Both are single-origin, unblended, sourced directly from the farmers I work with. Sustainable and fair trade practices throughout.

To enter: like and leave a comment below. Two winners drawn at random on end of day Sunday 3/22. Open to US residents only. The winners will be announced in this thread, you will have 48 hours after announcement to PM an address to receive the prize. Failure to will result in forfeit and re-draw.

Happy to answer questions about the coffees, the growing regions, or Vietnam's specialty coffee scene.

Regards,  
Tommie  
New Saigon Trading Co.  
[www.newsaigontrading.com](http://www.newsaigontrading.com/)

  
thank you mods for welcoming this post.",0,0,https://i.redd.it/bfo65qufyiqg1.jpeg,https://www.reddit.com/r/espresso/comments/1s0cf6o/us_giveaway_quang_tri_liberica_lam_dong_arabica/,1774153990.0,2026-03-22 04:33:10,NewSaigonTradingCo,1s0cf6o
EI,classicwowtbc,WHERE YOU AT B I G P V P,"https://preview.redd.it/00r8esr2yiqg1.png?width=1489&format=png&auto=webp&s=bbb5c835b25fa6e8c3a25b421953f400841cea63

YOUR KING IS DEAD",9,12,https://www.reddit.com/r/classicwowtbc/comments/1s0cdjj/where_you_at_b_i_g_p_v_p/,https://www.reddit.com/r/classicwowtbc/comments/1s0cdjj/where_you_at_b_i_g_p_v_p/,1774153844.0,2026-03-22 04:30:44,Due-Set-6299,1s0cdjj
EI,ValorantAccounts,"MUMBAI APAC ACCOUNT, with FE and receipts. 7 prems.",Dm if interested. ,1,0,https://www.reddit.com/gallery/1s0cco9,https://www.reddit.com/r/ValorantAccounts/comments/1s0cco9/mumbai_apac_account_with_fe_and_receipts_7_prems/,1774153769.0,2026-03-22 04:29:29,NopeitaintShrimp,1s0cco9
EI,OlderChillGamers,Who remembers Dangerous Dave?,"Pre-Doom game made by John Romero before he formed id Software.

Remember playing this game constantly on my grandma’s iMac in the early 2000’s",1,0,https://i.redd.it/4pa7y4pqxiqg1.jpeg,https://www.reddit.com/r/OlderChillGamers/comments/1s0cblh/who_remembers_dangerous_dave/,1774153671.0,2026-03-22 04:27:51,BigOlPenisDisorder,1s0cblh
EI,pourover,[US] Giveaway – Quang Tri Liberica + Lam Dong Arabica | New Saigon Trading Co.,"Hi [r/pourover](https://www.reddit.com/r/pourover),

  
My name is Tommie. I'm a veteran (US Army) who moved to Vietnam, reconnected with my roots, and discovered a third wave specialty coffee scene that changed how I think about coffee entirely. Vietnamese coffee has a reputation for sweetened condensed milk and Robusta. What I found here was something else altogether. I started New Saigon Trading Co. to bring it to the US market, because premium Vietnamese specialty coffee hasn't had its moment yet.

  
I'm giving away one bag each to two winners, drawn at random. Here's what's in the box:  


Quang Tri Liberica - Called Cà Phê Mít (jackfruit coffee) in Vietnam. Liberica represents roughly 1% of global coffee exports. It is a distinct species from Arabica and Robusta - different plant, larger berry, different flavor compounds entirely. I pull it as espresso and brew it as pour-over. Both are worth exploring. Medium Roast.  


Lam Dong Arabica - Sourced from Vietnam's Central Highlands - one of the few regions in the country with sufficient elevation for quality Arabica cultivation. Medium-dark roast. Flavor notes of chocolate, caramel, and plum. Selected to represent what Vietnamese Arabica looks like at its best.  


Both are single-origin, unblended, sourced directly from the farmers I work with. Sustainable and fair trade practices throughout.  


To enter: like and leave a comment below. Two winners drawn at random on end of day Sunday 3/22. Open to US residents only. The winners will be announced in this thread, you will have 48 hours after announcement to PM an address to receive the prize. Failure to will result in forfeit and re-draw.  


Happy to answer questions about the coffees, the growing regions, or Vietnam's specialty coffee scene.

Regards,  
Tommie  
New Saigon Trading Co.  
[www.newsaigontrading.com](http://www.newsaigontrading.com/)

  
This post  has been mod approved",32,37,https://i.redd.it/jc6lf5lawiqg1.jpeg,https://www.reddit.com/r/pourover/comments/1s0cb25/us_giveaway_quang_tri_liberica_lam_dong_arabica/,1774153625.0,2026-03-22 04:27:05,NewSaigonTradingCo,1s0cb25
EI,Advice,Need advice as i dont know what to do.,For context ive been unemployed for the past 6 weeks im a 23M ive been on ei and looking for a job very actively and I finally got an interview and I took the very first job available. We'll over the time my bills have been piling up and im at a point of no return I need to pay off my bills or I will be kicked out of my house and lose my car and ive been doing door dash and Uber and I just have had horrible luck. Ive even asked people close to me and my last resort is to take out a loan from fairstone or loans canada both have high apr and I just need money asap. I just need advice on what I should do here please,1,1,https://www.reddit.com/r/Advice/comments/1s0c94d/need_advice_as_i_dont_know_what_to_do/,https://www.reddit.com/r/Advice/comments/1s0c94d/need_advice_as_i_dont_know_what_to_do/,1774153447.0,2026-03-22 04:24:07,IllustratorBrave283,1s0c94d
EI,karachi,How was your Eid people?,I wasn't winning. I was swimming.,0,0,https://i.redd.it/da47e2zswiqg1.jpeg,https://www.reddit.com/r/karachi/comments/1s0c8jh/how_was_your_eid_people/,1774153397.0,2026-03-22 04:23:17,Previous_Yesterday95,1s0c8jh
EI,conspiracy,Miami Mall Incident,"Screenshots from a Reddit post I saved from almost a year ago. 

This sub won’t allow me to link. ",46,15,https://www.reddit.com/gallery/1s0c8bs,https://www.reddit.com/r/conspiracy/comments/1s0c8bs/miami_mall_incident/,1774153379.0,2026-03-22 04:22:59,PlumEmergency8876,1s0c8bs
EI,porramauricio,Parece que até a Magali tem limite,,12,1,https://i.redd.it/35synepscvif1.jpeg,https://www.reddit.com/r/porramauricio/comments/1s0c73g/parece_que_até_a_magali_tem_limite/,1774153270.0,2026-03-22 04:21:10,Specialist-Law1229,1s0c73g
EI,EmoStyle,recent fits in taiwan,,16,1,https://www.reddit.com/gallery/1s0c51s,https://www.reddit.com/r/EmoStyle/comments/1s0c51s/recent_fits_in_taiwan/,1774153088.0,2026-03-22 04:18:08,No-Item-1758,1s0c51s
EI,huntinroguehelldivers,Another traitorous scum to add to the firing wall,"Played two games with this guy on Seasse level 10 helldive, first game was a defense mission and kept getting knocked down and nearly killed by a random explosion over and over and shot at by who I thought was a teamate but gave some benefit of the doubt due to there being a motar turret (later realized it was this guy with the anti-material rifle.) Jumped in the pelican before anyone else was near or ready to go. Second game he keeps dying and eventually then gets called in near us and proceeds to shoot at the ground near teammates which I just put off as him messing around which I’m pretty sure he was just a bad shot and really meant to hit us and then turned around and killed me and another teamate. He then tried spawning us to kill us again only to get destroyed by me and the other teamates multiple times till he raged quit. Don’t be this guy and if you do see him shoot him on site.",9,1,https://i.redd.it/averm1ioviqg1.jpeg,https://www.reddit.com/r/huntinroguehelldivers/comments/1s0c3ux/another_traitorous_scum_to_add_to_the_firing_wall/,1774152978.0,2026-03-22 04:16:18,PostMcLovin,1s0c3ux
EI,CarsPH,Pwede ba magpadriving school kahit may DL na?,Alam ko magdrive pero sa multicab or pangdeliver na tubig. Bago sana ako bibili kotse. Gusto ko sana matutunan tantsahin yung body at AT transmission bago ko ei uwi ang sasakyan from CASA.,6,7,https://www.reddit.com/r/CarsPH/comments/1s0c3dj/pwede_ba_magpadriving_school_kahit_may_dl_na/,https://www.reddit.com/r/CarsPH/comments/1s0c3dj/pwede_ba_magpadriving_school_kahit_may_dl_na/,1774152934.0,2026-03-22 04:15:34,Future_Mention_8323,1s0c3dj
EI,FixMyPrint,Why are the first few layers terrible,"This is my creality ender 3 v3 plus and I am doing this large print but I noticed that the first layer has these striations in it. It is self leveling and I did have it level itself before I started the print, but the first layer seems too close to the bed due to the ridges being made. I have no clue how to fix this, so I will take any advice. ",1,5,https://i.redd.it/koo0lctiviqg1.jpeg,https://www.reddit.com/r/FixMyPrint/comments/1s0c39v/why_are_the_first_few_layers_terrible/,1774152925.0,2026-03-22 04:15:25,Current-Tour-6640,1s0c39v
EI,stealabrainrot,GUYS WAS THIS A W OR L PLEASE ANSWER IMMEDIATELY,,2,5,https://i.redd.it/ty2mnhwgviqg1.jpeg,https://www.reddit.com/r/stealabrainrot/comments/1s0c32i/guys_was_this_a_w_or_l_please_answer_immediately/,1774152908.0,2026-03-22 04:15:08,Salt_Interview_4705,1s0c32i
