bank,subreddit,title,selftext,score,num_comments,url,permalink,created_utc,created_date,author,id
EI,PolyTrack,New track I made:,PolyTrack24pdPYl1tyCjE8vECILPye99FFeGgBCgsogAyveT79bm5cyRvcNES6u6qriMnHe9rV1SXLZ98Q8n1OzVlzuGBNNlSSfeqqokCcBtJf2mh91fdJ9QU5sZPVw3nDBlBNCfbOOwHDVnGDENZKGGuGaf3tmp0lFdCX1G6IVgIrJZ36PNHPvKXvSyeSxaN39afce5fue96a6601a56L1l1sI96anz69aim6v1VD1813Rjo31noi6Nu6r1fcnh6DiCVqxPyVXzXWvWT7BLljIy7apDZN32Vq567tCbDWjO7vFJi6t2f2jQoQiy7tLRIHVheeI2CGKY9rRbfej9pT3V9WWVs2pQmDnxiKpsemudTaHuXGaUOwg03G5SfBtcYV3s9iIpEbz9Ge7q020l0vMwHE6aCdN64xmL7a0SZcVKSHKmuD300fAjaQY8esMJH5B53N6wEvEItiTcYSIaoR7RZqZ0Dm4kWCtY3uOmg4JVCRGp8E58JxQZDT1TzvFOPd9eSIFXEIexzqqbeKCSUssf9Mv14pVmDz9bWypf8keyr2WtYpuuog8JvxLBTyEPXh5KeC9yQgdYO598iAiQ1uppJ7ZkCDWhi2wtXVb68V0xrkFr4QHFNzXHpvKdmbAcAqCOA2FZOHOeiEnxhVkShxdm4jQrsZLyvZ162mNpvyKja1N57nkpWkrbZ2TZ2nUfW9h7gbLi2q9RPpNTMLfrLo8hW5WxkkqeEmHBWWeemwAx7222lR0Sp0lT0d1qlK9wsXpOZeM8Z0ceeDHTjxsnzTuXLRdq9fU7fwTtMactvtVxatlQu2cO5Q3087ERcvCufXrbxhheeE5YGGFdVtkQzxzai42n2peRsGrdYTLbkkatEvZbyBfkkkwZ5eKqmpxVwymE8IlTR1fRiXcERw8d3BCN9LGXS4GOgw30a02ZiyDl6mxeTvjq77NsJab5VuTHWhnN0MQqqqypMlkfY4T01Se8TksmfYtuuQL1oIneEZhOepIVVxmvyqs0Gf2YQ6Uxkri1WkyRUNmJ3KrKJqf3Tn7qxnOqPx5JVYDZqkqtorcOpOeeSyeEdUIq6GqaI7p1tmExPt0ihhejdTX6Hn9y2mpDDz9jl7kLtaf2oQyP4YUJleQ7td5EC0yrqbpeiXupe9Bcqa0nn4XYqGmee0BEsdOObHSSWCnvhc4Teadc2PbsN79ksKLaMrcze4lRSVWF55Ja1DjoOTX8bnLnL3d6IciOvaZb8w38Q8AKAGfLl1jEmBgjy8le3iZuW3316ufm1nnEegEEv08djVdvgD5eeiYMmj3ztQOz3xUT0l9IvZKTeizeN4Nrwt3N4Vn3M4dn3Mf4JRakWtXLbJRzSlISlztS1pKmnq2AvF67ZvJXLgMV6euXISaWhZkxelvvDKsGEfV6qCDZJfqFdPhxmzdWo03SZk8UWVtw2neV68MZg5Q086QOmLwcaJwf3Doei4godDLOdXeeu949iJFZbpXGEeYve6kvjgmI1nI3JPigenUEfeMscS2RE4OTbID0neOoW7N71JRCFG5H0W8KqEk8VJ6MxHi7BZ9TTIMsSWESafmT95bWGgl3mXG7MmsqYXmbfF5eJXFEwrywGfSlQceYlIKUtegEqCYEkpOzBOJlUeuX5qSEWWvfkqflzDrIfmvYLfle1dy7yfrgeyEELXHlLlX5cn5qWGI8CLrH6RVZlTdbmDjdu9o2p3bm4xuVrLdvJ6IV1V45drJp3J3Fq16G7479s0iOwE771L0mHG1Dv101Nf4Ndejs6BfueeRi8cguE984IPazagp8TWVW8Jn7WeKOTuBLvRiqIb46yKORuPWI0rHddUbYrP9YTEO6txKDAKV9noaPOeuZluLhLMyfseto3XGNr0WGNfxAtsdt5A7uiJGqd4fM79WetjDzd0yDk7WGk2Xo4U9K9HXr9jrvV10qTvW1o5FFeI9pXIjy9rwwR1fZKyae9rLUG8auca2MPsscE9KUKQ2t3gMqNhsmgMexuSmlzdOxubVSLsxJDntNvCeYyeiwNLkZ81YkKv52PCLbJNpYsO0a5s12RNE1bJ42cLoMzcJlTlnXt8efKUaIpeRqSwzE5yb6JTeeVD7xU9CZfyjYKl7z8vXuxvRk4I7oNIEjpweVLyJvYFFflGhmm0Zz19QaJuVDn9l7xhZ10q4ALPbXHhbCDsO1PzIGpT3JRw3AqTjRmSeRC7xMP9yGN8fpXJ2e0N2KSJzbSLKQuVBfT7Msd93DknbI84sBQlVriZul58jQ1f60dT6tIrzKvYemFvqOPzOv0mrTIP1NRS3ethjtQG15XrXSXjWxDclXVphaphrPqNLo6CiYZ63gz1AJsoBzL0OS46D6VKqMlfrjeFZqO4GahqyTG2zWPb5tnQPffujeEvt5sc7wjGqszqNUUfgexOHWwOX2Z7t6znuGRvRmtN32Lyk5g4cEyTXFH5VVXce79yboLDP3IXgl7ga04zQkn2KtBnbyNZbfbLccfe7ZcEowQjUQrwg7WdTSQfpgmrur3C5E0JztKkeGH3g1iEmb4aeITNPrlCfvII2YydR0TemI25ZSgaop2AdsxtmO6ghAqUkyiGSVpj8tlVscrGeHixgbeeu3wCOHkBKlGtaK5yPGVFfo5fEq4o0hfU8jLTRrlI0ZXulButCanejvTkApEYm2XMyxr3fUPLFJoOD3enytN2NY0TBLxwA5Q3hcXtbuDtT2cGVafGJfZz3AlkwkRIn5mV79e5EMUTbY2P31M8iNVT0abKLBEEIAS9SjrBjKjFS0Q8upZvmlYKUMYHeU4M1dZg7V5XH1rwzOV8ls5MOJowwPRtQ4hyaGxffRrUgamwiEpwmUty3dnTpfWH3wSy7fNu1PZloTKcdGLFEC8jlZrNf065UgPOxPkfIDGEt4AviJhExXSXweC8n2msLns7ulYQku4kIf2vFPseX5fEiJPp7EQ05aIx3IofQgFdpT9S3mxRGUeU067eXiXwQxKNJyNhYU9yYI1Yo9NBK5SMVjfmWCUEU4LSIfzKOsVkj3th30CiH30HerkMQhfFFGBe4fY8XyMKDUoOxm7hGJeIe4Jzeb0yGyr6iQ6CYY0rKDjbmbDLCLqVMFZLUtlgQX77fiY8Ni7OHZDt0v2kZTUCxfcelMbD1WaPyVAeAxqtmiDJFDxZfNafCmxNJYviTIurCRQ5XyuN4djf0zezKPLez2ZYTfJ13EkhSti1ZabjFo31yRHOmDXtOWEin0WNc5W36eOgfP4qwiKSSJk1FOJr5IxDOhYH34QtdviwxAqcfibi1KfIULhc7BcqulgKUEY6IemApeDJ4ZljBYeWIHC1ke5sguCu9N4UlCxV88Offpru24zoO2QnwjItSeisnwf6zDNvFyxtAOV8vZ3wHu4snE8Olwk4JjEPe6uHdKo6H4YinNgYn0aD5ek9PkpiDIpHf1vXvB0eoJjIQhAeQjhIhOdcYiyStmiOGknQ7C0pqKfm0C6lbDcnMJkKkjFZ7oPEO3D07wfxMlCOJsym2IeHQ4fbfvdMLs1cf7977UBWfkHO5AeyIHjVb4jzXt0Yy0WE8knptej8vQYQmcmbJC79DddvJq6J5eeluCkkUGwGW63UXaBMr7vGAnKlzPOeTYiqh59ZRoDgYHmVldyfBIVhWJpHYBYEePDMfBeZtEwJ5vfeswtdNk025d6HIVkXt0mzR1Big63gTgKmttLQ8TuMEtkfiPQfPRQP3toNqEjCqtEdbC3VOC5fV6hjKoRCnGgqO1oKCqs2dMIOMgHmingO2OQix2ORqAqWb4f8h3OhNRYNAvMfXrmyq3iTez0JfWc4D2jBWLZ4ABOPUS0eSeK2jCIKdTdIC1n8hurSswaWxYrqIeSDD1wM9DegeeeLzwI8PxaQXgMffxNKAA5gLl2SFgeEIIGeHi2efmhAkWZvx28YoOpeu0jkf9LfnFQglLzGgaSjNb43NYeqSpbrPOUfU6Bh4gsdzvVwBQse4ePloOMGTt02wvD4Rh1fEfLzbRCqSkRicwJ16rmlJ6Rzc1EItD80yIc2oePRleM8BXl0vIDmePf9enNT8IGkOnp3jzHUf10BPIh9skuAFLOZe6b0iMlm3CYifHRXDTw9MLlI2jmetZ4BOYuCPxgiEoKXFKC1WktRBxfEofKQeE0p8DBBamVWOdEXHb8XU4Mi2TghSXzxPMd43g4bAPtwLhL4PAR6f07uJorMnlBjW4cAOMF9hmegt6O6xwgeJD9EhCBXg59eJ9f8VLDVVOOLOceOfzWiGgWEYjts9bXIufGgN4f8pv6hSo3nof3B623jSTdftcOncEBIiG0WLoK3BCetsANJSB27eYaBvMaQk0y6IfTaTzXQnzjvL8f6ceLnh1Zi1pW7UmivpLli4QdQvSkcOuKAFIOZANItL0K8YZhic5f9qAgSYcgxQgf3PRP4U4cePOif7tJYx9Z6x0suj0AIayef8EcCc3qAbXcKsRA43P2ZjMHH1l3rvRXkOwKBQ6NRqtRrFRovO2JDkKPgnnUla0M6iPB4D7wi2MTuKBKcAjCCyQxlEEhnIbOClimxOwOO0Q6l4qSHRHFNsb8qEfRS7Tujx7sFyPHfjHQDUfRoCoJIdXcJI8256eY3eOaXkfXhSwwVXPI21hrYa2MLemaRhAJB7ueEO5PXHxDeQPIUZE5xMVqsubKFRXZfLf8nQB3fRsJzv9QVbAKasIUOpClmMUEfveRNB1ki8bXEOJQsssBn3BXFcP6FfFEUYMJloyIQOX5SwBuM8xB1eeTlEkdDUncVOSWkPrGvON2duXCenVujuaFJ8TAg8kj87PGAASzXvEzDRQpMQzdr2Lz2Hj5w698n5M6cIwIen6vLNtOPfqlmKnh5amyiyNAlW2wDSyalIQWw3mfcCerd4kJuogMSOoCTNi4fMheVYrKDNLAIfagz0xR0iNmN4TZ3teMeiL81BRufBgevDu9kcy3xzGgCY5nxRDePGUQV9SRyqNRBEr9bdMBhXQOEf34z00WnWg0ncrpGjfQffTzVeZxw4feeVp3DmBQP70e9wVFXNwza7fupfOPfg3Po3zdMBRgWIm15gvC86KTSqCdEV771WqbteiaeYnSgZtHjwmoJhr9Rq1xkNsYPgInpRvWrtVtX3xZokhKcF3DIzI9GkUOifYPdfUoe5eH4HZhgXlHfLtK11YuXRj213H3v3atgfbAf56f6QGmeT7keZE0x9PsGdfphbwKAEmg3DJN54m8fd3RAK3lbZCx6c3xbp72Ska50mfO5yjBqc0HwE3l2E7oVzLDJ685FghRo71nzKw75Az7NDYqFCzi9aRFGzh9ahFOzH9DBFSf9mlmNyt96aPNcrhkQj7azIhUE15bEP3clPFHqi0yyqNe3bcigc1IfRMhkoxPnczHhOPvFX4ekLPyfZeS4hegGIZW7JfNn1wEq2S5eEsQ9leebcCJO7ZOXl4udt0BtWfQGteeb1HdM6an1T8cKiIm5kJz8m735l5Tk5Yeu2YnzHVv4VnWLOnahEizrJLLbrUqucGG9M6beXbiekaNjiPIERaQgHSKekiMeVheFRQWDQNnkJvk27e3LIVfggv4bYGgZKdoHuzvoMsp5ciDjBltqQvKBWNLFawHpIvI8na0pqARCoJ4nEQrMqgZhNrfVfV6fEpmlJlRheFOAgJM9jiupNDG72V9w6X7JveN9138LTbFcVvjrL2nK3dLfNeLTqF3aH29zV7aNmvUBbCbFBPCrFRvs0UoVFTFYzll5skJ10UpTlWcd82f2A8SIUyGLxZZMoRf5du7cOaxgeNh8s1UmEbd6KvKf0NMIwUHfJ2AM23XdLyz2c8Zb78Uml1wQ78cWh1wBfE1PE11Cvbyr0efI4xjey,1,0,https://www.reddit.com/r/PolyTrack/comments/1rzseqx/new_track_i_made/,https://www.reddit.com/r/PolyTrack/comments/1rzseqx/new_track_i_made/,1774102131.0,2026-03-21 14:08:51,CarzyCat15,1rzseqx
EI,LululemonRestocks,Softstreme High-Rise Pant *Tall - Walnut Crunch - 12 is in stock at Lululemon for $128.00 (MSRP),"View current status at [https://www.trackalacker.com/products/showcase/lululemon-softstreme-high-rise-pant-tall...](https://www.trackalacker.com/products/showcase/lululemon-softstreme-high-rise-pant-tall?notification_id=xXWEssZhEVyWMvs%253D--5PpbSWvh5H3%252B5HKQ--eiG00%252BY1iw8JRlOM1NYycA%253D%253D&utm_campaign=stock-update&utm_medium=social&utm_source=reddit) (affiliate link)



As of 03/21/26 10:08 AM EDT",1,0,https://www.reddit.com/r/LululemonRestocks/comments/1rzselc/softstreme_highrise_pant_tall_walnut_crunch_12_is/,https://www.reddit.com/r/LululemonRestocks/comments/1rzselc/softstreme_highrise_pant_tall_walnut_crunch_12_is/,1774102119.0,2026-03-21 14:08:39,TrackaLackerBot,1rzselc
EI,mildlyinfuriating,Still waiting...,"I asked what I said, no response. ",5,5,https://i.redd.it/7smmqd6doeqg1.jpeg,https://www.reddit.com/r/mildlyinfuriating/comments/1rzse6a/still_waiting/,1774102092.0,2026-03-21 14:08:12,Butcher_Ben,1rzse6a
EI,snappisensuroimat0n,Siis tää lapsi syö vielä tuttia ja juo energiajuomia? Muutenki tän mamman vastaukset on turhan aggressiivisia ko miettii et jengi ihmettelee kyl ihan aiheesta. Silti tuol kommenteis ompi ihmisiä puolustelee et hekin juonu nuorena energiajuomia ja ovat elossa🫡,,22,18,https://www.reddit.com/gallery/1rzsdc1,https://www.reddit.com/r/snappisensuroimat0n/comments/1rzsdc1/siis_tää_lapsi_syö_vielä_tuttia_ja_juo/,1774102032.0,2026-03-21 14:07:12,__yourlocalhater__,1rzsdc1
EI,Fahrrad,Gepolsterte Fahrradhosen statt gepolsterte Sättel,"ganz ehrlich ich habe keine Ahnung, was ist der Vorteil? ein gepolsterter Sattel hätte doch den Vorteil, dass ich beim Eis essen nicht aussehe, als hätte ich mich eingeschissen.... ",0,19,https://www.reddit.com/r/Fahrrad/comments/1rzscr9/gepolsterte_fahrradhosen_statt_gepolsterte_sättel/,https://www.reddit.com/r/Fahrrad/comments/1rzscr9/gepolsterte_fahrradhosen_statt_gepolsterte_sättel/,1774101991.0,2026-03-21 14:06:31,DetailNew9111,1rzscr9
EI,kurosanji,Hinokuma Ran/日ノ隈らん joins Noname Production/のなめぷろだくしょん,"**Source:** [https://x.com/Noname\_Pr/status/2035285207126102274](https://x.com/Noname_Pr/status/2035285207126102274)

**Ran's X/Twitter Post:** [https://x.com/Ran\_Hinokuma/status/2035290787727257805](https://x.com/Ran_Hinokuma/status/2035290787727257805)

**Stream of the Announcement:** [https://www.youtube.com/watch?v=EuwrMzEiF80](https://www.youtube.com/watch?v=EuwrMzEiF80)

**Note:** Hinokuma Ran was a former member of Animare (now merged with Nanashinku/774 inc) and went independent back in October 28, 2024.",16,0,https://v.redd.it/oi36qcbyneqg1,https://www.reddit.com/r/kurosanji/comments/1rzscah/hinokuma_ran日ノ隈らん_joins_noname/,1774101961.0,2026-03-21 14:06:01,Benigmatica,1rzscah
EI,deadbydaylight,Can anyone explain what the actual fuck happened here?,"Context to this chase: I managed to down the Dwight and hook him, after he got unhooked he was just standing there, stuck - Unable to be hit by M1 or the ability. I just left him there, maybe a bug and he's just gone-

I found Lara and started chasing her, which brought me to the stuck Dwight and Lara also stuck herself in there. I managed to hit her somehow but couldn't carry her instantly. The same scourge hook was also unusable since Dwight was bodyblocking it so i ran to the second closest hook in sight. Half-way there you notice that I have dropped her without the animation but i didn't notice that in-game so i just failed to hook her. I went to the gen trying to catch another played off-guard but at this point I couldn't do anything

  
Translations at 0:55  
""Ma ei saa mitte midagi teha"" - I can't do anything  
""Kas ta ei näe mind?"" - Does she not see me?  
""Miks ma midagi teha ei saa?"" - Why can't I do anything?

I then backtrack the path I took with the Lara Croft and saw her just floating there in the downed state.

Something not visible on this video but also happened was that they tried to pallet stun me, maybe it'd fix it - Nothing.  
Flashes? Nothing.

Lara proceeded to quit the game and they just started fixing the gens after that to get a quick ez win.

I will add another video if the reddit allows me to show the ending-",1,3,https://v.redd.it/0a3ki5lpkeqg1,https://www.reddit.com/r/deadbydaylight/comments/1rzs66p/can_anyone_explain_what_the_actual_fuck_happened/,1774101533.0,2026-03-21 13:58:53,Plats_Reddit,1rzs66p
EI,tuffmangophonk,YES WE ARE ALL READING THIS BOOK,,15,3,https://i.redd.it/kyljbumvkeqg1.jpeg,https://www.reddit.com/r/tuffmangophonk/comments/1rzry8v/yes_we_are_all_reading_this_book/,1774100945.0,2026-03-21 13:49:05,savegandhi,1rzry8v
EI,taverna_aventurilor,First Among Thieves: A Review of Two Sides to the Coin,"Ei bine, în sfârșit am reușit să joc Two Sides to the Coin, ultimul din trilogia Osprey lansată anul trecut, și sincer îmi pare rău că nu am făcut-o mai devreme. Jocul acesta nu este doar absolut fantastic și distractiv, ci este unul dintre cele mai inovatoare TTRPG-uri pe care am avut plăcerea să le joc de foarte mult timp încoace.



Premisa este înșelător de simplă: grupul vostru este adunat pentru o misiune comună pe care toată lumea trebuie să o îndeplinească pentru a câștiga. Dar fiecare dintre voi poartă și un Motiv Ascuns, un obiectiv personal pe care vrei să îl atingi alături de, sau uneori pe seama, coechipierilor tăi. Ceea ce face totul să funcționeze este că stratul social se desfășoară în timp real, fără zaruri, fără aruncări, doar tu încercând să îi manipulezi pe cei din fața ta fără să îți dea de urmă. Este parte joc de spargere, parte deducție socială și complet diferit de orice altceva există pe piață în momentul de față.



Am organizat o sesiune completă de playtest pentru Gazette și masa a adorat experiența. Motivele Secundare singure au stârnit hohote de râs, iar paranoia care se construiește în jurul mecanicii de Demascare este ceva ce trebuie să trăiești cu adevărat pentru a o aprecia.



Recenzia completă este pe The RPG Gazette și intră în detaliu despre mecanici, prezentare, ce funcționează strălucit și câteva lucruri care ar putea fi îmbunătățite. Pe scurt: costă sub douăzeci de euro, este perfect pentru un one-shot și este unul dintre acele jocuri rare pe care le voi recomanda oamenilor mult timp de acum înainte.



Mulțumim Osprey pentru review-copy, și felicitări sincere adresate Rebeccăi Blake primul ei TTRPG publicat. Este un debut remarcabil și sper cu adevărat că nu va fi și ultimul.",1,0,https://therpggazette.wordpress.com/2026/03/20/first-among-thieves-a-review-of-two-sides-to-the-coin/,https://www.reddit.com/r/taverna_aventurilor/comments/1rzrxk1/first_among_thieves_a_review_of_two_sides_to_the/,1774100892.0,2026-03-21 13:48:12,alexserban02,1rzrxk1
EI,Gamethology,Copia fisica di Pragmata PS5 in Giappone 🇯🇵,,16,5,https://www.reddit.com/gallery/1rzrwxq,https://www.reddit.com/r/Gamethology/comments/1rzrwxq/copia_fisica_di_pragmata_ps5_in_giappone/,1774100846.0,2026-03-21 13:47:26,Upbeat-Woodpecker877,1rzrwxq
EI,Jordanians,حدا جرب رشة؟,الي بعرفهوش هاظ منتج اردني بهار المفروض بتقدر تحطو على اي اشي و يطلع زاكي،جبت منو مع العرض بس مش كثير زاكي، شو رايكو؟,1,6,https://i.redd.it/vi0tae3dkeqg1.jpeg,https://www.reddit.com/r/Jordanians/comments/1rzrvkm/حدا_جرب_رشة/,1774100745.0,2026-03-21 13:45:45,Confused_SeaOtter,1rzrvkm
EI,IceBergBrasil,O Iceberg COMPLETO da Primeira Guerra Mundial.,"Bem depois de menos de uma semana eu venho lhes trazer a parte final e completa do iceberg da Grande Guerra, foi um dos icebergs que eu mais gostei de fazer e que espero igualmente que vocês gostem de igual forma, o próximo será da Segunda Guerra Mundial, fiquem no aguardo 👀👀👀👀👀👀",4,1,https://i.redd.it/bxtek9vvjeqg1.png,https://www.reddit.com/r/IceBergBrasil/comments/1rzrtfe/o_iceberg_completo_da_primeira_guerra_mundial/,1774100585.0,2026-03-21 13:43:05,ExceptionalBadger,1rzrtfe
EI,vedic_astro_questions,"Do I have a good future ahead in terms of career , money and relationships …. I often get friends who are dual faced",,1,3,https://i.redd.it/5o1hl8rmjeqg1.jpeg,https://www.reddit.com/r/vedic_astro_questions/comments/1rzrs8l/do_i_have_a_good_future_ahead_in_terms_of_career/,1774100501.0,2026-03-21 13:41:41,straightforwardsmart,1rzrs8l
EI,google,What happened to my Google assistant? (Samsung Galaxy S25 Ultra),I asked Google assistant to delete all of my 6am alarms and this is what I got in response,5,1,https://i.redd.it/zo6afxyqieqg1.jpeg,https://www.reddit.com/r/google/comments/1rzroab/what_happened_to_my_google_assistant_samsung/,1774100201.0,2026-03-21 13:36:41,Hexfire0708,1rzroab
EI,kolkata,Can Bangali Baddies rizz? 😔,Ar tara ei sub e bash kore? ,0,36,https://www.reddit.com/r/kolkata/comments/1rzrnwx/can_bangali_baddies_rizz/,https://www.reddit.com/r/kolkata/comments/1rzrnwx/can_bangali_baddies_rizz/,1774100173.0,2026-03-21 13:36:13,deytioo,1rzrnwx
EI,IntreabaUnPsiholog,Ma simt ca un adult esuat,"Am implinit de curand 23 de ani, cu o situatie de final de facultate incerta. (e o poveste lunga)

In ultimii ani, de cand am intrat la facultate (i.e : 2022), situatia mea deja nasoala din liceu parca a devenit si mai rea. Am trecut prin ce se numeste *""gifted child burnout/syndrome""*. Practic am avut rezultate pana intr-un anumit punct in parcursul educational, insa am inceput sa nu am din momentul in care am inceput liceul. La facultate a fost si mai rau. Toti sunt independenti, au voluntariate/internship-uri/premii la concursuri, au multe de trecut in CV, si au skilluri. Intre timp, eu stau cu parintii, si sunt comparata non-stop de catre mama cu fosti colegi de generala/liceu, actuali colegi, copiii ale cunostintelor ei de la job, chiar si din familie. (Imi da incontinuu shaming ca am fost restantiera, de multiple ori, si ca am medii mici)

Nici cu relatiile interpersonale nu stau bine. Pot sa spun ca ma inteleg cu lumea in general, dar nu ca sunt prietenii mei in adevaratul sens al cuvantului. La capitolul dating stau si mai prost, nu m-am indragostit decat de o parte de prietenii pe care i-am avut online, spunandu-mi tot timpul ca vor irl.

Chiar si pentru cele mai mici chestii, neimportante pentru altii, eu ma macin in interior, indiferent daca se justifica sau nu.

Stiu ca viata e mai mult decat ce se mentioneaza, si ca meritele nu iti dau valoare, dar ma simt in urma. Nu am o mentalitate ca a celorlalti, si datorita acestui fapt, ma aflu in situatia curenta.

As avea nevoie de un sfat.",4,0,https://www.reddit.com/r/IntreabaUnPsiholog/comments/1rzrd8z/ma_simt_ca_un_adult_esuat/,https://www.reddit.com/r/IntreabaUnPsiholog/comments/1rzrd8z/ma_simt_ca_un_adult_esuat/,1774099370.0,2026-03-21 13:22:50,butterfly_spirit2007,1rzrd8z
EI,Wistoria,Profiles of Lefiya and Filvis Wistoria,,20,1,https://i.redd.it/8l0d4jp9geqg1.jpeg,https://www.reddit.com/r/Wistoria/comments/1rzrd8j/profiles_of_lefiya_and_filvis_wistoria/,1774099369.0,2026-03-21 13:22:49,Important-Disk5972,1rzrd8j
EI,Affordablewatches,"Not Just a Watch, It's a Statement: 216 Opportunities to Own a Vintage Orient Classic.","The Collector’s Technical Vault (focuses on specific features)



The Orient Professional Archive: A 216-Piece Vintage Mechanical Collection



Available for acquisition is a singular archive of 216 vintage Orient mechanical watches, documenting the peak of the brand’s innovative design period. This collection is specifically curated for collectors who appreciate Orient’s unique contribution to Japanese watchmaking history.



Design and Engineering Highlights:

The collection showcases the evolution of Orient’s most iconic features. This includes the high-impact oversized cases and the artistic mastery of their dial production. Collectors will find a wide array of multi-year calendars, King Divers, and the celebrated Jaguar Focus series. The movements are all original in-house Orient automatic calibers, known globally for their longevity, serviceability, and mechanical integrity.



Condition and Authenticity Standards:

Every watch in this 216-piece archive is verified as 100% authentic vintage Orient. Each piece has undergone a professional inspection to ensure it is in good working condition. Maintenance and servicing have been performed using authentic Japanese parts. There are no redials or aftermarket copies within this collection.



Acquisition Protocol:

Please review the numbered catalog (1–216) and send a Private Message (PM) with the numbers of the timepieces you wish to discuss. We will provide a full dossier for each piece, featuring high-resolution macro photos and individual pricing. We are open to discussions regarding group or bulk acquisitions.",0,0,https://www.reddit.com/gallery/1rzrd0q,https://www.reddit.com/r/Affordablewatches/comments/1rzrd0q/not_just_a_watch_its_a_statement_216/,1774099352.0,2026-03-21 13:22:32,ShoddyFox6291,1rzrd0q
EI,Imobiliare,Căsătorie cu regimul separației de bunuri: sunt necesare documente de la soț pentru vânzare?,"Printre actele necesare la vânzare se află și certificat fiscal pe numele proprietarului și al soțului/soției. Locuința a fost cumpărată în timpul căsătoriei, în nume propriu. Nu este desemnată ca locuință conjugală, soții având alt domiciliu. 

E necesar acest certificat dacă ei au convenție de separație a bunurilor? Soțul trebuie implicat în vreun fel în tranzacție?",2,1,https://www.reddit.com/r/Imobiliare/comments/1rzr9rj/căsătorie_cu_regimul_separației_de_bunuri_sunt/,https://www.reddit.com/r/Imobiliare/comments/1rzr9rj/căsătorie_cu_regimul_separației_de_bunuri_sunt/,1774099108.0,2026-03-21 13:18:28,Helpful_Hour1984,1rzr9rj
EI,Foxbody,Viper remote manual,"Hello all, recently purchased a 89’ GT from the original owner (90k miles!) along with its original keys and remote lock/unlock fob. I would like to get the locks working again. However the manual isn’t readable. Consulting the Reddit masterminds to point me into the right direction to a PDF or similar. ",15,5,https://www.reddit.com/gallery/1rzr628,https://www.reddit.com/r/Foxbody/comments/1rzr628/viper_remote_manual/,1774098823.0,2026-03-21 13:13:43,Frequent-Bat2295,1rzr628
EI,antimemeBR,Namorada,,62,14,https://www.reddit.com/gallery/1rzr4tr,https://www.reddit.com/r/antimemeBR/comments/1rzr4tr/namorada/,1774098726.0,2026-03-21 13:12:06,Popular-Foundation-2,1rzr4tr
EI,Autism_Parenting,4 year old misdiagnosed?,"This will be long, I apologize in advance. My son is 4. 

He saw a developmental pediatrician when he was 2 ish for an autism assessment but the doctor said my son just had a speech delay and some sensory issues. Our insurance only covered 15% of the bill and we were left with a 3k bill. This was after driving 3 hours and waiting 5 months for the appointment. My husband refuses to do it again, we simply cannot afford it. 

Now, about our son; he didn’t talk until he was 2.5 and it is mainly echolia. He also uses phrases from shows/movies. He will repeat Ms. Rachel verbatim with her tone and everything randomly throughout the day even if he hasn’t seen her show in weeks. He cannot answer yes or no questions. If you give him two options, he’ll always choose the last thing you said. He talks in his own “language”. He will gab all the time but only 10-20% is actual words. The rest is random gibberish. He was in EI until 3 and now private speech therapy. 

Potty training has been near impossible. He cannot/will not tell me when he has to go. For weeks I was bringing him to the toilet every few hours. Giving stickers when he went, etc. he loved it but still never grasped it on his own. 

He has big meltdowns over slight changes in his routine. He has a little brother who seems to be neurotypical and he ignored brother’s presence for the first year. He only recently started acknowledging and interacting with him. 

He does some stimming and benefits greatly from DPT especially at night to get ready for bed. I’ll give him his “squeezes” and he seems to regulate and wind down better. That and other reasons are what prompted the pediatrician to say he has sensory seeking behaviors. 

I am well aware that a diagnosis isn’t the end all/be all. But we have an amazing preschool in my town for kids with autism and I think he would benefit greatly from their program. But he wasn’t diagnosed with autism so I believe he will need another appointment before he can be accepted. I am just wondering if it is worth it. I was told before his first appointment that a diagnosis opens a lot of doors for therapy and other programs for help. Do I push my husband on this matter? Or should I wait for his preschool placement evaluation and see what they say? 

Thank you to anyone who has read this far. I’m not fishing for a diagnosis here, just trying to see what steps we should take and if you think it is worth going into debt again for 😓 ",3,3,https://www.reddit.com/r/Autism_Parenting/comments/1rzr38z/4_year_old_misdiagnosed/,https://www.reddit.com/r/Autism_Parenting/comments/1rzr38z/4_year_old_misdiagnosed/,1774098606.0,2026-03-21 13:10:06,Most_Abrocoma9320,1rzr38z
EI,vlandiya,ülkedeki panelci veletler hakkına,ülkede ne zaman katledilen bir insan olsa böyle mallar çıkıp insanın ailesini tehdit edip rahatsızlık veriyor ve hiçbir sikim olmuyor 15 16 yaşlarında oldukları için. bu cesareti nereden buluyorlar anlamış değilim devlet ne yapıyor bu sırada acaba çok merak ediyorum git gide iğrenç bir hal almaya başladı ülke ,57,28,https://i.redd.it/o8v5308qdeqg1.jpeg,https://www.reddit.com/r/vlandiya/comments/1rzr212/ülkedeki_panelci_veletler_hakkına/,1774098514.0,2026-03-21 13:08:34,Accomplished-Bag1622,1rzr212
EI,caso_isolado,Estado indenizará homem que levou soco de PM em abordagem no Agreste; ação foi gravada,"O 3º Juizado Especial da Fazenda Pública da Capital, do Tribunal de Justiça de Pernambuco (TJPE), condenou o Estado de Pernambuco a indenizar um homem que levou um soco no tórax durante abordagem da Polícia Militar (PM) em Limoeiro, no Agreste. A abordagem foi filmada por câmera de segurança.


https://www.diariodepernambuco.com.br/vida-urbana/2026/03/11710395-estado-indenizara-homem-que-levou-soco-de-pm-em-abordagem-no-agreste-acao-foi-gravada.html

https://www.instagram.com/reel/DWHrpVjiXiY/?igsh=MWdwdmtidXRpaGxmdg==",30,5,https://v.redd.it/ycta05kndeqg1,https://www.reddit.com/r/caso_isolado/comments/1rzr1s7/estado_indenizará_homem_que_levou_soco_de_pm_em/,1774098493.0,2026-03-21 13:08:13,RakonHenri,1rzr1s7
EI,Deltarune,TENTON PRIME (wear route),,2,0,https://i.redd.it/xplp9dpmdeqg1.png,https://www.reddit.com/r/Deltarune/comments/1rzr1mq/tenton_prime_wear_route/,1774098481.0,2026-03-21 13:08:01,Previous-Lobster-950,1rzr1mq
EI,CosplayHelp,Help with paint types,"Hi everyone! I'm working with a friend on Zanka's staff from Gachiakuta. We used acrylic blue paint on pvc, thinking it would hold up well. As you can see from the pics, it's not: it's getting off quite easily, sometimes even with light touch. We thought about fixing the white spots and applying a transparent topcoat, but weren't sure of what kind of topcoat would both be durable and not interfere with the underlying paint. Any suggestions?",3,5,https://www.reddit.com/gallery/1rzr0dv,https://www.reddit.com/r/CosplayHelp/comments/1rzr0dv/help_with_paint_types/,1774098389.0,2026-03-21 13:06:29,fartew,1rzr0dv
