bank,subreddit,title,selftext,score,num_comments,url,permalink,created_utc,created_date,author,id
EI,snappijuorutofftopic,Ero,"Hei pahoittelen ekana pilkuista ja pisteitä, jos ei ole kaikkia. Kirjotan tätä aika rikkinäisenä ja itkuisena, mutta erosin just joku 2v suhteesta enkä tiedä mitä teen. Ahdistaa kokoajan ja tuntuu, että ero oli hänelle helppoa ja mukavaa, kun minä taas olen todella tunteikas ihminen koen kaikki tunteet todella voimakkaasti. Olen yrittänyt olla pitämättä yhteyttä häneen, että näkisin jos hän välittää ja kirjoittaa minulle. Tuntuu ihan hirveältä nukkua yksin ja yöt kaikista pahimmat. Ollaan molemmat vielä tosi nuoria että kun puhuin vanhemmilleni tästä he vaan sanoivat että ollaan nuoria blääblää. Olen siis 20v mutta oon oikeasti tosi rikki ja tarvin kaikki maholliset neuvot tähän. Miten te olette selvinny pahimmasta ahistuksesta ja erosta? ",4,5,https://www.reddit.com/r/snappijuorutofftopic/comments/1rzq873/ero/,https://www.reddit.com/r/snappijuorutofftopic/comments/1rzq873/ero/,1774096141.0,2026-03-21 12:29:01,Background-Count9409,1rzq873
EI,andoescuchando,Amaneciendola,,1,0,https://i.redd.it/b875kkq76eqg1.png,https://www.reddit.com/r/andoescuchando/comments/1rzq6ek/amaneciendola/,1774095987.0,2026-03-21 12:26:27,nacozaurio,1rzq6ek
EI,JujutsuInfinite,"I was wondering if how worth is this ""Ring Of Frost""","after showing off or trying to put a booth attempt trading this ring many people want it?  
i just want to ask how worth is this ring of frost?

https://preview.redd.it/1z3307db5eqg1.png?width=1174&format=png&auto=webp&s=61bcb1357e630e4472670fcb213dc63a64b5e0b8

",2,3,https://www.reddit.com/r/JujutsuInfinite/comments/1rzq33u/i_was_wondering_if_how_worth_is_this_ring_of_frost/,https://www.reddit.com/r/JujutsuInfinite/comments/1rzq33u/i_was_wondering_if_how_worth_is_this_ring_of_frost/,1774095698.0,2026-03-21 12:21:38,ItsJayTheReddit,1rzq33u
EI,HotWheeelsDelhi,WTS - 999 set of 6 | 2 Best sets ready,,1,0,https://www.reddit.com/gallery/1rzq1oc,https://www.reddit.com/r/HotWheeelsDelhi/comments/1rzq1oc/wts_999_set_of_6_2_best_sets_ready/,1774095574.0,2026-03-21 12:19:34,DelhiBro,1rzq1oc
EI,camouflage,Genuine ERDL?,"Purchased this poncho liner very cheap today as it was sewn closed into a sleeping bag for fishing,  I have tried to find similar labels but the labels vary so much I am not sure. DSA claims 1967 so prime vietnam era of it's real. I plan on unpicking the modification to make it back into a liner",4,2,https://www.reddit.com/gallery/1rzq0uf,https://www.reddit.com/r/camouflage/comments/1rzq0uf/genuine_erdl/,1774095503.0,2026-03-21 12:18:23,Complete-Forever-785,1rzq0uf
EI,Polska_wpz,Teraz może być szczęśliwy z kolegą z pracy,,526,25,https://v.redd.it/s8ypyvjn4eqg1,https://www.reddit.com/r/Polska_wpz/comments/1rzq0kt/teraz_może_być_szczęśliwy_z_kolegą_z_pracy/,1774095478.0,2026-03-21 12:17:58,nocny_pingwin,1rzq0kt
EI,Eesti,SÕJARAPORT | Rainer Saks: senistes rünnakutes on hävinud Iraani tootmisvõimsused. Uusi rakette nad ise juurde toota enam ei suuda,,0,24,https://arvamus.delfi.ee/artikkel/120443798/sojaraport-rainer-saks-senistes-runnakutes-on-havinenud-iraani-tootmisvoimsused-uusi-rakette-nad-ise-juurde-toota-enam-ei-suuda,https://www.reddit.com/r/Eesti/comments/1rzpz6z/sõjaraport_rainer_saks_senistes_rünnakutes_on/,1774095361.0,2026-03-21 12:16:01,NeverClarke,1rzpz6z
EI,EasternOccult,求大师指教谢谢,最近变革中,2,0,https://i.redd.it/zizoe4xz2eqg1.jpeg,https://www.reddit.com/r/EasternOccult/comments/1rzpu2z/求大师指教谢谢/,1774094906.0,2026-03-21 12:08:26,FrostyValuable766,1rzpu2z
EI,Blacksmith,Is this anvil worth it? (I am a beginner),"I recently came across an anvil at a local market and I’m trying to figure out if it’s worth the asking price. I’m based in Europe, so US pricing and availability don’t really apply here.

I’m still a beginner in blacksmithing, so I don’t have much hands-on experience evaluating anvils yet. The one I saw looked to be in decent shape overall, and it did pass the bounce test (rebound seemed pretty lively).

What would you consider a fair price range for a used anvil in decent condition here in Europe? And are there any red flags I should look out for before buying?

Thanks in advance!",11,18,https://www.reddit.com/gallery/1rzppxu,https://www.reddit.com/r/Blacksmith/comments/1rzppxu/is_this_anvil_worth_it_i_am_a_beginner/,1774094539.0,2026-03-21 12:02:19,HapciuTheMan,1rzppxu
EI,de_IAmA,"Ich bin Tierfilmerin. Meine Dokus sollen helfen, die Meere und ihre Bewohner zu schützen. AMA!","Hi Reddit,

[ich bin Unterwasserkamerafrau und Tierfilmerin Christina Karliczek Skoglund](https://imgur.com/tiO57EQ), und ich tauche beruflich und in meiner Freizeit so oft ich kann.

Vor allem fasziniert es mich, in die verborgene Welt der Tiere einzutauchen und ihre spannenden Lebensweisen zu filmen. Tierverhalten zu dokumentieren, dass vorher noch nie filmisch eingefangen wurde.

Ich fühle mich unter Wasser zu Hause, mache auch Tauchgänge unter dem Eis oder in Höhlen. Ich drehe international für Dokumentationen, Spielfilme oder Stunts.

Am liebsten berichte gerne ich über meine außergewöhnlichen Begegnungen mit den Meeresbewohnern in den Ozeanen dieser Welt.

Für Tierfilme drehe ich seit etwa 15 Jahren überall auf unserem Planeten, auf der ganzen Welt, oft mit hochspezialisierter Kameraausrüstung und Drohnen. Ich habe das größte Tier unseres Planeten sehen dürfen, und bin aber auch sehr nerdy über nach den ganz kleinen Lebewesen wie Plankton.

Vielleicht habt ihr meine Filme mit Eishaien vor Grönland gesehen? Super selten gefilmter Hai, der uralt werden kann. Ich war aber auch an Korallenriffs und im Kongo-Fluss unter Wasser und habe wilde Bonobos und Gorillas in sehr abgelegenen Regenwäldern gefilmt. Spinnen im Schlafsack oder Campen auf dem arktischen Eis sind nichts Ungewöhnliches für mich. Es ist ein langer und steiniger Weg, um an die entlegensten Orte unserer Welt zu gelangen, aber für mich ist es der Kampf wert, um dort filmen zu können.

Ich bin davon überzeugt, dass es das wert ist, Bilder zu schaffen, die einfach so wenige Menschen überhaupt zu sehen bekommen. Ich sehe selbst viele Veränderungen in der Natur, seitdem ich zum ersten Mal getaucht bin. In vielen Teilen der Welt sind die Lebensräume der Ozeane schwer geschädigt. Gerade deshalb ist es entscheidend, Geschichten zu teilen, die belegen, wie ein achtsamerer Umgang mit der Natur nachweislich allen Seiten zugutekommt.

Natur inspiriert mich für mein eigenes Leben, ausdauernd zu sein. Es gibt mir Kraft um die Vielfalt in der Tierwelt zu wissen. Zum Beispiel als ich mein erstes Kind bekommen habe. Da hörte ich: “Oh, da musst du jetzt wohl deinen Beruf ändern und kannst nicht so eine Rabenmutter sein”. Nein, das musste ich nicht.

Als meine Tochter 3 Monate alt war, kam sie für fast ein Jahr mit nach Neuseeland, wo ich für eine BBC/NDR Serie gedreht habe. Damit haben wir dann sogar mehrere Preise gewonnen!

Und jetzt gerade streamt die ARD Mediathek Unter Buckelwalen – auf den Spuren ihrer Sprache. Es war super spannend, so nah mit Walen filmen zu können, aber auch, sich ganz in das Wissen über Buckelwale vertiefen zu können. Können wir bald mit Tieren kommunizieren, auch mithilfe von KI? Und was würden sie uns sagen? Und wir sie fragen? Ich hatte wirklich unglaubliche Begegnungen mit den Walen!

Am Montag findet das AMA von 12 bis 13 Uhr statt. Wenn ihr vorab meinen neuen Film sehen möchtet: Er heisst ""Unter Buckelwalen – auf den Spuren ihrer Sprache"" und ist in der Mediathek zu finden. [https://1.ard.de/unter-buckelwalen?ard=re](https://1.ard.de/unter-buckelwalen?ard=re) ",14,4,https://www.reddit.com/r/de_IAmA/comments/1rzppw3/ich_bin_tierfilmerin_meine_dokus_sollen_helfen/,https://www.reddit.com/r/de_IAmA/comments/1rzppw3/ich_bin_tierfilmerin_meine_dokus_sollen_helfen/,1774094536.0,2026-03-21 12:02:16,ARD-Mediathek,1rzppw3
EI,BaseballGloves,Mizuno MZP 10 (Revived),"Pro issued to Wright. 

Supposedly from 2007. 

Made in China, still an OK glove. 

Cleaned and conditioned, a bit soft. ",3,0,https://www.reddit.com/gallery/1rzpnie,https://www.reddit.com/r/BaseballGloves/comments/1rzpnie/mizuno_mzp_10_revived/,1774094347.0,2026-03-21 11:59:07,Outrageous-Long-4728,1rzpnie
EI,NianticWayfarer,Where’s the upgrade button?,"It’s the only one I have in queue, and I don’t have automatic upgrades turned on. I’ve upgraded one previously but on this one there isn’t a button to upgrade at all?",4,5,https://www.reddit.com/gallery/1rzpmpn,https://www.reddit.com/r/NianticWayfarer/comments/1rzpmpn/wheres_the_upgrade_button/,1774094277.0,2026-03-21 11:57:57,LinneasLanding,1rzpmpn
EI,notinteresting,"I did what u/ehitch86 did, but better [original post: https://www.reddit.com/r/notinteresting/s/2FdhqIdrAq]",,0,4,https://i.redd.it/srg9f8l21eqg1.jpeg,https://www.reddit.com/r/notinteresting/comments/1rzpmhw/i_did_what_uehitch86_did_but_better_original_post/,1774094257.0,2026-03-21 11:57:37,silli_guy130,1rzpmhw
EI,programare,am nevoie de ajutor,"Buna ziua, comunitate.

Scriu acest post, in speranta ca voi gasi un ajutor pentru construirea unui website de prezentare. De meserie sunt inginer de instalatii electrice si de curand am decis sa-mi deschid o firma de profil pentru a merge pe drumul meu, drum care sa nu depinda de cheful unui angajator de a promova sau nu competenta, instruirea si bunele practici. Sunt trecut de 44 de ani, sunt om serios, dedicat meseriei mele. Din pacate la aceasta varsta angajatorii prefera sangele tanar pe care il pot forma cum vor ei, il pot plati cum vor ei si in general e ""cum vrea angajatorul"". La varsta pe care o am nu mai vreau asta si consider ca experienta de peste 15 ani pe santier, ma va ajuta prin munca sa obtin ceva pe cont propriu. Fiind la inceput nu prea am lucrari si nici bani, pentru ca asa e la inceput. Nimeni nu incurajeaza pe nimeni sa inceapa ceva pe baze stabile si daca e sa dam in cap cuiva - o vom face. Duc un trai de pe o luna pe alta, intrucat contextul economic este extrem de prost (2 razboaie, pret crescut petrol, investitii putine, guvern fanatastic). Sa nu va astepatti ca am un sac de bani pe care sa il pun la dispozitie in cautarea izbavitorului site de prezentare. Eu am ceva, dar e foarte prost (facut cu Claude si Chat gpt). Am facut la un moment dat in aceasta viata si html css si putina javascript, sa spunem ca mai vad si eu secventele de cod. Ii rog pe cei ce vor sa ajute un om care munceste pe branci pentru fiecare ban sa ma contacteze si sa vedem daca putem face ceva impreuna. Multumesc mult. ",2,13,https://www.reddit.com/r/programare/comments/1rzpmb0/am_nevoie_de_ajutor/,https://www.reddit.com/r/programare/comments/1rzpmb0/am_nevoie_de_ajutor/,1774094239.0,2026-03-21 11:57:19,CelestialPuls3,1rzpmb0
EI,DeathBattleMatchups,Caine MU Tier List,,20,6,https://i.redd.it/7be0vpi60eqg1.png,https://www.reddit.com/r/DeathBattleMatchups/comments/1rzpj72/caine_mu_tier_list/,1774093959.0,2026-03-21 11:52:39,Saltheshark77,1rzpj72
EI,pokemon,Halp,just got legends za today it didnt come witha free nintendo online code is this switch 2 version only or smth? cuz i cant get the new megas from online battles then,0,2,https://i.redd.it/j2253317zdqg1.jpeg,https://www.reddit.com/r/pokemon/comments/1rzpfpr/halp/,1774093629.0,2026-03-21 11:47:09,socksiscoolfor1,1rzpfpr
EI,roFrugal,cod reducere altex careva?,"salut frugalilor, are careva un voucher de la altex de 150 lei? cel pentru reciclat electrocasnice, mie mi-a expirat desi nu l-am folosit, m-am dus la ei sa vad daca fac o exceptie.. mi-au dat cu jet :<

raman dator, pls :<",0,0,https://www.reddit.com/r/roFrugal/comments/1rzpfpa/cod_reducere_altex_careva/,https://www.reddit.com/r/roFrugal/comments/1rzpfpa/cod_reducere_altex_careva/,1774093628.0,2026-03-21 11:47:08,Natural_Ad_9570,1rzpfpa
EI,Topster,Guess my age and gender from my top albums/any recs?,"https://preview.redd.it/66dr8wroxdqg1.png?width=1990&format=png&auto=webp&s=23e9cee9d6a85804ced5acd9b4840fe2ddebc22b

",1,1,https://www.reddit.com/r/Topster/comments/1rzpagk/guess_my_age_and_gender_from_my_top_albumsany_recs/,https://www.reddit.com/r/Topster/comments/1rzpagk/guess_my_age_and_gender_from_my_top_albumsany_recs/,1774093127.0,2026-03-21 11:38:47,Educational_Use_5111,1rzpagk
EI,snappijuorut,Iitu/iida,"Siis mitä mieltä ootte tästä iidasta/iitusta??

Mun mielestä ihan järjetöntä tolkkua se että opiskelee lähihoitajaks mutta ei osaa pitää itsestään huolta? Ei osaa tehä ruokaa, kämppä koko ajan kun kaatopaikka, kaikki lävistykset tehny itse kotona, lopetti koulussa käymisen heti kun pääsi muuttamaan yksin ja on sitä hakkaamis taustaa kun potki sitä Ellaa päähän myös jtn huumetaustaa.

Tän iitun videotkin rasauttelee niin paljon kun puhuu kuinka ei voi elää ilman tyttö ystäväänsä jne jne

Ja sit vielä ne sen valehtelut tic oireista jne🙃",38,10,https://i.redd.it/ugofo4s4xdqg1.jpeg,https://www.reddit.com/r/snappijuorut/comments/1rzp8gg/iituiida/,1774092933.0,2026-03-21 11:35:33,salahomo113,1rzp8gg
EI,3Dprinting,I wanted the perfect surface so I wrote my own G-Code,"I wanted to print this button with PLA Orange Silk. For the first layer, I tried both the standard way with zigzag infill and concentric circles (set boundaries to 99). However the first looked really dull and the second had this optical line effect where the nozzle would move to the next circle. 

I couldn't find an option in my slicer (PrusaSlicer) to print the first layer continuously as a spiral, so I sat down and generated my own g-code for the first layer. Was the first time I did this and was really excited to see it work as desired :)

If anyone knows of an easier way to do this, please let me know.

Here is how I did it if anyone wants to replicate it:

1. use CAD to make a spiral  
2. put 300 equidistant points on the spiral  
3. export point coordinates (just save as igs and open in editor)  
4. calculate I & J arc values from point coordinates  
5. I reverse engineered the E parameter (extruder) to be proportional to the travel distance with a factor of \~68. Used that to generate my own E values.  
6. replaced the first layer g-code with my own  
7. made a happy face.

If anyone wants more detailed explanation, please let me know. Have a nice weekend!",990,40,https://www.reddit.com/gallery/1rzp8fu,https://www.reddit.com/r/3Dprinting/comments/1rzp8fu/i_wanted_the_perfect_surface_so_i_wrote_my_own/,1774092932.0,2026-03-21 11:35:32,Few-Manufacturer7109,1rzp8fu
EI,desabafos,Continuação- Vou ter que lascar laxante,"Como eu havia dito anteriormente tinha alguém comendo as minhas coisas no meu serviço. 

Então eu decidi colocar laxante. comprei um suco e um bolo, coloquei laxante nos dois e uma quantidade considerável. Nesse dia eu dobrei o turno só pra ver o resultado, e adivinhem de 7 suspeitos 6 passaram mal. 

O local que ei trabalho esta passando por uma reforma e está com poucos banheiros disponíveis, então eles estavam desesperados para não se cagarem e o mais inesperado é que ninguém suspeitou de nada. 

Agora eu não sei se faço um teste pra ver se eles roubam minha comida de novo ou se eles se tocaram e não falaram nada. 

Mas o fato é que no banheiro estava ocorrendo uma orquestra sinfônica de cu ",13,14,https://www.reddit.com/r/desabafos/comments/1rzp89m/continuação_vou_ter_que_lascar_laxante/,https://www.reddit.com/r/desabafos/comments/1rzp89m/continuação_vou_ter_que_lascar_laxante/,1774092917.0,2026-03-21 11:35:17,Yunna_sata,1rzp89m
EI,econ_uncensored,Massachusetts sees $4.2 billion lost as residents flee tax increases. NY governor Hochul calls her states migrating residents “un-patriotic.”,"https://preview.redd.it/ualaz32lwdqg1.jpg?width=1200&format=pjpg&auto=webp&s=521bb8790960ac780fe67667524599ba8f097afe

***Photo above*** *– Governor Hochul says NY residents have a patriotic duty to remain and pay a 14% income tax rate. She says plan B could be to ""go down to Palm Beach and see who you can bring back home, because our tax has been eroded.""*

Come on Taxachusetts, you can’t be THAT dumb. You doubled the state income tax rate on some residents to 9%, and then act surprised when a bunch move away? Probably best not to copy what’s going on in New York though. Governor Hochul surrounded herself with American flags, and called paying 14% (state & local) income “patriotic”. She really said this. (See links below.)

The problem in NY is only going to worse – and fast. New York mayor Mamdani has big plans for higher property taxes and all sorts of surcharges. California is readying a 5% “wealth tax”. The state will take 5% of your savings and investments if they think you earn too much. A vote will be held later this year. The money grab is cleverly positioned as retroactive, so moving after election day won’t save you. This is what’s known as an ex-post facto law, and I’m sure the Supreme Court will quickly make space on its docket to hear arguments to overturn it.

Where are all these people moving too? Entertainers, franchise team players, team owners, business owners, tech moguls? It’s not just Florida. There's also Tennessee, Montana, Wyoming, and any other place with tax rates below 5% and safe schools, Work from home – a covid 19 lockdown brainstorm – has boomeranged into an accelerating population migration.

In addition snarking that migrants are Florida traitors, a number of other measures are being considered by some states to close the tax vs spending gap. Raising taxes on middle income workers. Higher property taxes. Changing the state constitution to allow budget deficits. Exit fees (like a toll booth?). Confiscating part of a professional athlete's paycheck when they come to town to play an away game.

About the only thing NOT under consideration is getting voters involved in deciding which state spending is essential, and what part is superfluous crap. That's because spending billions on superfluous crap is how politicians corral single issue voters at the polls on election day.

I’m just sayin’ . . .

[**Massachusetts loses billions in income after millionaire tax**](https://www.msn.com/en-us/money/other/massachusetts-lost-4-billion-of-income-after-millionaire-tax/ar-AA1Z4xdw?ocid=BingNewsSerp)

[**From 'jump on a bus' to tax crackdowns: Blue states chase wealthy residents fleeing to red havens**](https://www.msn.com/en-us/news/us/from-jump-on-a-bus-to-tax-crackdowns-blue-states-chase-wealthy-residents-fleeing-to-red-havens/ar-AA1Z4kK8?ocid=msedgntp&pc=HCTS&cvid=69be70dd0f6649dc9febfe557760679c&ei=23)",1,0,https://www.reddit.com/r/econ_uncensored/comments/1rzp6oi/massachusetts_sees_42_billion_lost_as_residents/,https://www.reddit.com/r/econ_uncensored/comments/1rzp6oi/massachusetts_sees_42_billion_lost_as_residents/,1774092774.0,2026-03-21 11:32:54,baltimore-aureole,1rzp6oi
EI,Vrindavan,श्री पूर्णेश्वर महादेव जी के आज 21/03/2026 के दर्शन श्री धाम वृन्दावन से,,28,6,https://i.redd.it/b35gl49cwdqg1.jpeg,https://www.reddit.com/r/Vrindavan/comments/1rzp5j8/शर_परणशवर_महदव_ज_क_आज_21032026_क_दरशन_शर_धम_वनदवन/,1774092672.0,2026-03-21 11:31:12,Possible_Freedom_847,1rzp5j8
EI,Indiangamers,Selling Thrustmaster Th8A shifter brand new condition 3 months old with box and all accessories f2f and shipping both possible i am located in Kolkata,,0,0,https://www.reddit.com/gallery/1rzp42j,https://www.reddit.com/r/Indiangamers/comments/1rzp42j/selling_thrustmaster_th8a_shifter_brand_new/,1774092538.0,2026-03-21 11:28:58,Sea-Afternoon-6568,1rzp42j
EI,Nightwing_Starfire,Day 7 March Mail-A-Thon,"Original Post - 
https://www.reddit.com/r/Nightwing_Starfire/comments/1rph2d3/nightwing_and_starfire_mailathon/?utm_source=share&utm_medium=web3x&utm_name=web3xcss&utm_term=1&utm_content=share_button

And so we've reached the end of March Mail-A-Thon! Thank you everyone who participated. Even if it was just a like on a Dick/Kory post it is not wasted and I am so proud of each and every one of you! For the final day I would encourage you to write a letter! Here is mine I will be sending out today. I did not put my name yet for privacy but it's so easy to do. Even if you dont do it today. Write them!

Edit: Here is the DC Contact info!

DC Entertainment
C/O Fan Mail (You can also just put Editorial)
2900 W. Alameda Avenue
Burbank, CA 91505
USA

Alternately you can also mail a writer if you know their name. For example
Writer Name
C/O DC Entertainment
2900 W. Alameda Avenue
Burbank, CA 91505
USA

Don't have a stamp? In the US you can buy one singular stamp at your local post office. The cost of a stamp is $0.78.

Here is a guide on how to label an envelope:
https://www.wikihow.com/Label-an-Envelope

Even though March Mail-A-Thon is over let's never stop reaching out to DC to ask them to bring our favorite couple back. Long live Dick/Kory!",5,1,https://i.redd.it/q8is1f39vdqg1.jpeg,https://www.reddit.com/r/Nightwing_Starfire/comments/1rzp1k7/day_7_march_mailathon/,1774092300.0,2026-03-21 11:25:00,wordsofpeace,1rzp1k7
EI,memeesti,Ei teadnud et Tartu on linn süürias,,58,0,https://i.redd.it/145abx0iudqg1.png,https://www.reddit.com/r/memeesti/comments/1rzozpd/ei_teadnud_et_tartu_on_linn_süürias/,1774092122.0,2026-03-21 11:22:02,Lembit_moislane,1rzozpd
EI,Eesti,Pühapäevaseid lõunakohti?,"Kas keegi oskab soovitada Tallinnas mingit kohta, kus lõunatada Pühapäeval. Menüü võiks olla tavaline toit supid, kartul jne. Paljud kohad on kinni või ei paku lõunamenüüd. 

Otsime alternatiivi sõõrikukohvikule. ",7,11,https://www.reddit.com/r/Eesti/comments/1rzozix/pühapäevaseid_lõunakohti/,https://www.reddit.com/r/Eesti/comments/1rzozix/pühapäevaseid_lõunakohti/,1774092106.0,2026-03-21 11:21:46,DefinitelyAlphamale,1rzozix
EI,economy,Massachusetts sees $4.2 billion lost as residents flee tax increases. NY governor Hochul calls her states migrating residents “un-patriotic.”,"https://preview.redd.it/mb0ry4reudqg1.jpg?width=1200&format=pjpg&auto=webp&s=2b1139a2c4f916a152202e69bba5b30d2fab39d3

***Photo above*** *– Governor Hochul says NY residents have a patriotic duty to remain and pay a 14% income tax rate. She says plan B could be to ""go down to Palm Beach and see who you can bring back home, because our tax has been eroded.""*  
  
Come on Taxachusetts, you can’t be THAT dumb. You doubled the state income tax rate on some residents to 9%, and then act surprised when a bunch move away? Probably best not to copy what’s going on in New York though. Governor Hochul surrounded herself with American flags, and called paying 14% (state & local) income “patriotic”. She really said this. (See links below.)  
  
The problem in NY is only going to worse – and fast. New York mayor Mamdani has big plans for higher property taxes and all sorts of surcharges. California is readying a 5% “wealth tax”. The state will take 5% of your savings and investments if they think you earn too much. A vote will be held later this year. The money grab is cleverly positioned as retroactive, so moving after election day won’t save you. This is what’s known as an ex-post facto law, and I’m sure the Supreme Court will quickly make space on its docket to hear arguments to overturn it.  
  
Where are all these people moving too? Entertainers, franchise team players, team owners, business owners, tech moguls? It’s not just Florida. There's also Tennessee, Montana, Wyoming, and any other place with tax rates below 5% and safe schools, Work from home – a covid 19 lockdown brainstorm – has boomeranged into an accelerating population migration.  
  
In addition snarking that migrants are Florida traitors, a number of other measures are being considered by some states to close the tax vs spending gap. Raising taxes on middle income workers. Higher property taxes. Changing the state constitution to allow budget deficits. Exit fees (like a toll booth?). Confiscating part of a professional athlete's paycheck when they come to town to play an away game.  
  
About the only thing NOT under consideration is getting voters involved in deciding which state spending is essential, and what part is superfluous crap. That's because spending billions on superfluous crap is how politicians corral single issue voters at the polls on election day.  
  
I’m just sayin’ . . .  
  
[**Massachusetts loses billions in income after millionaire tax**](https://www.msn.com/en-us/money/other/massachusetts-lost-4-billion-of-income-after-millionaire-tax/ar-AA1Z4xdw?ocid=BingNewsSerp)  
  
[**From 'jump on a bus' to tax crackdowns: Blue states chase wealthy residents fleeing to red havens**](https://www.msn.com/en-us/news/us/from-jump-on-a-bus-to-tax-crackdowns-blue-states-chase-wealthy-residents-fleeing-to-red-havens/ar-AA1Z4kK8?ocid=msedgntp&pc=HCTS&cvid=69be70dd0f6649dc9febfe557760679c&ei=23)

",0,4,https://www.reddit.com/r/economy/comments/1rzoyzp/massachusetts_sees_42_billion_lost_as_residents/,https://www.reddit.com/r/economy/comments/1rzoyzp/massachusetts_sees_42_billion_lost_as_residents/,1774092051.0,2026-03-21 11:20:51,baltimore-aureole,1rzoyzp
EI,Displate,Looking for sticker,"Weird question, but does anyone have a bunch of these stickers they'd be willing to mail me if it cover postage? ",1,0,https://i.redd.it/ndb6ub0rtdqg1.jpeg,https://www.reddit.com/r/Displate/comments/1rzowf9/looking_for_sticker/,1774091794.0,2026-03-21 11:16:34,Matt_Bowen,1rzowf9
EI,ValorantMobile,I want to make valo mobile ac,,1,21,https://i.redd.it/2dqxo8vtsdqg1.png,https://www.reddit.com/r/ValorantMobile/comments/1rzot7u/i_want_to_make_valo_mobile_ac/,1774091491.0,2026-03-21 11:11:31,Leather-Top-6106,1rzot7u
