bank,subreddit,title,selftext,score,num_comments,url,permalink,created_utc,created_date,author,id
ENBD,dubai,0% Interest on Apple Product via ENBD Credit Card,"Hello there, I want to purchase an Apple product with my Emirates NBD credit card. Currently, there is a 0% interest offer going on for Apple. I was wondering how to claim that. Should I just purchase with my credit card and then convert it into installments? But how do I ensure that the 0% interest is applied to my credit card and not charged with interest? What do I need to do?",2,6,https://www.reddit.com/r/dubai/comments/1rxxjym/0_interest_on_apple_product_via_enbd_credit_card/,https://www.reddit.com/r/dubai/comments/1rxxjym/0_interest_on_apple_product_via_enbd_credit_card/,1773918724.0,2026-03-19 11:12:04,sirHUNGRYBOX,1rxxjym
ENBD,DubaiUX,"Emirates NBD just ran this AI-generated ad on LinkedIn. As designers, what do we think?","Spotted this Emirates NBD campaign promoting their 6% salary transfer offer.

A few things jump out immediately — curious what this community sees:

The AI-generated humans hugging oversized ""6%"" pillows is... a choice. Does the warmth land, or does it feel uncanny?

Emirates NBD is one of the biggest banks in the region. This ran as a paid LinkedIn promotion, so this wasn't a quick social post — there was budget and sign-off behind it.

Hot take or thoughtful breakdown — drop it below. What would you have done differently?",1,0,https://i.redd.it/fjnyf5pa7ypg1.jpeg,https://www.reddit.com/r/DubaiUX/comments/1rxt65n/emirates_nbd_just_ran_this_aigenerated_ad_on/,1773902641.0,2026-03-19 06:44:01,Born-James-Apex,1rxt65n
ADIB,UAEcreditcards,ADIB Etihad Platinum Card,Does anyone have the ADIB Etihad Platinum card? Is it any good? And how can I make the best use of it?,3,3,https://www.reddit.com/r/UAEcreditcards/comments/1ry2tlu/adib_etihad_platinum_card/,https://www.reddit.com/r/UAEcreditcards/comments/1ry2tlu/adib_etihad_platinum_card/,1773932560.0,2026-03-19 15:02:40,No-Parsley7066,1ry2tlu
ADIB,artificial,Generative AI improves a wireless vision system that sees through obstructions,"MIT researchers have spent more than a decade studying techniques that enable robots to find and manipulate hidden objects by ""seeing"" through obstacles. Their methods utilize surface-penetrating wireless signals that reflect off concealed items. Now, the researchers are leveraging generative artificial intelligence models to overcome a longstanding bottleneck that limited the precision of prior approaches.

The result is a new method that produces more accurate shape reconstructions, which could improve a robot's ability to reliably grasp and manipulate objects that are blocked from view. This new technique builds a partial reconstruction of a hidden object from reflected wireless signals and fills in the missing parts of its shape using a specially trained generative AI model.

The researchers also introduced an expanded system that uses generative AI to accurately reconstruct an entire room, including all the furniture. The system utilizes wireless signals sent from one stationary radar, which reflect off humans moving in the space.

This overcomes one key challenge of many existing methods, which require a wireless sensor to be mounted on a mobile robot to scan the environment. And unlike some popular camera-based techniques, their method preserves the privacy of people in the environment.

These innovations could enable warehouse robots to verify packed items before shipping, eliminating waste from product returns. They could also allow smart home robots to understand someone's location in a room, improving the safety and efficiency of human-robot interaction.

""What we've done now is develop generative AI models that help us understand wireless reflections. This opens up a lot of interesting new applications, but technically it is also a qualitative leap in capabilities, from being able to fill in gaps we were not able to see before to being able to interpret reflections and reconstruct entire scenes,"" says Fadel Adib, associate professor in the Department of Electrical Engineering and Computer Science, director of the Signal Kinetics group in the MIT Media Lab, and senior author of two papers on these techniques. ""We are using AI to finally unlock wireless vision.""",2,0,https://techxplore.com/news/2026-03-generative-ai-wireless-vision-obstructions.html,https://www.reddit.com/r/artificial/comments/1ry2qv3/generative_ai_improves_a_wireless_vision_system/,1773932400.0,2026-03-19 15:00:00,Secure-Technology-78,1ry2qv3
ADIB,YesstyleCodesSharing,TINA10 + BARBIE888 20% OFF 💞💞💞,,3,6,https://i.redd.it/9dlpru7l7zpg1.jpeg,https://www.reddit.com/r/YesstyleCodesSharing/comments/1rxweul/tina10_barbie888_20_off/,1773914846.0,2026-03-19 10:07:26,barbaraabera,1rxweul
ADIB,jobsdubai,Abu Dhabi Islamic Bank is hiring a Application Assurance Specialist,"🏢 Company: [Abu Dhabi Islamic Bank](https://zerotaxjobs.com/companies/abu-dhabi-islamic-bank)  
📍 Location: Dubai, United Arab Emirates  
💸 Salary Guide: $60,000 USD - $100,000 USD Tax-Free!  
👉 Apply & More Details: [https://zerotaxjobs.com/jobs/application-assurance-specialist-lxejee6o](https://zerotaxjobs.com/jobs/application-assurance-specialist-lxejee6o)  

📈 Trending Job Searches:  
[Software Engineer Jobs in Dubai](https://zerotaxjobs.com/software-engineer-jobs-in-dubai)  
[Expatriate Jobs in Saudi Arabia](https://zerotaxjobs.com/expatriate-jobs-in-saudi-arabia)  
[IT Jobs in Dubai](https://zerotaxjobs.com/it-jobs-in-dubai)  
[Jobs in Abu Dhabi](https://zerotaxjobs.com/jobs-in-abu-dhabi)",1,0,https://www.reddit.com/r/jobsdubai/comments/1rxrqp0/abu_dhabi_islamic_bank_is_hiring_a_application/,https://www.reddit.com/r/jobsdubai/comments/1rxrqp0/abu_dhabi_islamic_bank_is_hiring_a_application/,1773897602.0,2026-03-19 05:20:02,samotsar,1rxrqp0
ADIB,techjobs,[Hiring] [Hybrid] [Dubai / UAE / Saudi Arabia] - 20 zero-tax tech jobs - 18 March 2026,"Note for US Citizens: typically the IRS will not tax the first $126,500 USD you earn abroad under the [Foreign Earned Income Exclusion](https://www.irs.gov/individuals/international-taxpayers/foreign-earned-income-exclusion)

&#x200B;

|*Job Position @ Company*|*Location*|*Salary*|
|:-|:-|:-|
|[Sales Engineer @ CrowdStrike](https://zerotaxjobs.com/jobs/sales-engineer-n1vfscjr)|Dubai, United Arab Emirates|$80,000 USD - $120,000 USD Tax-Free|
|[Customer Success Manager @ Sprinklr](https://zerotaxjobs.com/jobs/customer-success-manager-xvf9yzp1)|Doha, Qatar|$80,000 USD - $120,000 USD Tax-Free|
|[Asst. Manager - Compliance, Projects & Data Analytics, Compliance - Sanctions Unit, Compliance Group @ Mashreq](https://zerotaxjobs.com/jobs/asst-manager-compliance-projects-data-analytics-compliance-qby60knm)|Dubai, United Arab Emirates|$70,000 USD - $90,000 USD Tax-Free|
|[Food Safety & Quality Specialist @ Delivery Hero](https://zerotaxjobs.com/jobs/food-safety-quality-specialist-vva3w6v1)|Unspecified, Unspecified|$38,000 USD - $55,000 USD Tax-Free|
|[Application Assurance Specialist @ Abu Dhabi Islamic Bank](https://zerotaxjobs.com/jobs/application-assurance-specialist-lxejee6o)|Dubai, United Arab Emirates|$60,000 USD - $100,000 USD Tax-Free|
|[Technology Analyst - Business Analyst - Emiratization & UAE Talent Development @ Accenture](https://zerotaxjobs.com/jobs/technology-analyst-business-analyst-emiratization-uae-bpmuq05u)|Dubai, United Arab Emirates|$30,000 USD - $45,000 USD Tax-Free|
|[Technology Analyst - Software Engineering - Emiratization & UAE Talent Development @ Accenture](https://zerotaxjobs.com/jobs/technology-analyst-software-engineering-emiratization-ho7nkh85)|Dubai, United Arab Emirates|$40,000 USD - $60,000 USD Tax-Free|
|[Technology Analyst - Software Engineering - Emiratization & UAE Talent Development @ Accenture](https://zerotaxjobs.com/jobs/technology-analyst-software-engineering-emiratization-7n6p9ntl)|Dubai, United Arab Emirates|$65,000 USD - $100,000 USD Tax-Free|
|[D360 Technical Architect @ Salesforce](https://zerotaxjobs.com/jobs/d360-technical-architect-y2u87flh)|Riyadh, Saudi Arabia|$80,000 USD - $120,000 USD Tax-Free|
|[Experienced Quality Assurance Specialist @ Boeing](https://zerotaxjobs.com/jobs/experienced-quality-assurance-specialist-a9kmztgj)|Doha, Qatar|$70,000 USD - $90,000 USD Tax-Free|
|[Channel Sales Intern @ F5](https://zerotaxjobs.com/jobs/channel-sales-intern-8uahtqvz)|Riyadh, Saudi Arabia|$6,000 USD - $12,000 USD Tax-Free|
|[Electrical Engineering Intern @ GE Vernova](https://zerotaxjobs.com/jobs/electrical-engineering-intern-156fw124)|Riyadh, Saudi Arabia|$8,000 USD - $12,000 USD Tax-Free|
|[Program Manager - 3P External Fulfillment @ Amazon](https://zerotaxjobs.com/jobs/program-manager-3p-external-fulfillment-iyzfj7us)|Dubai, United Arab Emirates|$90,000 USD - $120,000 USD Tax-Free|
|[Sr. Solutions Architect @ Amazon](https://zerotaxjobs.com/jobs/sr-solutions-architect-wirdwzsc)|Abu Dhabi, United Arab Emirates|$120,000 USD - $150,000 USD Tax-Free|
|[Manager - Customer Success @ Core42](https://zerotaxjobs.com/jobs/manager-customer-success-gbf5yjza)|Abu Dhabi, United Arab Emirates|$80,000 USD - $120,000 USD Tax-Free|
|[Networking Engineer @ Edge Group](https://zerotaxjobs.com/jobs/networking-engineer-i0we0n2o)|Abu Dhabi, United Arab Emirates|$70,000 USD - $100,000 USD Tax-Free|
|[Project Manager @ Edge Group](https://zerotaxjobs.com/jobs/project-manager-v6jnh0xk)|Dubai, United Arab Emirates|$82,000 USD - $118,000 USD Tax-Free|
|[Associate Solutions Architect (UAE National) @ Dell Technologies](https://zerotaxjobs.com/jobs/associate-solutions-architect-uae-national-719llea7)|Dubai, United Arab Emirates|$60,000 USD - $80,000 USD Tax-Free|
|[Alletra 4K Compute Specialist @ HP](https://zerotaxjobs.com/jobs/alletra-4k-compute-specialist-ehneiajy)|Dubai, United Arab Emirates|$80,000 USD - $120,000 USD Tax-Free|
|[Specialist - Business Analysis @ Presight](https://zerotaxjobs.com/jobs/specialist-business-analysis-84x0ty76)|Abu Dhabi, United Arab Emirates|$50,000 USD - $80,000 USD Tax-Free|",1,0,https://www.reddit.com/r/techjobs/comments/1rxjb2u/hiring_hybrid_dubai_uae_saudi_arabia_20_zerotax/,https://www.reddit.com/r/techjobs/comments/1rxjb2u/hiring_hybrid_dubai_uae_saudi_arabia_20_zerotax/,1773874804.0,2026-03-18 23:00:04,samotsar,1rxjb2u
EI,Eesti,"Tahan asutada OÜ-d, aga ei oma maad, kuhu seda registreerida. Kuidas olukorda lahendada?","Tegutsemise reaalne aadress varieerub ja muutub vastavalt minu liikumisele. Kuna teen tööd arvutist, ei ole mul fikseeritud asukohta. Üürikorterit ei taha aadressiks ilma omaniku nõusolekuta panna + **ma ei taha oma koduaadressi äriregistrisse**. Appi?

FIEks ma maksulistel põhjustel ei hakka.",4,8,https://www.reddit.com/r/Eesti/comments/1ry5n55/tahan_asutada_oüd_aga_ei_oma_maad_kuhu_seda/,https://www.reddit.com/r/Eesti/comments/1ry5n55/tahan_asutada_oüd_aga_ei_oma_maad_kuhu_seda/,1773938828.0,2026-03-19 16:47:08,eurooplane,1ry5n55
EI,bouldering,Sans Belay: A recent climbing-inspired character Illustration,"A recent character illustration I thought you guys might like to see. I've relatively recently gotten into bouldering and am enjoying it a lot, have only been inside so far, but hoping to do some ""sans belay"" rock stuff at some point. Let me know what you think! 

If you want to see any of my other bits of work you can find it at dead\_man\_flying on instagram (although so far not much of it is climbing related. That might change haha) ",22,0,https://i.redd.it/d98uasxk51qg1.png,https://www.reddit.com/r/bouldering/comments/1ry5l6h/sans_belay_a_recent_climbinginspired_character/,1773938710.0,2026-03-19 16:45:10,farenheit1472,1ry5l6h
EI,ThousandSons,Painting rubric marines,"Giving Thousand Sons a shot

I’ve painted a bit many years ago and have recently decided to start painting again as an alternative to spending time in front of the computer. Decided on a Thousand Sons combat patrol and am starting on the rubric marines before working towards the more unique models.

How am I doing? Any tips?",2,0,https://i.redd.it/93czk1ri61qg1.jpeg,https://www.reddit.com/r/ThousandSons/comments/1ry5l0e/painting_rubric_marines/,1773938699.0,2026-03-19 16:44:59,C4lib3rX,1ry5l0e
EI,lightsalot,ghostie tattoo,finally got my ghostie and the lyrics she wrote me tattooed above my soul symbol 💞 i know she drew a few ghosties this tour so i love the idea of a bunch of us having the same tattoo like the soul symbol 👻,6,0,https://www.reddit.com/gallery/1ry5l02,https://www.reddit.com/r/lightsalot/comments/1ry5l02/ghostie_tattoo/,1773938699.0,2026-03-19 16:44:59,lesleypika,1ry5l02
EI,PerfumesBR,Minha coleção da Granado/Phebo,"Basílico Roxo: no geral ele é bem fresco, herbal e verde. Gosto muito da nota de manjericão, e a fixação é melhor do que eu esperava, chegando a durar até umas 6 horas (com hidratante antes de aplicar). Muito bom.

Fava Tonka: é um amadeirado meio doce, mas ao mesmo tempo tem um frescor bem encorpado. Fixação e projeção boas, acho que ele tem a melhor performance entre esses da foto. Eu gosto de usar em ocasiões mais formais.

Chá Preto e Bergamota: esse é bem agradável, mas na minha experiência fixa e projeta muito pouco. Eu acabo usando ele mais em casa.

Imperial: esse tem um tempo que eu não uso, então talvez eu precise testar de novo. Mas mesmo não sendo doce, eu acho ele meio enjoativo. É mais feminino. Fixa e projeta bem.

Fantástico Circo: cheiro de conforto, pós-banho, lavanda e talco. Já tive 2 frascos antes desse da foto, gosto e uso muito, mas não dura tanto.

Oud: pode ser considerado muito forte ou mais masculino, mas eu borrifo ele e só penso “que cheiro bom”. Amadeirado fresco e verde, mas acho melhor pra ser usado à noite ou no frio. Fixa e projeta bem, em roupa fica impregnado.

Folha Imperial: um soco de verde. Ele é bem cítrico e meio amargo. Fixa e projeta dentro da média. Uso pouco porque o frasco já quase chegou ao fim e ele saiu de linha.

Agora comprei o Carioca na promoção da Amazon e tô querendo pegar o Bossa depois. Acho que são os mais famosos da marca e ainda não tive. Mas não tô acompanhando muito os lançamentos recentes de Granado, pois onde eu moro não tem loja física e não tenho coragem de dar blind agora com o aumento dos preços kk",2,0,https://i.redd.it/mn6bkcys51qg1.jpeg,https://www.reddit.com/r/PerfumesBR/comments/1ry5hd1/minha_coleção_da_granadophebo/,1773938478.0,2026-03-19 16:41:18,Cooler-Cucumber,1ry5hd1
EI,overemployed,Thinking out loud,"I see things like this where to live comfortably as a single adult in Tampa you need 94K+. Then I saw another post from a guy who had been working remote for 25 years who just got let go. He was asking for leads…

This is a big part of why I choose to OE. Thank GOD I’m able to do this. 

It’s brutal out there and you owe it to yourself to have a backup job and to be able to live the life you want to live. 

You’ve all got this, let’s go. ",60,4,https://i.redd.it/861jij8t51qg1.jpeg,https://www.reddit.com/r/overemployed/comments/1ry5h3o/thinking_out_loud/,1773938461.0,2026-03-19 16:41:01,TheAnonSicario,1ry5h3o
EI,AlexandriaEgy,لا حول ولا قوة الا بالله,,2,0,https://i.redd.it/hwek2smq51qg1.jpeg,https://www.reddit.com/r/AlexandriaEgy/comments/1ry5gq3/لا_حول_ولا_قوة_الا_بالله/,1773938437.0,2026-03-19 16:40:37,Hot-Garden-75,1ry5gq3
EI,UrbanHell,This villain base,,8,1,https://i.redd.it/irrhgkbo51qg1.jpeg,https://www.reddit.com/r/UrbanHell/comments/1ry5gci/this_villain_base/,1773938416.0,2026-03-19 16:40:16,Accomplished-Sky-837,1ry5gci
EI,Cheese,Port Salut,"Yes, it got slapped. 😉 Stress ball cheese. ",6,4,https://www.reddit.com/gallery/1ry5f5d,https://www.reddit.com/r/Cheese/comments/1ry5f5d/port_salut/,1773938342.0,2026-03-19 16:39:02,CheeseMongoNJ,1ry5f5d
EI,fujifilm,"B'Bugia, Malta - Fujifilm-XT30iii, Fujinon XC 13-33 Kit Lens",SOOC JPEG,2,0,https://www.reddit.com/gallery/1ry59zu,https://www.reddit.com/r/fujifilm/comments/1ry59zu/bbugia_malta_fujifilmxt30iii_fujinon_xc_1333_kit/,1773938018.0,2026-03-19 16:33:38,kurtscic99,1ry59zu
EI,Knightsofpenandpaper,Need some help,"Hey guys... Ive been playing for some hours and cant seem to get rid of this shuriken.. 
Even in the Smelt section (blacksmith) it doesnt show up...",1,0,https://i.redd.it/oxt9mk1g41qg1.jpeg,https://www.reddit.com/r/Knightsofpenandpaper/comments/1ry59q7/need_some_help/,1773938002.0,2026-03-19 16:33:22,KrussssstZ,1ry59q7
EI,Suomi,Olit oikeassa.,"Mökillä.

Ongelma: 

Keittiön lipasto johon hiiret paskovat talvisin niin paljon ettei kukaan kehtaa käyttää

Syy löydetty: 

Puuttuva selkälevy

\-Mene tonkimaan 80-vuotiaasta vajasta josko saattaisi löytyä tuohon sopivaa palasta

\-Etsiskelyn jälkeen, epätoivo jo kolkuttamassa ovella, yhtäkkiä katonrajasta pilkistää palanen puukuitulevyä

\-”Voikohan toi olla sopiva?”

\-Se on täydellinen, vaatii vain muutaman sentin leikkauksen

\-Naputtele paikoilleen

\-Ei pääse hiiret enää sisälle lipastoon

\-profit

Tarinan allegoria: 

Pala joka oli vajassa on ollut siellä vuosikymmeniä, jo kuolleen isoisoisäni sinne todennäköisesti laittama. Tämä on siis lojunut siellä loputtomia vuosia. Se on nähnyt auringonnousun ja laskun tuhansia kertoja. Lapsia on syntynyt, rakkaudet kukoistaneet ja sitten murentuneet, valtakunnat romahtaneet. Ihmiset tunnetut ja tuntemattomat sen läheisyydessä pyörineet, mahdollisesti joku häneen katseen kääntänyt, kuitenkin sen pois kääntänyt huomaten sen olevan turha.

Krääsä.

Roska.

Turha.

Näin kuitenkaan ei ollut. Lukemattomien elämien, kuolemien ja kaiken sen välillä liikkuvan jälkeen, tänä päivänä 19. päivä maaliskuuta kyseistä vuotta tuo joskus maasta kasvanut, sittemin silpottu puupalanen löysi jälleen merkityksensä, ruokatavaroiden ja (biohajoavien) kertakäyttöastioiden uskollisena suojelijana.

Miksi tästä kerron?

Toveri.

Olit oikeassa.

Se palanen.

Se pieni puunpalanen. Se kokoelma ruuveja. Se metallinpalanen jonka alkuperää et enää muista, mutta jolla voisi hyvinkin olla käyttöä.

Toveri!

Sillä on!

Jonakin päivänä, kun sen olemassaolon jo unohtanut olet, rupeat projektiin jota et alunperin olisi oikeastaan jaksanut mutta nyt huutaa nimeäsi! Kolmetoista kirosanaa ja kolme tuntia myöhemmin olet varmasti valmistanut jotakin, mitä ei ollut olemassa, kun silmäsi avasit!

Joten vielä kerran; olit oikeassa!

Vaikka tyttöystäväsi kanssa jo riitelet siitä että miksi et jo heitä pois tuota palasta?

”Mitä järkeä tässä on? Et sä edes tiiä mihin tää kuuluu!”

Tiedät. Jossain siellä syvällä. Sinä tiedät.

Naapurisi ihmettelevät miksi säilytät jotakin turhaketta. Perheesi jo sinua kummaksuu. Lapset eivät enää katso samalla tavalla.

Maailma on muuttunut hieman… tummemaksi.

Kunnes sinä yhtenä päivänä.

Kaikki muuttuu. Maailmankaikkeuden alusta asti odottanut palanen. Oli sitten ihmisellä vapaa tahto tai tapahtukoon kaikki jo ennalta määrätyn kaavan mukaisesti, kun tuona kultaisena päivänä tulevaisuudessa voit ilta-auringon hyväilemänä istua mökin nojatuolilla, kuiskaa itsellesi;

Olin oikeassa.",35,10,https://www.reddit.com/gallery/1ry59dt,https://www.reddit.com/r/Suomi/comments/1ry59dt/olit_oikeassa/,1773937981.0,2026-03-19 16:33:01,citizenK245,1ry59dt
EI,snappisensuroimat0n,Tuija ei pysty jättämään edes Vendiä rauhaan.,Tämä nainen oikeasti pitää raahata hoitoon. Ei mitään moraalia videoissaan.,20,13,https://v.redd.it/c7j7jtr641qg1,https://www.reddit.com/r/snappisensuroimat0n/comments/1ry58co/tuija_ei_pysty_jättämään_edes_vendiä_rauhaan/,1773937916.0,2026-03-19 16:31:56,Cool_Marsupial_5584,1ry58co
EI,CryptoMoon,Early access is now live for $TrumpClaude! 🥳🚀 (fair launch),"The narrative is fire mixing Trump and Claude ai 

Think this can be a good runner for sure 

I just thought more Trump Claude now 

Website https://trumpclaude.vip/",2,0,https://i.redd.it/8ipp484641qg1.jpeg,https://www.reddit.com/r/CryptoMoon/comments/1ry588q/early_access_is_now_live_for_trumpclaude_fair/,1773937909.0,2026-03-19 16:31:49,AdeptWolverine5318,1ry588q
EI,writingscaling,Sorry for adding this slop to the board,"Tried to make an interesting list and challenge myself with no repeats and covering different mediums. (With 1 exception) 

Most of this was just stream of consciousness because I could answer any of these with like 10 or more different responses. ",2,2,https://i.redd.it/jpkamzi441qg1.png,https://www.reddit.com/r/writingscaling/comments/1ry580v/sorry_for_adding_this_slop_to_the_board/,1773937894.0,2026-03-19 16:31:34,BigOwl526,1ry580v
EI,glutenfree,Are those safe to consume,"hello dear friends 

I have a question about Snickers and Bounty miniatures 

are they safe ? 

they are made in the Netherlands and I heard they are safe ",0,0,https://www.reddit.com/gallery/1ry57iu,https://www.reddit.com/r/glutenfree/comments/1ry57iu/are_those_safe_to_consume/,1773937864.0,2026-03-19 16:31:04,_JO_ACE_,1ry57iu
EI,AllCryptoBets,$TrumpClaude early access is live,"We are early do not fade it 

Great narrative and idea 

Solid project and 100% fair launch 

Website https://trumpclaude.vip",2,0,https://i.redd.it/8282tl8r31qg1.jpeg,https://www.reddit.com/r/AllCryptoBets/comments/1ry55xu/trumpclaude_early_access_is_live/,1773937770.0,2026-03-19 16:29:30,AdeptWolverine5318,1ry55xu
EI,FortniteAccSale,"🔴Wildcat , Galaxy , Travis Scott | 800+ Skins | $200 | Full access","\-Comes with Original Email & is email Changeable, Playable on ANY Platform. | I can show vouches 

\-YOU CAN NOT SIGN IN Without Payment 

Cashapp, Venmo , PayPal 

\-NOT GOING FIRST Dont waste time , if it’s still posted it available to buy. Dont message if you don’t have the funds please & thank you. ",0,0,https://www.reddit.com/gallery/1ry51jf,https://www.reddit.com/r/FortniteAccSale/comments/1ry51jf/wildcat_galaxy_travis_scott_800_skins_200_full/,1773937503.0,2026-03-19 16:25:03,Warm-Weakness-885,1ry51jf
EI,bapeheads,Legit,,1,3,https://www.reddit.com/gallery/1ry4zol,https://www.reddit.com/r/bapeheads/comments/1ry4zol/legit/,1773937396.0,2026-03-19 16:23:16,Clipzvznry,1ry4zol
EI,carsireland,Only 12 years left until it’s €56 👍🏻,"Found these while cleaning out the car, sad that they are doing away with the discs now because there’s nothing to show for it",16,10,https://i.redd.it/vbfritmm21qg1.jpeg,https://www.reddit.com/r/carsireland/comments/1ry4zlg/only_12_years_left_until_its_56/,1773937391.0,2026-03-19 16:23:11,VantaCodex,1ry4zlg
EI,peaceloveandhistory,"March 19, 1863 – US Civil War: The CSS Georgiana, said to have been the most powerful Confederate cruiser, is destroyed on her maiden voyage with a cargo of munitions, medicines, and merchandise then valued at over $1,000,000...",https://www.signalsaz.com/articles/this-day-in-history-march-19th-2021-the-ss-georgiana,2,0,https://www.reddit.com/gallery/1ry4z7j,https://www.reddit.com/r/peaceloveandhistory/comments/1ry4z7j/march_19_1863_us_civil_war_the_css_georgiana_said/,1773937367.0,2026-03-19 16:22:47,CrystalEise,1ry4z7j
EI,techsupport,Problems with Google Chrome,"Hello friends, I'm having a problem with my Google Chrome. Regardless of the theme I apply, the search results screen goes black, in all profiles except guest and incognito mode. The same thing is happening on my mobile Chrome browser. I've already tried disabling the ""Auto Dark Mode for Web Contents"" flag, my phone, laptop, and Chrome browser have their light themes enabled, battery saver is disabled, and this only happens when I perform a search. When I enter a website, it becomes light again, but when I leave, I can hear it. Is anyone else experiencing this problem?

https://preview.redd.it/8532u8ce21qg1.png?width=1917&format=png&auto=webp&s=d329d9c377f72f7a20922a3c826f3dc73c1dd864

",1,2,https://www.reddit.com/r/techsupport/comments/1ry4yyp/problems_with_google_chrome/,https://www.reddit.com/r/techsupport/comments/1ry4yyp/problems_with_google_chrome/,1773937352.0,2026-03-19 16:22:32,Lyaaaaaaaa,1ry4yyp
EI,pchelp,Problems with Google Chrome,"Hello friends, I'm having a problem with my Google Chrome. Regardless of the theme I apply, the search results screen goes black, in all profiles except guest and incognito mode. The same thing is happening on my mobile Chrome browser. I've already tried disabling the ""Auto Dark Mode for Web Contents"" flag, my phone, laptop, and Chrome browser have their light themes enabled, battery saver is disabled, and this only happens when I perform a search. When I enter a website, it becomes light again, but when I leave, I can hear it. Is anyone else experiencing this problem?

https://preview.redd.it/cxwsn3p121qg1.png?width=1917&format=png&auto=webp&s=045ca82b55971e8e69f8237a5b251d6f87ef272c

",1,1,https://www.reddit.com/r/pchelp/comments/1ry4wtj/problems_with_google_chrome/,https://www.reddit.com/r/pchelp/comments/1ry4wtj/problems_with_google_chrome/,1773937225.0,2026-03-19 16:20:25,Lyaaaaaaaa,1ry4wtj
EI,Bazi_Astrology,求大师指点，最近很迷茫,,1,1,https://i.redd.it/s72v741y11qg1.jpeg,https://www.reddit.com/r/Bazi_Astrology/comments/1ry4vue/求大师指点最近很迷茫/,1773937162.0,2026-03-19 16:19:22,Initial-Coyote6229,1ry4vue
