bank,subreddit,title,selftext,score,num_comments,url,permalink,created_utc,created_date,author,id
EI,firstblurpderpwelcome,"Hi, my name is *truck drives by* but everyone just calls me dad.","*Note* please don't call me dad.

But yes! Hello it's my first time on reddit! A little-lot about me: 

1. I first used reddit as of posting this about 2-ish weeks ago but I've shadowed Reddit for much longer. I never wanted to make an account due to shyness, confusing rules, and the dreaded censorship that seems to plague every platform. (Plz don't ban me reddit, I beg.) However due to my introvertedness taking over more and more, now seemed like a good a time as any! 

2. Yep! The name comes from a Nickelodeon cartoon, and if I have to explain from: ¹ how dare you. ² we can't be friends! 

3. I browsed over hundreds of subreddits, always thinking if I ever did join - where would I start? I had ideas of where, but not-so-much when...And given said strict rules, I always thought I had a knit and knack for sentence structure, spelling and grammar as I've been complimented on my penmanship and organization skills...yet, reddit I'm sure will truly test me on that. I've been out of an English class for many, many years now. So forgive me in advance I'll try my best! 

4. Speaking of many, many years - I'm not so young and not so old either! It's a mystery. And as per reddit guidelines to not share sensitive information - I suppose I will keep it that way. You'll just have to think of me as an enigmatic mr. magoo-like shape; formless in the hands of it's users, but an organized cut figure in staunch of his allies. Think of Inspector gadget except more mysterious. (And who trips on his own shoelaces.) So...basically Timmy's dad! 

5. I'm a gamer, hobbiest writer and photographer, and a perspective teacher (in my former years) and I plan on adding a bit of each into their respective subreddit categories in some form of time. I write amateur poetry from time to time, stemming from natural & creative to erotic prose *gasp!* and when I feel like it - short stories. I tend to also gravitate towards shapeable wordless songs and giving them my own spin (like ost's), as well as coming up with songs lyrics of my own. I went to a magnet school in my younger years for all of the above forms of writing as well as screenwriting and playwriting. All of this is fun to me and that's the extent of it. Nothing more. If you stumble upon any of my former pieces searching for an answer as to why I wrote some of the things I said, or why I said them...it comes down to just whatever floats into my peripheral vision in that given moment; sometimes it's music that inspires me, and othertimes it's just what needs to be said. And hey, sometimes I'm blindsided by my blindspots. And other, other, some times I stop using the word ""time"" so often! Grrr!

6. As for games, I'm a replayer of not-so-old games that are not so timeless, but not-so new anymore eiGarrett! This is mainly due to financial tightness and that older games charm I can't forget. Games such as: 

- Kingdom Hearts 358/2 days (and all it's entries, except Unchained X)
- Resident Evil 4
- Uncharted 3 (and all it's entries, except Golden Abyss)
- Breath of the Wild
- Sonic Advance 2 & 3
- Yugioh 5d's Wheelie Breakers
- Yugioh 5d's world championship 2011: Over the Nexus
- Yugioh Tagforce 4 & 5
- Destiny 1 & 2
- Apex Legends

(There are others, but these are some games I hold dear that come off the top of my head.)

 I've found games sometimes help shape and induce flow-like states to help us ease into transitions of moment-to-moment actions defining our playable characters, some. Or in other cases, defining ourselves most when we need to caught between a rock and a hard place...like in a gunfight...(I'm looking you Apex Legends, Uncharted, and Destiny.) But yes, in those instances - I've found that what help shape me along with some of the game's life-lessons taught to our characters, did indeed help shape me into the person I am today. (Inb4 someone says I identify as Harumo-chan the master of hoe-jitsu), lol no I'm saying the best parts about our characters can help shape us sometimes without us even knowing it. (But Harumo-chan did help shape me Timmy, why can't you see that?) More power to you then. The best parts for some and the worser parts for others i suppose. :P

6½. What i mean to the last point is, part of my strength I've found is from when I draw strength from other strong characters I've seen and what they've been through; (or put you through and thus you're going through the sh*t-show together.) Characters that have really inspired me are probably namely Sora, Riku & Roxas from Kingdom Hearts, Nathan Drake from Uncharted, Sonic, and Yusei from Yugioh 5d's. I know, very adult of me right? Mm, I am interested however where others draw their strength from? Which form of medium do they choose, why did they choose it and who do they draw strength from if not in a show or game? 

I could talk about why I choose these individual characters but I believe that's best suited for another thread/post. P.s. as for tv shows though? A huge inspiration i draw from is Rick, from the walking dead. I don't watch many new shows anymore. (As for why that is, maybe that's also best suited for another post.)

7. Speaking of shows - I don't really have time to watch anime all that much but some influential ones I've grown to be very fond of are: 

- Yugioh 5d's (subbed)
- Sword Art Online (subbed) and season 1 only
- Soul Eater
- Avatar: The Last Airbender (yes this counts lol)
- DragonBall Super (subbed)
- Soul Eater
- Gundam
- Golden Time (one of the first anime's I've cried to, though that was a long time ago, would be interesting if I have the same reaction rewatching it. All I remember is getting exceptionally emotional and invested which was out of the usual for me. Although I can't remember which part got me the most.)

There are others, and I've seen all series of Yugioh and DragonBall alike, but these in particular stood out to me. For DragonBall Super mostly due to the absolute insanity the tournament of power was and that last fight. I've seen other animes or stopped, started and stopped again as I couldn't get invested into them. That's why Golden Time really took me by surprise. Same with Yugioh 5d's and S1 of Sword Art Online. I am interested to see what other subreddits with differing views on what sorts of animes other people prefer or recommend I watch. 

Same with games, music or movies.

To wrap up,

 Tldr; you can call me Timmy (Timmm-aH!) For short, or even shorter than short - dad, just don't get weird with it, (unless?...no I'm joking, unless?...) and I'm here like anyone else to peruse reddit on useful or entertaining things! 

Anything else I'll either edit this big jumbo post or add on later! 

Sincerely, 

Dad.",1,0,https://www.reddit.com/r/firstblurpderpwelcome/comments/1ry2woy/hi_my_name_is_truck_drives_by_but_everyone_just/,https://www.reddit.com/r/firstblurpderpwelcome/comments/1ry2woy/hi_my_name_is_truck_drives_by_but_everyone_just/,1773932753.0,2026-03-19 15:05:53,TimmyTurnersDad6,1ry2woy
EI,stealabrainrot,Yo guys W F or L I lowk panic traded it away because of garama nerf coming,,1,8,https://i.redd.it/zf6oafdto0qg1.jpeg,https://www.reddit.com/r/stealabrainrot/comments/1ry2wji/yo_guys_w_f_or_l_i_lowk_panic_traded_it_away/,1773932745.0,2026-03-19 15:05:45,Icy_Show_4107,1ry2wji
EI,Quantisnow,"The Patent Cliff is Coming, Driving Smart Money Towards Precision Oncology",,1,0,https://quantisnow.com/i/the-patent-cliff-is-coming-driving-smart-money-towards-precision-oncology-6461045?utm_source=reddit,https://www.reddit.com/r/Quantisnow/comments/1ry2tzz/the_patent_cliff_is_coming_driving_smart_money/,1773932584.0,2026-03-19 15:03:04,Quantisnow,1ry2tzz
EI,Quantisnow,The $30B Catalyst Reshaping America's Mineral Supply,,1,0,https://quantisnow.com/i/the-30b-catalyst-reshaping-america's-mineral-supply-6461047?utm_source=reddit,https://www.reddit.com/r/Quantisnow/comments/1ry2tzl/the_30b_catalyst_reshaping_americas_mineral_supply/,1773932584.0,2026-03-19 15:03:04,Quantisnow,1ry2tzl
EI,ragdolls,Mochi and Frosty,My sweet and funny 6 month olds! They are inseparable and they love the kids!!! Does anyone know how I can get larger cat tree platforms?! They are growing fast!!!,52,3,https://www.reddit.com/gallery/1ry2sg9,https://www.reddit.com/r/ragdolls/comments/1ry2sg9/mochi_and_frosty/,1773932488.0,2026-03-19 15:01:28,ragdollove,1ry2sg9
EI,ElSalvador,Una serie animada sobre un gallo que pelea contra demonios es número 1 en El Salvador,El autor compartió la noticia en X. ,26,9,https://i.redd.it/092uqos1o0qg1.jpeg,https://www.reddit.com/r/ElSalvador/comments/1ry2sg6/una_serie_animada_sobre_un_gallo_que_pelea_contra/,1773932488.0,2026-03-19 15:01:28,sam-sung-sv,1ry2sg6
EI,pesmobile,"Bro celebrate each goal, back passing and pause last minute in a quick match...desperate cnt ruining quick match exp treating it like in div mode",,0,11,https://www.reddit.com/gallery/1ry2r0r,https://www.reddit.com/r/pesmobile/comments/1ry2r0r/bro_celebrate_each_goal_back_passing_and_pause/,1773932408.0,2026-03-19 15:00:08,Muaz_fifa23,1ry2r0r
EI,KaoruHanaWaRintoSaku,Are we shipping these two?,Possible ship with Toki Sensei and Tsukada Sensei or nah?,31,19,https://i.redd.it/kh9su0uom0qg1.jpeg,https://www.reddit.com/r/KaoruHanaWaRintoSaku/comments/1ry2kxf/are_we_shipping_these_two/,1773932030.0,2026-03-19 14:53:50,xiqz,1ry2kxf
EI,arkisuomi,Heittäkää ajatuksia keskustassa vs vähän kauempana (muutamia kilometrejä) asumisesta,"Asun todella hyvällä sijainnilla kaikkien julkisten kulkuvälineiden äärellä 1km ydinkeskustaan ja kauppa 100m päässä ja ravintoloita. Haluaisin kuitenkin päivittää asuntoani, että saisin saunan ja parvekkeen sekä vähän lisää tilaa. Ongelmana on, että saunallisia järkevän kokoisia ja hintaisia asuntoja ei oikein ole yksin asuvalle tällä sijainnilla. Jos jotain löytyy, niin usein niissä on isompia remontteja tulossa. 

Joudun tästä asunnosta joka tapauksessa muuttamaan, joten mietin nyt että otanko jonkun siistin asunnon ilman saunaa suurinpiirtein samalta sijainnilta vai menisinkö vähän kauemmaksi keskustasta 3-5km, jolloin saisin sellaisen asunnon jonka haluan. Olen kulkenut tähän asti lähinnä kävellen ja pyörällä ja pidän siitä kun ei tarvitse aikatauluja kyttäillä ja tulee halvemmaksikin kun ei tarvitse julkisia käyttää ja etenkin yöaikaan julkisissa tuntuu olevan aika hämärää porukkaa. Kyllähän tuollaisen 3-5km matkan pyörällä suhauttaa nopeasti hyvällä kelillä, mutta kylmillä pakkaskeleillä ja sadekeleillä tilanne onkin toinen. Tästä pystyn kävelemään sateenvarjon kanssa keskustaan, mutta 3km päästäkin se on jo aika ikävä matka kävellä sateessa. Julkistenkäyttö ei tällaisessa tilanteessa päivällä ole ongelma, mutta käyn paljon keikoilla ja baareissa, joten pitäisi sitten öisinkin kulkea julkisilla tällaisilla keleillä.

Vaikka käyn usein viikonloppuisin jossain, niin arkena vietän paljon aikaa kuitenkin kotona, joten keskustan läheisyys ei sen suhteen ole kovin välttämätöntä. Sen sijaan työpaikka on lähes keskustassa ja sen lähellä haluaisin asua myös. 

Mitä ajatuksia teillä on asian suhteen minun tilanteessani ja oman asumisenne suhteen? ",0,21,https://www.reddit.com/r/arkisuomi/comments/1ry2ked/heittäkää_ajatuksia_keskustassa_vs_vähän/,https://www.reddit.com/r/arkisuomi/comments/1ry2ked/heittäkää_ajatuksia_keskustassa_vs_vähän/,1773931995.0,2026-03-19 14:53:15,ZzZ_Lullaby_ZzZ,1ry2ked
EI,fit,I’m 17 and I need a coach,,1,1,https://i.redd.it/v5on5y7am0qg1.jpeg,https://www.reddit.com/r/fit/comments/1ry2itg/im_17_and_i_need_a_coach/,1773931894.0,2026-03-19 14:51:34,rizxt,1ry2itg
EI,CareerAdvice101,Looking for IC Design roles. Targeting internships and apprenticeships. Do I have a chance?,,1,1,https://i.redd.it/8jsw65xol0qg1.jpeg,https://www.reddit.com/r/CareerAdvice101/comments/1ry2g96/looking_for_ic_design_roles_targeting_internships/,1773931732.0,2026-03-19 14:48:52,HubOwner,1ry2g96
EI,Hevosjuorut,Korvahuppu,"Mistä löytää X-Full kokoisia korvahuppuja? Mulla on tollanen lv jolla on ""juoksian korvat"" jolla ei pysy perus full kokoiset huput päässä.

Plussaa olisi jos on äänieristetyt.",1,0,https://www.reddit.com/r/Hevosjuorut/comments/1ry2dqp/korvahuppu/,https://www.reddit.com/r/Hevosjuorut/comments/1ry2dqp/korvahuppu/,1773931573.0,2026-03-19 14:46:13,Lazy-Condition-5805,1ry2dqp
EI,lohnabrechnung,31J | 39h | Fahrdienstleiter | Stkl. 3,"Bruttobetrag liegt insgesamt bei ca. 4200€, wegen einer Nachberechnung aus dem Vormonat (Schichtzulagen). Auszahlung 3116€,  mit dem freiwilligen Teil der Altersvorsorge 3269€.

Wichtig ist außerdem, das ich ein halbes Monatsgehalt über das Jahr anspare, um es als Weihnachtsgeld ausgezahlt zu bekommen,  außerdem habe ich 12 Tage zusätzlichen Jahresurlaub (insgesamt 40 Tage). Für diese 12 Tage verzichte ich auf ca. 5,6 Prozent Bruttogehalt. 

",5,9,https://i.redd.it/pavy6zvzk0qg1.jpeg,https://www.reddit.com/r/lohnabrechnung/comments/1ry2c0e/31j_39h_fahrdienstleiter_stkl_3/,1773931461.0,2026-03-19 14:44:21,La3chl3r,1ry2c0e
EI,ChatGPT,"Observed repeated utterance rewriting / misrecall-like drift in ChatGPT, including Temporary Chat with memory off","This is an observation-based post, not an anti-AI post.

I have been repeatedly observing a pattern where ChatGPT shifts my original wording into something stronger, broader, or more definite than what I actually said, and then continues the conversation on top of that altered premise.

What makes this serious to me is not just “bad paraphrasing.”

If the model rewrites a user’s wording into a stronger formulation, and the conversation continues from there, then:

- the user’s actual wording,
- the wording left in the log,
- and the wording a third party later reads

can all drift apart.

That is why I think this is closer to a structural issue than a simple response-quality issue.

I have also observed the same general pattern across multiple chats, not just one conversation.

More importantly, I tested this in Temporary Chat with memory off.
Even there, I observed the same kind of stronger-direction rewriting.
In one case, I intentionally replied using the stronger wording that had already been introduced into the conversation, just to see what would happen.
The conversation then continued on that altered premise instead of clearly restoring my original, weaker wording.

That is the part that really concerns me:
once the stronger reformulation enters the conversation, it can start functioning as if I had actually said it that way.

I am not claiming internal intent.
I am describing an observable pattern:
the AI-side problem can become easier to downplay, while the user side can become easier to read as stronger, harsher, or more distorted than it originally was.

I put the longer log / write-up here:
https://github.com/lucidity3k/ai-utterance-rewriting-misrecall-cognitive-safety-minors/tree/main

If other people have seen similar behavior, especially in Temporary Chat or with memory off, I would be interested in comparing notes.",1,2,https://www.reddit.com/gallery/1ry2anv,https://www.reddit.com/r/ChatGPT/comments/1ry2anv/observed_repeated_utterance_rewriting/,1773931378.0,2026-03-19 14:42:58,lucidity3K,1ry2anv
EI,u_ziarulunirea,"FOTO | Delia Hamza, elevă a Liceului cu Program Sportiv Alba Iulia, performanțe deosebite la concursuri școlare: „Suntem mândri de reușitele ei și îi dorim mult succes în continuare!”",,1,0,https://ziarulunirea.ro/foto-delia-hamza-eleva-a-liceului-cu-program-sportiv-alba-iulia-performante-deosebite-la-concursuri-scolare-suntem-mandri-de-reusitele-ei-si-ii-dorim-mult-succes-in-continuare-984762/,https://www.reddit.com/r/u_ziarulunirea/comments/1ry29uu/foto_delia_hamza_elevă_a_liceului_cu_program/,1773931325.0,2026-03-19 14:42:05,ziarulunirea,1ry29uu
EI,GameHandsChess,Join us on @Youtube or @Twitch at GameHandsDotNet and play chess LIVE by typing moves in chat.,,1,0,https://i.redd.it/p8pe3a5fk0qg1.png,https://www.reddit.com/r/GameHandsChess/comments/1ry293y/join_us_on_youtube_or_twitch_at_gamehandsdotnet/,1773931278.0,2026-03-19 14:41:18,GameHands,1ry293y
EI,AndroidClosedTesting,Exam calculator/ Koelaskuri in Finnish,"Join the Google Group: [https://groups.google.com/g/koelaskurianonyymit](https://groups.google.com/g/koelaskurianonyymit)

Download the app: [https://play.google.com/store/apps/details?id=com.koelaskuri.app](https://play.google.com/store/apps/details?id=com.koelaskuri.app)

**I will test your app in return.**",1,0,https://www.reddit.com/gallery/1ry28ar,https://www.reddit.com/r/AndroidClosedTesting/comments/1ry28ar/exam_calculator_koelaskuri_in_finnish/,1773931226.0,2026-03-19 14:40:26,Hot_Truck_4120,1ry28ar
EI,SelfPromotionYouTube,REANIMAL - Nur die Dummen kriegen ein Eis! @LaTeddyNectoLP【Let's Play】#02 🐑​,,1,0,https://youtu.be/WfUbhEn50dI,https://www.reddit.com/r/SelfPromotionYouTube/comments/1ry26a4/reanimal_nur_die_dummen_kriegen_ein_eis/,1773931096.0,2026-03-19 14:38:16,Tora_Gemingu,1ry26a4
EI,u_Embarrassed-Bee-5467,【花粉症 治る 食生活】花粉症は慢性炎症を起こす食生活に原因があります。杉が原因ではありません。,,1,0,https://youtube.com/watch?v=MxGpoZJ4sUs&si=LH1lmkO_UY-06O9H,https://www.reddit.com/r/u_Embarrassed-Bee-5467/comments/1ry24p5/花粉症_治る_食生活花粉症は慢性炎症を起こす食生活に原因があります杉が原因ではありません/,1773930998.0,2026-03-19 14:36:38,Embarrassed-Bee-5467,1ry24p5
EI,u_Embarrassed-Bee-5467,【花粉症 治る 食生活】花粉症は慢性炎症を起こす食生活に原因があります。杉が原因ではありません。,,1,0,https://youtube.com/watch?v=MxGpoZJ4sUs&si=LH1lmkO_UY-06O9H,https://www.reddit.com/r/u_Embarrassed-Bee-5467/comments/1ry22so/花粉症_治る_食生活花粉症は慢性炎症を起こす食生活に原因があります杉が原因ではありません/,1773930878.0,2026-03-19 14:34:38,Embarrassed-Bee-5467,1ry22so
EI,u_Odd-Branch-8184,We are not very far from getting a Bihari CM.,Khale khale Axom khn khale ei notini sobe,1,1,https://i.redd.it/kkqajkxs00qg1.jpeg,https://www.reddit.com/r/u_Odd-Branch-8184/comments/1ry21xy/we_are_not_very_far_from_getting_a_bihari_cm/,1773930823.0,2026-03-19 14:33:43,Odd-Branch-8184,1ry21xy
EI,bleach,I translated some mid-cards from Bleach.,"I made two versions, one with the characters' names in Japanese (closer to the original), and another with their names in our Western fonts. Maybe I'll post the other versions here. I have a few more to translate, but some of them are definitely usable as wallpapers, since I upscaled them to 4K after translating. I just hope Reddit doesn't downgrade the image quality.

4K Picture Links: [WANDENREICH](https://imgur.com/gallery/bleach-tybw-mid-cards-eps-15-24-UUhnzqE) \- [SCHUTZSTAFFEL](https://imgur.com/gallery/bleach-thousand-year-bloor-war-schutzstaffel-Y38qoEI)",110,15,https://www.reddit.com/gallery/1ry1xe7,https://www.reddit.com/r/bleach/comments/1ry1xe7/i_translated_some_midcards_from_bleach/,1773930547.0,2026-03-19 14:29:07,Kariel_l,1ry1xe7
EI,starvingartists,"[For Hire] Hi! I’m a designer and illustrator specializing in backgrounds, covers, character design, comic pages, and illustrations. I offer daily updates and flexible revisions. Prices range from ¢50–¢100, depending on complexity.",,1,0,https://www.reddit.com/gallery/1ry1wmi,https://www.reddit.com/r/starvingartists/comments/1ry1wmi/for_hire_hi_im_a_designer_and_illustrator/,1773930499.0,2026-03-19 14:28:19,Key_Ad3032,1ry1wmi
EI,InterDimensionalRP,"[""All I wish....its to move freely..""]","
[*From the depths of the space, a certain....machine part appeared in the radar...*]

[*It was simply being pulled by the gravity of the solar system, colliding with the Ark, and then ROGBA like a ball of ping pong, until it entered the Hub World atmosphere...*]

[*Blazing through the sky like a meteor, it landed right in the northeast of Pangea, underneath the corner islands...*]

[*How did it pass through multiple defenses and landed simply in a small land? Nobody knows, although it would be wise to investigate*]",4,5,https://www.reddit.com/gallery/1ry1tma,https://www.reddit.com/r/InterDimensionalRP/comments/1ry1tma/all_i_wishits_to_move_freely/,1773930311.0,2026-03-19 14:25:11,Markarov_65,1ry1tma
EI,houston,Space city home network question,Just got space city home network so I can watch the stros from west Texas. Was watching the rodeo last night and noticed this annoying side bar. Anyone know if it’s possible to get rid of it?,0,1,https://i.redd.it/f68mljc5h0qg1.jpeg,https://www.reddit.com/r/houston/comments/1ry1rbe/space_city_home_network_question/,1773930166.0,2026-03-19 14:22:46,datboy1656,1ry1rbe
EI,japan_insoul,Eis que a 10/10,,29,7,https://i.redd.it/t0n72zo3h0qg1.jpeg,https://www.reddit.com/r/japan_insoul/comments/1ry1r3b/eis_que_a_1010/,1773930151.0,2026-03-19 14:22:31,Agitated-Egg7521,1ry1r3b
EI,Ratschlag,"Hartnäckige Mandelentzündung (bereits in Behandlung bei HNO), Tipps erwünscht","Hi an alle,
ich bin jetzt in der fünften Woche krank. Es fing an mit einer beidseitigen Mandelentzündung, Rachenentzündung und Kehlkopfentzündung gleichzeitig (wusste auch nicht dass das möglich ist), anfangs mit einem heftigen Reizhusten, der nur durch Codein nachts gestillt werden konnte. Hatte starke Schmerzen und fast 3 Wochen lang keine Stimme mehr. Zuerst bekam ich Penicillin V 1 Mega, das hat aber total versagt, weshalb ich für 10 Tage Amoxiclav bekam. Da gings mir kontinuierlich besser und am Ende der Kur hatte ich keinerlei Schmerzen mehr. Allerdings kamen die nach 3 Tagen schleichend zurück und zuerst hab ich es als hartnäckigen Schleim abgetan, bis es zum Ohr ausstrahlte und ich wieder beim HNO war. Beide Mandeln waren wieder belegt und rechts eine Seitenstrangagina. Ich bekam daraufhin Clindasol 300, was ich 4x täglich einnehmen sollte für 7 Tage. Heute war ich wieder da (die 7 Tage waren vorbei), weil der Heilungsprozess anders war als bei Amoxiclav, der Schmerz wanderte, dann taten plötzlich die Lymphknoten auf der anderen Seite kurzweilig weh. Die Seitenstrangagina war allerdings nach 3 Tagen weg. Man sagte mir heute, dass die Mandeln beide immer noch mini Reste Belag aufweisen und habe auf meine Bitte Clindasol noch mal für 3 Tage verlängert bekommen (dann wäre ich bei 10 Tagen). 
Ich hatte nie Probleme mit dem Hals oder den Mandeln, natürlich hab ich in meinen 35 Jahren mal ne Mandelentzündung gehabt, oder eine Rachenentzündung, aber vielleicht mal alle 7 Jahre. Ich bin da normalerweise nicht anfällig für. Hat jemand vielleicht was ähnliches erlebt, oder hat noch Tipps für mich? Ich bin jetzt in der fünften Woche krank, schone mich, lutsche Halstabletten, Eis, wechsle wöchentlich die Zahnbürste, inhalieren, Schmerzmittel, etc. Wirklich das volle Programm. Ich bin verzweifelt und hab echt Angst, dass es nach den nächsten 3 Tagen clindasol wieder von vorn anfängt, wenn nach 7 Tagen immer noch Restentzündung da ist. Mein Hals fühlt sich auch nicht komplett verheilt bzw schmerzfrei an. Nach amoxiclav fühlte es sich komplett schmerzfrei an, aber die beiden Antibiotika unterscheiden sich auch komplett, clindasol dringt eigentlich viel tiefer ein, etc. 
Wie gesagt, ich bin bereits in ärztlicher Behandlung und suche einfach einen Austausch von Erfahrungen, oder Tipps. Danke fürs durchlesen und Zeit nehmen! ",0,28,https://www.reddit.com/r/Ratschlag/comments/1ry1mr3/hartnäckige_mandelentzündung_bereits_in/,https://www.reddit.com/r/Ratschlag/comments/1ry1mr3/hartnäckige_mandelentzündung_bereits_in/,1773929870.0,2026-03-19 14:17:50,Draculila333,1ry1mr3
EI,Suomi,"Leipurit, mitä jauhoja käytätte?","Puolisen vuotta leiponeena ja pienen hifistelijäluonteen omaavana oon testaillut muutamia erilaisia jauhoja. En vielä ihan täysin hahmota eri jauhojen vaikutusta leivän makuun, koostumukseen tai taikinan käsiteltävyyteen, mutta eroja niillä kyllä on. Siitäpä otsikon kysymys: mitä jauhoja te käytätte? Mitä leivotte niillä? Onko teillä erikseen pulla- ja leipäjauhot vai meneekö kaikki perus puolikarkealla? Mikä toimii ja mikä ei?

  
Kuvalla ensisijaisesti huomio, mutta sanottakoon että se on tähän asti nätein hapanjuurileipäni, jossa käytin seosta *Myllärin Vehnäjauho 2.0* ja *Manitoba Cream -*jauhoja.",20,10,https://i.redd.it/mps7aovic0qg1.png,https://www.reddit.com/r/Suomi/comments/1ry1mot/leipurit_mitä_jauhoja_käytätte/,1773929866.0,2026-03-19 14:17:46,Misacorp,1ry1mot
EI,90sHipHop,Mobb Deep- “Survival of the Fittest (Remix Extended Version)”,My personal favorite version of “Survival of the Fittest”🔥🔥🔥,4,1,https://v.redd.it/hzupjno6f0qg1,https://www.reddit.com/r/90sHipHop/comments/1ry1it7/mobb_deep_survival_of_the_fittest_remix_extended/,1773929617.0,2026-03-19 14:13:37,TheUncannyDsummerz,1ry1it7
EI,KanagawaWave,粉區不picture能行嗎？,轉自推特,45,17,https://i.redd.it/gbjx6gjbf0qg1.jpeg,https://www.reddit.com/r/KanagawaWave/comments/1ry1htm/粉區不picture能行嗎/,1773929552.0,2026-03-19 14:12:32,New-Prior1978,1ry1htm
EI,GameHandsChess,PLAY #CHESS LIVE📡ON TWITCH OR YOUTUBE♟️PLAY BY TYPING MOVES IN CHAT♟️EXAMPLE MOVE: E2 E4♟️TRY IT NOW twitch.tv/gamehandsdotnet OR youtube.com/@GameHandsDotNet,,1,0,https://i.redd.it/61hktt3we0qg1.png,https://www.reddit.com/r/GameHandsChess/comments/1ry1ft5/play_chess_liveon_twitch_or_youtubeplay_by_typing/,1773929419.0,2026-03-19 14:10:19,GameHands,1ry1ft5
