bank,subreddit,title,selftext,score,num_comments,url,permalink,created_utc,created_date,author,id
EI,Vinyl_Jazz,"Texas Twister, redux - Don Wilkerson","This pickup from the Pittsburgh George collection is getting so much time on the table.  I can't think of anything I've bought in awhile that stays in the now playing pile for so long.  Sides 1 and 2 are completely different vibes, and Side 1 is what I go to most frequently.

  
Dig it!

[https://youtube.com/playlist?list=PLCN6G\_aYeGR3fTIL0W-o5eNgDmGKzGWkp&si=Qf7-g-EqWLbm4ex\_](https://youtube.com/playlist?list=PLCN6G_aYeGR3fTIL0W-o5eNgDmGKzGWkp&si=Qf7-g-EqWLbm4ex_)",3,0,https://www.reddit.com/gallery/1s0a0u5,https://www.reddit.com/r/Vinyl_Jazz/comments/1s0a0u5/texas_twister_redux_don_wilkerson/,1774146620.0,2026-03-22 02:30:20,austingonzo,1s0a0u5
EI,SaoPauloFC,"Fair Play fora de campo: São Paulo fortalece laços com Palmeiras e presidentes trocam camisas. ""Futebol vai além das quatro linhas."" diz torcedor.","""A gente acredita no fair play e na boa relação institucional entre os clubes. Nosso compromisso é com a integração do clube, o espetáculo fica por conta da comissão técnica."" Afirma o presidente do São Paulo após fortalecer laços com o Palmeiras e trocar camisas.",28,19,https://i.redd.it/ls0eac8qciqg1.jpeg,https://www.reddit.com/r/SaoPauloFC/comments/1s0a0mr/fair_play_fora_de_campo_são_paulo_fortalece_laços/,1774146605.0,2026-03-22 02:30:05,Grouchy-Echo3194,1s0a0mr
EI,HeatedRivalryTVShow,Spotted Ksenia as bg extra in adults!,"had to pause bc I thought I recognised her lol! She had a few speaking lines and was reoccurring throughout the ep, but not much else.",21,0,https://i.redd.it/elmtbuygciqg1.jpeg,https://www.reddit.com/r/HeatedRivalryTVShow/comments/1s09zk0/spotted_ksenia_as_bg_extra_in_adults/,1774146519.0,2026-03-22 02:28:39,flavourtown420,1s09zk0
EI,Princession_Orchestra,School Uniforms - Original design drawing by Shimazaki Mari,https://twitter.com/MariShimazaki/status/2035540604655132820,7,3,https://i.redd.it/cpf0bknbciqg1.jpeg,https://www.reddit.com/r/Princession_Orchestra/comments/1s09yxa/school_uniforms_original_design_drawing_by/,1774146470.0,2026-03-22 02:27:50,gianben123,1s09yxa
EI,AcquireStartup,selling this twitter account,fan account and high engagement. visible top search w/ active likers. organic followers🔥,1,0,https://i.redd.it/lzskq3n7ciqg1.jpeg,https://www.reddit.com/r/AcquireStartup/comments/1s09ygs/selling_this_twitter_account/,1774146431.0,2026-03-22 02:27:11,rhizuo,1s09ygs
EI,Brawlstars,Here to ruin your day,"Did you know that Gadgets and Starpowers are off center on the quick selection screen? As you can see, the gadgets are placed higher than starpowers, and the second image it's how they should look",0,1,https://www.reddit.com/gallery/1s09vvj,https://www.reddit.com/r/Brawlstars/comments/1s09vvj/here_to_ruin_your_day/,1774146228.0,2026-03-22 02:23:48,Fantastic-Whole902,1s09vvj
EI,arquitetura,"RRT de gestão ou execução, eis a questão!","Pessoal, preciso de uma ajuda para entender uma situação com minha obra.

Contratamos uma arquiteta para cuidar da construção da nossa casa. Porém, ela quer emitir apenas uma RRT de gestão/gerenciamento, e não de execução da obra. Ao mesmo tempo, o profissional que aprovou o projeto na prefeitura está registrado lá como responsável pela execução, mas quem de fato vai tocar a obra é ela.

Ficamos confusos com isso. Quais riscos podemos ter nessa configuração? Existe algum problema em ela não querer assumir a RRT de execução? Pode ser por questões trabalhistas com empreiteiros?

Ela é experiente, temos boas referências, mas estamos nesse impasse e queremos entender melhor antes de seguir.

Alguém já passou por algo parecido ou pode dar uma orientação?

Obrigada!",1,2,https://www.reddit.com/r/arquitetura/comments/1s09psl/rrt_de_gestão_ou_execução_eis_a_questão/,https://www.reddit.com/r/arquitetura/comments/1s09psl/rrt_de_gestão_ou_execução_eis_a_questão/,1774145748.0,2026-03-22 02:15:48,tenhoumapergunta,1s09psl
EI,vinyl,Does anyone know what this record is or the story behind it,"Used picture disk I found at the local record store, so there’s no jacket cover art for me to go off of. Appears it came it in 1978, and it’s songs from various artists instead of just one. 

Anyone know what this is for? Why pizza? And who that person might be on the opposite side? ",9,8,https://www.reddit.com/gallery/1s09nkk,https://www.reddit.com/r/vinyl/comments/1s09nkk/does_anyone_know_what_this_record_is_or_the_story/,1774145575.0,2026-03-22 02:12:55,purplehorseneigh,1s09nkk
EI,Valheim_Seeds,5 bosses really close together.,"igsnwWAp7u

https://preview.redd.it/ljd641u69iqg1.png?width=4096&format=png&auto=webp&s=04a6c20318f63047cf1f3be60ebebe83079c1332

",5,1,https://www.reddit.com/r/Valheim_Seeds/comments/1s09m4r/5_bosses_really_close_together/,https://www.reddit.com/r/Valheim_Seeds/comments/1s09m4r/5_bosses_really_close_together/,1774145458.0,2026-03-22 02:10:58,OkStrategy685,1s09m4r
EI,BatmanArkham,Arkham knight finally 960%,,27,6,https://i.redd.it/m6j0j03x8iqg1.jpeg,https://www.reddit.com/r/BatmanArkham/comments/1s09kg2/arkham_knight_finally_960/,1774145323.0,2026-03-22 02:08:43,Big16_sg,1s09kg2
EI,hairstylist,"🇨🇦 gals that are self employed, do you pay into EI, why or why not?",,1,5,https://www.reddit.com/r/hairstylist/comments/1s09k9a/gals_that_are_self_employed_do_you_pay_into_ei/,https://www.reddit.com/r/hairstylist/comments/1s09k9a/gals_that_are_self_employed_do_you_pay_into_ei/,1774145309.0,2026-03-22 02:08:29,plastikbaginthewind,1s09k9a
EI,InterDimensionalRP,Khakrahk ( aka the Scarlet King ) tears out one of the eyes on his chest,"“Ok this should be good.”

(( I couldn’t find a picture of this actually happening ))",2,10,https://www.reddit.com/gallery/1s09ih5,https://www.reddit.com/r/InterDimensionalRP/comments/1s09ih5/khakrahk_aka_the_scarlet_king_tears_out_one_of/,1774145164.0,2026-03-22 02:06:04,Which-Emu8951,1s09ih5
EI,animequestions,So you're telling me right wing fujoshis exist? That is something I never even heard of nor imagine existed at all.,,0,0,https://i.redd.it/8i1b7pdq7iqg1.png,https://www.reddit.com/r/animequestions/comments/1s09fl2/so_youre_telling_me_right_wing_fujoshis_exist/,1774144925.0,2026-03-22 02:02:05,FlowerOk7957,1s09fl2
EI,GayRateMe,"22m, would I catch your eye if we passed by?",,4,1,https://www.reddit.com/gallery/1s09cd1,https://www.reddit.com/r/GayRateMe/comments/1s09cd1/22m_would_i_catch_your_eye_if_we_passed_by/,1774144684.0,2026-03-22 01:58:04,maelstrom_blues,1s09cd1
EI,GojiCenter,Just made a new hybrid bc why not,hope u guys like him,5,6,https://i.redd.it/y2gy8ww46iqg1.jpeg,https://www.reddit.com/r/GojiCenter/comments/1s099qj/just_made_a_new_hybrid_bc_why_not/,1774144474.0,2026-03-22 01:54:34,Traditional-Depth976,1s099qj
EI,PrintedCircuitBoard,"[Review Request] Audio & LED Controller Board (ESP32-S3) - ""Insane Sound System V5""","Hey everyone,

I'm currently working on the 5th iteration of my custom audio and LED controller board and could really use some experienced eyes for a design and routing review.

Just a quick background: The old version was a bit of a through-hole/DIP monster. For V5, I've switched completely to SMD to shrink things down properly. The board is about 40% smaller now.

**The Setup:** The brain of the operation is an ESP32-S3 DevKit (handling WiFi/Home Assistant). It uses UART to control a secondary, bare ESP-WROOM-32D that acts strictly as a Bluetooth audio receiver. The S3 also directly toggles the EN/IO0 pins on the WROOM for flashing and resets.

For audio, the I2S signal from either the S3 or the WROOM goes into an SN74CB3Q3257 hardware multiplexer. That feeds a PCM5102A DAC and an onboard TPA3110 Class-D amp.

For power, the board runs on a 24V main supply which directly drives the 3 LED zones (WS2805, RMT). For the logic and audio side, an MP1584 buck converter steps the voltage down and feeds two separate AMS1117-3.3V LDOs, so the audio and the ESPs get their own separated, clean 3.3V supplies. There are also three TMP102 temp sensors (I2C) and some PWM fan control.

**Where I'm unsure and need your feedback:**

1. Two ESPs on one board: Both ESP modules overhang the edge of the board, so there are no PCB antenna keep-out zones to worry about. But do you see any issues with how the UART and reset lines are routed between the two MCUs?
2. Audio noise & grounding: Because of the I2S mux, the amp, and two actively transmitting ESPs, I really want to avoid digital noise and hum in the speakers. Does my ground plane separation make sense here?
3. Power delivery: The 24V LED traces, the amp, and the ESPs pull a decent amount of current. Are my trace widths sufficient for the 24V and 3.3V rails, and are the decoupling caps (especially around the LDOs) placed correctly?
4. High-speed routing: Is it okay to route the I2S lines through the multiplexer like this?

It would be awesome if someone could take a look. Please be brutal and honest with the critique!

Thanks & cheers",1,4,https://www.reddit.com/gallery/1s09846,https://www.reddit.com/r/PrintedCircuitBoard/comments/1s09846/review_request_audio_led_controller_board_esp32s3/,1774144341.0,2026-03-22 01:52:21,BabeinlovexD,1s09846
EI,Topster,Some of my favourite albums of all time,Thoughts? ,7,9,https://i.redd.it/oq7bhlfg5iqg1.png,https://www.reddit.com/r/Topster/comments/1s095va/some_of_my_favourite_albums_of_all_time/,1774144160.0,2026-03-22 01:49:20,Sofi---,1s095va
EI,pistols,Star 30M,"Just bought this at a gun show. Just looking to get more information if anyone knows anything about them, ik there from Spain and were used by military and police.",2,0,https://www.reddit.com/gallery/1s08zph,https://www.reddit.com/r/pistols/comments/1s08zph/star_30m/,1774143680.0,2026-03-22 01:41:20,Direct_Scar_8287,1s08zph
EI,sanfrancisco,You had one job…,I hope they got a discount…,192,31,https://i.redd.it/h9lf1aej3iqg1.jpeg,https://www.reddit.com/r/sanfrancisco/comments/1s08xmf/you_had_one_job/,1774143515.0,2026-03-22 01:38:35,Senchent,1s08xmf
EI,PokemonPocketTradeCo,"LF Serena, Will, Irida, PW Iono",,1,1,https://i.redd.it/dpokpk8b2iqg1.png,https://www.reddit.com/r/PokemonPocketTradeCo/comments/1s08skt/lf_serena_will_irida_pw_iono/,1774143102.0,2026-03-22 01:31:42,loverofloving,1s08skt
EI,CanadaJobs,Contract workers,"Hi all, 

I just wanted to issue a warning to anyone working on contract. 

If you are on a contract of less than 1 year do NOT take a second job. You’ll be stuck working both jobs indefinitely if you don’t want it impacting EI. 

I’m currently working 2 jobs (70 hours a week) one is an accounts payable job which is full time with a contact until the end of June and the other is a a minimum wage job that makes up the rest of the hours. 

The EI office basically told me I’m stuck working these hours because quitting would put me in an unemployment situation given my contract, even though it’s full time. Where I live pretty much every job is contract based so getting a non contract job is impossible without cutting my pay down to minimum wage basically. 

So don’t do it. Even if the pay is low, you’ll be stuck in this hell. ",0,11,https://www.reddit.com/r/CanadaJobs/comments/1s08sk3/contract_workers/,https://www.reddit.com/r/CanadaJobs/comments/1s08sk3/contract_workers/,1774143101.0,2026-03-22 01:31:41,RogueCanadia,1s08sk3
EI,PTCGPTrading,"LF Serena, Will, Irida, PW Iono",,1,0,https://i.redd.it/nks24cc72iqg1.png,https://www.reddit.com/r/PTCGPTrading/comments/1s08s47/lf_serena_will_irida_pw_iono/,1774143066.0,2026-03-22 01:31:06,loverofloving,1s08s47
EI,BookshelvesDetective,Partner said to post mine!,,3,3,https://www.reddit.com/gallery/1s08rx7,https://www.reddit.com/r/BookshelvesDetective/comments/1s08rx7/partner_said_to_post_mine/,1774143049.0,2026-03-22 01:30:49,Good-Examination-919,1s08rx7
EI,TcgPtrade,"LF Serena, Will, Irida, PW Iono",,0,0,https://i.redd.it/7e1fht132iqg1.png,https://www.reddit.com/r/TcgPtrade/comments/1s08rn8/lf_serena_will_irida_pw_iono/,1774143026.0,2026-03-22 01:30:26,loverofloving,1s08rn8
EI,PTCGPocketTrading,"LF Serena, Will, Irida, PW Iono",,0,2,https://i.redd.it/js9og9902iqg1.png,https://www.reddit.com/r/PTCGPocketTrading/comments/1s08rae/lf_serena_will_irida_pw_iono/,1774143000.0,2026-03-22 01:30:00,loverofloving,1s08rae
EI,peliculas,La secretaría de salud en México tapó la cara de Mira en el ramen de Kpop Demon Hunters.,,493,13,https://i.redd.it/ogxpmc9s0iqg1.jpeg,https://www.reddit.com/r/peliculas/comments/1s08maj/la_secretaría_de_salud_en_méxico_tapó_la_cara_de/,1774142588.0,2026-03-22 01:23:08,FlimsyOperation5107,1s08maj
EI,computadores,Preciso de ajuda pra montar meu primeiro PC.,"Estou me planejando para montar meu primeiro PC e estou me preparando pra gastar em volta de 6mil pra montar uma máquina que faça o que meu Series X já faz (menos o 4k que na realidade nem existe nos consoles se formos sinceros).

Então eis a build que alucinei depois de pesquisar bastante e ver preço.

CPU: Intel Core I5 12400F - razão: ví que ele suporta tanto DDR4 quanto DDR5;

GPU: Radeon RX 9060 XT 16gb - razão: ví que é o melhor custo benefico pra jogar em 1440p, que é a resolução do meu monitor que uso o xbox e um notebook;

Placa mãe: alguma H610 (não sei a diferença entre os modelos e marcas) - razão: preço;

Fonte: MSI MAG AB650N 650w - razão: ja vi em vários locais que é de boa qualidade e vi que essa potência me permite fazer upgrade no futuro;

SSD: nvme m.2 Adata Legend ou Kingston NV3 - razão: não sei, fui pelos mais vendidos e bem avalidados, até agora não consegui entender as dieferenças entre cada tipo;

Ram: 2x T-Force Vulcan Z 8gb DDR4 - razão: achei o preço ""bom"" e vi em alguns posts que a TEAMGROUP é uma marca boa de memória ram;

Meu racional foi basicamente a possibilidade de fazer upgrade daqui uns 2-3 anos sem precisar trocar o processador logo de cara, apenas investindo numa placa mãe mais cara da linha B e memória ram DDR5. Vi que o soquete LGA1700 da Intel ainda suporta até a 14a geração de processadores, então tenho espaço e liberdade pra upgrade... eu poderia gastar a mesma coisa em um Ryzen AM4 mas não seria tão fácil ($) fazer um upgrade para um AM5 sem trocar inclusive o processador (eu acho). Também não sei se a escolha específica desas peças foi uma boa escolha, aceito recomendações de peças de boa qualidade e custo benefício. Eu gostaria de passar pelo menos uns 5 anos sem mexer nesse setup, aparte do upgrade de placa mãe e memória ram.

É basicamente isso, não sei se faz sentido pois eu tenho 0 experiência com isso. Então qualquer informação é válida, agradeço de antemão pela paciência e disponibilidade de quem responder. ",1,1,https://www.reddit.com/r/computadores/comments/1s08kjw/preciso_de_ajuda_pra_montar_meu_primeiro_pc/,https://www.reddit.com/r/computadores/comments/1s08kjw/preciso_de_ajuda_pra_montar_meu_primeiro_pc/,1774142452.0,2026-03-22 01:20:52,CrisJaks,1s08kjw
EI,softwaregore,Everything works fine,Capture card decided to freak out and give me a beautiful video feedback (It's flashing reallllly fast),10,0,https://i.redd.it/7a5zehd2zhqg1.png,https://www.reddit.com/r/softwaregore/comments/1s08fkz/everything_works_fine/,1774142064.0,2026-03-22 01:14:24,BuggedCookieDev,1s08fkz
EI,Silverbugs,Great addition to my stack,Just got into silver stacking and got what I feel is great deal today. Old guy had 53oz listed on Craigslist for $3000. Offered him $2500 and he took it. He actually had 54 but one was fake from eBay(stuck to magnet). More than I wanted to buy right now but feel like I couldn’t pass it up.,28,9,https://www.reddit.com/gallery/1s08ehb,https://www.reddit.com/r/Silverbugs/comments/1s08ehb/great_addition_to_my_stack/,1774141977.0,2026-03-22 01:12:57,hurleyshark,1s08ehb
EI,OCD,1AM and I'm up nearly in tears over thoughts about breaking the new phone I got today - just need to get this off my chest and advice would help ❤️,"## To give some context: 
I'm writing this on the tail-end of one of the worst weeks I've had so far this year, with a lot of work stress and a recent relapse that I'm physiologically recovering from. I understand I might be in a vulnerable space but it started even before ei got my new phone. On Wednesday I went on a riverboat tour with colleagues and people were asking me to take photos of them, passing me their phones, I ended up snapping at them every time. I was so certain that I'd end up throwing their phones into the river. I wasn't able to even take my own phone out. 

**Why the phone is important:** I have had a history of really intense EUPD and I carry a lot of responsibility for harming myself and frequently throwing phones against the wall (up until 3 years ago, I'd been through 7 phones in about 2.5/3 years) often as a way to demonstrate the hatred I used to have for myself(stupid, I know!). 

For the last 3 years, I've managed to look after and pay for my own phone and be independent (paying myynownnrent etc) after doing really well and holding down a job for the first time in my 20's. My contract just ended, and I'm so proud of myself for having looked after 2 phones (and now getting an upgrade on my contract) despite having dropped my old phone last week while riding to work, and shattering the screen, it works, but it's barely holding together. 

**The new phone:** My new phone is the new Samsung Flip phone, and I can't hold it without getting beyond panicked and flustered with thoughts of just snapping it. I can feel it in my hands, there's so little stopping me to just snapping it and I keep telling myself I don't want to do it but there's a part of me who feels like I deserve it. I have so much to pay back to myself in terms of how poorly I've treated myself and been so self destructive, I feel like I don't deserve to finally enjoy the things I've worked so hard to actually achieve. 

I can't return the phone, and I guess I can't run away from this. I need to figure out how to navigate this. I know it probably sounds so stupid, but",5,5,https://www.reddit.com/r/OCD/comments/1s08dyw/1am_and_im_up_nearly_in_tears_over_thoughts_about/,https://www.reddit.com/r/OCD/comments/1s08dyw/1am_and_im_up_nearly_in_tears_over_thoughts_about/,1774141935.0,2026-03-22 01:12:15,chronically-iconic,1s08dyw
EI,bilgisayar,alinir mi bunlar,,0,10,https://i.redd.it/gk4q906lyhqg1.jpeg,https://www.reddit.com/r/bilgisayar/comments/1s08cuq/alinir_mi_bunlar/,1774141849.0,2026-03-22 01:10:49,OliveOk4130,1s08cuq
EI,Japananimetravel,⚓ Azur Lane POP UP SHOP in Marui 2026,"⚓ Azur Lane POP UP SHOP in Marui 2026  
  
📅 Event Period  
• Tokyo: April 17 – April 26, 2026  
• Hyogo: May 15 – May 24, 2026  
  
📍 Shinjuku Marui Men / Kobe Marui  
  
✨ Highlights  
• “After bath” themed newly drawn illustrations  
• Exclusive merch featuring new visuals  
• Random bonus clear cards (6 designs)  
• Large character panels on display  
• Special present campaign available  
  
ℹ️ Event hours may differ from store hours  
  
💙 Don’t miss these fresh Azur Lane visuals & goods! 👇  
[https://animemaps.com/event/%E3%80%8C%E3%82%A2%E3%82%BA%E3%83%BC%E3%83%AB%E3%83%AC%E3%83%BC%E3%83%B3%E3%80%8Dpop-up-shop-in%E3%83%9E%E3%83%AB%E3%82%A4-2026/](https://animemaps.com/event/%E3%80%8C%E3%82%A2%E3%82%BA%E3%83%BC%E3%83%AB%E3%83%AC%E3%83%BC%E3%83%B3%E3%80%8Dpop-up-shop-in%E3%83%9E%E3%83%AB%E3%82%A4-2026/)  
  
\#azurlane #animeevent #popupshop #otaku #anime  
  
©Manjuu Co.,Ltd. & Yongshi Co.,Ltd.",3,0,https://www.reddit.com/gallery/1s08ci2,https://www.reddit.com/r/Japananimetravel/comments/1s08ci2/azur_lane_pop_up_shop_in_marui_2026/,1774141822.0,2026-03-22 01:10:22,AnimeMaps,1s08ci2
Mashreq,UAE,banks flagging Interactive Brokers transfers?? Should I be worried?,"just got hit with one of those bank compliance checks and honestly not sure how serious this is.
My bank (Mashreq) emailed me saying there’s “unusual activity” on my account because of transfers to Interactive Brokers. Total transfers are around ~290k AED over time.


Would really appreciate hearing real experiences, especially from people using IBKR in the UAE.

I already replied to the mail but i need to know should i get serious worry about??",10,20,https://i.redd.it/cx60dx1cfhqg1.jpeg,https://www.reddit.com/r/UAE/comments/1s05yej/banks_flagging_interactive_brokers_transfers/,1774135395.0,2026-03-21 23:23:15,Jolly-Piccolo-9799,1s05yej
Mashreq,UAE,Built a luxury fashion brand solo in uae → hit 40k AED last month first quarter. Need advice scaling + getting my first loan,"Eek I’m not sure if this is the right subreddit sorry, I will try my luck here for answers. First hope all are safe and Eid Mubarak 

I’m 21F based in Dubai and I’ve built a luxury fashion brand I’m so in love with. Little bit about the structure - it’s online, no employees, no funding, I wanted this since forever and made enough with tuition money and just bet on myself. I handle everything: designing, sourcing, ads, content, social media, suppliers, and customers.

Alhamdulillah, last month I did 40,000+ AED in revenue after about a quarter of building this seriously. Now I want to scale with more designs, pop-up in Dubai and Doha, influencers, increase ad spend I estimate I need around 70,000 AED.

Problem I have:

•	no credit history (only debit that too 4 months only)

•	no loans

•	no formal employment i only have this rakez registration for the business

I’m unsure how to secure funding via bank loan someone please advise because it seems there is no luck without a formal employment ;( I bank with mashreq only I’m not looking for investors now it’s just i need to find a way to get a loannn",1,6,https://www.reddit.com/r/UAE/comments/1s032qe/built_a_luxury_fashion_brand_solo_in_uae_hit_40k/,https://www.reddit.com/r/UAE/comments/1s032qe/built_a_luxury_fashion_brand_solo_in_uae_hit_40k/,1774127899.0,2026-03-21 21:18:19,Prestigious-Big-9462,1s032qe
