bank,subreddit,title,selftext,score,num_comments,url,permalink,created_utc,created_date,author,id
ENBD,StockMarketIndia,Decline in IDBI Bank Share Price as Privatisation Plans Face Roadblocks Amid Divestment Constraints,"The Government of India holds a stake of 45.48% in IDBI Bank along with the Life Insurance Corporation (LIC) owning a stake of 49.24%. Together, they own 94.72% of IDBI Bank. Earlier, the Press Trust of India issued a report stating the duo were planning to sell 60.72% (comprising 30.48% held by the government and 30.24% by LIC) of the total equity of IDBI Bank, leaving them with combined holdings of 33.99% (15% held by GOI and 19% held by LIC)

  
They had floated an Expression of Interest in Oct’22 and the Department of Investment and Public Asset Management (DIPAM) confirmed that the interested parties had bid by 6^(th) February 2026. Bidders included Fairfax Financial Holdings, Emirates NBD and Kotak Mahindra Bank. The three bidders were allowed to move to the final stage of the process after completing due diligence and clearing the technical bid stage.  
  
The government was pursuing the sale as part of its wider strategic divestment programme, aimed at boosting non-tax revenues and scaling back its involvement in non-core sectors. The divestment gained traction after IDBI exited the Reserve Bank of India’s Prompt Corrective Action (PCA) framework in March 2021, following improvements in asset quality, capital adequacy, and profitability. Exiting the PCA was seen as a crucial step to attract private investors and renew interest in the strategic sale.  
  
However, market sentiment made the share extremely volatile recently in response to reports about the divestment process. On Friday, 13th Mar 2026, IDBI Bank shares closed at 92.18. The share then opened at 82.12 and fell further to close at 76.31 on Monday, 16th Mar.  
  
The decline of close to 17% in a single day occurred after reports suggested that the government may reconsider or halt their decision to divest in the bank after the financial bids put in by the potential buyers were below the reserve price.  
  
IDBI Bank didn’t confirm or deny the reports, they commented that the divestment process is a confidential strategic process being undertaken by the Indian government and that they would immediately inform stock exchanges of all material developments and price-sensitive information in compliance with the Securities and Exchange Board of India’s Listing Obligations and Disclosure Requirements regulations. They also mentioned that the report to the bidding process and does not involve any regulatory or legal proceedings. A clarification was provided after a query from BSE seeking comments on a media report that the government may scrap the majority stake sale due to the low-price bids.  
  
Investors are likely to benefit from increased clarity once the government gives an official statement on the future of the disinvestment process which has been watched keenly by hawkish investors who have been expecting the operational efficiency to increase.  
  
Despite the bank’s total income declining to ₹8,282 crore in Q3 FY26 from ₹8,565 crore in Q3 FY25, and interest income fell to ₹7,074 crore from ₹7,816 crore a year ago, the earnings report showed the profitability of the lender increased by 1.42% from Q3 FY25’s earnings.

The gross non-performing asset (GNPA) ratio represents the total value of all loans and advances that have ceased to generate income for a bank, usually when interest or principal payments are overdue for over 90 days. The gross non-performing asset ratio improved to 2.57% as of December 31, 2025, from 3.57% in the year-ago period. This indicates better credit quality and lower risk as there is a lower chance of loan losses. However, the net non-performing asset remained at 0.18%. The net NPA shows the actual risk of loan losses to the bank as it reduces provisions made for losses from the GNPA and accrued interest on non-performing loans that the bank has not recognized as income (Interest suspense). The Net NPA of 0.18% shows minimal actual loan loss risk even if some loans are “non-performing” i.e. the borrower fails to pay interest or principal for 90 days or more and the bank cannot recognize the interest as income.  
  
The bank’s capital adequacy ratio (CAR) strengthened to 24.63% at the end of December 2025, up from 21.98% a year earlier. The CAR measures how well a bank can absorb losses while continuing operations. An improvement shows that the bank has a strong capital buffer making it safe to invest and deposit in due to the stability.  
  
On the other hand, return on assets (ROA) moderated to 1.83% in Q3 FY26, compared with 1.99% in Q3 FY25. The ROA measures how efficiently a bank is using its assets to generate profit. Here, we are able to notice that the bank has relatively become less efficient as the bank earned slightly less profit per ₹100 of assets than a year ago. The ROA may have declined despite flat profits because total assets may have grown faster than profits.



*Bibliography:*  
Press Trust of India: [https://www.ptinews.com/story/business/idbi-bank-strategic-sale-scrapped-as-financial-bids-below-reserve-price-sources/3464548](https://www.ptinews.com/story/business/idbi-bank-strategic-sale-scrapped-as-financial-bids-below-reserve-price-sources/3464548)

Economic Times: [https://economictimes.indiatimes.com/industry/banking/finance/banking/idbi-bank-divestment-scrapped-lic-govt-owned-bank-clarifies-after-stock-tanks/articleshow/129604537.cms?from=mdr](https://economictimes.indiatimes.com/industry/banking/finance/banking/idbi-bank-divestment-scrapped-lic-govt-owned-bank-clarifies-after-stock-tanks/articleshow/129604537.cms?from=mdr)

India Today: [https://www.indiatoday.in/business/market/story/idbi-bank-share-price-crashes-16-percent-why-is-the-stock-down-today-2882641-2026-03-16](https://www.indiatoday.in/business/market/story/idbi-bank-share-price-crashes-16-percent-why-is-the-stock-down-today-2882641-2026-03-16)  
  
MarketControl: [https://www.moneycontrol.com/news/business/economy/financial-bids-from-kotak-emirates-nbd-fairfax-received-for-idbi-bank-privatisation-13816353.html](https://www.moneycontrol.com/news/business/economy/financial-bids-from-kotak-emirates-nbd-fairfax-received-for-idbi-bank-privatisation-13816353.html?utm_source=chatgpt.com)",1,0,https://www.reddit.com/r/StockMarketIndia/comments/1rzp6u5/decline_in_idbi_bank_share_price_as_privatisation/,https://www.reddit.com/r/StockMarketIndia/comments/1rzp6u5/decline_in_idbi_bank_share_price_as_privatisation/,1774092788.0,2026-03-21 11:33:08,CarsAndCapital,1rzp6u5
ENBD,GearsOfWars,"The Best Xbox 360 Exclusive Games That Are Backwards Compatible Right Now!THE GAME THRIFTERMarch 20, 2026 at 02:00PM",,1,0,https://www.youtube.com/embed/RPZ9HOqF0IA,https://www.reddit.com/r/GearsOfWars/comments/1rz5mte/the_best_xbox_360_exclusive_games_that_are/,1774034605.0,2026-03-20 19:23:25,GameProfessional,1rz5mte
ENBD,UAEcreditcards,"Saves on hotels, car rentals, and stays local and beyond!","Good evening, 
So many sites and services it's overwhelming, suggest one that offers promotionals and credit cards offers! 

I have:
- SIB cashback 
- Mashreq noon
- ENBD UEMAAR

Thank you 

",1,0,https://www.reddit.com/r/UAEcreditcards/comments/1rz0y2i/saves_on_hotels_car_rentals_and_stays_local_and/,https://www.reddit.com/r/UAEcreditcards/comments/1rz0y2i/saves_on_hotels_car_rentals_and_stays_local_and/,1774024020.0,2026-03-20 16:27:00,PepticUlcer27,1rz0y2i
ENBD,dubai,Transfer from MBank Business Account to another bank account,"Hi! Does anyone here know how to transfer funds from a MBank Business account to another bank account like Emirates NBD? The app doesn’t show up any “add beneficiary” option or at least I can’t find it.

TIA!

Update: nevermind, I found the desktop login. It’s only possible via desktop. Leaving this info here in case it helps someone else.",2,2,https://www.reddit.com/r/dubai/comments/1ryy1bq/transfer_from_mbank_business_account_to_another/,https://www.reddit.com/r/dubai/comments/1ryy1bq/transfer_from_mbank_business_account_to_another/,1774017542.0,2026-03-20 14:39:02,FacelessCreative,1ryy1bq
ADCB,UAE,ADCB Touch points Redemption,"Hello Everyone, 
Eid Mubarak!

Wondering what is the best way to redeem ADCB touch points? Any suggestions to make the best use out of these points (mostly for retail shopping purposes)",2,4,https://www.reddit.com/r/UAE/comments/1rzqej3/adcb_touch_points_redemption/,https://www.reddit.com/r/UAE/comments/1rzqej3/adcb_touch_points_redemption/,1774096669.0,2026-03-21 12:37:49,Character-End-8178,1rzqej3
ADCB,CPTSDmemes,"They are obsessed with their false legacy, I’m obsessed with the consciousness beyond…",,57,0,https://i.redd.it/dkw8raqvt8qg1.jpeg,https://www.reddit.com/r/CPTSDmemes/comments/1rz46s9/they_are_obsessed_with_their_false_legacy_im/,1774031305.0,2026-03-20 18:28:25,Awkward-Worth5484,1rz46s9
ADIB,PHBookClub,Selling my Pre-Loved Books,Selling some of my pre-loved books. Already switched to e-reader and might need funds. Feel free to reach out and I might include freebies too for sure buyers.,1,0,https://i.redd.it/9zlq5whjedqg1.jpeg,https://www.reddit.com/r/PHBookClub/comments/1rznirl/selling_my_preloved_books/,1774086718.0,2026-03-21 09:51:58,hauntedhalogen,1rznirl
ADIB,u_FluidStance,Desk Setup: Can you write directly on the FluidStance Dashboard & Slope Desktop Whiteboards? - YES!,"**""Is it possible to write on the Dashboard itself, or is it only possible on the Flow Cards? And for the Slate color, how do the markers look when writing on it?"" -Customer Question**

**Yes**, Our Whiteboards are made to be written directly on the Board. (White, Yellow & Slate)

**The White & Yellow Finish:** Works best with standard dry-erase markers.  
**The Slate (Gray) Finish:** If you have the Slate color, standard dry-erase won't show up as well. This board is designed for bright, wet-erase markers (we include a white one with your order to get you started). Wet-erase pops against the dark surface. 

**Create an Ecosystem for your Desktop - More than just a whiteboard**

* The Slope and Dashboard allow you to hide and tuck-away your keyboard when you are done using it to leave your desk feeling clean and organized. 
* Ditch the sticky notes and add Flow Card Mini-Magnetic whiteboards to your Slope or Dashboard. Use these to jot down daily tasks, brainstorm, or doodle while on a call. They simply snap (magnetize) in place on top of the Dashboards and Slopes.
* Add mini magnet pins (sold on our site) to hold smaller paper documents or keys.  

**Cleaning the White and Yellow Boards:** Erase your markings as soon as you don't need them to prevent ghosting. For a deep clean, our Whiteboard Kit (the Shine Spray -sold on our site-smells incredible!) works perfectly. 

**Cleaning the Slate Board:** When using the Slate whiteboards, users usually use wet-erase markers. For  your best bet, use a lightly damp, soapy rag to wipe it down. We highly recommend keeping a small spray bottle at your desk, or using our Shine Spray to keep your workspace looking spotless.

I'll drop the links to everything in the comments below! 👇

",1,1,https://www.reddit.com/gallery/1rz2g1a,https://www.reddit.com/r/u_FluidStance/comments/1rz2g1a/desk_setup_can_you_write_directly_on_the/,1774027343.0,2026-03-20 17:22:23,FluidStance,1rz2g1a
ADIB,Palestine,"dward Said and his sister, Rosemarie Said, dressed in traditional Palestinian cothing, 1940","Israel confiscated the Said house in May 1948. The Saids had fled Jerusalem earlier that April, but all their belongings were still in the house. The house and its contents remained in the possession of the so-called Custodian of Absentee Property until the early 1980s, when Menachem Begin gave it to the International Christian Embassy, a right-wing evangelical organization established in 1980 to support the Zionist state. In the 1990s, when the organization relocated, Amidar, an Israeli state-owned housing company established in 1949, was granted the property. In the early 2000s, a private real estate company, Talbeia Properties, purchased the property from Amidar, and shortly thereafter in 2005, Jewish-American financiers and brothers Arthur and Michael Fried bought it from Talbeia Properties along with 90 percent of Talbeia Properties. Wasting no time, the Fried brothers hired an architect to add two more floors to the edifice, transforming the two-story Said family home into a four-story condominium apartment building to be managed as short-term family vacation rentals.3

Like thousands of Palestinians’ properties in Jerusalem (see The West Side Story, Part 4: The Erasure of the New City and Its Transformation into Jewish West Jerusalem), the Israeli state and its associated bodies confiscated the Saids’ dream family home (see The Sakakini House: Tracing Israel’s Bureaucracy of Collective Confiscation through One Treasured Home) in Talbiyya, casting them into exile, where they remain to this day. Not a single Said remains in Jerusalem today; their descendants are now scattered across the Palestinian diaspora, including in Jordan, Lebanon, Switzerland, the UK, Canada, and the US. The majority are located in Amman and Beirut.

The Said family fled their home in Talbiyya in the months leading up to May 1948 and sought refuge in Cairo, where they had opened a branch of their family business years prior. But their lives in Egypt were also interrupted by the 1952 revolution, which sent them back to Ramallah, then to Amman, Beirut, the United States, and beyond throughout the Palestinian diaspora. While Edward Said is undoubtedly the most famous Said, this Photo Essay tells the story of his aunt and uncle’s family—who lived in the same house in Talbiyya—and whose descendants now live in Amman, Jordan.

Before their flight from Jerusalem in the months leading up to May 1948, members of the Said family were part of the city’s Christian aristocracy. Affluent, well-traveled, and educated in the city’s British institutions, this Protestant Anglican family originally hailed from the large Khleif tribe of Nazareth. The story goes that one of their ancestors fought with his brothers and moved to Jerusalem in the mid-19th century, starting his own family line: the Saids. Prior to the Nakba, the family’s most renowned members, cousins, and businessmen, Wadie and Boulos Said, were born in the Old City around the turn of the 20th century. The two went into business together, and their relationship grew even closer when Boulos married Wadie’s sister Nabiha. The descendants of Wadie and his wife, Hilda, would come to include writers, intellectuals, and academics, most notable among them Edward Said. Their less famous cousins, Boulos and Nabiha’s children, would preserve the family business first established in Jerusalem into the 21st century.

The Said family home is located today at 10 Brenner Street, just down the road from the prime minister’s house, along Chille Square, a park in the Talbiyya neighborhood of what is now West Jerusalem. But when Wadie and Boulos purchased the lot in the late 1920s, the land surrounding it was largely empty, and its prospects for development seemed limitless. They decided to build a two-story family home large enough to accommodate their families, which included 13 children. Boulos and Nabiha had twins Evelyn and Yousef, George, twins Adib and Labib (who died in infancy), Margaret (who died as a teenager), and twins Albert and Robert. Wadie and Hilda had Edward, Jean, Rosemary (Rosy), Joyce, and Grace. The cousins grew up in Jerusalem within the walls of their modern home built with the majestic Jerusalem stone. Though their school was on the other side of the Old City, their favorite place to meet and play with their friends, the YMCA, was less than a 10-minute walk from their new home in the flourishing New City.

“Not being able to go back to our home in Talbiyya was something my father was never able to accept and part of why he died so young at 51 of heart failure,” Dina, 65, Albert’s daughter with Sylvia Salah from Ramallah, shared. Dina and her two siblings, Basim and Hala, were born in Cairo a few years after the Nakba.

Jordan annexed East Jerusalem between 1948 and 1967, and so it was possible for the Saids to periodically return to the West Bank for visits while they lived in Cairo.

Though each of Boulos’s sons and their descendants secured Western nationalities—either Swiss, Canadian, or American—and could therefore visit Jerusalem as tourists of those countries, none of them was ever able to enter their home in Talbiyya again. But they have each stood outside it, that home their grandparents and great-grandparents built for them nearly a century ago, and Basim’s son Najib, 35, a British citizen, even met the Jewish Israeli-American family from Brooklyn that now inhabits his family home. “He told me he bought it fair and square from the Israeli state,” Najib explained about his conversation with the occupier of his grandfather’s home in 2016. “And when I didn’t argue and instead asked if I could enter to see where my grandfather grew up, he refused and said: ‘Don’t worry, we’re taking care of the house now.’”

When Dina, as a US citizen, went to see her father’s home in December 2011, she looked at the limestone wall her father had climbed when he was a child, the only part of the redesigned building that still retained her grandfather and grandmother’s original imprint. “I felt I wasn’t allowed to be there; I felt I wasn’t allowed to touch the stone, sit on it, or enter the building. I felt the Israelis were watching and would detain me for trespassing,” Dina shared. “All I could do was kneel down on the sidewalk across from the house, under the pine trees where my father and his siblings and cousins played. I cried a long lament of a mourning that my father was never allowed to have.”

That was the last time Dina returned to Jerusalem. “I bid farewell to my father and Jerusalem that day. So long as they’re still there, still in our home, I can never go back, not even to visit. It’s too painful.”

Source:

https://www.jerusalemstory.com/en/article/said-family-jerusalem-denied-return-their-home-talbiyya-perpetual-trauma-exile   

https://commons.wikimedia.org/wiki/File:SaidSis.jpg#mw-jump-to-license",323,6,https://www.reddit.com/gallery/1ryz2rk,https://www.reddit.com/r/Palestine/comments/1ryz2rk/dward_said_and_his_sister_rosemarie_said_dressed/,1774019894.0,2026-03-20 15:18:14,Sun_fire_,1ryz2rk
EI,YarnAddicts,My wool lucky bag from Hobbii,I was impatient to know .... not too bad ! I like the colours. And will be looking for ideas for the big wool one ! ,1,0,https://i.redd.it/sl09nbndreqg1.jpeg,https://www.reddit.com/r/YarnAddicts/comments/1rzss7u/my_wool_lucky_bag_from_hobbii/,1774103104.0,2026-03-21 14:25:04,RunningMistiChat,1rzss7u
EI,tumblrhelp,Is this a new kind of scam?,"Followed me yesterday and sent the top most message to me, is this some kind of scam? ",2,2,https://i.redd.it/qog9jgqrqeqg1.png,https://www.reddit.com/r/tumblrhelp/comments/1rzsph9/is_this_a_new_kind_of_scam/,1774102901.0,2026-03-21 14:21:41,Crowcuss,1rzsph9
EI,mildlyinfuriating,Impossible to open easily and usually just get stabbed,,4,4,https://i.redd.it/xzb5sxpgqeqg1.jpeg,https://www.reddit.com/r/mildlyinfuriating/comments/1rzso0k/impossible_to_open_easily_and_usually_just_get/,1774102796.0,2026-03-21 14:19:56,victoriaholtopalfan,1rzso0k
EI,1to1reps,"Clean Streetwear Rotation — Hoodies, Knitwear & Winter Layers","Carhartt Yellow Jacket

Bright standout piece with solid workwear feel. Durable and great for bold fits.

W2C: https://weidian.com/item.html?itemID=7603744208

Carhartt Navy Zip-Up Jacket

Clean and practical, smooth zip with sturdy material. Great everyday layer.

W2C: https://weidian.com/item.html?itemID=7572050432

Acne Studios Pink Sweatshirt

Soft and minimal with a nice color pop. Good for relaxed outfits.

W2C: https://weidian.com/item.html?itemID=7569748460

Supreme Gray Jacket

Simple and clean with decent branding. Lightweight and easy to wear.

W2C: https://weidian.com/item.html?itemID=7550696146

Ralph Lauren Navy Blue Sweater

Classic knit with clean logo. Comfortable and versatile.

W2C: https://weidian.com/item.html?itemID=7601773569

Balenciaga Black Sweatshirt

Oversized fit with premium feel. Minimal but stylish.

W2C: https://weidian.com/item.html?itemID=7618381887

Represent White Sweatshirt

Clean aesthetic with good fabric weight. Works well in simple fits.

W2C: https://weidian.com/item.html?itemID=7617882544

Hellstar Black Sweatshirt

Bold graphics with strong streetwear vibe. Decent quality overall.

W2C: https://weidian.com/item.html?itemID=7537400819

Essentials Gray Sweatshirt

Soft and oversized, very comfortable. Minimal branding looks good.

W2C: https://weidian.com/item.html?itemID=7528717008

Carhartt Blue Jeans

Durable denim with classic workwear fit. Breaks in nicely over time.

W2C: https://weidian.com/item.html?itemID=7572005136

Cole Buxton White Sweater

Clean and minimal design. Good for layering and everyday wear.

W2C: https://weidian.com/item.html?itemID=7528845432

Essentials White T-Shirt

Basic essential, soft and easy to style. Good everyday tee.

W2C: https://weidian.com/item.html?itemID=7524339542

Stussy Yellow Shirt

Bright and eye-catching. Great for standout summer fits.

W2C: https://weidian.com/item.html?itemID=7613538135

Represent Vintage White T-Shirt

Vintage wash gives a nice look. Comfortable and stylish.

W2C: https://weidian.com/item.html?itemID=7630160070

Balenciaga Blue T-Shirt

Oversized fit with clean branding. Premium streetwear vibe.

W2C: https://weidian.com/item.html?itemID=7522470523

Burberry White Beach Shorts

Lightweight and stylish. Perfect for summer wear.

W2C: https://weidian.com/item.html?itemID=7524362518

Godspeed Black T-Shirt

Simple with bold graphic touch. Good for casual fits.

W2C: https://weidian.com/item.html?itemID=7630150158

Hellstar White T-Shirt

Clean base with standout design. Nice quality overall.

W2C: https://weidian.com/item.html?itemID=7540742668

Chrome Hearts Black T-Shirt

Bold branding with premium look. Great statement tee.

W2C: https://weidian.com/item.html?itemID=7524214316

AMIRI Blue T-Shirt

Stylish and modern design. Comfortable and good quality.

W2C: https://weidian.com/item.html?itemID=7636574212

GUCCI Khaki Hat

Clean accessory with subtle branding. Easy to match.

W2C: https://weidian.com/item.html?itemID=7523110377

Ralph Lauren Black Hat

Classic cap with simple logo. Great everyday piece.

W2C: https://weidian.com/item.html?itemID=7619772340

Alexander McQueen White Item

Minimal and premium aesthetic. Good addition to fits.

W2C: https://weidian.com/item.html?itemID=7619667266

Louis Vuitton Blue Item

Clean and stylish with premium vibe. Solid overall piece.

W2C: https://weidian.com/item.html?itemID=7525044106",6,1,https://www.reddit.com/gallery/1rzsm39,https://www.reddit.com/r/1to1reps/comments/1rzsm39/clean_streetwear_rotation_hoodies_knitwear_winter/,1774102659.0,2026-03-21 14:17:39,Thevoid77,1rzsm39
EI,Tampere,Leikkausjonot Pirkanmaalla (TAYS),"Oon jonossa nielurisaleikkaukseen Pirkanmaalla (TAYS / Pirha), ja kiinnostais kuulla muiden kokemuksia leikkausjonoista yleisesti.

Millaisia odotusaikoja teillä on ollut ei-kiireellisiin leikkauksiin (ENT, ortopedia tms.) ja nopeuttaako peruutuspaikat oikeasti pääsyä leikkaukseen?",3,0,https://www.reddit.com/r/Tampere/comments/1rzskaf/leikkausjonot_pirkanmaalla_tays/,https://www.reddit.com/r/Tampere/comments/1rzskaf/leikkausjonot_pirkanmaalla_tays/,1774102530.0,2026-03-21 14:15:30,DiligentPriority5477,1rzskaf
EI,snappijuorut,Henna Honkala,"En keksinyt muuta paikkaa pohtia tätä. Kysyin Ngl linkissä, et onko hän raskaana, nii nyt hän oli laittanut stooriin et ”Ngl mun yksityisasiat ei kuulu tänne” tms. Jäin siis miettii joskus, kun hän puhu jotain, et Kelasta ei saa tukea enempää, jos on kaks naista lapsen kanssa samassa taloudessa. Se ei liittynyt mihinkään niin jäi jotenki mieleen ja joo sen sisko hoitaa kai jotain nukkea, niin sen takia varmaan ostaa vauvajuttuja, mutta osti täs joskus jotain vauvan lusikoita useita nii mietin, et meinaako hän lisääntyä. Ei oo tosiaan fresh miettiä onko joku raskaana, et jos tää on asiaton nii modet varmaan poistaa. Hän on kyllä juonut alkoholia ja ei vaikuta elämänhallinta ihan siltä, että tohon talouteen kannattais vauvaa hankkia, mut kerta tää on juorukanava niin kai täällä saa tämmöstä pohtia ✌️🫣",2,2,https://www.reddit.com/r/snappijuorut/comments/1rzsk7c/henna_honkala/,https://www.reddit.com/r/snappijuorut/comments/1rzsk7c/henna_honkala/,1774102523.0,2026-03-21 14:15:23,Responsible_Tiger740,1rzsk7c
