bank,subreddit,title,selftext,score,num_comments,url,permalink,created_utc,created_date,author,id
EI,Unity3D,Gameready Anime - Kimono Girl,"hi, this is my cutesy Gameready kimono Girl :)

* **Available here:** [**https://fab.com/s/e23ae864b04d**](https://fab.com/s/e23ae864b04d)",2,0,https://www.reddit.com/gallery/1s0c2s3,https://www.reddit.com/r/Unity3D/comments/1s0c2s3/gameready_anime_kimono_girl/,1774152881.0,2026-03-22 04:14:41,Kasugaa,1s0c2s3
EI,elderscrollslegends,Link to download for Print and play,"# Link to download for Print and play

I apologize for spamming posts, but here is a link to download the cards, if youd like to print them using a company i recommend using

[https://www.makeplayingcards.com/](https://www.makeplayingcards.com/)

 MPC is what i used to print off my first foil card as seen in the images however the foil which I believe was the flaming foil print didnt look very good and made the image to dark, I also noticed there were problems with the card art not fitting evenly, however I fixed it for the most part so if you try to print with mpc or aura you shouldnt run into that issue. If you decide youd like to have foil cards and want to go with mpc i recommend just using the silver foil and increasing the brightness of the cards to 15-20%, they should be as dark.



or

[https://aura-print.com/usahttps://aura-print.com/usa](https://aura-print.com/usahttps://aura-print.com/usa)

 Aura-Print has much higher quality, and if you want to ""spot foil"" they can do it unlike mpc, its a fair bit more expensive, but honestly if you want a cool foil version of the card to collect they are the way to go for sure.



a side note, I'm still working on the website with the deck builder its 60% finished, however if you want to just have all the files use the link. if you have any suggestions or want any custom cards just let me know.

the correct size to print out the cards is 63mm x 88mm roughly the size of magic the gathering cards for reference.

[https://mega](https://mega/) .nz/file/e9oFARaD#eOv4ORatOc8yvL3fZFfxtNvizEi-4K8hXXdr8K46RSI

https://preview.redd.it/wszhd380viqg1.jpg?width=672&format=pjpg&auto=webp&s=48965e52f5e370a99cde288bdb3a3a1fc7cd44f3

https://preview.redd.it/e407nsm0viqg1.jpg?width=1161&format=pjpg&auto=webp&s=ef2bc39de99363c05bdfcc03ea9e5d46cabf106e

  


[](https://preview.redd.it/link-to-download-for-print-and-play-v0-4aiiloo6siqg1.jpg?width=672&format=pjpg&auto=webp&s=fc2bdf2c4212b38df8dd6fb23a82bb9b8c5064b1)

[](https://preview.redd.it/link-to-download-for-print-and-play-v0-lnvmtkl7siqg1.jpg?width=1161&format=pjpg&auto=webp&s=7db9b32c09ed36fef5af184bafec87e467f6f4e1)",5,0,https://www.reddit.com/r/elderscrollslegends/comments/1s0c1hc/link_to_download_for_print_and_play/,https://www.reddit.com/r/elderscrollslegends/comments/1s0c1hc/link_to_download_for_print_and_play/,1774152771.0,2026-03-22 04:12:51,Appropriate-Wing-809,1s0c1hc
EI,emergencyintercom,Guests,"Tbh I liked the guests in the last ep but does anyone else find it so annoying that they never introduce their guests? They know that most of the viewers wouldn’t be Neighbors fans, they’d be ei fans. I don’t know who the hell those ppl are. 

I did look them up after and watched Neighbors it’s actually pretty good lol ",0,1,https://www.reddit.com/r/emergencyintercom/comments/1s0bpo5/guests/,https://www.reddit.com/r/emergencyintercom/comments/1s0bpo5/guests/,1774151767.0,2026-03-22 03:56:07,No-Dress4233,1s0bpo5
EI,3dsqrcodes,G.O.D: Mezame yo to Yobu Koe ga Kikoe [G.O.D.: Heed the Call to Awaken] (Easy Mode by mteam) (Japanese) & (English by Dynamic-Designs) (SNES Hack),"The Easy Mode hack is more of an Anti-Grind patch. It halves the random encounter rate, while doubling the EXP, Gold and Cosmo Stone drops. 

It works on the English translated version and the original Japanese one too! Enjoy both AND Pixel Perfect and Full Screen variants of both!",3,0,https://youtu.be/-X8HkpJ7ims?si=SGCuhg3LYUjbQOXL,https://www.reddit.com/r/3dsqrcodes/comments/1s0bpaf/god_mezame_yo_to_yobu_koe_ga_kikoe_god_heed_the/,1774151737.0,2026-03-22 03:55:37,Mumpmander,1s0bpaf
EI,CitizenWatches,Citizen in Tokyo,First time seeing Citizen in person and they have the most beautiful dials for the price. ,10,1,https://www.reddit.com/gallery/1s0bp98,https://www.reddit.com/r/CitizenWatches/comments/1s0bp98/citizen_in_tokyo/,1774151735.0,2026-03-22 03:55:35,yudhiesh,1s0bp98
EI,imouto,Caring imouto,,90,3,https://i.redd.it/royfz7uhriqg1.jpeg,https://www.reddit.com/r/imouto/comments/1s0bnc7/caring_imouto/,1774151572.0,2026-03-22 03:52:52,Big-Ask-7879,1s0bnc7
EI,garbagepailkids,Uncut series 2,,3,1,https://i.redd.it/lsg80wmeriqg1.jpeg,https://www.reddit.com/r/garbagepailkids/comments/1s0bmye/uncut_series_2/,1774151540.0,2026-03-22 03:52:20,yellow447,1s0bmye
EI,conversas,"Sobre acessibilidade, a outra rede e uma cega que talvez devesse só ir dormir, ao invés de ficar falando bobagem por aqui.","É, sou eu de novo.

Lá estava eu, conversando/tretando naquela outra rede social que vocês sabem muito bem qual é, e a outra pessoa respondeu com um meme que, devido à falta de descrição, não consegui ver. Então eu, como qualquer pessoa madura faria, fui reclamar disso por lá mesmo, expondo como isso é irritante e blá, blá, blá.

Mas então, talvez meu anjo da guarda, cansado de ver minha involução, subiu no meu ombro, e eis que eu tenho quiçá a melhor epifania da minha semana:

Vale a pena exigir qualquer coisa, mesmo que seja acessibilidade e bom senso alheio... \*No twitter\*?

Eu sei que muitos de vocês dirão que não, porque, bem, é o twitter, porra. No entanto, eu também me pergunto se nós, seres desprovidos de capacidade total ou parcial de processar o mundo por meios visuais, não merecemos ter acessibilidade até mesmo nas coisas mais ridículas, fúteis, idiotas e danosas possíveis.

Enfim, qual a vossa opinião?",4,9,https://www.reddit.com/r/conversas/comments/1s0bker/sobre_acessibilidade_a_outra_rede_e_uma_cega_que/,https://www.reddit.com/r/conversas/comments/1s0bker/sobre_acessibilidade_a_outra_rede_e_uma_cega_que/,1774151319.0,2026-03-22 03:48:39,Effective-Sweet2606,1s0bker
EI,dogsusingpillows,Velvet hippo on a pillow with his girl,,6,0,https://i.redd.it/ppbxhv6qqiqg1.jpeg,https://www.reddit.com/r/dogsusingpillows/comments/1s0bkbi/velvet_hippo_on_a_pillow_with_his_girl/,1774151312.0,2026-03-22 03:48:32,scottonaharley,1s0bkbi
EI,pitbulls,Just a girl and her pibble,,32,2,https://i.redd.it/9kqur9whqiqg1.jpeg,https://www.reddit.com/r/pitbulls/comments/1s0bjeu/just_a_girl_and_her_pibble/,1774151234.0,2026-03-22 03:47:14,scottonaharley,1s0bjeu
EI,velvethippos,Just a girl and her velvet hippo,,19,1,https://i.redd.it/c5vd6t3cqiqg1.jpeg,https://www.reddit.com/r/velvethippos/comments/1s0bisd/just_a_girl_and_her_velvet_hippo/,1774151180.0,2026-03-22 03:46:20,scottonaharley,1s0bisd
EI,fnv,Bug or failed quest?,"While doing the Wild Card : Finishing Touches, I've noticed that it's not progressing as described in most guides.

Some things of note :

\-in the El Dorado Power Station, when activating the terminal it says : ""Override Chip removed."" 

\-the securitron stops on a hill overlooking the REPCONN HQ, and can't interact it with further. 

How screwed am I? ",2,5,https://i.redd.it/p3cqwg1bqiqg1.jpeg,https://www.reddit.com/r/fnv/comments/1s0bio6/bug_or_failed_quest/,1774151171.0,2026-03-22 03:46:11,AtelierEdge,1s0bio6
EI,BudgetAudiophile,Vintage York 2405 amp,Never owned a a piece of vintage audio gear before. Sure looks nice! My uncle gave this to me too. ,2,5,https://i.redd.it/lk7ecyhpoiqg1.jpeg,https://www.reddit.com/r/BudgetAudiophile/comments/1s0bchr/vintage_york_2405_amp/,1774150635.0,2026-03-22 03:37:15,RC_car6-7lol,1s0bchr
EI,Monopoly_GO,My 5 star for your 4 star..,Play MONOPOLY GO! with me! Download it here: https://mply.io/KyrlLZ7koUA,2,4,https://www.reddit.com/gallery/1s0b7hx,https://www.reddit.com/r/Monopoly_GO/comments/1s0b7hx/my_5_star_for_your_4_star/,1774150197.0,2026-03-22 03:29:57,ReasonableOutside411,1s0b7hx
EI,Fantasy,"Two Bingo Cards, but Only One is Mine","This year I only did one card (and barely at that—it was a wild fall). But early last bingo season I told my now-partner (who doesn't use Reddit) about it and put together a card for her. I felt like it was worth sharing as well.

# My Card

https://preview.redd.it/hfwzokr56iqg1.png?width=2913&format=png&auto=webp&s=1c3141c0c5311c701a9172fe2f03a942dbb55eaf

Overall not my best year of reading for bingo. Too many books that were just fine. But last year was also unusually good, which may be skewing my feelings. Plus I foolishly thought that the PopSugar and Book Riot challenges from last year actually looked like they might be fun, unlike the last few, so I spent too much time trying to finish those.

All of my (brief) reviews can be found at [The StoryGraph](https://app.thestorygraph.com/user_reviews/smartflutist661).

* Highlights
   * **The Man from Earth** was excellent ([review](https://www.reddit.com/r/Fantasy/comments/1qt3q48/not_a_book_the_man_from_earth/)), and a welcome surprise (I was expecting much worse given the budget.)
   * I'm glad bingo finally gave me an excuse to get around to **The Road**. It blew me away. It was depressing and hopeless and shattering. One of those books that left me in a haze for hours afterward.
* Most Surprising: **Princess Holy Aura** was not nearly as deconstructive as I expected from the blurb.
* Most Disappointing: Maybe a tie between **The Other Valley** and **Piranesi**.
   * For Piranesi, I had seen a lot of glowing reviews, but while it was beautiful, nothing about the (lack of) plot or, really, character grabbed me.
   * I loved the idea of valleys bordering each other in time rather than space and was looking forward to seeing what could be done with it, but thought The Other Valley was pretentious without justification, and that it didn't handle Odile's struggle all that well. And the plot was pretty standard time-travel stuff.
* Sequels I Wish We Had: Very sad **Stars in My Pocket** never got the planned sequel. Apparently a sequel to **Asunder** is planned but has no timeline; I'll be watching...
* Most Synergy: I read The Sapling Cage (by Margaret Killjoy) for Beyond Binaries, and listened to Hermetica *read* by Margaret Killjoy.
* Bingo Failure: I was going to use **The Girl in the Tower** (Winternight book 2, Katherine Arden) for Gods & Pantheons, but unlike book 1, the Orthodox Church was more backdrop than major player, and I couldn't justify using it for hard mode. So I spent the last three days reading Asunder, which I knew within a few pages was going to count just fine.

# Her Card

https://preview.redd.it/3m7aekr56iqg1.png?width=2913&format=png&auto=webp&s=b6ab223b454f892f4ed40bfa08011b333731ea12

For my card, I make a list of 5–40ish options per square and then read what calls to me as I look through the options over the year. In contrast, this one was pre-planned: I made a list of a few books for each square that I thought she might like, from my favorites and bingo recs, and we talked through some of the options to set the whole card.

She hadn't read a *ton* of spec fic prior to this; I think every author on the card was completely unfamiliar. Her favorites were **Tress**, **Tainted Cup**, **Murder By Memory**, and **Blood Over Bright Haven.** Least favorites were **Immortal**, **Time War**, and **Earthsea** (I think those were the only three she actively disliked). She's said this has reminded her how much she enjoys reading and is looking forward to doing it again this coming bingo season, which I count as success.

She's also the second friend I've successfully gotten hooked on Guild Codex, though neither of them are close to matching my ""read the whole thing in a month"" addiction.",16,1,https://www.reddit.com/r/Fantasy/comments/1s0b3mj/two_bingo_cards_but_only_one_is_mine/,https://www.reddit.com/r/Fantasy/comments/1s0b3mj/two_bingo_cards_but_only_one_is_mine/,1774149859.0,2026-03-22 03:24:19,smartflutist661,1s0b3mj
EI,maldives,Quail eggs,"I want quail eggs n quail meat god, i saw a tiktok and they look so tasty like what. Am i tripping",1,0,https://i.redd.it/xwaky85bmiqg1.jpeg,https://www.reddit.com/r/maldives/comments/1s0b3ak/quail_eggs/,1774149827.0,2026-03-22 03:23:47,not_a_randombanana69,1s0b3ak
EI,maldives,Quail eggs,"I want quail eggs n quail meat god, i saw a tiktok and they look so tasty like what. Am i tripping",1,0,https://i.redd.it/6opriw98miqg1.jpeg,https://www.reddit.com/r/maldives/comments/1s0b2zr/quail_eggs/,1774149801.0,2026-03-22 03:23:21,not_a_randombanana69,1s0b2zr
EI,StealTheBrainrot,Selling dm me good offers. No trades,,2,0,https://www.reddit.com/gallery/1s0b1b9,https://www.reddit.com/r/StealTheBrainrot/comments/1s0b1b9/selling_dm_me_good_offers_no_trades/,1774149660.0,2026-03-22 03:21:00,JoeFssh,1s0b1b9
EI,CelebrityJets,"Kim Kardashian's Jet Took off from Tokyo, Tōkyō Prefecture, Japan.",,1,0,https://i.redd.it/nfa47gqkliqg1.png,https://www.reddit.com/r/CelebrityJets/comments/1s0b0dg/kim_kardashians_jet_took_off_from_tokyo_tōkyō/,1774149579.0,2026-03-22 03:19:39,plane-notify,1s0b0dg
EI,IMadeThis,Made a small app for kpop fans :),"It collects recent videos from up to 3 groups you follow and organizes them into categories like self-content, fancams, stage mix, etc.

The home feed only shows the last 7 days so it stays focused.  
My gems lets you save videos permanently.  
There’s also a weekly stan report showing what you watched, your viewing ratio by group, and content type breakdown.

There’s also a Shorts viewer where you can scroll short-form videos only from the idols you follow.

it’s usable in Korean and English

Idol names are still in Korean though — just a heads up.

Still pretty minimal, but I’m improving it over time!!

If you feel like trying it, I’d really appreciate it — feedback is always welcome!!

appstore :

[https://apps.apple.com/us/app/%EC%95%84%EC%9E%84%EB%8D%95/id6759539957](https://apps.apple.com/us/app/%EC%95%84%EC%9E%84%EB%8D%95/id6759539957)

playstore :

[https://play.google.com/store/apps/details?id=com.superdeveloper.imduk](https://play.google.com/store/apps/details?id=com.superdeveloper.imduk)",1,0,https://www.reddit.com/gallery/1s0awqq,https://www.reddit.com/r/IMadeThis/comments/1s0awqq/made_a_small_app_for_kpop_fans/,1774149265.0,2026-03-22 03:14:25,Glittering-Rich-2762,1s0awqq
EI,JYJ,"Yuchun to Participate in ""The Unity - Super Voices"" on July 11th in Tokyo",,1,1,https://i.redd.it/6419ivmbkiqg1.jpeg,https://www.reddit.com/r/JYJ/comments/1s0avh2/yuchun_to_participate_in_the_unity_super_voices/,1774149159.0,2026-03-22 03:12:39,TheChosenBlacksmith,1s0avh2
EI,ps2,Local game store is always buy 3 get 1 free,,38,2,https://i.redd.it/w2cv0dymjiqg1.jpeg,https://www.reddit.com/r/ps2/comments/1s0aspg/local_game_store_is_always_buy_3_get_1_free/,1774148928.0,2026-03-22 03:08:48,shiddinbricks,1s0aspg
EI,elderscrollsonline,bruh what the fuck,"https://preview.redd.it/i6mf0ra4jiqg1.png?width=1228&format=png&auto=webp&s=01c8e496cd44de48171c48d56f65ef9b07d27df0

why do they put you in a match instead of filling up the groups then putting you in a match? ESO is doing terrible with PvP content. ",0,9,https://www.reddit.com/r/elderscrollsonline/comments/1s0ara2/bruh_what_the_fuck/,https://www.reddit.com/r/elderscrollsonline/comments/1s0ara2/bruh_what_the_fuck/,1774148808.0,2026-03-22 03:06:48,Barbosa706,1s0ara2
EI,WithHarbour,Filing for EI after a layoff,"Okay so I think the most confusing thing I felt when I went through my layoff was filing for EI. I actually had no idea when the deadline was, I was lucky someone mentioned it me THREE DAYS before the deadline. Anyways, thought I'd organize the things I wish I knew about EI filing.

**1. The deadline is 4 weeks and it's not flexible** From your last day of work. Not from when you feel ready or when your ROE shows up. Miss it and you lose benefits for every day you waited. Apply now and sort the details out after.

**2. You're getting 55% of your salary, capped at $668/week** If you were making decent money before the layoff this number is going to hurt. Build it into your budget from day one so it doesn't blindside you three weeks in.

**3. Severance delays your start date** If you got a package, Service Canada may treat it as earnings and push back when your benefits actually kick in. Lump sum and salary continuance are treated differently. Worth understanding before you assume EI starts on a specific date.

**4. You have to report every two weeks — including any freelance work** EI is not a one time filing. Every two weeks you confirm hours worked and earnings. If you do any paid work and don't report it that's considered fraud. The good news is earning money doesn't automatically kill your benefits — there's a threshold before they start reducing.

**5. Set up your My Service Canada Account before you need it** Identity verification takes time. If you've never used it before it can delay your application by days. Takes 20 minutes. Do it now.

Questions in the comments, happy to help.",2,0,https://www.reddit.com/r/WithHarbour/comments/1s0ap9p/filing_for_ei_after_a_layoff/,https://www.reddit.com/r/WithHarbour/comments/1s0ap9p/filing_for_ei_after_a_layoff/,1774148637.0,2026-03-22 03:03:57,withharbour,1s0ap9p
EI,RoastMyCat,"Roast Freddy, knocked down cam and then took a dump in front of it","logged in remotely and notice cam wasn't where it needed ti be, looked at the history and caught him showing how he felt about it. video on youtube.

https://youtu.be/KrOr-BwytEI?si=huUM9gaYyJUqa4d\_",79,11,https://i.redd.it/uhcfhkwmiiqg1.jpeg,https://www.reddit.com/r/RoastMyCat/comments/1s0aoq6/roast_freddy_knocked_down_cam_and_then_took_a/,1774148591.0,2026-03-22 03:03:11,undergroundsilver,1s0aoq6
EI,teensofkolkata,DADA/DIDI NEED YOUR ADVICE,So am basically icse dichi kalke last exam..will be moving to class 11 eibar my other friends are going to cbse and some are staying in isc..ami dekhlam ei koiekdin e cbse teyh erom bnash paper dei loker 75 percent anan tough JEE so I dropped the plan for going to cbse and isc ami senior der jigesh korlam they told isc books have excess information..and last option is state board and amader eikahne kar school e I got to know school er teacher der kache porle naki project marks and all bere jabeans obvio school na giyeo bhalo ekta image toiri hobe...i request everyone bhukto bhugi to tell me either kaj ta thik korchi na ganja kheye kaj korchi.,3,12,https://www.reddit.com/r/teensofkolkata/comments/1s0aofo/dadadidi_need_your_advice/,https://www.reddit.com/r/teensofkolkata/comments/1s0aofo/dadadidi_need_your_advice/,1774148568.0,2026-03-22 03:02:48,ieatkidsfordinner123,1s0aofo
EI,WaifuDiscussions,What's a random product you've found with a Waifu slapped in front of it?,"While shopping, I've found these Chips Ahoy cookies with some random anime girl in front of it. I don't know if she's from a show, movie, game, vocaloid, or a fucking Vtuber",7,3,https://i.redd.it/mintszi8hiqg1.jpeg,https://www.reddit.com/r/WaifuDiscussions/comments/1s0aiza/whats_a_random_product_youve_found_with_a_waifu/,1774148122.0,2026-03-22 02:55:22,Yakuza-wolf_kiwami,1s0aiza
EI,Soundmap,Radiant quest issue??,Why can I evolve all these shinies (minus limp bizkit) from random ass artists but i can't evolve the shinies i actually want? they just don't appear?? ,1,3,https://i.redd.it/4tc0uex8giqg1.jpeg,https://www.reddit.com/r/Soundmap/comments/1s0af0d/radiant_quest_issue/,1774147787.0,2026-03-22 02:49:47,swerve-cityx,1s0af0d
EI,ITZY,260322 ITZY Twitter Update - ITZY 3RD WORLD TOUR <TUNNEL VISION> in SEOUL l Re-Streaming | FOCUS again with the hot <TUNNEL VISION> 🏍️ See you soon at Beyond LIVE 💘,,107,1,https://i.redd.it/c4krofh5giqg1.jpeg,https://www.reddit.com/r/ITZY/comments/1s0aepk/260322_itzy_twitter_update_itzy_3rd_world_tour/,1774147762.0,2026-03-22 02:49:22,kpopsns28,1s0aepk
EI,OmnibusCollectors,"Mount Rushmore Cubes: Gaiman, Moore, Vaughan, and Miller. What’s in yours?",Had to get creative with some of the shelving ,15,7,https://i.redd.it/xrgqnt3yfiqg1.jpeg,https://www.reddit.com/r/OmnibusCollectors/comments/1s0adu3/mount_rushmore_cubes_gaiman_moore_vaughan_and/,1774147689.0,2026-03-22 02:48:09,OddText208,1s0adu3
EI,PokemonTCGNL,"Ben ik blij dat ik meeste van deze ""PC"" kaarten voor de ""Boom"" Heb gekocht.","Na flink wat aanpoten heb ik merendeels van mijn ""PC Wishlist"" Kaarten weten te verzamelen.

Enkel voelt de huidige markt niet natuurlijk meer aan.
Ik heb bijvoorbeeld de Raikou & Suicune voor +- 2K € via ebay gekocht laatst (was al tijdje aan het zoeken naar deze set) 
Maar voor minder dan de prijs van dar setje, had ik ELK deel van de andere legends, In minder dan 3 jaar tijd...
(Niet uitslovend bedoeld, Die 2k was 1,5 maand werk bij me minimum loon baantje)

Misschien is het het feit dat Gen Z nu ""dispossable adult money"" krijgt, Of dat ""instituten"" zich hebben verdiept in de pokemon markt (betere rendementen dan veelal van de aandelen markt afgelopen jaren)
Maar het voelt gewoon niet meer natuurlijk aan, En thus hou ik mezelf voorlopig weg van de hobby.

Regelmatig spookt de gedachten om alles te verkopen toch wel door m'n hoofd, Zeker gezien het geld wat er momenteel uit te halen valt - in mijn geval - ""life changing"" kan zijn, Maar ik krijg de trigger maar niet gepulled.
Damn nostalgia.

Anyway, Ik wou dit even kwijt, Gezien ik geen vrienden heb waar ik kan mijn pokemon rants kwijt kan, lol.

Mocht je het tot hier hebben gemaakt, Heb een goede zondag & maak er wat van!

Cheers.",0,0,https://www.reddit.com/gallery/1s0adrm,https://www.reddit.com/r/PokemonTCGNL/comments/1s0adrm/ben_ik_blij_dat_ik_meeste_van_deze_pc_kaarten/,1774147683.0,2026-03-22 02:48:03,Willem_BXL,1s0adrm
EI,moviecritic,"Forgotten (2017, Dir. by Jang Hang-jun) is the wildest ride I’ve watched so far this year!","Forgotten (2017) caught me completely off guard! I watched a brief trailer for it randomly and thought why not, cool weekend watch. I wasn’t ready for any of it! I went from, “Hmmm, interesting” to “damn that’s crazy” to “whhhaaaattt the fuuhhhh” by the end! 

Really well done! I thought it maintained the intrigue / mystery pretty well throughout the film and definitely did a good job and keeping the viewer guessing. It felt a little contrived in one area of the movie but ended up making sense in the end. Great watch overall!

Solid 9.5 out of 10",1,0,https://i.redd.it/iadhp12xdiqg1.jpeg,https://www.reddit.com/r/moviecritic/comments/1s0a5mt/forgotten_2017_dir_by_jang_hangjun_is_the_wildest/,1774147004.0,2026-03-22 02:36:44,Lucky_LeftFoot,1s0a5mt
EI,relacionamentos,Me tirem uma dúvida!,"Já fiz um post há uns meses atrás sobre isso, mas vou resumir novamente. Eu namorei uma menina por quatro anos e em outubro do ano passado ela terminou comigo. Foi literalmente do nada. Ela chegou até mim e disse que não conseguia mais me amar e que por isso queria terminar. Eu não questionei a decisão dela, mas fiquei abalado, tinha planos para casar e tudo mais. 
Porém, eu tenho 100% de certeza que já fui traído por ela. Vi mensagens no celular trancada com um homem, vi trocas de mensagens dela com uma amiga onde a amiga dizia que ela me traia horrores, mensagens dela com essa mesma amiga dizendo que tinha ficado com um cara na faculdade. 
Detalhe: eu soube de tudo isso e mesmo assim não consegui ser homem suficiente pra terminar, era muito carente e na minha cabeça fazia mais sentido ficar com ela mesmo assim do que ficar solteiro. 
Eis minha dúvida, nosso término tem uns seis meses, mas nunca deixamos de nos falar (somos da mesma igreja então isso intensifica esse contato), ela vive curtindo minhas coisas, curte até foto que eu posto com outras mulheres, vive fazendo perguntas invasivas pra mim, do tipo perguntado com quem eu tô ou onde estava, vi que ela me colocou nos melhores amigos no Instagram, mas eu não vejo nada que ela posta, na verdade raramente vejo. 
Minha mãe disse que ela me colocou pra chamar atenção e que se sente culpada pelo que fez comigo, mas mesmo assim não tem interesse em mim (e que bom que não tem) , só se sente muita culpada. Desde que nós terminamos meus amigos me falam que ela vive postando foto dela, sendo que ela raramente postava quando namorávamos, e eu cheguei a conclusão que ela posta pra buscar validação de homem e de amigas. 
Ela vive dentro de um sistema religioso que ela quer sair, mas não consegue, e isso a faz ter uma vida que ela não quer viver, consequentemente ela busca essa atenção fora, segundo minha mãe. E galera, eu tô de saco cheio dela ficar me mandando mensagem como se eu fosse um burro emocional ambulante, mas eu não tenho força pra bloquear ela, mesmo querendo muito. Como vocês, a partir do meu relato, analisam essa situação? ",2,4,https://www.reddit.com/r/relacionamentos/comments/1s0a4vu/me_tirem_uma_dúvida/,https://www.reddit.com/r/relacionamentos/comments/1s0a4vu/me_tirem_uma_dúvida/,1774146942.0,2026-03-22 02:35:42,Ok-Economist-6154,1s0a4vu
EI,piscatorio,ei orochi vai tomar no cu,,32,1,https://v.redd.it/rsfai2mpdiqg1,https://www.reddit.com/r/piscatorio/comments/1s0a4sn/ei_orochi_vai_tomar_no_cu/,1774146936.0,2026-03-22 02:35:36,tamarisdofelca,1s0a4sn
EI,Smallafro,Fuck Ricochet,,4,1,https://v.redd.it/z102o6i7diqg1,https://www.reddit.com/r/Smallafro/comments/1s0a2o6/fuck_ricochet/,1774146766.0,2026-03-22 02:32:46,JAMMYTOAST01,1s0a2o6
