bank,subreddit,title,selftext,score,num_comments,url,permalink,created_utc,created_date,author,id
EI,DottoreMains,Is Dottore too evil to be playable?,"Nah!



This is aimed at Doomers and people who worry often (of course I know him, he's me!) About whether Dottore can be playable due to all the harm he's caused to Traveler their friends.



This will be part 1 of a larger series about Dottore's playability (maybe its 3 idk yet???) For this one, I'm just gonna do my best to show that there are characters who the traveler had **awful** relationships with, that were forgiven and now playable. There is of course a tldr near the bottom so skip if wanna, I know I yap so I fr don't mind :3

Massive tyyyy to u/No_Throat_5869 for proofreading and theorizing with me for like a week while I went crazy over this, u/Yani-Madara too😭


Starting with Inazuma, probably the biggest thorn in my side here. An entire war occurred, where we are explicitly shown the loss of life and suffering of innocents, playables included. We are shown all these examples of people suffering from either the effects of delusions, the loss of their visions, the war in general...only for most of this to kinda poof away by the end. Three characters who were heavily involved on the ""bad"" side of this war are now playable, despite all they done and what the traveler used to think of them. This is what I wanna talk about. 



I think that people who say that there's no way Dottore can be playable due to what the traveler and other playable characters think of him...have forgotten how high tensions were during Inazuma. I don't blame anyone either, because I and others I've talked to forgot about it too, cuz it was years ago! Like, the traveler used to want Scaramouche dead, for very similar reasons they hate Dottore rn, but even THAT relationship healed! ***By the standards Genshin has set for their writing, there's no reason the traveler can't forgive or at least settle with Dottore enough for him to be a playable character.***



((I really want you to read this with Genshin's standards in mind. Try to discard your irl opinions on certain morals, because they obviously treated differently in this fantasy world!!!))



This will be important later, so I'm gonna briefly the relationship between the puppet and Ei, mostly because there is a direct connection between her and Dottore. We know that his segments are partially created through technology he learned from studying Scara. Segments > Scara > Ei that's what I'm getting at. The puppet is partly Ei, she placed her consciousness into the blade it carries, and based it's programming off of her own ideals. Shogun to Ei is a bit like Dottore to Zandik, but with a more physical split. I admit it's loose, but there is a narrative connection between Ei and Dottore, both in their ""splitting"" of their consciousness, and relationship with Scara. 



(I bring this up to explain why I'm using Ei as an example! This seriously isn't meant to be a hit piece, I am selecting characters with similarities or connections to him, that's all :3)



The decree caused innocent deaths, plain and simple. It's cruel and unjust, the narrative agrees with this, as shown through Ayaka, where she gives a quest that's all about motivating the traveler(audience) to care about stopping the war. She sends us to help people affected by the loss of their visions and see what it's doing to the surrounding community. The people who have lost their visions are characterized as tragic and sympathetic. One was a samurai who'd went into debt trying to keep his village fed, the other was an old man who was going to wander off alone to find someone he couldn't even remember. People you're meant to feel sad for.

https://preview.redd.it/il68c04j4fqg1.jpg?width=1920&format=pjpg&auto=webp&s=38363df75bc8b5180a4069e5ef4574a672a985d5

https://preview.redd.it/spj6xfbk4fqg1.jpg?width=1920&format=pjpg&auto=webp&s=d960febe0b7efef04570f2cb338e96cccdcf945f

Look at how much the writers want you to view losing a vision as a bad thing. Something that playable characters are responsible for and engaged in. Sara directly steals visions from people, Scaramouche is part of the organization that cooked up the decree and Ei is an enabler of the decree. Three playable characters engaged in an act that is depicted as cruel, oppressive and selfish. There's no retrospective justification made for the vision hunt decree, no ""it wasn't that bad"" or ""The victims deserved it in the end!"" like with how the tribes Nefer killed were all conveniently filled with nothing but greedy murderers...



Really think about this from a hard writing perspective. The writers seriously want the audience to be against The Vision Hunt Decree, so they show the **NEGATIVE EFFECTS** it has had on the characters. Ayaka, Yomiya, Thoma, they are all deeply hurt by having to watch their community suffer, with Thoma nearly facing this fate himself. Then, the Watatsumi characters recieved direct attacks from the Shogunate and Sara, with the traveler specifically joining the *rebel* army and receiving their regional nickname here. 



Why? 



Because we are meant to side with them, you are expected to agree with the resistance and feel for them. The traveler's only dialogue options are to support the rebels. This is why we are given endearing characters like Ayaka, Kokomi, Gorou, Kazuha, Teppei ect. They're charming and easy to love, you want to listen and help when you see them upset.

https://preview.redd.it/pb0i86jn4fqg1.jpg?width=2520&format=pjpg&auto=webp&s=32f01d1f15931b85625f15789e16fcafb22e698f

[Interesting to note that he was hit from BEHIND while performing a defensive block, she didn't even interfere with an active lethal strike...](https://preview.redd.it/4devwbbo4fqg1.jpg?width=2520&format=pjpg&auto=webp&s=059ee2f772ce8824c9d7ed7aaff99a2de53e10b4)

We are shown Sara killing a member of the army we are supposed to be sympathetic to  Now, this isn't me claiming she's an awful person who doesn't deserve to be playable...because she absolutely does. She is an incredibly written and nuanced character (who gets unfortunately shafted 24/7 *damn you hoyoverse*...) and I'm sure you can infer this, but I tend to love characters on the morally gray side. 



I only show her killing a nameless npc here because Dottore does the same to people the game hasn't even tried to endear us to! Sara got to be playable despite stealing people's visions, (which destroys people mentally) and killing people we are told to side with. ***By the criteria set by Sara, Dottore can still be playable even if he did kill those npcs with his experiments.*** Especially because unlike the rebel army, which we are giving charming scenes of them hanging out and adoring traveler, the brainswap victims are wholly strangers.



Motive matters here too, Sara killed that man because she is at war and fighting for what she wholeheartedly believes in, even if her mindset is wrong. Dottore's energy fields effects appear to be unintentional, he admits to the traveler that he is making mistakes while learning his new powers and the brainswaps could have been Dottore checking what the effect was. Certainly not an ethical experiment, but this Dottore working by a mindset he wholeheartedly believes in, even if it's wrong. 



Noooow! The isn't to say that the audience isn't meant to feel bad for them...because you should, these are innocent people who lost their lives in painful ways for SEEMINGLY no full reason we can discern yet. However, more there is more emotional weight put on Sara's npc victims than Dottore's in this particular case, since the game puts in effort to make us care about them. So if you're a person who's scared that he may be ""too evil"" to be playable, look at the the game has previously allowed! I'm only started with Sara because she did the least here, next is Ei!

https://preview.redd.it/2cz34mke7fqg1.jpg?width=2520&format=pjpg&auto=webp&s=dcf8c85f2280a985ef2819cb305ee154f6d5d06f

https://preview.redd.it/oq29goje7fqg1.jpg?width=2520&format=pjpg&auto=webp&s=72f37ec3f3f5c83d74539f4d47e6d82f99ae22cd

Opinions of her are not very high during Inazuma. Paimon is meant to be the audience opinion, and she calls Ei selfish, to which Thoma agrees. Kazuha, who had his friend murdered by her, calls her oppressive. She is a dictator here, you could even call her the *villain*??? 👀👀👀



https://preview.redd.it/1nrlr1gg7fqg1.jpg?width=1920&format=pjpg&auto=webp&s=593eee2403da9efe5da86d66195e0991719b1e36

She is moving with intent to kill, The traveler only survives stuff like this due to their special composition. Because we are in the Plane, we know this is Ei's doing, not the puppet. Even then, for reasons mentioned before, this puppet follows Ei's ideals. She would have killed them for going against her flawed beliefs here! And we still get her playable. 

https://preview.redd.it/5zl9n31j7fqg1.jpg?width=1920&format=pjpg&auto=webp&s=5158f4352d097379e90ff3bfc9375de574696571

She attacks the traveler from behind just for being against her beliefs, the same beliefs that the game **tells** us are flawed and hurtful. She's fully intending to kill them here, since she wishes to purge the enemy of eternity. And this is Ei's doing!!! Not the puppet! Ei can at any moment, enter the puppet's body to see the outside world and do stuff. That's probably what all the glitching is for, the spiritual pressure of a god's ire is a pretty intense thing. 

https://preview.redd.it/1svv23zl7fqg1.jpg?width=1920&format=pjpg&auto=webp&s=d0fd5263eda56c888bcbe4bc89ef37f18eec71ec

She tries to kill Kazuha for merely **blocking** her *sucker* strikes. He never raises his blade against her, only performing defensive movements to protect the traveler. When she gets pushed back, she again tries to strike him lethally, which he blocks without any lethal retaliation of his own. Why do I go in on this? A playable character, Ei, is trying to murder another playable character, Kazuha, in a totally unjustified manner. ***We have an example here of attempted murder (that the game TELLS us to disagree with) not being enough to prevent a character from being playable.***



When it comes to direct violence against playable characters or the traveler, Sumeru era Dottore only put them to sleep. He gets more intense in Nod-Krai of course, but notably never gets violent without provocation. His cheapest move was ambushing Bina at the festival but even then he never harmed her so directly as Ei did to Traveler. I made sure to exasperate the dichotomy of Ei vs Kazuha's approaches, lethal vs defensive to point out...Dottore responded with equal measures throughout Nod-Krai. I'm not saying the main cast were wrong for attacking him, he was posing a huge danger, but **unlike** Ei, he did have a fundamentally *logical* reason to use lethal force. They were all trying to kill him and he tried to kill them, when he murked Sandrone, that was after multiple attempts on his life and actions that HE perceived as betrayals. Compared to Ei, the scales are presented as way more balanced.



Onto puppet boy...



Scaramouche was here by orders of The Fatui and even taunts the traveler by telling them to go catch the real bad guy...*wonder if he meant Signora or Tsaritsa*, anyway...

https://preview.redd.it/hl2ylgju7fqg1.jpg?width=1920&format=pjpg&auto=webp&s=3893175b3932b4bd1c160185fe990c6bc5f2c229

He wasn't all too interested in the situation, coming off as aloof and sarcastic. He talks down to the traveler and doesn't really seem to respect them at all. His characterization is focused on his poor attitude toward humans and lack of care regarding the morality own actions.

[Speed I'm watching your stream-](https://preview.redd.it/qpfnr6kv7fqg1.jpg?width=1920&format=pjpg&auto=webp&s=77b020629e4728e77f1df1ad30bc55bfd583e1bf)

He also seemed to take a bit of delight or satisfaction in all this. His mindset on humanity is even more extreme than Dottore's, as he claims there isn't **any** value in them, while Dottore does at least believe people can be enhanced. 

https://preview.redd.it/z2fuf6ay7fqg1.jpg?width=1920&format=pjpg&auto=webp&s=5700127645fbd63e3f4920d48633ffd3ff6976d5

Notice how he treats the traveler here, laughing in their face about the death of someone important to them. A death he is absolutely responsible for considering the fact he brought delusions to Inazuma and is in charge of overseeing this operation. He knows what he did, laughs about and mocks the misery he's caused. This stuff is also all intentional, the delusions are here specifically to destabilize Inazuma enough to make them vulnerable and take the gnosis. There's no accidental deaths or whoopsies about it, Scara knew the plan, what he was doing, how it affected people and he laughed about it. The traveler is also totally pissed with him and wants to attack, maybe even kill him. *Reeeeally* similar to how they feel about Dottore 👀👀👀

https://preview.redd.it/bu5435108fqg1.jpg?width=1919&format=pjpg&auto=webp&s=c8bb311a152f72f3cac3affaec4195121a8a3c20

Scaramouche also even hurts the traveler, this is on him since he specifically riled them up while they're standing near the gas that punishes you for being riled up.

https://preview.redd.it/m2gt8qi38fqg1.jpg?width=1920&format=pjpg&auto=webp&s=332a3c687555cb4da50e12dbe521a1443e625c31

This direct murder attempt is in the future but I'm just putting now to show, ***A character still became playable despite causing the death of someone the traveler/audience cared about, delighting in the suffering of innocents and directly trying to kill the traveler for selfish reasons.*** 



Here is the actual meat, I really just had to get that setup out there, Inazuma has been sitting in my brain just steaming...



Ei, Sara and Scara are three playable characters who participated in or perpetuated in horrible actions that lead to severe destruction, death and most importantly, the harm of playable characters. But they have all received their grace from the narrative by now. I could tattoo Ei and Miko's reunion onto my heart, because once hoyo remembered this is a character that needs sell, we got our sad backstory. 



It turned out Ei had alot of unresolved trauma that resulted her taking an apathetic stance on things, with her not even realizing she was hurting people that badly due to her disconnection from the world. Yae Miko worked as the sympathetic bridge, subtly implying there was more to her under the surface. Being someone who rarely spent much time out unless it was to fight, Ei ended up hardened by the world, placing all her love in her sister and friends...until they were ripped away from her. With what little she loved gone and a whole nation to care for, she broke down and had to lock herself away. She did something that was pretty cruel, that being leaving Scara with nothing in an abandoned factory, not even a message or any resources. But this wasn't out of malice, she was at the lowest point of her grief here and thought that killing him would be too cruel despite Yae Miko's desire to dispose of him. There is a clear level of kindness here! Yes, the specific way she abandoned him was cruel and very harmful to his development...but she did care about him to at least some degree despite how poorly she treated him. It's implied she probably felt some sort of kinship or special emotion, why else would a tough warrior allow a ""risk to inazuma"" just roam free when her entire mission statement is to protect her people? Yae Miko is the person she loves and trusts the most, and Ei put whatever she felt for Scaramouche above even **HER** opinion despite the logic behind it. *She claims to have shut herself off from the world and useless emotions, but still couldn't put it aside when it came to family.*



Sara was manipulated to hell and back at every turn in her life, never given the chance to develop her own opinions and even discriminated against on the basis of her being inhuman. She knew nothing but serving whoever you were indebted to, she indeed carried out harmful orders, but she has been groomed from an absurdly young age to follow the will of the Shogun. The moment she tried to participate in normal society with other kids by playing, they received a horrible punishment just for being around her. She was intentionally isolated from any outside influences to ensure she could be molded into the perfect soldier. She was forced into her position and had no choice but to blindly obey what she was told was the shogun's orders, because she had literally nothing to turn to. If she left the Shogunate at that point, she would be left alone in a society that hates and fears her in a harsh environment. She believes the shogun saved her life *by providing her with resources and a place to belong.* 



Scaramouche is following the orders to stir up a war and causing the deaths of innocent people. He's reveling in what he's doing, most likely because being in his old home brought up memories he didn't enjoy, leading him to obscure them with a mask of detachment. Knowing he was being a pain in the side of an archon he used to care for that abandoned him, it's like his own mini-revenge to cause trouble for those who hurt him in the past. This is his way of feeling powerful and in control in an environment that previously stifled him. This is the home that he believes rejected him, where he was punished for being himself as every relationship he tried to have fell apart for reasons he couldn't understand. *Scaramouche turns his misunderstanding of humanity into disdain, if he can't participate into society then he'll simply put himself above it all.* 



This stuff is sounding familiar, right?



Dottore shares a narrative with characters who have received their pardons and more importantly...playable status. (These just are a select few mind you)



Back in the hospital, Zandik was genuinely ignorant to the harm he was causing to his patients for a time. Even when you would think it would be obvious what negative effects would come from he was doing, he didn't get it until the consequences were staring him in the face. 



You would think it's obvious that extreme medical treatments would have a severe mental effect on people

https://preview.redd.it/uf99dd068fqg1.jpg?width=1080&format=pjpg&auto=webp&s=12d959f93d409dcc73df9af0d6282c80e591adf9



Or that it's well known stealing someone's vision could deeply damage them to the point of losing themself. 

https://preview.redd.it/2stb5jr68fqg1.jpg?width=2520&format=pjpg&auto=webp&s=010700237c02e1ae689e2a9e3d8f48faac8650b1



And yet, due to the fact both of these characters suffered from trauma and an extreme lack of socialization...they were genuinely incapable of understanding the harm. Am I being clear here??? I really hope so. 



Zandik and Raiden are the SAME, they are doing the SAME THING HERE! They are taking something vital away from people but can't inherently understand the negative effects until something super bad happens, in both cases being shocked by humans *dying*. Notice how they also both change their behavior in response to the consequences too! *Ei lifted the decree, Zandik took measures to protect his patients from harm.* From this fundamentally similar behavior, **one** of them ended up playable with narrative grace. 



Sara is a non-human who was treated as a monster from a young age, only used as a tool for her skills, not knowing much more than to serve. Zandik's entire thing has been about how he barely feels human, how just wants people to view him as a monster off the bat so he doesn't have suffer rejection since nobody would have ever liked him in the first place. He was groomed into the fatui, being young and mentally unstable when Pierro picked him up. He was also already poorly socialized (even abused) as can be inferred from his flawed view on family that he presents to Bina. The Fatui would have been the first society he'd ever truly felt apart of just like Sara had literally nothing but the Tengu as the second she made any other friends, they were ripped away from her. They both follow orders to murder people they know deep down are innocent, *because that's the requirement of being accepted in their society.* 



Wanderer and Zandik's parallels make me ill. The way you can just feel Dottore looming over Scaramouche's shoulders every second he's in Inazuma. The way both of them put on a mask of superiority and arrogance, acting like the rejection from their homeland didn't hurt them, like they have no love for this place anymore. The way they treat their work here as just some minor thing, and even take joy in the fact they're getting back at those who hurt them by causing trouble for the Archon and those in charge. You can feel the weight of how badly they wish things had gone differently, how much they yearn for a different outcome, how they want acceptance. They do these things, at the order of The Fatui, but with an underlying delight of revenge and bitterness. 



So why can't Dottore's get flowers? Characters just like him, who hurt/killed innocent people, carried out awful orders, intentionally destabilized a country...have all gotten their narrative pardon. Ei is our archon buddy with a surprising silly side, she can't cook and loves to read fantasy books. Sara receives vacations now, goes to festivals where she's cordial with characters she was once at war with. Wanderer rebuilt his life from the ground up, he got the cleanest slate with all his worst actions just being swiped under the rug due to the Irminsul wipe since he's just Hat Guy now.



More on Scara because he's the most similar to Dottore here. 



The clans he nearly obliterated, were entirely him. Yes, Dottore and Pierro did manipulate him into believing the lies about Niwa...but he made the choice to go slaughter all these people who were hardly tangentially related. What's interesting is that those he killed, were simply other swordsmiths who practiced an similar art, because he stopped his spree AT THE SIGHT of Niwa's descendent. This means that he never even targeted Niwa's family specifically since he would've met a descendent quite quickly. If it was just Niwa's clan he was after, he **COULD HAVE** almost spun the justification of ""Well they're related and must all share a traitor philosophy"" but no...his victims were **JUST** other people who made the swords. Scaramouche went out just killing wholly *innocent* people that he had *no mental justification* for, and he knew that, which is why he stopped. If he truly believed what he was doing was right, that all of those merely breathed around an art similar to Niwa's were his enemies, *why quit halfway*? 



Again, I LOVE Scaramouche, I am not **GENUINELY** hating him for wiping out nameless NPCS because honestly...I don't care that much, it's fiction. I bring this up to show that a playable character has a very nasty past which includes the murder of innocent people. That by hoyo's own moral standards for who can playable, Dottore does meet the criteria. He has a similar ""following orders"" defense, another character to blame in Pierro and underlying emotional trauma.



And take an extra look at Scaramouche, this guy acts like a mini-Dottore through and through, even has a similar defeat scene to him. People were worried he was too bad to be playable...because they didn't yet know enough about the circumstances that led to him acting that way. The interlude showed us Dottore and **Pierro** were as the root of his behavior, all I'm saying is...what's stopping hoyo from just...doing it again? Scaramouche never really had to atone for the bad things he did, the focus was merely shifted to Dottore. As much as I love him, I doubt Pierro will be playable, he's a bearded old man, so hoyo will probably throw him under the bus to develop the others. (Pompey you're still number one in my heart💔) There are already some suspect implications about Pierro, particularly with the fact he seems to always find his harbingers at their lowest (which I ponder in another post of mine [https://www.reddit.com/r/DottoreMains/s/mWfJgoUMmQ](https://www.reddit.com/r/DottoreMains/s/mWfJgoUMmQ) ) 



The point isn't that Dottore's actions ""aren't really that bad"" or that he's ""secretly a good person"", but that there is enough set up for him to recieve the same playability justification that someone like Scaramouche did.



So then, what about the visceral amount of hatred other characters have toward Dottore? 



Granted, the language used against other characters who were a villain for a time like Ei was not as extreme as wishing harm or death, upon them, but there is a key difference. Paimon, Thoma and Kazuha are not very violent or harsh people, they're down to earth. The people who wish death upon Dottore are far more accustomed to that mindset. Arle, Sandrone and Scaramouche are already killers, with two of them having anger issues. That's why we see much more visceral hatred toward him within the game, he's pitted against more vocal, volatile characters. You can spit in Thoma's face and he still won't curse at you, but breathe wrong around Sandrone and she'll explode your eardrums. These characters have different ways of expressing their grievances and *veryyyyy* different levels of patience. 



\[Mini tangent here, had a hard time fitting this in...\]



Also a note about Sandrone...keep in mind that the reason she hated him so much **BEFORE** 6.2....was bc he dicked around on a project of theirs, caused a huge mess for her to clean up...and recieved favoritism from Pantalone. Her grudge against him is mostly due to him inconveniencing her not because he's a bad person. Sandrone is decently pragmatic person but her emotions are reserved for those close to her. She declared Nod-Krai to belong to the Fatui with no moral compunctions for those who live there. It doesn't ***appear*** she cares too much about people unless they are personally connected to her. I say this based on the line delivery and animation, her anger is mostly focused on the fact her time was wasted, as she seemingly glossed over the ""deadly"" part.



I put an emphasis on B.B.B *\[Before Bina Boxing\]* because I think there's still muddy information on why and how his plan went down. Sandrone's journal has some implications about their relationship and potential collusion that I believe have a chance of coming into effect later. (Which I am gonna post about again laterrrr!)



So, in my opinion, it's not enough just to say ""he can't be playable because other characters want him dead"" since we have to look at the actual context on why some hate him. Especially when some of the characters who wish death upon him, either engage in very similar *or worse* behavior, while hating him for all the wrong reasons. Characters can be wrong or ignorant about eachother, that's what makes things interesting! They can even *lie* or omit information about eachother to uphold a certain image of someone, they aren't immune to bias or prejudice. Some acknowledge this and **actively** engage in deception because it serves their agenda...*what's this image doing here*?

[Thanks to U\/Yani-Madara for pointing this out!!!](https://preview.redd.it/h2jurhkb8fqg1.jpg?width=1080&format=pjpg&auto=webp&s=6e700103d09dbf2e0859d3f82895efdf35fd6488)

Just because it's said by a character the game likes, doesn't necessarily have to mean it's true or something we are expected to agree with. Despite some hiccups, genshin does have quite 3-dimensional characters who engage in conflicting but realistic behavior. They aren't designed to be 100% perfect all the time and can present different ideals to the audience. Two characters that receive love from the game and fans can have two wildly different beliefs and still both be playable. Different mindsets are allowed to coexist in this game. One parental figure may believe emotions have to be bottled up and that crying is a sign of weakness...while another may allow their kids to express themselves freely and creatively, letting them run wild and develop their own identity. 



Characters having negative or tense relationships with eachother isn't enough to bar someone ever being better either. Just look at how nasty Scara used to talk about Sandrone, before the Nod-Krai. He did not like her at all, yet that didn't stop the game from turning things around for her character. Though I think the method they chose was too quick, they managed to bring their relationship to a point where Scara respects her abilities enough to trust her with his core. For better or worse, massive changes **ARE** possible. **Nothing** is stopping Dottore from getting the same narrative glaze.

https://preview.redd.it/y2r0ljic8fqg1.jpg?width=1080&format=pjpg&auto=webp&s=c4ca93b4d137498e5e2ed8608e2b032485cb2a09

This is someone who WILL be playable. (Just look at her. She has an id, detached sleeves, marketable personality.) If you worry about Scara's hatred of Dottore being too much for him to be playable...look at the 180° Sandrone had. Scara tore into every piece of her here, being way more harsh than he was to Dottore for some reason. He's so messy here that you would assume Sandrone must've did something personal, this wasn't your average everyday sass, it's advanced sass! Yet, *despite* how much venom he spoke with here, the game found a way to preen her character up into playable status. We never got to know why he hated her to the degree he would insult her so viscerally, but a massive change did occur. Dottore has all the hallmarks of the same tactics used to sell other morally dubious characters to us. He has the tragic backstory, was groomed into the Fatui, a secret emotional side that can be tapped into and most importantly, a Pierro shaped scapegoat.



I'm not totally saying that this **WILL** happen, but I believe that when comes to stories, ***any*** interpretation can be valid if you find enough evidence. As it stands, there is undeniably enough setup to support a narrative that leads to playable Dottore, much more than for characters like Sandrone and Arle who's main arcs really only took place over **one** nation. Dottore has had since the days of the manga to change and develop, an advantage few other characters have. If hoyo can cook up Crucabena, a character who shows up out of *genuinely nowhere* in order to make sure Arle has a moral high ground to stand on to be playable, then hoyo can do **SOMETHING** with the *already existing* clues for Dottore. 



If you're gonna take something away from my post, it's this. *Other characters have been shaped up from ""nothing"", so Dottore can be refined with the ""materials"" that DO exist.* 



Tldr; If characters like Ei, Sara and Scara can cause harm or directly murder innocent people and still be playable, there's no reason Dottore can't be too. Bigger leaps have been made to defend or ignore the evil deeds of other characters with less detailed tragic foundations than him. He has a sad backstory, and falls under the same justification the game has used to defend the aforementioned character's actions, Scaramouche in particular.



This is really for the doomer me of a week ago and a week in the future to consider. Even with my confidence, I flip between Dottore being playable all the time, but when I look at instances like these, I feel much more comfortable. This is not me saying that I necessarily want his actions voided or swept away...but, we need to remember that this is a gacha. This game has made some insane asspulls and blatant retcons to shape other characters into playability, so sorry that I at least want that for MY favorite too?? 🐒



I bring up all this stuff about the others, not to claim they don't deserve any of the defense that the story has given them, but to hopefully comfort fans who are worried about how evil deeds can affect his playability. I really love some of the characters I tear into here, I only used them simply because they fit the criteria of an evil or dubious character receiving a strong narrative shift. Yes, Dottore has done some awful stuff, but hope that for some of the reasons I provided today, you can feel a little less nervous about getting to pull for him one day :3",32,28,https://www.reddit.com/r/DottoreMains/comments/1rzvjci/is_dottore_too_evil_to_be_playable/,https://www.reddit.com/r/DottoreMains/comments/1rzvjci/is_dottore_too_evil_to_be_playable/,1774109837.0,2026-03-21 16:17:17,lncoherentScreeching,1rzvjci
