bank,subreddit,title,selftext,score,num_comments,url,permalink,created_utc,created_date,author,id
EI,VeganDE,Heutiger Penny Einkauf,"Moinsen, heute mal wieder ein bisschen was bei Penny eingekauft.
Preis für die veganen Produkte 55,49€.

Nicht ganz vegan, weil meine Freundin die Mühlen Wiener wollte, die ich seit 2024 eigentlich auch ganz toll fand, aber heute herausgefunden, dass sie nur vegetarisch sind und nie vegan waren??? Ich bin nun also auf dringender Suche nach veganen Wienern!!

Produkte, die ich heute zum ersten Mal gekauft habe zum testen:
Den veganen Burger Big Classic von Food For Future, den Lekka Landschinken, die Mini Doppelkekse von Covo, die Alpro Not Milk, die Sonnenblumen-Margarine von Solvel, die Knorr Fusion Noodles Kebab Taste, die gefriergetrockneten Erdbeerscheiben von Simply Sunny und die Reis Fit Gerichte (Kichererbsen mit Quinoa, Linsen mit Reis). 

Produkte, die ich nun regelmäßig kaufen werde, weil sie einfach gut sind: Soja Joghurt Vanille Geschmack von Food for Future, Pesto Verde von Food for Future, den (No)Eier Salat von Food for Future, die Taste of Asia Ramen, den Alpro Drink Banane und Chocolate und das Simply Sunny Studentenfutter. 

Der Sojajoghurt ist sehr solide, besser noch als Haferjoghurt den ich bisher probiert habe (und ich liebe Hafer okay). Das Pesto kommt in Saucen, aufs Brot, auch mal so auf die Nudeln oder Cracker...es ist sehr toll. Der (No)Eier Salat ist sehr gut, auch, wenn die Konsistenz etwas anders ist als Ei-Salat. Die Ramen sind gut wenn's schnell gehen muss und schmecken deutlich besser als harte Ramenblöcke. Der Alpro Drink wird jedes Mal besser. Studentenfutter ist aus meinem Leben als Student nicht wegzudenken.

Um der Kritik von vor ein paar Wochen Widerstand zu leisten: ja, normalerweise esse ich nicht viele Obst- und Gemüsesorten außer sowas wie Tomaten, Gurken, Karotten, Äpfel, Weintrauben, Erdbeeren,.... Ich mag die Konsistenz von sehr vielem einfach nicht. Aber sehet an! 2 Mangos. Ich habe noch nie Mangos selber geschnitten, also mal schauen, was wird. Es gibt für alles bekanntlich ein erstes Mal.

Aufgestockt werden Ketchup, Haferflocken, Senf, Hefe, Vanillinzucker, Schnittlauch, Linseneintopf (der muss immer Zuhause griffbereit sein), Katjes und .... Weißwein?

Ja, ich habe mit dem Weißwein Großes vor (wir kochen sonst eher mit Rotwein), denn ich habe hier letztens einen Post gesehen zu einem Senf-Tofu-Schmaus, der so verdammt 🔨 aussah, ich werde es nachkochen müssen.

Ich mag eigentlich keine Butter auf Brot und früher mochte ich auch Margarine nicht, für die meisten gekochten Dinge nutze ich Öle. Jedoch habe ich in den letzten Wochen beim Kochen öfters Butter vermisst (z.B. beim Anschweißen von Gemüse), also wird es nun Margarine tun müssen.

Die Radieschen werden zu Salat mit Kräutern, Zitronensaft und Ahornsirup. Fragt mich nicht, warum mir das schmeckt.

Porridge mit Ahornsirup, Banane und Mango checks out.

Abendliches Update: Zum Burger kann ich bereits was sagen. Er ist genauso schlabberig wie einer von Mcces. Und schmeckt sehr ""gemüsig"", wenn ich das so beschreiben darf. Also den zweiten werde ich mir schon noch antun, aber eher aus der Not heraus, dass ich zwei gekauft habe.
",25,4,https://i.redd.it/orj2tytggipg1.jpeg,https://www.reddit.com/r/VeganDE/comments/1rvtd6b/heutiger_penny_einkauf/,1773712014.0,2026-03-17 01:46:54,butterflynabiya,1rvtd6b
EI,toogoodtogo,"WF 2 refrigerated grocery $6.99 each, prepared foods $9.99, and produce $6.99 bags. [Cleveland, OH]","Produce isn’t very fresh looking, but the others are great!",2,0,https://www.reddit.com/gallery/1rvtcym,https://www.reddit.com/r/toogoodtogo/comments/1rvtcym/wf_2_refrigerated_grocery_699_each_prepared_foods/,1773711999.0,2026-03-17 01:46:39,reseekee,1rvtcym
EI,carros,Qual escolher? modelos peculiares,"Pouco tempo atrás eu estava completamente fora da realidade e vim perguntar aqui sobre qual carro pegar saindo de um Honda Civic EXR, na epoca perguntei de hb20, enfim, eis minhas escolhas de hoje, visto que, eu busco um carro durável e economico:

Lexus ux 250h 2019 - 
pros: hibrido. mecânica robusta, qualidade e construção superior ao do civic, motorização superior, e, principalmente, 3x mais economico (o civic faz perto de 6.5km/l as vezes)

cons: apertado (300l de porta malas é foda), carro de nicho

OU

geely ex2 max, pros: elétrico, alma de volvo, 0km, na garantia 
cons: marca nova no brasil, infra frágil ainda de elétricos, acabamento inferior ao civic

Ambos ai na faixa dos seus 120-130 mil, uma comparação entre um 0km e um usado robusto e conservado, note se que eu pensei puramente na economia pegando o ex2 max, suponho eu que o max por ser menos pelado e ter adas vai desvalorizar menos que o habitual, além de que ele é superior a um byd mini, e, eu esperava colocar placa solar aqui para abater o valor alto da luz (+1 real kWh), então juntaria o útil ao agradável, mas... achei um carro divertidinho e to em duvida",1,0,https://www.reddit.com/r/carros/comments/1rvtatr/qual_escolher_modelos_peculiares/,https://www.reddit.com/r/carros/comments/1rvtatr/qual_escolher_modelos_peculiares/,1773711846.0,2026-03-17 01:44:06,Far-Cartoonist3090,1rvtatr
EI,FuckMicrosoft,The State of the Modern Dead Internet (this literally just happened to me now),"Got a notification through Phone Link from Signal. Clicked to reply. It opened a Bink search. Searched for Signal. Signal results all Chinese. Results not related to Signal. 

This is literally on my screen now. In my DEFAULT BROWSER too. It just... Searched for Signal. And gave me these results. After clicking to reply... I used Phone Link to reply to a Messenger message before, so it fucking works! What the actual fuck, Microsoft. 

Oh - unrelated, but also, last night, a Windows bug made me think my GPU was dying. Digital artifacts everywhere. Both monitors. Gone today. 

The actual fucking state of Microslop, man. 

https://preview.redd.it/8guzg9pveipg1.png?width=1647&format=png&auto=webp&s=803e4b757437aa940c32e1af9d8fa254f94fa401

",8,4,https://www.reddit.com/r/FuckMicrosoft/comments/1rvt6wg/the_state_of_the_modern_dead_internet_this/,https://www.reddit.com/r/FuckMicrosoft/comments/1rvt6wg/the_state_of_the_modern_dead_internet_this/,1773711571.0,2026-03-17 01:39:31,That-Acanthisitta572,1rvt6wg
EI,legaladvicecanada,can i take my roommates to small claims court?,"hi! i live in Alberta and just recently moved out from my living situation. i have posts on my profile with more detail about what my living situation was like! i was living with two friends (who are a couple) since June of last year. both of them were living off of gf's savings (they both dont work) and when she gave away most of her savings to her mom, they started asking me for money. i was dumb and started lending them money, and now it's over 2 grand. 

the girlfriend also broke her foot over the summer, and the boyfriend hasn't gotten a job. the two of them live off her EI, and have done multiple things to me in our time of living together. now that im moved out, i have been thinking about taking them to small claims court, but im wondering if it's even worth it? they are both broke and won't pay me back. i just am so sad that they took advantage of me and would like to get my money back

any advice is greatly appreciated, thank you!❤️",2,4,https://www.reddit.com/r/legaladvicecanada/comments/1rvt6kn/can_i_take_my_roommates_to_small_claims_court/,https://www.reddit.com/r/legaladvicecanada/comments/1rvt6kn/can_i_take_my_roommates_to_small_claims_court/,1773711547.0,2026-03-17 01:39:07,throwawaybfmademesad,1rvt6kn
EI,Watchexchange,[WTS] Dry or Sweet Manhattan? 2 Omega Constellation Manhattan Day-Dates - The Wallet Friendly Integrated Bracelet Choice!,,2,4,https://www.reddit.com/gallery/1rvsz4a,https://www.reddit.com/r/Watchexchange/comments/1rvsz4a/wts_dry_or_sweet_manhattan_2_omega_constellation/,1773711000.0,2026-03-17 01:30:00,rkman11,1rvsz4a
EI,xatfi,"Näyttelijä Linnea Leino oppi terapiassa, että musertava olo ei jatku ikuisesti",,1,0,https://yle.fi/a/74-20214319?origin=rss,https://www.reddit.com/r/xatfi/comments/1rvsz26/näyttelijä_linnea_leino_oppi_terapiassa_että/,1773710996.0,2026-03-17 01:29:56,xatfi,1rvsz26
EI,ComentariosMelhores,Nunca perde a graça,,159,3,https://i.redd.it/ivqd3lv8cipg1.jpeg,https://www.reddit.com/r/ComentariosMelhores/comments/1rvstjz/nunca_perde_a_graça/,1773710595.0,2026-03-17 01:23:15,Lil_Demon_777,1rvstjz
EI,EuSouOBabaca,Sou babaca por não querer visitar meus parentes?,"Minha vó e tia, são as pessoas mais sem noção do planeta, pra contextualizar faz uns anos que me mudei de cidade, da umas 8 horas de onde eu morava antes  e  fui embora de casa por não aguentar os abusos, por exemplo, sempre trabalhei e estudei,ou seja saia cedo e voltava a noite, chegava em casa e meu quarto estava virado, roupas jogadas fora, as roupas que sobraram, sapatos, maquiagem todas jogadas pelo quarto, pq segundo minha vó se eu queria fazer bagunça ela tbm sabia, detalhe que meu pai não falava nada e se eu reclamasse ele ainda me batia, e foi assim por anos, até um dia que eu tranquei a porta do quarto pra ir trabalhar e quando cheguei estava ela e minha tia me esperando e berraram comigo, me ameaçaram falaram que eu era ingrata, infantil e mais um monte de coisa.

Fora que eu trabalhava até sábado e chegava domingo queria dormir um pouco mais, eu acordava pelas 9 no susto com ela arrombando a porta me mandando levantar que eu tinha que limpar a casa e sempre reclamando na minha orelha, as vezes acordava com ela falando em alto e bom tom com meu pai o que eles tinham feito de tão grave na vida pra me merecer, sendo que nem em festa ia, não bebia, não fumava, era do trabalho pra escola/faculdade (isso aconteceu por anos) e casa.

Minha vó mora no mesmo terreno do meu pai e minha tia mora em outro lugar, mas não sai de lá. tipo, eu fui visitar meu pai uns anos atrás e disse que ia ficar uma semana só e mesmo assim minha tia insistiu que eu fosse pra outra cidade ver umas coisas com ela, chegando lá ela disse que ficaria uma semana e eu disse que já tinha falado pra ela que eu ia ficar uma semana só, aí meu pai ligou pra ela, disse que queria ficar comigo e eu fui embora de ônibus, pq? Pq meu pai pediu, certo. Já que estava na casa do meu pai novamente com a auto estima baixa pensei, pq não me cuidar? Fui em um salão perto da casa dele e fiz progressiva, postei foto de como ficou e todo mundo comentando como eu estava bonita, aí vem a infeliz e comenta: agora entendi o pq você quis ir embora, porra, qual a necessidade de comentar essa merda sabendo que MEU PAI que pediu que eu fosse? Bicha idiota, apaguei o comentário, óbvio. 

Fora minha vó que é uma narcisista de merda, passei em primeiro lugar no vestibular, fui feliz contar e ela vem rir da minha cara e dizer que eu devo ter sido a única a fazer pra ter passado em primeiro. 

Fora que também fui chamada de burra, inútil, incapaz, put4 tudo isso a vida toda e hoje sou border por passar por tudo isso desde a infância! 

Eis que agora peguei férias do serviço de novo e elas estão perguntando se eu não vou pra lá, inventei que estou fazendo curso, fazendo exames, pq se eu disser que não quero ir vao dizer que eu sou infantil, e outras coisas que adoram me chamar. 

Enfim, eu sou a babaca por não querer ir visitá-los? ",5,3,https://www.reddit.com/r/EuSouOBabaca/comments/1rvsrti/sou_babaca_por_não_querer_visitar_meus_parentes/,https://www.reddit.com/r/EuSouOBabaca/comments/1rvsrti/sou_babaca_por_não_querer_visitar_meus_parentes/,1773710477.0,2026-03-17 01:21:17,LankySignal3368,1rvsrti
EI,AfroBeats,Eyeon Mane - I Need More Time (Ft. @ObenneMotswana )[Official audio],"I Need Mo Time' 🕰 💯 IS OUT NOW ON YOUTUBE.  Please stream, like, and share my latest Afrobeat banger  &🙏 Subscribe for new music updates 💖
 #Afrobeat #NewMusic #IneedMoTime""
",1,0,https://youtu.be/gh10iSfpYn0?si=sm6ULJBXMhhgTkiS,https://www.reddit.com/r/AfroBeats/comments/1rvspsh/eyeon_mane_i_need_more_time_ft_obennemotswana/,1773710338.0,2026-03-17 01:18:58,Extension-Energy1002,1rvspsh
EI,howislivingthere,"San Diego, California",What’s it like living in San Diego. From living on the beach to the more inland towns to the Mexico border. I’m really interested in visiting and seeing what it’s like and if moving there would be good,28,58,https://i.redd.it/1m7n1fbabipg1.jpeg,https://www.reddit.com/r/howislivingthere/comments/1rvsovo/san_diego_california/,1773710271.0,2026-03-17 01:17:51,Razorbackfan3002,1rvsovo
EI,mongolia,"Help! My morin khuur was turned away at the airport, I think I have a solution though","So they wouldn't let the morin khuur on the plane but a nice gate employee said that they would take it back to the shop (egshiglen in ulaanbaatar). As i'm out of the country now and they don't speak english and they don't have an email I can contact, could somebody help me convey my details and a message to them to ask if they would ship the morin khuur to europe?

  
[**Address**](https://www.google.com/search?sca_esv=2249988ea6ef4f61&rlz=1C5AJCO_enDE1198DE1198&biw=1414&bih=736&sxsrf=ANbL-n4ETXSKH6-X0CcthpUwbdX1ueLphQ:1773710095386&q=egshiglen+ulaanbaatar+address&ludocid=5877045733198168298&sa=X&ved=2ahUKEwiw3K2B4aWTAxUPhP0HHd2DFNwQ6BN6BAg9EAI): [Байр - 24, SBD - 6 khoroo, Ulaanbaatar 14201, Mongolia](https://www.google.com/maps/place//data=!4m2!3m1!1s0x5d96924310a492c1:0x518f75f4d80080ea?sa=X&ved=1t:8290&ictx=111)

[**Phone**](https://www.google.com/search?sca_esv=2249988ea6ef4f61&rlz=1C5AJCO_enDE1198DE1198&biw=1414&bih=736&sxsrf=ANbL-n4ETXSKH6-X0CcthpUwbdX1ueLphQ:1773710095386&q=egshiglen+ulaanbaatar+phone&ludocid=5877045733198168298&sa=X&ved=2ahUKEwiw3K2B4aWTAxUPhP0HHd2DFNwQ6BN6BAg-EAI): [\+976 9929 3689](https://www.google.com/search?q=egshiglen+music+store&sca_esv=2249988ea6ef4f61&rlz=1C5AJCO_enDE1198DE1198&sxsrf=ANbL-n7_RV1PbdSrOCAeoPO3aV_SR9hiuw%3A1773710090950&ei=Cqu4aaTaOdqN9u8PrueXsA8&biw=1414&bih=736&ved=0ahUKEwikh5__4KWTAxXahv0HHa7zBfYQ4dUDCBE&uact=5&oq=egshiglen+music+store&gs_lp=Egxnd3Mtd2l6LXNlcnAiFWVnc2hpZ2xlbiBtdXNpYyBzdG9yZTIFEAAYgAQyCxAAGIAEGIYDGIoFMgsQABiABBiGAxiKBTILEAAYgAQYhgMYigUyBRAAGO8FMgUQABjvBTIFEAAY7wUyBRAAGO8FSOkEUIUCWIUCcAF4AZABAJgBgwGgAYMBqgEDMC4xuAEDyAEA-AEBmAICoAKPAcICChAAGLADGNYEGEeYAwCIBgGQBgSSBwMxLjGgB4cFsgcDMC4xuAeKAcIHAzItMsgHCYAIAA&sclient=gws-wiz-serp#)",1,4,https://www.reddit.com/r/mongolia/comments/1rvsnsd/help_my_morin_khuur_was_turned_away_at_the/,https://www.reddit.com/r/mongolia/comments/1rvsnsd/help_my_morin_khuur_was_turned_away_at_the/,1773710192.0,2026-03-17 01:16:32,Necessary-Low-5226,1rvsnsd
EI,pokemoncards,2000’s era cards.,"My husband had some sitting in our basement, and thanks to our neighbor/ our 7 year old is big into collecting we decided to catalog them. Over 1300 cards total, and I’m not done putting all the “good” ones into sleeves, but I’m so excited and wanted to share it with someone. Most have some slight whitening on the corners/very few I would place at needing to be graded, but it’s so fun to see a part of my husband’s treasure growing up. He did not play with them only collected.  The one’s with the palm trees are some of my favorites- and I have not got them all out of the binders and in better covers yet. I just figured you all might appreciate these with me. ",2,2,https://www.reddit.com/gallery/1rvsgyx,https://www.reddit.com/r/pokemoncards/comments/1rvsgyx/2000s_era_cards/,1773709705.0,2026-03-17 01:08:25,mw2676,1rvsgyx
