bank,subreddit,title,selftext,score,num_comments,url,permalink,created_utc,created_date,author,id
ENBD,UAE,"Unable to sign in Al Hilal, ENBD & Emirates Islamic app","Is anyone facing issues with logging in the bank apps? While trying it says wrong credentials or you are not eligible. While resetting password it is showing wrong DOB or card number.

Any suggestions on how to resolve this?",0,3,https://www.reddit.com/r/UAE/comments/1rwtgws/unable_to_sign_in_al_hilal_enbd_emirates_islamic/,https://www.reddit.com/r/UAE/comments/1rwtgws/unable_to_sign_in_al_hilal_enbd_emirates_islamic/,1773806284.0,2026-03-18 03:58:04,Ok-Thought1191,1rwtgws
ENBD,UAE,Talabat credit card got rejected and approved later,"Recently, I have applied my first talabat credit card and my application got rejected three times in a row when I contact the bank, they ask the salary account from which bank, which is Mashreq  my case so they informed that ADCB is unable to verify salary transaction of Mashreq due to internal issues, even though the salary is more than 5K so I have shifted my salary to ENBD for a month and application got approved instantly my advice to you if you want to apply credit card use the below for benefit for both or text me. I can help youout you can get 80,000 TouchPoints,Use ZAYO6ZVW4 or click on link

https://www.adcb.com/mib/general/member-get-member?Promocode=ZAYO6ZVW4",0,0,https://www.reddit.com/r/UAE/comments/1rwhvqx/talabat_credit_card_got_rejected_and_approved/,https://www.reddit.com/r/UAE/comments/1rwhvqx/talabat_credit_card_got_rejected_and_approved/,1773778210.0,2026-03-17 20:10:10,im_zayaan,1rwhvqx
ENBD,3Dprinting,Help: Odd Top Layer Issue,"I have a [Folger Tech Prusa i3 RepRap](https://www.treatstock.com/machines/item/194-folgertech-2020-i3) desktop 3d printer that I have had since \~2016. I have slowly been tinkering with and tweaking my slicer settings and the officially released [Marlin Firmware](https://drive.google.com/drive/u/0/folders/0B9b1NbuMK524fldIWWVCa0xfSXAtZmttcDhrbjBMeFNWcENBdVUzWnhtWDZ2YWdHVXpoUXM?resourcekey=0-f1LaECCF6osAy1Ac0SYnWg) that came with the build, and now I have it to where it can print D&D minis at decent resolution. However, there is one issue that I have never been able to solve: the printer gives up right at the end of printing the top layer if the top layer is flat. This doesn't happen on other solid layers or curved surfaces (perhaps because the layers get small and other settings override the normal print settings?), just flat top layers. I have tried everything I can think of to fix it, but I have never seen anyone else with the same issue and AI has been no help either. I have tried adding custom Gcode to the end of a print just to trick the printer into thinking it is still going, but whether by my own lack of skill with Gcode or some other cause, that did not solve it either. I would appreciate any and all help with regards to this strange issue.

[One of my earliest prints: a cord bundle holder for my headphones. Note how the bottom right  portion of the peg is unfinished.](https://preview.redd.it/xdtf4q63wnpg1.jpg?width=3072&format=pjpg&auto=webp&s=843a2a2bb41482511d8372430e2bbade7c0a972e)

[Most recent 3d print: a mahjong tile. Bottom left is unfinished.](https://preview.redd.it/y54fxq63wnpg1.jpg?width=3072&format=pjpg&auto=webp&s=48c83aad0a758132a62e743217c2119aec54d6f7)

[One of my largest prints. Bottom left region of top layer \(the curved piece is an insert\) is unfinished.](https://preview.redd.it/9z5g5r63wnpg1.jpg?width=3072&format=pjpg&auto=webp&s=0a67b3cb4e8a40dce16f27c6385d289f3419b427)

",1,2,https://www.reddit.com/r/3Dprinting/comments/1rwhsq5/help_odd_top_layer_issue/,https://www.reddit.com/r/3Dprinting/comments/1rwhsq5/help_odd_top_layer_issue/,1773778034.0,2026-03-17 20:07:14,Alert_Pin_2056,1rwhsq5
ENBD,UAE,ENBD bank,"Is any body able to login to enbd app , it says failure to login ?",2,15,https://www.reddit.com/r/UAE/comments/1rwczen/enbd_bank/,https://www.reddit.com/r/UAE/comments/1rwczen/enbd_bank/,1773768145.0,2026-03-17 17:22:25,kyahog324,1rwczen
ENBD,UAE,Need advice on noon lol,So i saw that Emirates NBD offers free delivery for noon and i was applying for it but thought i should ask for as im jobless lol is it worth it? Because they said i can make it but idk im scared lol need advice from people who have it,1,3,https://www.reddit.com/r/UAE/comments/1rwbd5v/need_advice_on_noon_lol/,https://www.reddit.com/r/UAE/comments/1rwbd5v/need_advice_on_noon_lol/,1773764771.0,2026-03-17 16:26:11,nsk222,1rwbd5v
ADCB,Hasan_Piker,"I live just a few minutes from Dubai Airport, and my whole bed was shaking from what sounded like around 20 missiles launched by Iran 10 minutes ago, i think all were intercepted but the shockwaves from the explosions are so damn scary",,171,28,https://i.redd.it/0jif1okcjopg1.jpeg,https://www.reddit.com/r/Hasan_Piker/comments/1rwl9oc/i_live_just_a_few_minutes_from_dubai_airport_and/,1773785625.0,2026-03-17 22:13:45,LumpyAnalyst,1rwl9oc
ADCB,UAE,"Avoid the ""IVR Trap"": How I lost AED 5.00 in 5 minutes just trying to reach ADCB !!","I just topped up AED 10 to call the ADCB helpline for an urgent matter, and my balance is already disappearing without me even speaking to a human.

**The Issue**: Every time I dial, I get the automated ""We are fully functional"" message. I hang up and redial thinking I'II get through next time.

**The Reality**: Etisalat is charging me AED 0.76 every single the automated voice picks up. Even though I haven't reached an agent, the call is ""connected"" the second the recording starts playing.

**The Lesson**: Don't keep hanging up and redialing! Stay on the line if you can, or check if the bank has a toll-free 800 number. Redialing is just giving the telcos free money for listening to a bot.",2,3,https://i.redd.it/p7hb7redxmpg1.jpeg,https://www.reddit.com/r/UAE/comments/1rwc0ca/avoid_the_ivr_trap_how_i_lost_aed_500_in_5/,1773766127.0,2026-03-17 16:48:47,woopandcoop,1rwc0ca
ADCB,darktower,Made a guide to the Cosmology of Stephen King. What did I miss? What would you change?,"I start teaching a course on King's mythology next week, and I wanted a visual that showed students the whole architecture before we got into the weeds. This is what I came up with. Probably spent more hours on it than I should admit. I know it's not complete. King's universe is too big for one graphic. But I'm curious what you'd add or change.

Quick Edit: I included a screenshot of the work in process just to prove this wasn't AI slop.",122,39,https://www.reddit.com/gallery/1rw9cbo,https://www.reddit.com/r/darktower/comments/1rw9cbo/made_a_guide_to_the_cosmology_of_stephen_king/,1773760450.0,2026-03-17 15:14:10,Adept-Engineering-71,1rw9cbo
ADIB,Bolehland,We Malaysians getting evil day by day,"Why such evil behaviour, wishing for the plane crash?",3,0,https://www.reddit.com/gallery/1rx3l8j,https://www.reddit.com/r/Bolehland/comments/1rx3l8j/we_malaysians_getting_evil_day_by_day/,1773839730.0,2026-03-18 13:15:30,Venkie2Maybach,1rx3l8j
ADIB,u_Logical_Lab_494,What to Look for in the Best Bank in UAE,"Finding the [**best bank in UAE**](https://www.adib.ae/) starts with understanding your needs. Discover important factors such as account flexibility, online banking, service quality, and financial tools that can help you manage your money better.",1,0,https://www.reddit.com/r/u_Logical_Lab_494/comments/1rwy1bz/what_to_look_for_in_the_best_bank_in_uae/,https://www.reddit.com/r/u_Logical_Lab_494/comments/1rwy1bz/what_to_look_for_in_the_best_bank_in_uae/,1773822017.0,2026-03-18 08:20:17,Logical_Lab_494,1rwy1bz
EI,tomica,Found a shop in China with sm rare TLVs!,,1,0,https://i.redd.it/qy6fcgep0tpg1.jpeg,https://www.reddit.com/r/tomica/comments/1rx3njk/found_a_shop_in_china_with_sm_rare_tlvs/,1773839891.0,2026-03-18 13:18:11,datredboii,1rx3njk
EI,pokerogue,WHY?!?!?,Round just before Eternatus Got a shiny charm of all things. bruh,2,4,https://i.redd.it/k8jnilagzspg1.png,https://www.reddit.com/r/pokerogue/comments/1rx3mmz/why/,1773839829.0,2026-03-18 13:17:09,SkyRider797,1rx3mmz
EI,was_esst_ihr,Maultaschen und Bratkartoffeln mit Ei und geschmorten Rotweinzwiebeln,dazu ein Salat mit Honig Senf Dressing ,1,0,https://i.redd.it/0940k4ti0tpg1.jpeg,https://www.reddit.com/r/was_esst_ihr/comments/1rx3mmb/maultaschen_und_bratkartoffeln_mit_ei_und/,1773839828.0,2026-03-18 13:17:08,LatexRaan,1rx3mmb
EI,fuckcarsRomania,Ariile naturale protejate din rețeaua Natura 2000 devastate de ATV-uri și motociclete de teren,"

Lunca Timisului face parte din rețeaua Natura 2000 de 19 ani, însă autoritățile au manifestat 0 interes !
ATV-urile și motocicletele vuiesc grotesc aproape zilnic ,în weekenduri ce sa mai zic...e durere. 
Vara, un nor teribil de praf se ridică și rămâne suspendat în aer până târziu în noapte; era miezul nopții și încă plutea în aer, deabia respiri. 
Ei poartă măști și ochelari de protecție, în timp ce noi restu plus animale, păsări, insecte – ne sufocăm în praf. 
Ceea ce se întâmplă este scandalos. Nu găsesc nicio pagină sau grup organizat pe Facebook, nimic. 
Trebuie să ne unim și să ne organizăm! Nu putem continua așa!",1,0,https://www.reddit.com/r/fuckcarsRomania/comments/1rx3mg5/ariile_naturale_protejate_din_rețeaua_natura_2000/,https://www.reddit.com/r/fuckcarsRomania/comments/1rx3mg5/ariile_naturale_protejate_din_rețeaua_natura_2000/,1773839816.0,2026-03-18 13:16:56,Puzzled-Violinist461,1rx3mg5
EI,farialimabets,"Se o meu jogo é ""adultização"", por que o vídeo do político é ""Livre""?","Salve, clã.

Ontem o **ECA Digital (Lei Felca)** entrou em vigor e o estrago começou. A Riot já começou a bloquear contas de menores no LoL, e a Rockstar simplesmente suspendeu vendas diretas no Brasil pra não ter que lidar com a burocracia. O argumento? ""Proteger o menor de conteúdo nocivo e viciante"".

Mas aqui vai a ""red pill"" do dia: se o sistema diz que uma skin de jogo é nociva, o que dizer do conteúdo que os próprios políticos postam?

Mas aqui vai a real: se o sistema diz que uma skin de jogo ou uma mecânica de sorte é nociva, o que a gente diz do conteúdo que os próprios políticos postam todo santo dia?

E é pior ainda, tem muito político ganhando engajamento, seguidor e até monetização indireta em cima de visualização de criança. Eles usam o algoritmo pra jogar treta e baixaria no feed de quem nem tem idade pra votar, construindo ""fã-clube"" com conteúdo que, em qualquer outro canal, seria banido por ser tóxico. Querem ""proteger o bolso"" das famílias contra os jogos, mas o bolso deles tá muito bem, obrigado, lucrando com a nossa atenção e com a dos nossos irmãos mais novos.  
  
Tô propondo aqui um **Teste de Estresse do Sistema**. Não é sobre política A ou B, é sobre >!isonomia!<.   
  
Se a régua da lei é a ""proteção contra o que faz mal"", por que o conteúdo de Brasília não é classificado como 18+?

Pensem bem. A gente viu candidato trocando cadeirada em debate ao vivo, gente se xingando com os termos mais chulos possíveis e usando o medo e o pânico pra manipular o voto. Se um YouTuber posta uma briga de rua, o vídeo cai. Se você é tóxico no chat do jogo, você toma ban. Mas na conta oficial de um político, a agressão física e verbal circula livre, sem filtro, no feed de qualquer criança.

A minha proposta é simples: em qualquer plataforma que essa lei alcance, sempre que você vir um político, postando qualquer coisa, faça a denúncia como **""Conteúdo 18+ / Impróprio para menores"", pois política é assunto de adulto**.

**O objetivo não é censura, é coerência!**   
  
Se o meu jogo favorito virou 18+ por causa de ""influência negativa"", o político que grita, agride e mente na rede social também é conteúdo adulto. Se o sistema ignorar as denúncias contra os ""poderosos"" mas continuar punindo quem joga, a gente prova de uma vez por todas que essa lei nunca foi sobre proteger criança nenhuma, mas sim sobre controle.

Quem quiser, jogue a ideia adiante e faça o teste.   
  
Printem as respostas das plataformas. Vamos ver se esse ""ambiente seguro"" da internet vale pra quem criou a regra ou se a lei só serve pra quem não tem foro privilegiado.

  
Observação: Esta ideia, este texto e a imagem do banner são de **domínio público**. Quem sentir que a lógica faz sentido, sinta-se totalmente autorizado a copiar, adaptar e postar onde achar necessário. O objetivo é o debate e a pressão técnica, não a autoria.

**Mas o mais importante:** Este é um experimento de análise cidadã sobre os critérios de moderação das plataformas. **A proposta é estritamente apartidária e não foca em nenhum político específico, partido ou ideologia (seja de direita, esquerda ou centro).** 

O alvo do teste não é a corrente política, mas sim a aplicação isonômica da classificação indicativa (+18) conforme os termos de uso das próprias redes e a natureza inerentemente adulta do conteúdo político brasileiro. Não incentivamos o assédio ***ou o discurso de ódio, contra ninguém***, apenas a cobrança por coerência técnica.",3,6,https://i.redd.it/lyhtildzzspg1.jpeg,https://www.reddit.com/r/farialimabets/comments/1rx3k78/se_o_meu_jogo_é_adultização_por_que_o_vídeo_do/,1773839660.0,2026-03-18 13:14:20,Flimsy-Excuse-663,1rx3k78
EI,arkisuomi,"Kuolinpesän asnunnon myynti, osakas ei suostu alentamaan hintaa","Tässä on mennyt suhde koko toiseen puoleen suvusta, mutta vielä on se riippakivi eli ""arvoasunto""... noh ei ole kovin arvokas ja remonttia tulossa arviolta 50 000€.

Pitäisi päästä tästä eroon ja vähän äkkiä, muuten ""pesä"" kärsii. Mutta, mutta, tätini ei suostu pudottamaan hintaa.

Onko muuta tehtävissä enää kuin pesänjakajan homaaminen? Pistin juuri viestiä tädille, noin 8kk sen jälkeen kun se otti nokkiinsa, että en ollut kertonut että meille syntyy esikoinen ja lopettin kaiken yhteydenpidon. Välit keplottelija isääni on jo mennyt, hän tämän koko paskan niskaani sysäsi kun kieltäyti perinnöstä koska on pirun veloissa siitä, että on vetänyt viinaa koko ikänsä ja kussut kaikki työ/firmat joita on pyörittänyt.

Mitä tässä on enää tehtävissä kuin pesänjakajan mukaan ottaminen? Onko vaikeaa? Meneekö asuntoja nykyään vaikka pistäisi pilkkahintaan?",2,5,https://www.reddit.com/r/arkisuomi/comments/1rx3jla/kuolinpesän_asnunnon_myynti_osakas_ei_suostu/,https://www.reddit.com/r/arkisuomi/comments/1rx3jla/kuolinpesän_asnunnon_myynti_osakas_ei_suostu/,1773839614.0,2026-03-18 13:13:34,CatCatFaceFace,1rx3jla
EI,MemesBrasil,"Se o meu jogo é ""adultização"", por que o vídeo do político é ""Livre""?",,1,1,https://i.redd.it/ndt5w9yqzspg1.jpeg,https://www.reddit.com/r/MemesBrasil/comments/1rx3j7k/se_o_meu_jogo_é_adultização_por_que_o_vídeo_do/,1773839590.0,2026-03-18 13:13:10,Flimsy-Excuse-663,1rx3j7k
EI,repollitos_criptidos,Momazos bíblicos 🗣🔥🧀,,1,0,https://www.reddit.com/gallery/1rx3ioo,https://www.reddit.com/r/repollitos_criptidos/comments/1rx3ioo/momazos_bíblicos/,1773839553.0,2026-03-18 13:12:33,alohisreal,1rx3ioo
EI,AutomobileRO,Pareri si sugestii,"Salut reddit, am luat decizia impreuna cu parintii mei ca dupa 8 luni de permis si plictisit de condusul masinii parintilor, sa luam o masina ,,personala'' .A aparut nevoia unei masini in plus in familia noastra pe care o voi conduce 85% din timp eu. ( fapt pentru care sunt foarte recunoscator) 

Vreau sa mentionez faptul ca nu sunt interesat sa alerg prin ,,sate'' cu ea, dar vreau o masina buna. Dupa umarirea acestei comunitati am vazut ca multi dintre voi spuneti ca mai bine iti iei o troaca sau ceva foarte low budget sa dai de toate cu ea (exagerez). Mi am facut si eu research timp de 2 ani cu sute de ore cel putin ( obsedat putin ) despre masina si consider ca o masina manuala, hatchback si cu an mai nou de productie este perfecta pentru mine in acest moment.

\* mentionez faptul ca am un phase on and off cu Dacia Duster, care nu stiu de unde vine, probabil de la robustete si garda inalta care par minuscule pe langa dezavantajele ei si nepotrivirii cu varsta mea (nu zic ca nu poti merge linistit, dar nu cred ca ar fi cea mai placuta experienta pentru mine). Mai ales ca siguranta nu  pare foarte buna din teste..

Asadar faptul care m a facut sa ies din umbra reddit ului si sa scriu acest post e ca tatal meu l a intrebat pe un mecanic ( ar fi inginer ceva, nu prea am inteles bine dar se ocupa cu masinile si nici nu vreau sa contrazic omu sau sa nu ofer respect) despre masinile enumerate de mine. 

El spune ca ultima masina trimisa de mine un clio 2019 1.0 tce, ar fi o alegere proasta deoarece e in 3c si nu se compara cu motoarele de 4c, iar distributia ar fi defapt curea in ulei (wet belt). \* este pe lant \* 

Urmand sa precizeze ca mai bine ies cu un duster 1 facelift ca e mai ,, ieftin '' la intretinere si tot ( probabil diferenta mica ) si ca e o masina buna si cu motoare pe benzina bune ( probabil din cauza toate ca sunt aspirate fara faimosul 1.2 tce, ,, faimosul ''. 

Asadar as vrea o parere asupra acestui fapt si o sugestie de masina pentru 3 ani minim 

Buget 7000- max 8000

Hatchback 

An cat de nou se poate in banii respectiv si nu vreau vreo dotare anume care trebuie sa fie acolo, dar cu cat mai multe cu cat mai bune.

Motor sub 1.6 ( fara sa tineti cont de asigurare si taxe) 

Motorina benzina/ motorina nu stiu sigur daca n am alte variante pe benzina si daca e cum a zis domnul, ca toate in 3 cilindrii sunt proaste ar trebui sa iau diesel si aia e 

2 ani o folosesc pentru naveta, 22-25 km dus, mers prin oras si dupa 22-25 km intors, pe langa drumurile mai lungi ocazionale si dupa vedem.

Ce am mai vazut eu: 

Golf 7/ Leon 3 arata frumos dar treaba cu motorizarile, nu mi se par asa bune pe benzina, in schimb Renault inca mi se pare o optiune f buna pentru calitate- pret si daca iau diesel as lua 1.5 dci...

Megane 4 hatch am vazut 1.5 dci 2017 160 k km

Clio 5 din poveste dar am auzit ca insa motorul 1.0 tce nu e asa rau, dar par cam multi 150-170k km pe el... 

Deci cam pe aici ma invart eu, pe langa dorinta care vine si pleaca pentru duster ul pe care nici eu nu stiu de ce l as vrea ca tanar... pentru ca imi place sa conduc, nu teribilist, dar o plimbare de seara cu o muzica in limita bunului simt mi se pare o activitate ideala.

( thank you for your time) ",1,1,https://www.reddit.com/r/AutomobileRO/comments/1rx3ii1/pareri_si_sugestii/,https://www.reddit.com/r/AutomobileRO/comments/1rx3ii1/pareri_si_sugestii/,1773839538.0,2026-03-18 13:12:18,Plus-Response4542,1rx3ii1
EI,Roumanie,Cel mai normal membru RoGenZ,Eu n-am cuvinte. Trageți voi concluzile. (Puncte bonus pentru cine e banat în ambele suburi ),30,21,https://i.redd.it/n6u3yqomzspg1.jpeg,https://www.reddit.com/r/Roumanie/comments/1rx3icm/cel_mai_normal_membru_rogenz/,1773839527.0,2026-03-18 13:12:07,TerraRaff,1rx3icm
EI,GoldIndia,"Why is there a ₹5,000+ price gap between these two 10g 24K gold coins? (Khazana vs Tanishq) And you can get more 3% discount at checkout in khazana","Hey guys, I’m looking to buy a 10g 24K gold coin for long-term investment and was comparing prices today. I noticed a pretty big difference between two major sellers and wanted to make sure is khazana ok to buy.
I wanted to know few things 
The Price Gap,Khazana Reliability,Buybacks (for both khazana and tanishq)
 Also please guide me which is the best coin or bar brand to consider for long term investment 
Thanks!",1,5,https://www.reddit.com/gallery/1rx3dl6,https://www.reddit.com/r/GoldIndia/comments/1rx3dl6/why_is_there_a_5000_price_gap_between_these_two/,1773839192.0,2026-03-18 13:06:32,Big_Tax1961,1rx3dl6
EI,Eesti,"Päästeamet katsetab täna ohuteavitussüsteemi, üle riigi kõlavad sireenid","Kas teie kuulete? Minul täna imekombel keegi korrusmajas remonti ei tee ja midagi ei mängi ka, kuulen surmvaikuses kuskilt kaugelt nõrka oigamist.",2,21,https://www.reddit.com/r/Eesti/comments/1rx3czu/päästeamet_katsetab_täna_ohuteavitussüsteemi_üle/,https://www.reddit.com/r/Eesti/comments/1rx3czu/päästeamet_katsetab_täna_ohuteavitussüsteemi_üle/,1773839148.0,2026-03-18 13:05:48,Previous-Silver-8550,1rx3czu
EI,expectedrussians,ну.. лан похуй,,17,1,https://i.redd.it/l0auw9ahyspg1.jpeg,https://www.reddit.com/r/expectedrussians/comments/1rx3cwn/ну_лан_похуй/,1773839142.0,2026-03-18 13:05:42,Lopsided-Oil4898,1rx3cwn
EI,NoticiasBR,"Se o meu jogo é ""adultização"", por que o vídeo do político é ""Livre""?","Salve, clã.

Ontem o **ECA Digital (Lei Felca)** entrou em vigor e o estrago começou. A Riot já começou a bloquear contas de menores no LoL, e a Rockstar simplesmente suspendeu vendas diretas no Brasil pra não ter que lidar com a burocracia. O argumento? ""Proteger o menor de conteúdo nocivo e viciante"".

Mas aqui vai a ""red pill"" do dia: se o sistema diz que uma skin de jogo é nociva, o que dizer do conteúdo que os próprios políticos postam?

Mas aqui vai a real: se o sistema diz que uma skin de jogo ou uma mecânica de sorte é nociva, o que a gente diz do conteúdo que os próprios políticos postam todo santo dia?

E é pior ainda, tem muito político ganhando engajamento, seguidor e até monetização indireta em cima de visualização de criança. Eles usam o algoritmo pra jogar treta e baixaria no feed de quem nem tem idade pra votar, construindo ""fã-clube"" com conteúdo que, em qualquer outro canal, seria banido por ser tóxico. Querem ""proteger o bolso"" das famílias contra os jogos, mas o bolso deles tá muito bem, obrigado, lucrando com a nossa atenção e com a dos nossos irmãos mais novos.  
  
Tô propondo aqui um **Teste de Estresse do Sistema**. Não é sobre política A ou B, é sobre >!isonomia!<.   
  
Se a régua da lei é a ""proteção contra o que faz mal"", por que o conteúdo de Brasília não é classificado como 18+?

Pensem bem. A gente viu candidato trocando cadeirada em debate ao vivo, gente se xingando com os termos mais chulos possíveis e usando o medo e o pânico pra manipular o voto. Se um YouTuber posta uma briga de rua, o vídeo cai. Se você é tóxico no chat do jogo, você toma ban. Mas na conta oficial de um político, a agressão física e verbal circula livre, sem filtro, no feed de qualquer criança.

A minha proposta é simples: em qualquer plataforma que essa lei alcance, sempre que você vir um político, postando qualquer coisa, faça a denúncia como **""Conteúdo 18+ / Impróprio para menores"", pois política é assunto de adulto**.

**O objetivo não é censura, é coerência!**   
  
Se o meu jogo favorito virou 18+ por causa de ""influência negativa"", o político que grita, agride e mente na rede social também é conteúdo adulto. Se o sistema ignorar as denúncias contra os ""poderosos"" mas continuar punindo quem joga, a gente prova de uma vez por todas que essa lei nunca foi sobre proteger criança nenhuma, mas sim sobre controle.

Quem quiser, jogue a ideia adiante e faça o teste.   
  
Printem as respostas das plataformas. Vamos ver se esse ""ambiente seguro"" da internet vale pra quem criou a regra ou se a lei só serve pra quem não tem foro privilegiado.

  
Observação: Esta ideia, este texto e a imagem do banner são de **domínio público**. Quem sentir que a lógica faz sentido, sinta-se totalmente autorizado a copiar, adaptar e postar onde achar necessário. O objetivo é o debate e a pressão técnica, não a autoria.

**Mas o mais importante:** Este é um experimento de análise cidadã sobre os critérios de moderação das plataformas. **A proposta é estritamente apartidária e não foca em nenhum político específico, partido ou ideologia (seja de direita, esquerda ou centro).** 

O alvo do teste não é a corrente política, mas sim a aplicação isonômica da classificação indicativa (+18) conforme os termos de uso das próprias redes e a natureza inerentemente adulta do conteúdo político brasileiro. Não incentivamos o assédio ***ou o discurso de ódio, contra ninguém***, apenas a cobrança por coerência técnica.",0,4,https://i.redd.it/82239bc0yspg1.jpeg,https://www.reddit.com/r/NoticiasBR/comments/1rx3bo0/se_o_meu_jogo_é_adultização_por_que_o_vídeo_do/,1773839054.0,2026-03-18 13:04:14,Flimsy-Excuse-663,1rx3bo0
EI,moneyeduorgtw,錢坤- 海期女戰神 學姊 - 海期鈔能力- 理周美姬- 理周教育學苑- 坤最愛， 假帳號們， 你愛我， 我愛你， 講2句，就開始推課程🤣 一貫作風， 幾個假帳號對話， 然後錢坤就假裝出來感謝感謝。 課程這麼有效果， 錢坤為什麼還要打3份工？ 他的技術還不能幫他提早退休嗎？ 還整天，為了588元， 掙扎邊緣🤣 過了5年，還在拼了條老命賣課程。 他自己操盤也不穩， 還在整天坑教！,"錢坤- 理周美姬- 理周教育學苑- 

錢坤- 海期女戰神 學姊 - 海期鈔能力- 理周美姬- 理周教育學苑

錢坤最愛， 假帳號們， 你愛我， 我愛你， 講2句，就開始推課程🤣 一貫作風， 幾個假帳號對話， 然後錢坤就假裝出來感謝感謝。 課程這麼有效果， 錢坤為什麼還要打3份工？ 他的技術還不能幫他提早退休嗎？ 還整天，為了588元， 掙扎邊緣🤣 過了5年，還在拼了條老命賣課程。 他自己操盤也不穩， 還在整天坑教！ ",1,0,https://www.reddit.com/gallery/1rx3avi,https://www.reddit.com/r/moneyeduorgtw/comments/1rx3avi/錢坤_海期女戰神_學姊_海期鈔能力_理周美姬_理周教育學苑_坤最愛_假帳號們_你愛我_我愛你/,1773838999.0,2026-03-18 13:03:19,Radiant-String6127,1rx3avi
EI,ScotlandRugby,Scotland Squad for Women’s Six Nations,,14,1,https://www.reddit.com/gallery/1rx37x8,https://www.reddit.com/r/ScotlandRugby/comments/1rx37x8/scotland_squad_for_womens_six_nations/,1773838806.0,2026-03-18 13:00:06,Connell95,1rx37x8
