bank,subreddit,title,selftext,score,num_comments,url,permalink,created_utc,created_date,author,id
ENBD,GearsOfWars,"The Best Xbox 360 Exclusive Games That Are Backwards Compatible Right Now!THE GAME THRIFTERMarch 20, 2026 at 02:00PM",,1,0,https://www.youtube.com/embed/RPZ9HOqF0IA,https://www.reddit.com/r/GearsOfWars/comments/1rz5mte/the_best_xbox_360_exclusive_games_that_are/,1774034605.0,2026-03-20 19:23:25,GameProfessional,1rz5mte
ENBD,UAEcreditcards,"Saves on hotels, car rentals, and stays local and beyond!","Good evening, 
So many sites and services it's overwhelming, suggest one that offers promotionals and credit cards offers! 

I have:
- SIB cashback 
- Mashreq noon
- ENBD UEMAAR

Thank you 

",1,0,https://www.reddit.com/r/UAEcreditcards/comments/1rz0y2i/saves_on_hotels_car_rentals_and_stays_local_and/,https://www.reddit.com/r/UAEcreditcards/comments/1rz0y2i/saves_on_hotels_car_rentals_and_stays_local_and/,1774024020.0,2026-03-20 16:27:00,PepticUlcer27,1rz0y2i
ENBD,dubai,Transfer from MBank Business Account to another bank account,"Hi! Does anyone here know how to transfer funds from a MBank Business account to another bank account like Emirates NBD? The app doesn’t show up any “add beneficiary” option or at least I can’t find it.

TIA!

Update: nevermind, I found the desktop login. It’s only possible via desktop. Leaving this info here in case it helps someone else.",2,2,https://www.reddit.com/r/dubai/comments/1ryy1bq/transfer_from_mbank_business_account_to_another/,https://www.reddit.com/r/dubai/comments/1ryy1bq/transfer_from_mbank_business_account_to_another/,1774017542.0,2026-03-20 14:39:02,FacelessCreative,1ryy1bq
ENBD,UAEcreditcards,ENBD Marriott,Do you get the 100k points on activation if you avail the first year free offer?,3,13,https://www.reddit.com/r/UAEcreditcards/comments/1ryurgv/enbd_marriott/,https://www.reddit.com/r/UAEcreditcards/comments/1ryurgv/enbd_marriott/,1774009279.0,2026-03-20 12:21:19,Skd98012,1ryurgv
ADCB,CPTSDmemes,"They are obsessed with their false legacy, I’m obsessed with the consciousness beyond…",,46,0,https://i.redd.it/dkw8raqvt8qg1.jpeg,https://www.reddit.com/r/CPTSDmemes/comments/1rz46s9/they_are_obsessed_with_their_false_legacy_im/,1774031305.0,2026-03-20 18:28:25,Awkward-Worth5484,1rz46s9
ADCB,DubaiUX,Dark pattern or defensible design decision? And have you spotted worse in UAE banking apps?,"Spotted this in the ADCB mobile app. You open it, get hit with a “What’s New” credit card promo, tap the X to close it — and then get this:

Alert: Are you sure you want to close?

\[No\] \[Yes\]

A confirmation dialog. To close an advertisement.

The UX problems:

	∙	“Alert” is a system-level word — it signals urgency or error, not “hey we’d like you to keep reading our ad”

	∙	“No” and “Yes” with no labels means users have to parse the double negative: No, I don’t want to close? Yes, I do want to close?

	∙	The button hierarchy is flat — same weight, same color — giving users no clear safe exit

	∙	The promo content underneath is partially obscured, so you can’t even evaluate what you’re closing

The bigger issue:

This is a financial app. Trust is the entire product. Dark patterns that trap users in promotional flows are exactly the kind of thing that erodes that trust — especially among users who are already cautious about banking apps.

There’s a real conversation to be had here about who approved this interaction — was it a product decision, a marketing mandate, or did UX just not have a seat at that table?

Drop your take below:

Dark pattern or defensible design decision? And have you spotted worse in UAE banking apps?",1,0,https://www.reddit.com/r/DubaiUX/comments/1ryrgz4/dark_pattern_or_defensible_design_decision_and/,https://www.reddit.com/r/DubaiUX/comments/1ryrgz4/dark_pattern_or_defensible_design_decision_and/,1773998231.0,2026-03-20 09:17:11,Born-James-Apex,1ryrgz4
ADIB,u_FluidStance,Desk Setup: Can you write directly on the FluidStance Dashboard & Slope Desktop Whiteboards? - YES!,"**""Is it possible to write on the Dashboard itself, or is it only possible on the Flow Cards? And for the Slate color, how do the markers look when writing on it?"" -Customer Question**

**Yes**, Our Whiteboards are made to be written directly on the Board. (White, Yellow & Slate)

**The White & Yellow Finish:** Works best with standard dry-erase markers.  
**The Slate (Gray) Finish:** If you have the Slate color, standard dry-erase won't show up as well. This board is designed for bright, wet-erase markers (we include a white one with your order to get you started). Wet-erase pops against the dark surface. 

**Create an Ecosystem for your Desktop - More than just a whiteboard**

* The Slope and Dashboard allow you to hide and tuck-away your keyboard when you are done using it to leave your desk feeling clean and organized. 
* Ditch the sticky notes and add Flow Card Mini-Magnetic whiteboards to your Slope or Dashboard. Use these to jot down daily tasks, brainstorm, or doodle while on a call. They simply snap (magnetize) in place on top of the Dashboards and Slopes.
* Add mini magnet pins (sold on our site) to hold smaller paper documents or keys.  

**Cleaning the White and Yellow Boards:** Erase your markings as soon as you don't need them to prevent ghosting. For a deep clean, our Whiteboard Kit (the Shine Spray -sold on our site-smells incredible!) works perfectly. 

**Cleaning the Slate Board:** When using the Slate whiteboards, users usually use wet-erase markers. For  your best bet, use a lightly damp, soapy rag to wipe it down. We highly recommend keeping a small spray bottle at your desk, or using our Shine Spray to keep your workspace looking spotless.

I'll drop the links to everything in the comments below! 👇

",1,1,https://www.reddit.com/gallery/1rz2g1a,https://www.reddit.com/r/u_FluidStance/comments/1rz2g1a/desk_setup_can_you_write_directly_on_the/,1774027343.0,2026-03-20 17:22:23,FluidStance,1rz2g1a
ADIB,Palestine,"dward Said and his sister, Rosemarie Said, dressed in traditional Palestinian cothing, 1940","Israel confiscated the Said house in May 1948. The Saids had fled Jerusalem earlier that April, but all their belongings were still in the house. The house and its contents remained in the possession of the so-called Custodian of Absentee Property until the early 1980s, when Menachem Begin gave it to the International Christian Embassy, a right-wing evangelical organization established in 1980 to support the Zionist state. In the 1990s, when the organization relocated, Amidar, an Israeli state-owned housing company established in 1949, was granted the property. In the early 2000s, a private real estate company, Talbeia Properties, purchased the property from Amidar, and shortly thereafter in 2005, Jewish-American financiers and brothers Arthur and Michael Fried bought it from Talbeia Properties along with 90 percent of Talbeia Properties. Wasting no time, the Fried brothers hired an architect to add two more floors to the edifice, transforming the two-story Said family home into a four-story condominium apartment building to be managed as short-term family vacation rentals.3

Like thousands of Palestinians’ properties in Jerusalem (see The West Side Story, Part 4: The Erasure of the New City and Its Transformation into Jewish West Jerusalem), the Israeli state and its associated bodies confiscated the Saids’ dream family home (see The Sakakini House: Tracing Israel’s Bureaucracy of Collective Confiscation through One Treasured Home) in Talbiyya, casting them into exile, where they remain to this day. Not a single Said remains in Jerusalem today; their descendants are now scattered across the Palestinian diaspora, including in Jordan, Lebanon, Switzerland, the UK, Canada, and the US. The majority are located in Amman and Beirut.

The Said family fled their home in Talbiyya in the months leading up to May 1948 and sought refuge in Cairo, where they had opened a branch of their family business years prior. But their lives in Egypt were also interrupted by the 1952 revolution, which sent them back to Ramallah, then to Amman, Beirut, the United States, and beyond throughout the Palestinian diaspora. While Edward Said is undoubtedly the most famous Said, this Photo Essay tells the story of his aunt and uncle’s family—who lived in the same house in Talbiyya—and whose descendants now live in Amman, Jordan.

Before their flight from Jerusalem in the months leading up to May 1948, members of the Said family were part of the city’s Christian aristocracy. Affluent, well-traveled, and educated in the city’s British institutions, this Protestant Anglican family originally hailed from the large Khleif tribe of Nazareth. The story goes that one of their ancestors fought with his brothers and moved to Jerusalem in the mid-19th century, starting his own family line: the Saids. Prior to the Nakba, the family’s most renowned members, cousins, and businessmen, Wadie and Boulos Said, were born in the Old City around the turn of the 20th century. The two went into business together, and their relationship grew even closer when Boulos married Wadie’s sister Nabiha. The descendants of Wadie and his wife, Hilda, would come to include writers, intellectuals, and academics, most notable among them Edward Said. Their less famous cousins, Boulos and Nabiha’s children, would preserve the family business first established in Jerusalem into the 21st century.

The Said family home is located today at 10 Brenner Street, just down the road from the prime minister’s house, along Chille Square, a park in the Talbiyya neighborhood of what is now West Jerusalem. But when Wadie and Boulos purchased the lot in the late 1920s, the land surrounding it was largely empty, and its prospects for development seemed limitless. They decided to build a two-story family home large enough to accommodate their families, which included 13 children. Boulos and Nabiha had twins Evelyn and Yousef, George, twins Adib and Labib (who died in infancy), Margaret (who died as a teenager), and twins Albert and Robert. Wadie and Hilda had Edward, Jean, Rosemary (Rosy), Joyce, and Grace. The cousins grew up in Jerusalem within the walls of their modern home built with the majestic Jerusalem stone. Though their school was on the other side of the Old City, their favorite place to meet and play with their friends, the YMCA, was less than a 10-minute walk from their new home in the flourishing New City.

“Not being able to go back to our home in Talbiyya was something my father was never able to accept and part of why he died so young at 51 of heart failure,” Dina, 65, Albert’s daughter with Sylvia Salah from Ramallah, shared. Dina and her two siblings, Basim and Hala, were born in Cairo a few years after the Nakba.

Jordan annexed East Jerusalem between 1948 and 1967, and so it was possible for the Saids to periodically return to the West Bank for visits while they lived in Cairo.

Though each of Boulos’s sons and their descendants secured Western nationalities—either Swiss, Canadian, or American—and could therefore visit Jerusalem as tourists of those countries, none of them was ever able to enter their home in Talbiyya again. But they have each stood outside it, that home their grandparents and great-grandparents built for them nearly a century ago, and Basim’s son Najib, 35, a British citizen, even met the Jewish Israeli-American family from Brooklyn that now inhabits his family home. “He told me he bought it fair and square from the Israeli state,” Najib explained about his conversation with the occupier of his grandfather’s home in 2016. “And when I didn’t argue and instead asked if I could enter to see where my grandfather grew up, he refused and said: ‘Don’t worry, we’re taking care of the house now.’”

When Dina, as a US citizen, went to see her father’s home in December 2011, she looked at the limestone wall her father had climbed when he was a child, the only part of the redesigned building that still retained her grandfather and grandmother’s original imprint. “I felt I wasn’t allowed to be there; I felt I wasn’t allowed to touch the stone, sit on it, or enter the building. I felt the Israelis were watching and would detain me for trespassing,” Dina shared. “All I could do was kneel down on the sidewalk across from the house, under the pine trees where my father and his siblings and cousins played. I cried a long lament of a mourning that my father was never allowed to have.”

That was the last time Dina returned to Jerusalem. “I bid farewell to my father and Jerusalem that day. So long as they’re still there, still in our home, I can never go back, not even to visit. It’s too painful.”

Source:

https://www.jerusalemstory.com/en/article/said-family-jerusalem-denied-return-their-home-talbiyya-perpetual-trauma-exile   

https://commons.wikimedia.org/wiki/File:SaidSis.jpg#mw-jump-to-license",283,6,https://www.reddit.com/gallery/1ryz2rk,https://www.reddit.com/r/Palestine/comments/1ryz2rk/dward_said_and_his_sister_rosemarie_said_dressed/,1774019894.0,2026-03-20 15:18:14,Sun_fire_,1ryz2rk
EI,u_qurbatt,"iQOO Z11x 5G (Prismatic Green, 8GB RAM, 256 GB Storage) | Dimensity 7400-Turbo Processor | 7200 mAh Battery Smartphone | Powered by OriginOS 6","# About this item

* PERFORMANCE: Segment’s Fastest Smartphone, powered by Dimensity 7400 Turbo chipset with an AnTuTu score of 1Mn+, paired with UFS 3.1 and 256GB storage. Gaming features include Dual 10x Super Touch Control, Monster Mode, in-game overlay notifications, 4D game vibration, and Game Voice Changer for an immersive gaming experience.
* BATTERY: Segment’s Biggest Battery, Z11x packs a massive 7200mAh battery. Supports 1600 complete charging cycles maintaining battery health for up to 6 years. 44W FlashCharge, battery temperature control, and overnight charging protection ensure fast and safe charging. Supports Bypass charging, with 25-Dimension Security Protection and PPS support.
* OPERATING SYSTEM: Running on OriginOS 6, the Z11x offers 2 years of Android updates and 4 years of security patches. Key features include AI Captions, AI Creation, AI Transcript Assist, Circle to Search, and Screen Translation. It also includes Private Space for added privacy, Origin Island with Drag & Go, Copy & Go, and lock screen customisation.
* IP & DURABILITY: Industry’s Leading IP68 & IP69+ dust and water resistance. It also comes with Military Grade Durability, designed to withstand drops, shocks, and tough daily use.
* CAMERA: The Z11x includes a 50MP Sony IMX 852 Ultra-HD AI-powered main camera with a 32MP front camera. It supports 4K video recording on both front and rear cameras, 4K Video-to-Live Photo conversion, Dual-View Video Recording, Video Electronic Image Stabilisation (EIS), and Live Photo.",1,0,https://www.reddit.com/r/u_qurbatt/comments/1rzlp38/iqoo_z11x_5g_prismatic_green_8gb_ram_256_gb/,https://www.reddit.com/r/u_qurbatt/comments/1rzlp38/iqoo_z11x_5g_prismatic_green_8gb_ram_256_gb/,1774079593.0,2026-03-21 07:53:13,qurbatt,1rzlp38
EI,Urbexyoutube,MAGISCHES ALLGÄU: Wandern auf dem Eis & Ruinen-Check! 🏔️✨,,1,0,https://youtu.be/WGYh9ctvj9Y?is=xcgX6833bI1PzREY,https://www.reddit.com/r/Urbexyoutube/comments/1rzlozq/magisches_allgäu_wandern_auf_dem_eis_ruinencheck/,1774079582.0,2026-03-21 07:53:02,Conscious_Demand_765,1rzlozq
EI,dashuju,AI的坦诚结语,,1,0,https://i.redd.it/46qoda61tcqg1.jpeg,https://www.reddit.com/r/dashuju/comments/1rzlns8/ai的坦诚结语/,1774079445.0,2026-03-21 07:50:45,Existing-Buffalo6787,1rzlns8
EI,punjabimusic,would have been better without Sartaaj!,"I love Jaiye Sajna from Dhurandhar. Jasmine Sandlas’s voice just melts through me, it’s pure, effortless, and emotional. But, When Satinder Sartaaj comes in, it doesn’t feel wrong, however it ruins the experience of the song for me, it kind of breaks that magic. Honestly, this song was jasmine’s from the start; it should’ve just been Jasmine. Sartaaj part could have been a separate song.",0,2,https://i.redd.it/qt9cw05xscqg1.jpeg,https://www.reddit.com/r/punjabimusic/comments/1rzlngm/would_have_been_better_without_sartaaj/,1774079409.0,2026-03-21 07:50:09,Gurkirat_sndhu1,1rzlngm
EI,vedalsverse,"Admiral Ensin and Count Wolfy Full SNN Interview (Neuro-sama: The Good, the Evil and the Filtered.)",[Me and AdmiralEnsin Full SNN Interview (lots of me yapping)](https://www.youtube.com/watch?v=EiOYDRbQVak) by [Count Wolfy](https://www.youtube.com/@CountWolfy),1,0,https://www.youtube.com/watch?v=EiOYDRbQVak,https://www.reddit.com/r/vedalsverse/comments/1rzlmni/admiral_ensin_and_count_wolfy_full_snn_interview/,1774079318.0,2026-03-21 07:48:38,Yu555,1rzlmni
EI,PSAPowerPacks,Keep or sell?,🤔🤔,2,0,https://i.redd.it/51zddo1cscqg1.jpeg,https://www.reddit.com/r/PSAPowerPacks/comments/1rzllpk/keep_or_sell/,1774079212.0,2026-03-21 07:46:52,FatheroftheMoon92,1rzllpk
EI,me_irl,me irl,"https://preview.redd.it/ool06yyascqg1.png?width=1052&format=png&auto=webp&s=fbf7c4241929c6a9d53a79165cc3738a20507794

",1,1,https://www.reddit.com/r/me_irl/comments/1rzlln3/me_irl/,https://www.reddit.com/r/me_irl/comments/1rzlln3/me_irl/,1774079205.0,2026-03-21 07:46:45,nicotine-70,1rzlln3
EI,sydney,Rocker Locker,Castle Towers today. ,6,1,https://i.redd.it/pauf6ukascqg1.jpeg,https://www.reddit.com/r/sydney/comments/1rzllkw/rocker_locker/,1774079198.0,2026-03-21 07:46:38,Ebeeeeeee,1rzllkw
EI,Finanzen,Hat das Problem noch jemand,"Moin, warte schon seit Tagen auf meine neue Schufa Auskunft über die App, jedoch wurde mein Datensatz nicht gefunden…

Jedoch stand bei der Anmeldung, dass es nur 1 Tag dauern sollte. Dass ist schon etwas länger her.

Hat es Ei her Broich große Nachteile, wenn man Leinenschuhe mehr hat",1,3,https://i.redd.it/2bzn5dj1scqg1.jpeg,https://www.reddit.com/r/Finanzen/comments/1rzlku3/hat_das_problem_noch_jemand/,1774079113.0,2026-03-21 07:45:13,Chris_234567,1rzlku3
EI,Vedic_Astrology_free,When will I most likely get married and spouse nature?,,1,4,https://i.redd.it/754g5cv0scqg1.jpeg,https://www.reddit.com/r/Vedic_Astrology_free/comments/1rzlkso/when_will_i_most_likely_get_married_and_spouse/,1774079109.0,2026-03-21 07:45:09,Western-Might-5276,1rzlkso
EI,werkzaken,Snel schakelen of even afwachten?,"Collega’s! 

Ik heb jullie expertise nodig over wat wijsheid is. 

Op dit moment werk ik 2.5 jaar bij bedrijf X als salesmanager. Bedrijf gaat al een jaar niet goed, markt is zeer uitdagend en nieuwe klanten blijven uit. Sinds paar maanden ligt mijn hoofd op het hakblok en inmiddels zo erg dat de eigenaar twee weken geleden heeft aangegeven dat ik nog 4 weken heb om nieuwe klanten te regelen, anders is het exit. Ik heb een vast contract dus hij kan niet zomaar afscheid van mij nemen, dit zal dan middels een VSO moeten. 

Inmiddels zijn we twee weken verder en is er niet veel veranderd. Ik ben wel gaan schakelen en heb wat lijntjes uitgegooid bij oude werkgever, deze noem ik even bedrijf Y. Deze hebben aangegeven mij terug te willen hebben maar willen dit graag nog snel regelen voor einde maand zodat ik snel kan beginnen. Dit is een ander bedrijf waar ik aan de slag zal gaan als inkoper. Past uiteindelijk ook beter bij mij dan een verkopende rol. 

Wat is wijsheid? Bedrijf Y nog even afhouden en nog 3/4 weken wachten en kijken wat er gebeurt bij X, zodat er misschien nog een VSO komt of deze maand nog ontslag nemen en zo snel mogelijk starten bij bedrijf Y? 

Side note. Afgelopen maanden zijn zeer stressvol geweest bij bedrijf X. Het bedrijf staat in brand en ik weet ook even niet hoe ik dit ga veranderen. Hier heb ik prive wel last van. Eigenaar is echter wel altijd netjes naar mij geweest, eerste 1,5 jaar een goede tijd gehad en toen we nog niet in brand stonden was alles koek en ei. 

Side side note: ik heb eerder in een reorganisatie gezeten bij een ander bedrijf. Hier ben ik toen ook weggegaan met een VSO en een mooie zak geld meegekregen. Toch de zolderverbouwing van kunnen betalen 🥹 ",1,3,https://www.reddit.com/r/werkzaken/comments/1rzljm4/snel_schakelen_of_even_afwachten/,https://www.reddit.com/r/werkzaken/comments/1rzljm4/snel_schakelen_of_even_afwachten/,1774078983.0,2026-03-21 07:43:03,Aromatic-Bit4871,1rzljm4
EI,Suomi,"Kansanedustaja Noora Fagerströmin (kok) salaattifirmalla ei ole kaikki kunnossa: Yritykselle sataa tuomioita – Selvitimme, mistä syistä",,12,6,https://www.iltalehti.fi/politiikka/a/2845a8e3-85a5-4371-938e-d6b31e9c1501,https://www.reddit.com/r/Suomi/comments/1rzlhzi/kansanedustaja_noora_fagerströmin_kok/,1774078814.0,2026-03-21 07:40:14,soldierofcinema,1rzlhzi
EI,PersonalFinanceCanada,Forgot a form on my taxes?,"I don't have complicated taxes. Just T4s. However, last year I received a bit of EI. I filed my taxes and completely forgot to add this form. What does the CRA do? I am unable to edit what I've submitted. Will they settle it up on their end?",2,2,https://www.reddit.com/r/PersonalFinanceCanada/comments/1rzlhnm/forgot_a_form_on_my_taxes/,https://www.reddit.com/r/PersonalFinanceCanada/comments/1rzlhnm/forgot_a_form_on_my_taxes/,1774078777.0,2026-03-21 07:39:37,robot-fingers,1rzlhnm
EI,TaxQuestions,Canada - What happens if you leave out a form?,"I don't have complicated taxes. Just T4s. However, last year I received a bit of EI. I filed my taxes and completely forgot to add this form. What does the CRA do? I am unable to edit what I've submitted. Will they settle it up on their end?",2,0,https://www.reddit.com/r/TaxQuestions/comments/1rzlhd1/canada_what_happens_if_you_leave_out_a_form/,https://www.reddit.com/r/TaxQuestions/comments/1rzlhd1/canada_what_happens_if_you_leave_out_a_form/,1774078744.0,2026-03-21 07:39:04,robot-fingers,1rzlhd1
EI,XboxSupport,Already tried the night mode doesn’t work please help,"I’m literally trying to get this to work, the Xbox network didn’t work and it did eventually, and now my entire screen is like broken",1,1,https://i.redd.it/dasxbq6bqcqg1.jpeg,https://www.reddit.com/r/XboxSupport/comments/1rzlfd7/already_tried_the_night_mode_doesnt_work_please/,1774078532.0,2026-03-21 07:35:32,Imaginary_Speech_394,1rzlfd7
EI,loopit22,Niin höh mitää!,"EI tapahdu hetkessä eläminen ja työskentely ulkomailla, mutta tääl Suomeen ni kyl toimiin",1,0,https://www.reddit.com/r/loopit22/comments/1rzlerl/niin_höh_mitää/,https://www.reddit.com/r/loopit22/comments/1rzlerl/niin_höh_mitää/,1774078465.0,2026-03-21 07:34:25,tubeeno,1rzlerl
EI,bankingexam,How to solve this puzzle?,Isme  P corner ke bad kaise karenge,1,6,https://i.redd.it/gtt48744ocqg1.jpeg,https://www.reddit.com/r/bankingexam/comments/1rzl8iu/how_to_solve_this_puzzle/,1774077797.0,2026-03-21 07:23:17,Swimming_Search2947,1rzl8iu
