bank,subreddit,title,selftext,score,num_comments,url,permalink,created_utc,created_date,author,id
EI,scaryeddie,I don't even know what this is,[Road trip](https://youtu.be/GMgsFZ4rkEI?si=c2KvSD3R4cxgdgKs),3,0,https://www.reddit.com/r/scaryeddie/comments/1rvvcfo/i_dont_even_know_what_this_is/,https://www.reddit.com/r/scaryeddie/comments/1rvvcfo/i_dont_even_know_what_this_is/,1773717380.0,2026-03-17 03:16:20,Latter-Bottle1836,1rvvcfo
EI,Broomfield,CO House of Representatives Data,"When four qualified candidates were running for HD33, I became curious about what each candidate would be able to contribute to the legislature in terms of skills and life experiences for both the district and the state. I mapped out who was at legislature in terms of gender, racial/ethnic background, education and career focus, notable achievements, building a visual board using sticky notes for each representative’s profile.

As Democrats, and progressive leaning Unaffiliateds, representation matters, so this felt like a useful exercise for me and decided to share the summary.

If you are not aware, The Colorado House of Representatives has 65 members: 43 Democrats and 22 Republicans. Women hold the majority at about 58–60% (38 women, 27 men), and the average age is about 48.9 overall.

Among the 43 Democratic members, 34 are women and 9 are men, meaning 79% of Democratic House members are women.

The average age of Democratic members in the 2025–2026 session is 48.47 years.

Racial composition is approximately 73.4% White, 14.1% Hispanic/Latino, 7.8% Black, 3.1% Other and Two or More 1.6% at our House of Representatives. If you look at our Colorado population (based on 2024 estimates) the distribution should be White (Non-Hispanic) 65.1%, Hispanic/Latino 23.3%, Black/African American 4.3%, Asian 3.9% and Other/Multi-racial 3.4%.

Despite AAPI residents making up roughly 4% of Colorado’s population, House representation remains limited. With Kenny Nguyen’s vacancy appointment, he is the first Vietnamese American to serve, yet identifying other AAPI members is difficult without deep diving into individual profiles. It’s also important to distinguish MENA representatives—like Senator Iman Jodeh (Palestinian) and Representative Yara Zokaie (Iranian)—who are often grouped with Asian legislators in public data but have distinct ethnic identities with neither being Asian.

While Colorado’s 65-member House is anchored by legal, education, business and community advocacy professionals, significant gaps remain in technical and ""blue-collar"" fields. There are currently no representatives with backgrounds in AI, data science, anti-money laundering, or skilled trades such as mechanics, plumbers, HVAC etc. Medical expertise is also notably absent. As the 2026 session tackles heavy regulation in these specialized sectors, the lack of direct professional experience highlights a critical need for broader representation.

As an aside, two of the original 4 candidates have professional backgrounds not currently represented. Former candidate James Marsh-Holschen, a Georgetown Law graduate, BA from Eastern Washington University, Government & Economics, with 10 years of anti–money laundering experience, and Paloma Delgadillo, an applied data scientist, University of Chicago Graham School Master pf Science, Applied Data Science with roughly a decade of professional experience in that field. Both have backgrounds sorely missed in the House and, in my thinking, critical for the future. And, outside of Kenny (appointee and current candidate) there are no additional Colorado House Representatives with a Master of Public Administration (MPA) degree - University Colorado Denver.

Geez, I hope the format stays good! ",10,8,https://i.redd.it/z5qv0cvcwipg1.jpeg,https://www.reddit.com/r/Broomfield/comments/1rvvc61/co_house_of_representatives_data/,1773717358.0,2026-03-17 03:15:58,motowngal,1rvvc61
EI,PokemonMisprints,Anyone seen a printer hickey spanning multiple cards?,"Went through the childhood card binder and found something pretty strange. I had a Charmander with what appears to be a large, white printer hickey. Maybe nothing too crazy (although I haven't seen any quite like this). Stranger yet, the card behind it also had a white hickey.....but they align perfectly as if they were printed on the same sheet, and I just so happened to get both of them.

Could be common, but hadn't seen anything online about this happening. Interested to hear your thoughts 

https://preview.redd.it/iwt4g3f5wipg1.jpg?width=4032&format=pjpg&auto=webp&s=403f6c620a14e7732dc8f82858521a59505b67fd

",1,0,https://www.reddit.com/r/PokemonMisprints/comments/1rvvbmy/anyone_seen_a_printer_hickey_spanning_multiple/,https://www.reddit.com/r/PokemonMisprints/comments/1rvvbmy/anyone_seen_a_printer_hickey_spanning_multiple/,1773717316.0,2026-03-17 03:15:16,WazzOverland,1rvvbmy
EI,cantax,Hired nanny. Do I need to adjust my taxes?,"Hello! For about 6 months last year we hired a live in nanny. I did not deduct room and board from her. I withheld taxes, CPP, and EI and submitted using a third party service with a newly created business account for said purpose. Do I need to do anything with my own personal taxes this year? Do I need to file business taxes, even though I had no income on the business account? Thank you. ",2,2,https://www.reddit.com/r/cantax/comments/1rvv9ng/hired_nanny_do_i_need_to_adjust_my_taxes/,https://www.reddit.com/r/cantax/comments/1rvv9ng/hired_nanny_do_i_need_to_adjust_my_taxes/,1773717150.0,2026-03-17 03:12:30,xNyxx,1rvv9ng
EI,GreenConvert,Problem,"https://preview.redd.it/3edoub8bvipg1.jpg?width=1620&format=pjpg&auto=webp&s=2a66d62c1ce0ee7141e4a8a13c07bb01eb36a11f

I haven’t had any luck what so ever since the big update, and whenever I have made an attempt to post a link to convert to mp4, I consistently get this……",1,0,https://www.reddit.com/r/GreenConvert/comments/1rvv96b/problem/,https://www.reddit.com/r/GreenConvert/comments/1rvv96b/problem/,1773717111.0,2026-03-17 03:11:51,JohnnyWadd815960,1rvv96b
EI,filson,How to date from latest tags,"The 2rd line seems to be the style number. What about the number from the 1st row?
",5,3,https://i.redd.it/5ukbit8hvipg1.jpeg,https://www.reddit.com/r/filson/comments/1rvv8lj/how_to_date_from_latest_tags/,1773717064.0,2026-03-17 03:11:04,Ok-Balance6754,1rvv8lj
EI,mealprep,My short lived meal planning effort.,What do you think of my regular diet?,2,2,https://i.redd.it/y1wam0zcuipg1.png,https://www.reddit.com/r/mealprep/comments/1rvv483/my_short_lived_meal_planning_effort/,1773716717.0,2026-03-17 03:05:17,lemasney,1rvv483
