bank,subreddit,title,selftext,score,num_comments,url,permalink,created_utc,created_date,author,id
EI,gatosportugal,Falhei como Família de Acolhimento Temporário,"Tinha duas gatas, a Kira e a Tenshi. Amo-as de morte. Sou louca por gatos que ando sempre com comida para dar aos bichinhos de rua. Um dia, vi no OLX um gato em estado deprimente e a pessoa que resgatou a pedir alguém que acolha o bichinho em casa porque ele no veterinário estava a definhar pela depressão… não aguentei… não era bebé, não era saudável, precisava de alimentação hipoalergenica porque ele tem alergias… mas trouxe-o para casa e falhei como FAT… de temporário não tive nada e não aguentava a ideia de ele se sentir abandonado mais uma vez. Bem vindo a casa, Mochi. De gato 🐈 magríssimo, todo sujo, que tinha desistido inclusive do seu cuidado de limpeza… para este gordo lindo branco e laranja. 

Fiz amizade com a menina que faz resgates. Um anjo na terra… um dia estávamos a falar e ela conta-me a história de uma ninhada de 5 gatinhos cujo destino seria a morte certa, já não era a primeira ninhada daquela gata e nunca sobreviviam (ela está há anos a tentar castrar a gata, está a tentar TUDO e já tentou, ainda não conseguiu)… e eu? Bem. São bebés… não há nada que duas jaulas gigantes de veterinário e uma marquise não aguente… ofereci-me para ser FAT novamente… 5 bebés! Fiquei com 3 adultos em casa e 5 bebés que davam mais trabalho que 10 adultos 😭! 

Encontramos famílias excelentes que adotaram 2 irmãos em conjunto! Demorou mas são famílias ótimas, valeu a pena a espera toda… e o 5…? foi adotado… por mim! Não conseguia dizer adeus. Ele deixou uma patinha no meu coração e soube que era o meu bebé. Ele veio meio avariado de fábrica e não tem ligação no canal lacrimal que requer limpeza e cuidado frequente… mas é o meu baby e mais uma vez. Falhei como FAT! :) agora lá temos 4, bem vindo a casa Yuki. O Mochi e ele ficaram melhores amigos! 👯 

A minha Kira está com alopecia e stress porque odeia-os aos dois, especialmente ao pequeno. A Tenshi não gosta de ninguém. E eles os dois gostam de tudo e todos. 

(Aceito recomendações anti stress para a Ki, já estou a tentar ração específica, suplementos calmantes para alopecia, feliway Optimus, etc). 

Eis os meus falhanços a serem fofos. :) bem haja!",64,5,https://www.reddit.com/gallery/1rx0rkt,https://www.reddit.com/r/gatosportugal/comments/1rx0rkt/falhei_como_família_de_acolhimento_temporário/,1773831691.0,2026-03-18 11:01:31,PatzCM,1rx0rkt
EI,BloxFruitsTradingHub,Looking for kitsune!,,1,1,https://i.redd.it/hcwev1racspg1.jpeg,https://www.reddit.com/r/BloxFruitsTradingHub/comments/1rx0rgp/looking_for_kitsune/,1773831682.0,2026-03-18 11:01:22,Separate-Capital,1rx0rgp
EI,bucuresti,Recomandări de licee private în București,"Bună, tuturor! Prietena mea are o fiică de vârsta admiterii în liceu și are nevoie de recomandări legate de liceele private din oraș (pe Filologie sau Științe Sociale) sau dacă aveți ceva insight-uri despre Liceul Hyperion (Filologie). Vă las mai jos mesajul ei:

""Doresc pentru fiica mea sa iau în considerare și liceul Hyperion (secția Filologie) pe langa liceele de stat, pentru admiterea din toamna. As dori păreri avizate legate de cum se desfășoara orele aici, dacă e un liceu serios si cum sunt profesorii/elevii acestui liceu... L-ați recomanda? Sau ați recomanda mai degrabă alte licee private din București pe Filologie sau Științe Sociale (nu Științe ale naturii)?

Mulțumesc frumos anticipat!""

V-am fi recunoscătoare pt orice info.",0,13,https://www.reddit.com/r/bucuresti/comments/1rx0qs0/recomandări_de_licee_private_în_bucurești/,https://www.reddit.com/r/bucuresti/comments/1rx0qs0/recomandări_de_licee_private_în_bucurești/,1773831630.0,2026-03-18 11:00:30,NiceRequirement6153,1rx0qs0
EI,Suomi,mitä pitäis tehdä,"koen tulleeni loukatuksi koulussa opettajan suhteen. varoituksen sana, tässä nyt tulee romaani.. opiskelen kosmetologiksi ja valmistun pian. luonnollisesti olen oma ohjaajan opetukseen oppinut parhaiten kun hän on eniten tunteja pitänyt. olen ollut myös jo eri työpaikoilla ja suorittanut näyttöjä. osaan siis asiat ja minulla luonnollisesti on oma tyyli minkä koen parhaaksi. yksi tietty opettaja (ei oma ohjaaja) JOKA kerta puuttuu miten asiat pitäisi tehdä eritavalla ja saa minulle oikeasti olon etten osaa mitään kun asiakas vaan möllöttää siinä kun saan huutista etten tee oikein. minulla myös vanha vamma olkapäässä joka haittaa työntekoa jonka takia välillä joudun olemaan poissa. (vammaa tutkittu viimeiset 4 vuotta ja koko ajan hoidossa). tänään sitten mainitsin että käy aika kipeää että minun täytyy perua yksi asiakas ellei toista tekijää ole. hän sitten naurahti virnuillen siihen ja ennenkin on sanonut ettei noin nuorella (pian 19v) voi olla vielä vanhuuden vaivoja. myös piilovittuili tänään että tee näin niin ei vsrmasti olkapäähän koske. myöskin hänen oma ryhmä (eka vuotelaiset) on jättänyt asioita hoitamatta jotka kostautuivat meidän ryhmälle (pyykit pesemättä joten meidän asiakkaille ei puhtaita pyyhkeitä) sanoi sitten minulle että no jostain sun täytyy taikoa ne pyykit 😀 omassa ryhmässä ei mitään vikaa mutta hetikun muista kyse niin syyt niskoille. en tiiä mitä pitäs tehä kun tää on tosi yleistä että piilovittuilee ja valittaa että tekee asiat väärin. enkä ole ainut. valehteli myös etten ilmoittanut poissaoloa ja sain kirjallisen varoituksen (aspa päivistä ei voi olla poissa ilman sairaspoissaolo todistusta) tää selvitettiin eikä asialle tehty mitään. ootan vaan valmistumista että pääsen helvettiin tuolta

pitäskö vaan ystävällisesti laittaa vastaan ja oottaa et se kilahtaa ja tehdä sit joku ilmotus?",0,11,https://www.reddit.com/r/Suomi/comments/1rx0qmb/mitä_pitäis_tehdä/,https://www.reddit.com/r/Suomi/comments/1rx0qmb/mitä_pitäis_tehdä/,1773831617.0,2026-03-18 11:00:17,Dull-Instruction8587,1rx0qmb
EI,SpaceXMasterrace,The true solution to tipping,,7,4,https://i.redd.it/v8ny8h5kbspg1.jpeg,https://www.reddit.com/r/SpaceXMasterrace/comments/1rx0ojv/the_true_solution_to_tipping/,1773831440.0,2026-03-18 10:57:20,Sarigolepas,1rx0ojv
EI,arkisuomi,olen alkanut rakastaa ideaa hankkia vain yksi lapsi,"tulen perheestä, jossa minulla on sisarus mutta monista syistä meillä ei juurikaan ole suhdetta. Serkkuja on muutama mutta emme pidä yhteyttä ja suku on muutenkin etäinen ja pieni. Ei siis ole tarjota mitään suuria sukujuhlia omille jälkläisille.

Pitkään kahdehdin sitä kun muilla on useita sisaruksia ja halusin tämän tarjota tavallaan myös omille tulevaisuuden lapsille. Että heillä olisi ihanaa sitten teininä/aikuisena. 

Mutta se lapsiarki, en ehkä rehellisesti ole oikea ihminen siihen että minulla olisi monta lasta. Ehkä kaksi vähän isommalla ikäerolla, mutta muuten en ehkä ole valmis siihen rumbaan ja olisi ihan kun voisi vain keskittyä yhteen.

  
Olisi ihana kuulla teidän mielipiteitä joilla ei niitä isoja sukuja ole eikä sisaruksia, onko se ollut teille silti ihanaa lapsuutta ja elämää?",0,34,https://www.reddit.com/r/arkisuomi/comments/1rx0o0o/olen_alkanut_rakastaa_ideaa_hankkia_vain_yksi/,https://www.reddit.com/r/arkisuomi/comments/1rx0o0o/olen_alkanut_rakastaa_ideaa_hankkia_vain_yksi/,1773831400.0,2026-03-18 10:56:40,Choice-Duck1810,1rx0o0o
EI,MedTechPH,Thoughts on this? Ginanahan ako bigla.,Context: almost all 90+ gwa ko sa mga subjects 88 for micropara and 47 sa isang major sub that's why I failed march BE,7,3,https://i.redd.it/xg52iw66bspg1.jpeg,https://www.reddit.com/r/MedTechPH/comments/1rx0mvy/thoughts_on_this_ginanahan_ako_bigla/,1773831303.0,2026-03-18 10:55:03,Appropriate_Tip_3144,1rx0mvy
EI,maldives,There's just something about these foods,I probably just woke a part of your brain that has been asleep for years,10,9,https://www.reddit.com/gallery/1rx0kh9,https://www.reddit.com/r/maldives/comments/1rx0kh9/theres_just_something_about_these_foods/,1773831098.0,2026-03-18 10:51:38,CriticalBrick3186,1rx0kh9
EI,toiminnanohjaus,Laskin paljonko meiltä jäi laskuttamatta viime vuonna - en olisi kyllä halunnut tietää,"Meillä on 18 asentajaa. Pyöritän firmaa yhdeksättä vuotta. Luulin että asiat ovat ihan ok – kasvua tulee, asiakkaat on tyytyväisiä. Sitten tein viime talvena pienen Excel-laskelman.  
  
Otin yhden kuukauden tuntilaput ja vertasin niitä lähteneisiin laskuihin. Ero oli järkyttävä. Konservatiivisestikin laskettuna meiltä jäi laskuttamatta joka kuukausi töitä, joita ei yksinkertaisesti muistettu kirjata tai joiden paperit katosivat matkalla toimistolle.  
  
En puhu pienistä summista.  
  
Ongelma ei ollut asentajissa. Ongelma oli siinä, että koko järjestelmämme perustui siihen, että minä muistan kaiken. Tuntilaput tulivat paperilla, tiedot syötettiin käsin, lasku lähti päiviä myöhemmin. Jokainen välivaihe oli paikka jossa jotain katosi.  
  
Otimme käyttöön toiminnanohjausjärjestelmän (meillä Evelia) alkuvuodesta. Asentajat kirjaavat tunnit suoraan puhelimella projektille, lasku muodostuu automaattisesti.  
  
Kolmen kuukauden jälkeen laskutus on noussut selvästi – ilman yhtään uutta asiakasta tai ylimääräistä työtä. Rahat olivat koko ajan siellä, me vain unohdimme laskuttaa ne.  
  
Jos pyörität isompaa porukkaa ja laskutus tapahtuu vieläkin tuntilapuilla ja Excelillä, suosittelen tekemään sen saman laskelman. Se on epämukava hetki mutta kannattaa.",1,0,https://www.reddit.com/r/toiminnanohjaus/comments/1rx0k7l/laskin_paljonko_meiltä_jäi_laskuttamatta_viime/,https://www.reddit.com/r/toiminnanohjaus/comments/1rx0k7l/laskin_paljonko_meiltä_jäi_laskuttamatta_viime/,1773831076.0,2026-03-18 10:51:16,Senior_Syrup_2351,1rx0k7l
EI,Suomi,Tunnetut naiset joutuivat AI-pornosivustolle – Riikka Purra: Tämän alkaminen oli vain ajan kysymys,"Mm. Intiassa on jo pitkään ollut tapana keinona hiljentää naiset ja saada naiset pois julkisuudesta feikkipornokuvien avulla. Ei yllätä, että Suomessakin on miehiä, jotka tekevät tällaista, koska kuten yksi tekijöistä kommentoi: ""LOL pahinta mitä voi tapahtua on, että jotkut kuvat poistetaan.""



""Ylen selvitys vahvistaa, että naisiin kohdistuva digitaalinen väkivalta on kasvussa. Yle tutki sivustoa, jossa julkaistaan päivittäin suuri määrä pornografisia kuvia ja lyhyitä gif-animaatioita. Iso osa kuvista on tekoälyllä tehtyjä deepfake-kuvia eli niin kutsuttuja syväväärennöksiä.



Yle tunnisti kuvista yhteensä 75 julkisuudesta tunnettua suomalaisnaista. Kuvia oli yhteensä lähes 1 500.



Tekoälyllä tehdyn alastonkuvan levittäminen ilman suostumusta on laitonta uuden seksuaalirikoslainsäädännön mukaan.



Yksittäiset poliitikot ja julkisuuden henkilöt ovat kertoneet deepfake-kuvista julkisuudessa aiemmin, mutta Ylen tutkima aineisto on mittakaavaltaan ainutlaatuinen. Vastaavaa ei ole tullut Suomessa aiemmin ilmi.""

  
""Yle otti suoraan yhteyttä sivuston käyttäjiin, jotka olivat tehneet suuria määriä kuvia suomalaisista julkisuuden henkilöistä. Heiltä kysyttiin tekniikasta, julkaisujen laajuudesta ja mahdollisesta kiinnijäämisestä. Yhteydenotot tehtiin peiteprofiilin avulla.



Käyttäjät esiintyvät nimimerkeillä, mutta useimmat kertovat olevansa Suomessa asuvia miehiä.



Saatujen vastausten mukaan kuvien tekeminen on helppoa. Yksi käyttäjistä kertoo esimerkiksi tehneensä yhdessä päivässä lähes 200 kuvaa.



– Helppoo ku heinänteko... Sun ei tarvii oikeen mitään osata muuta kun asentaa omalle koneelle noi ohjelmat. Ja pistää kone ruksuttaa.""



""Husson mukaan suomalaisilla ei ole yleisesti tiedossa, että deepfake-kuvien julkaisu voi rikkoa lakia. Uhrit kokevat tarpeetonta häpeää ja pyrkivät peittelemään asiaa, Husso kuvaa.



– Tässä toimivat samantyyppiset uhrin syyllistämisen mekanismit kuin seksuaalisessa väkivallassa. Naisia pyritään häpäisemään, ja häpeä estää puhumisen. Sillä vaiennetaan naisia.""",138,112,https://yle.fi/a/74-20215745,https://www.reddit.com/r/Suomi/comments/1rx0h5r/tunnetut_naiset_joutuivat_aipornosivustolle/,1773830799.0,2026-03-18 10:46:39,Mission_Ad1669,1rx0h5r
EI,pcmasterrace,Was this a decent purchase with prices right now ?,Planning on getting this pc from Best Buy asap 🙏,4,6,https://www.reddit.com/gallery/1rx0efe,https://www.reddit.com/r/pcmasterrace/comments/1rx0efe/was_this_a_decent_purchase_with_prices_right_now/,1773830545.0,2026-03-18 10:42:25,Fit-Particular-24,1rx0efe
EI,LobotomyKaisen,It took me way too long to realize his name was a pun.,,5,2,https://i.redd.it/a94eqewh8spg1.png,https://www.reddit.com/r/LobotomyKaisen/comments/1rx0ctd/it_took_me_way_too_long_to_realize_his_name_was_a/,1773830403.0,2026-03-18 10:40:03,Waifu_Raichu,1rx0ctd
EI,Suomi,Kuka/mikä määrää Kierrätyskeskuksen hinnat?,"Mikä taho omistaa [Kierrätyskeskus.fi](http://Kierrätyskeskus.fi) kierrätyskeskuksen toiminnan? Tai näkyyhän se niillä, mutta lähinnä ajattelin: KUKA SAATANA NIITÄ TUOTTEITA HINNOITTELEE?

Sama tuote voi olla 50% kalliimpi (esim. perus langallinen näppis). Pyörät on aivan JÄRJETTÖMÄN hintaisia (Perushuolto ei maksa mitään, rasva ja kiristykset), vaatteet naurettavan hintaisia ja jotkin elektroniikat jne. kalliimpia kuin ne oli uutena.

Kyseessähän on ~~voittoa tavoittelematon taho~~ Yleishyödyllinen firma, mutta ei maksa kuin toiminnan ja tilamaksut, puoli-ilmaiseksi porukka töissä, sitten vetelee hurjia hintoja.

Pitäisiköhän tässä nyt ihan ottaa asiaksi alkaa pöhisemään noissa piireissä jotka sitä ylläpitää ja omistaa, soluttautua johtoryhmään ja hankkia itselle pesti jossa pääsisin hinnoittelemaan tuotteet niiden oikeaan arvoon.

**EDIT: Hei mitä vittua nyt:** [https://kauppa.kierratyskeskus.fi/kirjat/atlas-of-north-european-vascular-plants-north-of-the-tropic-of-cancer-volumes-i-iii-hulten-eric-magnus-fries/p/10105468094/](https://kauppa.kierratyskeskus.fi/kirjat/atlas-of-north-european-vascular-plants-north-of-the-tropic-of-cancer-volumes-i-iii-hulten-eric-magnus-fries/p/10105468094/)",36,41,https://www.reddit.com/r/Suomi/comments/1rx0cq4/kukamikä_määrää_kierrätyskeskuksen_hinnat/,https://www.reddit.com/r/Suomi/comments/1rx0cq4/kukamikä_määrää_kierrätyskeskuksen_hinnat/,1773830394.0,2026-03-18 10:39:54,CatCatFaceFace,1rx0cq4
EI,arkisuomi,Onko tässä vaaraa että myrkytän itseni? Liimasin rikkinäiset moccamasterin kannet takaisin yhteen pikaliimalla.,"Moccamasterist on ollut kannet halki jo hetken. Meni moti joten pikaliimasin ne takaisin yhteen, rupesin tässä nyt operaation jälkeen miettimään että onko nyt mahollisuutta että tosta liimasta irtoa jotakin tököttejä mukaan kahvia keitellessä. Uudet kannet ei onneksi maksa hirveesti mutta vähän ketuttaa kun tarkotus oli kuitenki säästää rahaa.",46,72,https://www.reddit.com/gallery/1rx09hs,https://www.reddit.com/r/arkisuomi/comments/1rx09hs/onko_tässä_vaaraa_että_myrkytän_itseni_liimasin/,1773830087.0,2026-03-18 10:34:47,the-radical-waffler,1rx09hs
EI,overclocking,Today better than yesterday. 9816 points in 3dmark Benchmark steel nomad at 4k. With my Rtx 5080 and an I9-14900kf,**Thank to Gpu Tweak III and a change in process priority.**,0,1,https://i.redd.it/wamqt8a66spg1.jpeg,https://www.reddit.com/r/overclocking/comments/1rx08x6/today_better_than_yesterday_9816_points_in_3dmark/,1773830033.0,2026-03-18 10:33:53,Dry_Consideration_57,1rx08x6
EI,Ranaghat,Keo stadium e eshe badminton khelega?,"Game korega? Badminton game?
Hothat kore Badminton khelte ichha korche, ei stadium er side e thaki ami...
Btw ami jiboneo Badminton khelini...
Keo khelega?",3,5,https://www.reddit.com/r/Ranaghat/comments/1rx07xj/keo_stadium_e_eshe_badminton_khelega/,https://www.reddit.com/r/Ranaghat/comments/1rx07xj/keo_stadium_e_eshe_badminton_khelega/,1773829944.0,2026-03-18 10:32:24,hetty_mickey,1rx07xj
EI,kolkata,Acha AI er ei unnoti hoche,,4,1,https://v.redd.it/jk1khhgz6spg1,https://www.reddit.com/r/kolkata/comments/1rx07hp/acha_ai_er_ei_unnoti_hoche/,1773829900.0,2026-03-18 10:31:40,YogurtclosetNo28,1rx07hp
EI,LululemonRestocks,Define Cropped Jacket *Nulu - Oxford Red/Gold/Gold - 10 and 1 other listing are in stock at Lululemon,"[View 2 stock updates](https://www.trackalacker.com/products/showcase/define-cropped-jacket-nulu?notification_id=BqXGmPhHJGUGlEI%253D--38Zghm3xrnNZn2HB--oiYkVDFD7u0WK9dEu1%252F1iw%253D%253D&render_batch=true&utm_campaign=batch-stock-update&utm_medium=social&utm_source=reddit)  


As of 03/18/26 06:30 AM EDT",1,0,https://www.reddit.com/r/LululemonRestocks/comments/1rx06hu/define_cropped_jacket_nulu_oxford_redgoldgold_10/,https://www.reddit.com/r/LululemonRestocks/comments/1rx06hu/define_cropped_jacket_nulu_oxford_redgoldgold_10/,1773829815.0,2026-03-18 10:30:15,TrackaLackerBot,1rx06hu
EI,WomenRO,Mama anxioasa sau doar fitoasa?,"Simt ca imi iau campii. Am 48 de ani, si mama 71, sta la mine. E pe deplin functionala, merge, mananca, iese in oras, sta pe FB. Acum am un iubit si de fiecare data cand vreau sa dorm la el sau sa plecam la tara la cabana lui, face crize de anxietate. Cu tensiune mare, panica. Si eu las totul bata sa fug la ea si se linisteste. Imi spune ca e prea traumatizata sa stea noptile singura, ca nu se poate controla. De fiecare data cand mi-am facut planuri, i se facea rau exact cand sa plecam. Am renuntat la cursuri si burse in alt oras din cauza asta.

Imi spune sa nu polate controla starea asta, ca ii vine sa se arunce de pe zid atunci. Ca nu inteleg. Vrea sa vina cu noi in concediu, sa sta cu noi in casa. Nu pot accepta asta, nu e normal si sanatos. Refuza medicamentatia, consilierea, caminul. Nu vreau nici sa o las de izbeliste la greu, dar nu mai pot. Mi-am sacrificat toate relatiile sa stau cu ea. Niciun barbat nu mai accepta relatii in care la 10 plec acasa si nu putem pleca in concediu sau in weekend. Mi-e teama ca o sa il pierd si pe el. Dar pe de alta parte, mama pune problema ca si cand ar fi viata ei sau relatia mea.

Ce sa fac? Simt ca o iau razna,nu mai dorm, ma trezesc cu panica si stres, am slabit. Sunt la limita. Spune ca e responsabilitatea mea sa ma ocup si sa ii gasesc o solutie.

Nu vreau sa aduc un strain in casa sa stea cu ea si sa ma fure cate doarme mama.",42,46,https://www.reddit.com/r/WomenRO/comments/1rx00xq/mama_anxioasa_sau_doar_fitoasa/,https://www.reddit.com/r/WomenRO/comments/1rx00xq/mama_anxioasa_sau_doar_fitoasa/,1773829296.0,2026-03-18 10:21:36,FrostyPreference3440,1rx00xq
EI,DMZ,Architecture from Iran,"Was Al Mazra just a psyop, grooming us for Iran? ",6,4,https://i.redd.it/pt17bbav4spg1.jpeg,https://www.reddit.com/r/DMZ/comments/1rwzznq/architecture_from_iran/,1773829182.0,2026-03-18 10:19:42,Expensive_Compote772,1rwzznq
EI,Endfield,I can’t take it anymore,"I can’t take it anymore, I’m sick of T credits.

I try to level Perlica, it costs Tcredits. I try to raise my Laevatains skill, it costs Tcredits. I try to level her weapon, it costs Tcredits.

I pull Last Rite. I can’t even afford to look at her talent tree. I already wasted all my sanity trying to get some decent essences. I found 2000 Tcredits in the credit store for 75% off. I need 6,700,000.

I look at my factory. The only thing it generates are stock bills and I already emptied both regions of all their Tcredits. I decide to try to hunt for more clues to exchange to buy more from the shop. The only clues I get are 7.

Xaihi looks at me. Not saying a word. I know she wants her promotion too. I still have her skills at level 3. 

I have 12.5k Tcredits to my name.",948,187,https://i.redd.it/xo5mxwfr3spg1.jpeg,https://www.reddit.com/r/Endfield/comments/1rwzvq7/i_cant_take_it_anymore/,1773828810.0,2026-03-18 10:13:30,MeltSimp,1rwzvq7
EI,FashionRomania,"Jeans Boss slim fit, sub 550 lei pe Beslim - merita?","Prietenul meu are nevoie de niste blugi noi ca s-au rupt cei vechi. El e destul de pretentios, nu poarta orice, vrea sa arate bine si sa tina mult. Am zis sa ma uit dupa ceva de calitate si am dat peste Boss P-Delaware pe Beslim. Stiu ca Boss e brand serios, dar m-a luat cu mirare pretul. 541 lei pentru niste blugi e mult, dar daca tine cativa ani poate merita. Eu unul am blugi de la H&M si dupa 6 luni arata groaznic, asa ca ma gandesc ca poate e momentul sa investim in ceva mai bun.

Sunt slim fit, adica sunt stramti pe picior dar nu lipiti de piele. Au 5 buzunare, clasice, nimic special la capitolul asta. Sunt din denim, evident, si se pare ca sunt destul de grosi, deci buni pentru primavara si toamna. Culoarea e albastru inchis, din ce imi dau eu seama din poza, deci se asorteaza cu cam orice. I-as pune cu un tricou alb si adidasi pentru casual sau cu o camasa si pantofi pentru birou. Boss e cunoscut pentru calitate, asa ca banuiesc ca materialul e ok si nu se deformaza dupa cateva spalari.

**541.9 lei**

Sub 550 lei pentru blugi Boss mi se pare un pret decent. La mall ii gasesti undeva la 600-700 lei, asa ca aici scutesti ceva bani. Comparat cu ce e la Zara la 150-200 lei, diferente e mare. Dar daca tine de 3-4 ori mai mult, poate iese mai ieftin pe termen lung. Eu am citit ca blanjii de calitate tin ani de zile daca ai grija de ei. Nu l-am testat personal, asa ca nu pot sa zic cum e materialul. Dar dupa poza arata destul de bine, nu pare ceva slab calitativ.

🔗 https://beslim.ro/products/boss-p-delaware-10272920-01

*Voi cat de mult sunteti dispusi sa dati pe o pereche de blugi?*",1,0,https://www.reddit.com/r/FashionRomania/comments/1rwzqva/jeans_boss_slim_fit_sub_550_lei_pe_beslim_merita/,https://www.reddit.com/r/FashionRomania/comments/1rwzqva/jeans_boss_slim_fit_sub_550_lei_pe_beslim_merita/,1773828340.0,2026-03-18 10:05:40,IulianHI,1rwzqva
EI,Intti,"Jatkuva sairastelu, E-paperit pt2","Kirjotin tänne ennemmin mun sairasteluista ja siitä että onkohan e paperit lähellä. Eilen avlla en ottanut koko asiaa puheeksi, niin hoitaja itse käski käymään vääpelin juttusilla sairasteluista. Tänään kävin vääpelin luona, hänen mukaan tilanne ei oo vielä semmonen, että tulis pakko e-paperit, mutta jos ei 1-2 viikon kuluessa hellitä niin se on aika todennäköstä. Toisaalta hän sanoi että halutessani, jos itsestä tuntuu että ei ole menossa ohi ja haluan lykätä, niin voin käydä veksistä lääkäriltä hakemassa lausunnon jota yksikkö kyllä puoltaisi.

Nyt oon sitte vaikeen valinnan eessä:

Odottelenko 2 viikkoa, että joko tervehdyn ja jatkan palvelusta, tai sitten olen vielä kipeänä ja lähden kotiin

Vai

Menenkö maanantaina avlle ja haen lääkäriltä lausunnon, ja lähden kotiin jo ensi viikolla.

Moti inttiin on lopahtanut täysin sairastelun takia, lisäksi olen sissi, joten koulutus ei ole mikään kevyt minkä voi puolikuntoisena suorittaa, eli vaatisi sen että tervehtyisin täysin ennen kuin teen mitään.

Muutenkin intti ollut todella raskasta henkisesti, kun olen ihminen joka tarvitsee välillä omaa tilaa ja sitähän ei täällä ole.

Jos nyt jommasta kummasta syystä E-paperit saan, niin siviilissä aijon hommata c-paperit. Jatkamaan en oo elämäntilanteen takia tulossa.",3,2,https://www.reddit.com/r/Intti/comments/1rwzq4l/jatkuva_sairastelu_epaperit_pt2/,https://www.reddit.com/r/Intti/comments/1rwzq4l/jatkuva_sairastelu_epaperit_pt2/,1773828272.0,2026-03-18 10:04:32,Old_Application9440,1rwzq4l
EI,mohu,你支持習近蘋還是扁習近蘋？,,7,0,https://www.reddit.com/gallery/1rwzpbp,https://www.reddit.com/r/mohu/comments/1rwzpbp/你支持習近蘋還是扁習近蘋/,1773828195.0,2026-03-18 10:03:15,OccasionThat4759,1rwzpbp
