bank,subreddit,title,selftext,score,num_comments,url,permalink,created_utc,created_date,author,id
ENBD,StockMarketIndia,Decline in IDBI Bank Share Price as Privatisation Plans Face Roadblocks Amid Divestment Constraints,"The Government of India holds a stake of 45.48% in IDBI Bank along with the Life Insurance Corporation (LIC) owning a stake of 49.24%. Together, they own 94.72% of IDBI Bank. Earlier, the Press Trust of India issued a report stating the duo were planning to sell 60.72% (comprising 30.48% held by the government and 30.24% by LIC) of the total equity of IDBI Bank, leaving them with combined holdings of 33.99% (15% held by GOI and 19% held by LIC)

  
They had floated an Expression of Interest in Oct’22 and the Department of Investment and Public Asset Management (DIPAM) confirmed that the interested parties had bid by 6^(th) February 2026. Bidders included Fairfax Financial Holdings, Emirates NBD and Kotak Mahindra Bank. The three bidders were allowed to move to the final stage of the process after completing due diligence and clearing the technical bid stage.  
  
The government was pursuing the sale as part of its wider strategic divestment programme, aimed at boosting non-tax revenues and scaling back its involvement in non-core sectors. The divestment gained traction after IDBI exited the Reserve Bank of India’s Prompt Corrective Action (PCA) framework in March 2021, following improvements in asset quality, capital adequacy, and profitability. Exiting the PCA was seen as a crucial step to attract private investors and renew interest in the strategic sale.  
  
However, market sentiment made the share extremely volatile recently in response to reports about the divestment process. On Friday, 13th Mar 2026, IDBI Bank shares closed at 92.18. The share then opened at 82.12 and fell further to close at 76.31 on Monday, 16th Mar.  
  
The decline of close to 17% in a single day occurred after reports suggested that the government may reconsider or halt their decision to divest in the bank after the financial bids put in by the potential buyers were below the reserve price.  
  
IDBI Bank didn’t confirm or deny the reports, they commented that the divestment process is a confidential strategic process being undertaken by the Indian government and that they would immediately inform stock exchanges of all material developments and price-sensitive information in compliance with the Securities and Exchange Board of India’s Listing Obligations and Disclosure Requirements regulations. They also mentioned that the report to the bidding process and does not involve any regulatory or legal proceedings. A clarification was provided after a query from BSE seeking comments on a media report that the government may scrap the majority stake sale due to the low-price bids.  
  
Investors are likely to benefit from increased clarity once the government gives an official statement on the future of the disinvestment process which has been watched keenly by hawkish investors who have been expecting the operational efficiency to increase.  
  
Despite the bank’s total income declining to ₹8,282 crore in Q3 FY26 from ₹8,565 crore in Q3 FY25, and interest income fell to ₹7,074 crore from ₹7,816 crore a year ago, the earnings report showed the profitability of the lender increased by 1.42% from Q3 FY25’s earnings.

The gross non-performing asset (GNPA) ratio represents the total value of all loans and advances that have ceased to generate income for a bank, usually when interest or principal payments are overdue for over 90 days. The gross non-performing asset ratio improved to 2.57% as of December 31, 2025, from 3.57% in the year-ago period. This indicates better credit quality and lower risk as there is a lower chance of loan losses. However, the net non-performing asset remained at 0.18%. The net NPA shows the actual risk of loan losses to the bank as it reduces provisions made for losses from the GNPA and accrued interest on non-performing loans that the bank has not recognized as income (Interest suspense). The Net NPA of 0.18% shows minimal actual loan loss risk even if some loans are “non-performing” i.e. the borrower fails to pay interest or principal for 90 days or more and the bank cannot recognize the interest as income.  
  
The bank’s capital adequacy ratio (CAR) strengthened to 24.63% at the end of December 2025, up from 21.98% a year earlier. The CAR measures how well a bank can absorb losses while continuing operations. An improvement shows that the bank has a strong capital buffer making it safe to invest and deposit in due to the stability.  
  
On the other hand, return on assets (ROA) moderated to 1.83% in Q3 FY26, compared with 1.99% in Q3 FY25. The ROA measures how efficiently a bank is using its assets to generate profit. Here, we are able to notice that the bank has relatively become less efficient as the bank earned slightly less profit per ₹100 of assets than a year ago. The ROA may have declined despite flat profits because total assets may have grown faster than profits.



*Bibliography:*  
Press Trust of India: [https://www.ptinews.com/story/business/idbi-bank-strategic-sale-scrapped-as-financial-bids-below-reserve-price-sources/3464548](https://www.ptinews.com/story/business/idbi-bank-strategic-sale-scrapped-as-financial-bids-below-reserve-price-sources/3464548)

Economic Times: [https://economictimes.indiatimes.com/industry/banking/finance/banking/idbi-bank-divestment-scrapped-lic-govt-owned-bank-clarifies-after-stock-tanks/articleshow/129604537.cms?from=mdr](https://economictimes.indiatimes.com/industry/banking/finance/banking/idbi-bank-divestment-scrapped-lic-govt-owned-bank-clarifies-after-stock-tanks/articleshow/129604537.cms?from=mdr)

India Today: [https://www.indiatoday.in/business/market/story/idbi-bank-share-price-crashes-16-percent-why-is-the-stock-down-today-2882641-2026-03-16](https://www.indiatoday.in/business/market/story/idbi-bank-share-price-crashes-16-percent-why-is-the-stock-down-today-2882641-2026-03-16)  
  
MarketControl: [https://www.moneycontrol.com/news/business/economy/financial-bids-from-kotak-emirates-nbd-fairfax-received-for-idbi-bank-privatisation-13816353.html](https://www.moneycontrol.com/news/business/economy/financial-bids-from-kotak-emirates-nbd-fairfax-received-for-idbi-bank-privatisation-13816353.html?utm_source=chatgpt.com)",1,0,https://www.reddit.com/r/StockMarketIndia/comments/1rzp6u5/decline_in_idbi_bank_share_price_as_privatisation/,https://www.reddit.com/r/StockMarketIndia/comments/1rzp6u5/decline_in_idbi_bank_share_price_as_privatisation/,1774092788.0,2026-03-21 11:33:08,CarsAndCapital,1rzp6u5
ENBD,GearsOfWars,"The Best Xbox 360 Exclusive Games That Are Backwards Compatible Right Now!THE GAME THRIFTERMarch 20, 2026 at 02:00PM",,1,0,https://www.youtube.com/embed/RPZ9HOqF0IA,https://www.reddit.com/r/GearsOfWars/comments/1rz5mte/the_best_xbox_360_exclusive_games_that_are/,1774034605.0,2026-03-20 19:23:25,GameProfessional,1rz5mte
ADCB,UAE,ADCB Touch points Redemption,"Hello Everyone, 
Eid Mubarak!

Wondering what is the best way to redeem ADCB touch points? Any suggestions to make the best use out of these points (mostly for retail shopping purposes)",2,7,https://www.reddit.com/r/UAE/comments/1rzqej3/adcb_touch_points_redemption/,https://www.reddit.com/r/UAE/comments/1rzqej3/adcb_touch_points_redemption/,1774096669.0,2026-03-21 12:37:49,Character-End-8178,1rzqej3
ADCB,CPTSDmemes,"They are obsessed with their false legacy, I’m obsessed with the consciousness beyond…",,59,0,https://i.redd.it/dkw8raqvt8qg1.jpeg,https://www.reddit.com/r/CPTSDmemes/comments/1rz46s9/they_are_obsessed_with_their_false_legacy_im/,1774031305.0,2026-03-20 18:28:25,Awkward-Worth5484,1rz46s9
EI,bucuresti,De ce un contract de închiriere de regulă nu are valoare și mai tare te încurcă?,"Salutare la toată lumea! Am mai scris postări pe subiectul ăsta al chiriilor, cine este interesat le găsește rapid în contul meu. 

Piața chiriilor în București e un fel de vestul sălbatic. Proprietari și chiriași care la început sunt prieteni apoi pe parcursul chiriei ajung să se urască și într-un final devin care pe care, cine să țăpuiscă mai tare pe celălalt. Rareori ajung să-și strângă mâna la final.

Avem chiriași care nu-si plătesc datoriile, lasă mizerie și stricăciuni sau proprietari care nu fac reparații și nu returnează garanția. Despre reparații și garanție o să fac altă postare, că e multă confuzie și aici, dar de regulă am văzut că lucrurile astea se întâmplă când chiriașii închiriază fără contract și plătesc chirie numerar. 

Am scris de multe ori și în postări și prin comentarii că este esențial înainte să închiriezi să faci niște minime verificări. Mulți au scris, siderați, că vezi Doamne încalci dreptul la viață privată, dreptul de confidențialitate, gdpr bla bla bla.... De parcă atunci când îți lasă chiriașul varză casa și cu datorii, fix de drepturile lui protejate te mai interesează. Chiar și așa eu accept și varianta unei garanții mai mare dacă totuși pare de treabă, dar nu vrea să dea detalii despre el sau dovezi privind veniturile.

Pe scurt, dacă un chiriaș care nu are venituri, nu are bunuri pe numele său, nu are pe cineva care să garanteze pentru el, nu achită o garanție mai mare, dacă îl accepți doar pe vorbe, pe încredere, e ca și cum tu garantezi pentru el că își va respecta obligațiile (plata chiriei, a utilităților, păstrarea  apartamentului curat etc).

Contractul te ajută doar în măsură în care chiriașul este o persoană care are de pierdut în cazul în care este dat în judecată, evacuat prin instanță sau direct prin executor (nu stau să plictisesc cu detalii dar, depinde după cum e împlinit sau nu termenul contractului). Dacă el lucrează la negru (destul de frecvent in ziua de azi din cauza taxelor mari pe care le plătesc anagajatorii) si nu are bunuri ce pot fi urmărite silit, îl va durea în cot de contractul tău. Va trage de timp cat mai mult, va avea un consum mare, iar când o să te vezi până la urmă cu hotărârea în mână după luni bune sau chiar ani, o să vezi că nu ai ce să-i faci. În afară de a-l scoate de acolo, tot ce înseamnă chirie, datorii la utilități, cheltuilei de judecată, cheltuilei cu avocat, cheltuilei cu executarea etc rămân în sarcina ta. 

În ultimul rând, mai sunt unii de zic că riscurile sunt doar in cazurilor în care ai apartamente în zone proaste, neamenajate, unde îți vin tot felul de chiriași.  

Pe de-o parte așa este. Locuințele bune atrag chiriași mai de calitate sa zicem. Dar asa cum văd eu lucrurile, riscurile sunt chiar mai mari. Pentru că in cazul unui apartament într-o zonă rău famată, chiria e mai mică, chiriașii nu stau să se judece cu anii, de regulă se sperie mai ușor și nu așteaptă să vină proprietarul să le arunce lucrurile în stradă că pleacă ei singuri. 

Dar ce te faci în cazul unui apartament in zonă bună unde și chiria e mai mare, iar paguba la final ajunge să fie mult mai mare dacă dai de un chiriaș care știe să exploateze la maximum în favoarea lui sistemul ăsta stricat. Dacă ai un apartament într-o zonă bună, nu înseamnă că ești ferit de riscuri, din contră, pagubele pot fi mult, mult mai mari. 

Deci dacă nu vrei să te complici să faci niște minime verificări sau dacă chiriașul refuză, cum am scris mai sus, că are principii și nu acceptă verificări, dar nici garantie mai mare nu vrea să plătească, mai bine nu faci contract că sunt toate șansele să nu te ajute cu nimic. Doar vor face instanțele, avocații și executorii bani pe seama ta, iar tu rămâi cu ochii în soare.

Legat de verificări, nu ar fi idee rea și chiriașii să le facă, pentru că nu de puține ori s-au trezit că au dat bani grei chirie si garantie, au semnat contract, iar ""proprietarii"" erau niste puștani ce aveau cheile fiindcă închiriaseră în regim hotelier 😐",0,0,https://www.reddit.com/r/bucuresti/comments/1rzxxzt/de_ce_un_contract_de_închiriere_de_regulă_nu_are/,https://www.reddit.com/r/bucuresti/comments/1rzxxzt/de_ce_un_contract_de_închiriere_de_regulă_nu_are/,1774115529.0,2026-03-21 17:52:09,alxalx89,1rzxxzt
EI,TwentiesIndia,PATIENCE ( Explanation of artwork in body text),"This doodle captures a man caught between time and expectation. He sits still, composed on the surface, yet the repeated word ""patience"" around him feels more like pressure than guidance. It reflects how people are constantly told to wait, even when answers are nowhere in sight. The empty window behind him symbolizes some good possibilities of future. His stillness is not peace, but restraint. This artwork shows that patience is not passive, it demands strength and control. The man is enduring, not because it is easy, but because he must making patience a quiet, ongoing test of resilience. 
",1,0,https://i.redd.it/guur3ws7sfqg1.jpeg,https://www.reddit.com/r/TwentiesIndia/comments/1rzxxh5/patience_explanation_of_artwork_in_body_text/,1774115493.0,2026-03-21 17:51:33,cos2ub,1rzxxh5
EI,EastAsianDramas,Secret Love (2013) - A Classic Dark Romantic tale of love & Revenge for Grown-ups,"https://preview.redd.it/59gfyigiqfqg1.png?width=640&format=png&auto=webp&s=daf0835fb4f9fa9d445fdaed2f7bf19834095e84

As previously in the review of 'Can This Love Be Translated?', Love is a very strange thing. It can make a person to go beyond their limits, it can break a person to the ground where he/she can't return or it can make the person to do such a thing that he/she never thought of, just for the sake of love. K-Dramas, from the Golden Era to the New Age Era, have always toyed with the concept of intense, passionate love that crosses all the boundaries. But 2010's was the era when dark romantic love stories started to make rise slowly but steadily. Take the impact of 'The Smile Has Left Your Eyes' as an example and you will get an idea of how this kind of dramas have succeeded. But all this success started from 2013, when 'Secret Love' released and became the flag-bearer of dark romantic dramas.

Released in 2013, **'Secret Love'** is a classic dark romantic tale of love that surely deserves more than it got. Not a very high-conceptualized story, but it's a story so that most of you can relate, even if it never happens in real life. TBH, this drama is intense in its storytelling and unapologetic in depicting certain scenes that are too harsh to watch. The themes of Tragic Love, Revenge, Sacrifice and Betrayal are used perfectly, combining all these to create a web around the story to flow without faults. Despite some cliches being present and the fact that writing or say the execution got weak around episode 9-11, the shift in character personality is what I liked the most because the makers showed it with conviction and with a grounded approach, along with how every event in the story was kept close and tight to ensure no loopholes are present. The concept of Main Leads V/s Second Main Leads is also done perfectly, on the basis of how convincing it looked. Overall, it's not very great, but still a neat work done by makers, which should be acknowledged considering these types of stories were still in early age.

Moving to cast performance, this is one of the rare dramas that I've watched where FL has edged over ML, and you will surely agree to this. **Hwang Jeong-Eum**'s performance as **Kang Yoo-Jeong** is the highlight of this drama, dominating over a great actor like **Ji Sung**. The way she portrayed her character was perfect, showcasing her wide range of emotions from pain to happiness (even if it is not much, but still). But her performance can also be contributed to great writing and characterisation of her character. The Pain and Trauma Kang Yoo Jeong went through was harsh to watch because losing your son and your father, facing a slow and painful betrayal from your first love - you will naturally feel sympathetic for her. This is where Hwang Jeong-Eum shines and I'm totally impressed with her acting. **Ji Sung**, well I don't have words to express just how good he is. Even if **Hwang Jeong-Eum** dominates over him, he ensures that he still controls the proceedings of this story. The reason why **Ji Sung** comes close but not on top is because his character Jo Min-Hyuk is a flawed character, not in terms of characterisation or portrayal but because of lack of proper execution in some parts of the series that kept his character kind of 'up and down'. Despite this, **Ji Sung** steals every scene in the initial eps as well as towards the end with his perfect balance of rage and care or love. He perfected the character shift of **Jo Min-Hyuk** from a rich bad boy to lovable, humanised person, which showcases his ever-lasting range. **Bae Soo-Bin** portrayed his character of **Ahn Do-Hoon** in such a way you will never be able to love him (no pun intended). Just like in case of **Jo Min-Hyuk**, shift in personality of **Ahn Do Hoon** from good lovable man to a bastard, was done perfectly and credit must be given to **Bae Soo-Bin**. **Lee Da-Hee, as Shin Se-Yeon**, also does her best in playing the second fiddle to **Soo-Bin's Ahn Do-Hoon**, although the impact is less than what she did in **'I Hear Your Voice'**, which was released in the very same year. Out of all the four Main Character, Shin **Se-Yeon** is the least impactful one for sure. The Supporting Cast also did their best in their performance.

The OST is a banger to listen, the most impressive ones being **'Incurable Illness'** by Navi and **'Tears Stole my Heart'** by AILEE. Whenever these songs were played, it literally boosted that scenes' impact. The cinematography is very raw at the start, kind of darkish. Later on, it slowly turns brighter and brighter which matches the story's arc.

Overall, it's **8/10** for me. Could have done more in terms of writing and execution, but nevertheless, it's a good drama to binge if you're a fan of Ji Sung or you like dark romance.

Let me know your views about this drama in the comment section below.",1,0,https://www.reddit.com/r/EastAsianDramas/comments/1rzxxat/secret_love_2013_a_classic_dark_romantic_tale_of/,https://www.reddit.com/r/EastAsianDramas/comments/1rzxxat/secret_love_2013_a_classic_dark_romantic_tale_of/,1774115481.0,2026-03-21 17:51:21,AsphaltPrimus28,1rzxxat
EI,IndianArtAndThinking,PATIENCE ( Explanation of artwork in body text),"This doodle captures a man caught between time and expectation. He sits still, composed on the surface, yet the repeated word ""patience"" around him feels more like pressure than guidance. It reflects how people are constantly told to wait, even when answers are nowhere in sight. The empty window behind him symbolizes some good possibilities of future. His stillness is not peace, but restraint. This artwork shows that patience is not passive, it demands strength and control. The man is enduring, not because it is easy, but because he must making patience a quiet, ongoing test of resilience. 
",1,0,https://i.redd.it/nl65njwyrfqg1.jpeg,https://www.reddit.com/r/IndianArtAndThinking/comments/1rzxw6v/patience_explanation_of_artwork_in_body_text/,1774115410.0,2026-03-21 17:50:10,cos2ub,1rzxw6v
EI,Football_Head_Coach,Where to upgrade?,So I’ve been kind of buying and selling as I see players go on sale. If you had 8m what would you upgrade here?,1,0,https://i.redd.it/oncv754qrfqg1.jpeg,https://www.reddit.com/r/Football_Head_Coach/comments/1rzxuy4/where_to_upgrade/,1774115327.0,2026-03-21 17:48:47,Pleasant-Macaron8131,1rzxuy4
EI,wildlifephotography,Water birds,,4,0,https://www.reddit.com/gallery/1rzxugs,https://www.reddit.com/r/wildlifephotography/comments/1rzxugs/water_birds/,1774115294.0,2026-03-21 17:48:14,Oshenawa,1rzxugs
EI,snappisensuroimat0n,Voi poistaa jos ei kuulu tänne,Katoin tätä lilyksi,4,5,https://i.redd.it/lrwkssqjrfqg1.jpeg,https://www.reddit.com/r/snappisensuroimat0n/comments/1rzxu40/voi_poistaa_jos_ei_kuulu_tänne/,1774115269.0,2026-03-21 17:47:49,Similar_Astronaut845,1rzxu40
EI,TheDigitalCircus,Kinger’s real name was probably Grant + second entity?,"I paused and read ALL of the code. It’s a convo between Kinger and PRESUMABLY Caine, but because Caine didn‘t realize what Kinger was doing), I don’t know how he’d be communicating with him.

$ could be Caine, Abel, Bubble or even Scratch depending on your own personal theory. ",6,0,https://www.reddit.com/gallery/1rzxttt,https://www.reddit.com/r/TheDigitalCircus/comments/1rzxttt/kingers_real_name_was_probably_grant_second_entity/,1774115252.0,2026-03-21 17:47:32,Fruitsdog,1rzxttt
