bank,subreddit,title,selftext,score,num_comments,url,permalink,created_utc,created_date,author,id
ENBD,UAE,Emirates NBD not returning the stolen money despite police catching the scammer and deporting him,"3 months ago, a transaction of AED7k  was taken from my fathers credit card via Google pay despite my dad not receiving even an OTP from the bank. 

The bank kept denying accountability, so he filed a police case and they arrested the individual who happened to live in UAE itself, the arrested individual confessed to his crime and was deported. 

But now Central bank rejected our request to get the money back saying it’s not the banks responsibility. What do I do in this situation? How can we trust our money in the bank when they offer 0 protection when funds are  stolen by frauds. ",1,10,https://www.reddit.com/r/UAE/comments/1rvcau3/emirates_nbd_not_returning_the_stolen_money/,https://www.reddit.com/r/UAE/comments/1rvcau3/emirates_nbd_not_returning_the_stolen_money/,1773674243.0,2026-03-16 15:17:23,No_Department1748,1rvcau3
ENBD,UAEcreditcards,LIV by ENBD Credit Card,"I have a Liv. credit card. Do you also experience that the minimum cashback you can redeem is AED 500, or am I mistaken?
",2,3,https://www.reddit.com/r/UAEcreditcards/comments/1rv8f4g/liv_by_enbd_credit_card/,https://www.reddit.com/r/UAEcreditcards/comments/1rv8f4g/liv_by_enbd_credit_card/,1773665094.0,2026-03-16 12:44:54,jerababy,1rv8f4g
ENBD,UAEcreditcards,Best credit card for my current expenditures?,"At the moment I have ENBD Duo and ADIB cashback card. I know ENBD duo isn't very good nowadays but I'm still keeping it because I have some items I purchased and converted into installments. So really I utilize mostly my ADIB cashback card since from what I know you need an minimum of 5k spend per month using the ENBD duo. 

Here are my main monthly expenditures:

DEWA

Etisalat

Tabby Payments

Fast food (Work Lunch)

Delivery apps like Keeta, Talabat, Noon

Is ADIB good enough or shall I cancel it and open another credit card like SIB ",1,4,https://www.reddit.com/r/UAEcreditcards/comments/1rv3r86/best_credit_card_for_my_current_expenditures/,https://www.reddit.com/r/UAEcreditcards/comments/1rv3r86/best_credit_card_for_my_current_expenditures/,1773649416.0,2026-03-16 08:23:36,Kolabear15,1rv3r86
ENBD,TradingViewSignals,All flights to and from Dubai have been temporarily suspended. Emirates Airlines $ENBD is currently facing challenges.,"Emirates airline just posted: 

Please do not go to the airport.

Emirates will share updates when available. We would like to thank our customers for their understanding and patience.

The safety of our passengers and crew is our highest priority and will not be compromised.",1,1,https://i.redd.it/hzvrpldc9cpg1.jpeg,https://www.reddit.com/r/TradingViewSignals/comments/1rv0bud/all_flights_to_and_from_dubai_have_been/,1773636976.0,2026-03-16 04:56:16,Ubersicka,1rv0bud
ADCB,HungryArtists,"[For Hire] I'm a Multimedia Designer TouchDesigner/CGI/3D Character Rig, MoCap, Animation, Textures/VFX Pro","Hello, I'm a multimedia designer and independent artist that has worked for a little more than 5 years in various industry projects. 
If you need a set of visuals for a live performance that must run in real time, 3D art for a game or project. Develop a narrative with animation and storytelling. Design and realize a VFX heavy scene. Anything I can do, you can count on me.

We can create:

Optimized 3D: Modeling, Retopology, Texturing. Character Rigging, Animation & MoCap Clean up. Animation Sets. Delivered in any file format you need. 

VFX Development & Integration: Develop your idea for a VFX oriented composition in your scene or project. 

Set of Visuals(Live): Create a set of visuals (clips, animation, motion graphics) for your content or live performances. I can work using tools like TouchDesigner/Resolume to help you create a set of live visuals that can react to your audio input, be controlled in real time and synch with your set. 

Motion graphics/2D-3D Animation: I will help you in making a motion graphic, or 2D/3D animation for your brand. 

3D Rendering & Product Animation: I will help you develop interesting 3D renders for your products or environments. So you can showcase what you make yo your clients. 

Portfolio: https://linktr.ee/ivangeraldo

Hourly Rate: $12/hr

You can reach out to me via email:
ivan.geraldo.nu@gmail.com
",1,0,https://www.reddit.com/gallery/1ruzen7,https://www.reddit.com/r/HungryArtists/comments/1ruzen7/for_hire_im_a_multimedia_designer/,1773633995.0,2026-03-16 04:06:35,IvanGeraldo,1ruzen7
ADCB,Artistsforhire,"[For Hire] I'm a Multimedia Designer TouchDesigner/CGI/3D Character Rig, MoCap, Animation, Textures/VFX Pro | $12/hr","Hello, I'm a multimedia designer and independent artist that has worked for a little more than 5 years in various industry projects. 
If you need a set of visuals for a live performance that must run in real time, 3D art for a game or project. Develop a narrative with animation and storytelling. Design and realize a VFX heavy scene. Anything I can do, you can count on me.

We can create:

Optimized 3D: Modeling, Retopology, Texturing. Character Rigging, Animation & MoCap Clean up. Animation Sets. Delivered in any file format you need. 

VFX Development & Integration: Develop your idea for a VFX oriented composition in your scene or project. 

Set of Visuals(Live): Create a set of visuals (clips, animation, motion graphics) for your content or live performances. I can work using tools like TouchDesigner/Resolume to help you create a set of live visuals that can react to your audio input, be controlled in real time and synch with your set. 

Motion graphics/2D-3D Animation: I will help you in making a motion graphic, or 2D/3D animation for your brand. 

3D Rendering & Product Animation: I will help you develop interesting 3D renders for your products or environments. So you can showcase what you make yo your clients. 

Portfolio: https://linktr.ee/ivangeraldo

Hourly Rate: $12/hr

You can reach out to me via email:
ivan.geraldo.nu@gmail.com",1,0,https://www.reddit.com/gallery/1ruz24s,https://www.reddit.com/r/Artistsforhire/comments/1ruz24s/for_hire_im_a_multimedia_designer/,1773632950.0,2026-03-16 03:49:10,IvanGeraldo,1ruz24s
ADCB,UAEcreditcards,Is foreclosure of payment plans mandatory for closing ADCB CC. even though balance is zero,"I’m trying to close my ADCB CC.  Paid a big portion of the utilized amount from another bank (now it’s Zero). So when i went to their branch in the same payment date. They told me that its showing 4k AED

So i don’t know if it’s due the time needed to be reflected in the bank system or is it related to the several payment plans ?

Also if there’s a way to cancel it using the app or customer service. Would be appreciated ",2,2,https://www.reddit.com/r/UAEcreditcards/comments/1ruvzpm/is_foreclosure_of_payment_plans_mandatory_for/,https://www.reddit.com/r/UAEcreditcards/comments/1ruvzpm/is_foreclosure_of_payment_plans_mandatory_for/,1773624255.0,2026-03-16 01:24:15,First-Emergency6278,1ruvzpm
EI,Suomi,"Stubb Lontoossa: Eurooppa ei auta Trumpia, koska hän ei konsultoinut meitä [Stubb myös haluaa turvallisuusneuvoston veto-oikeuden poistamista. Lisäksi hän ehdottaa äänioikeuden poistamista turvallisuusneuvoston jäseneltä, jos se rikkoo YK:n peruskirjaa]",,6,2,https://yle.fi/a/74-20215611,https://www.reddit.com/r/Suomi/comments/1rvi1d8/stubb_lontoossa_eurooppa_ei_auta_trumpia_koska/,1773686295.0,2026-03-16 18:38:15,Sumuttaja,1rvi1d8
EI,Fallout76Marketplace,[Xb1] H: Bulwark n Rage armor W: Offers,,1,1,https://www.reddit.com/gallery/1rvi0h3,https://www.reddit.com/r/Fallout76Marketplace/comments/1rvi0h3/xb1_h_bulwark_n_rage_armor_w_offers/,1773686242.0,2026-03-16 18:37:22,Remarkable_Leg_7724,1rvi0h3
EI,obs,"Jogo com FPS ok, porém gravação com FPS baixo","Estou tendo problemas com OBS a algum tempo nas minhas gravações. Em jogos AAA eu jogo com a taxa de quadros em 60 FPS (Sempre travado) e a gravação em várias partes, ou a gravação inteira, fica com FPS baixo (10, 15, 20 fps). Em jogos como HOGWARTS LEGACY até mesmo acontece ghostings na tela, ou deformações quando se mexe muito rápido. 

Tenho um hardware de:
Ryzen 5 5500
RTX 5060ti 16gb de Vram
16gb de Memória Ram

As configurações do OBS estão em:
Codificador: NVIDIA NVENC AV1
Quantização constante (CQP): 15
Intervalo de Keyframes: 0s
Predefinição: P6: mais lento (qualidade ótima)
Ajuste: alta qualidade
Modo multipass: Duas passadas (Um quarto da resolução)
Perfil: main
Quadros futuros: ativado
Quantização adaptativa: ativado
B-frames: 4
Referencia de B-frames: Desativado

Resolução que eu gravo: a mesma do monitor e que eu jogo 2560x1440p

A prioridade do processo do OBS está alta e ei estou executando ele como adiministrador.

Essas são as configurações recomendadas pelo site da NVIDIA, e ja vi um corte do Youtuber BRKSEDU dizendo que utiliza praticamente as mesmas configurações, porém, além de eu ter esse problema de travamentos a qualidade não fica satisfatória com o CQP. Já tentei várias outras configurações, e em VBR normalmente a qualidade melhora, porem o baixo FPS se mantem e os arquivos ficam muito grandes. Alguém sabe como consigo resolver e deixar as minhas gravações a 60FPS com a melhor qualidade, que replica quase que fielmente a do jogo?",1,1,https://www.reddit.com/r/obs/comments/1rvhzzf/jogo_com_fps_ok_porém_gravação_com_fps_baixo/,https://www.reddit.com/r/obs/comments/1rvhzzf/jogo_com_fps_ok_porém_gravação_com_fps_baixo/,1773686215.0,2026-03-16 18:36:55,Cabessa09,1rvhzzf
EI,FridgeDetective,what does my fridge say about me?,"I love this sub. I just went for a restock, I usually get more fruit but it was all bad. Yes i live alone that is obvious lol.",1,0,https://i.redd.it/2obcgtlkbgpg1.jpeg,https://www.reddit.com/r/FridgeDetective/comments/1rvhyxi/what_does_my_fridge_say_about_me/,1773686153.0,2026-03-16 18:35:53,Longjumping_Map4899,1rvhyxi
EI,TeslaLounge,2025 Tesla M3LR RWD Highland - car shaking starting at 45mph,"I've owned my M3LR Highland since brand new Feb 2025. Last month at exactly 10k miles, started to notice excessive steering vibrations at highway speed on 2/28/26. Strangely, I was experiencing a glitch on my Amazon music (it was playing the same two songs over and over again). I did the double scroll wheel reboot and magically the steering wheel vibration went away.

Two weeks later, car shaking came back - notice at highway speeds starting around \~45mph but it's really bad as I get to 65-75+ mph. Made an appt at Tesla to troubleshoot under warranty (which I have to preauthorize at $220).

What could this be? Hope it's something along the lines of wheels need rebalancing -but how often does tire foam detachment happen to cause the shaking/wobbling of my wheels? Also hope it's nothing that requires replacement of half shafts or drive drive unit.

I have the original [Michelin Primacy A/S](https://www.google.com/search?q=Michelin+Primacy+A%2FS&sca_esv=9a3fab58edaf9218&rlz=1C1GCEA_enUS967US967&sxsrf=ANbL-n4qzDBu_94LrPbUf6liYwhaCNoFLA%3A1773685852293&ei=XEy4ac7HEaWu5NoP2MrTmA0&biw=2688&bih=1091&ved=2ahUKEwi28ryRh6WTAxWEGFkFHeYMOZwQgK4QegQIAxAB&uact=5&oq=highland+model+3+oem+tires&gs_lp=Egxnd3Mtd2l6LXNlcnAiGmhpZ2hsYW5kIG1vZGVsIDMgb2VtIHRpcmVzMgYQABgWGB4yBhAAGBYYHjIIEAAYgAQYogQyCBAAGIAEGKIEMggQABiABBiiBEjjOlCSEFjSOXACeAGQAQCYAcIBoAHoE6oBBTE3LjEwuAEDyAEA-AEBmAIdoAKcFcICChAAGLADGNYEGEfCAgQQIxgnwgINECMYgAQYJxjJAhiKBcICChAjGIAEGCcYigXCAgsQABiABBiRAhiKBcICERAuGIAEGLEDGNEDGIMBGMcBwgILEC4YgAQYsQMYgwHCAgoQABiABBhDGIoFwgILEAAYgAQYsQMYgwHCAggQLhiABBixA8ICBxAjGPAFGCfCAhAQLhiABBjRAxhDGMcBGIoFwgIWEC4YgAQYQxjHARiYBRiZBRiKBRivAcICEBAuGIAEGEMYxwEYigUYrwHCAgoQLhiABBhDGIoFwgILEC4YgAQYsQMYigXCAgUQLhiABMICBRAAGIAEwgIIEAAYgAQYsQPCAgoQABiABBgUGIcCwgILEC4YgAQYxwEYrwHCAgcQABiABBgKwgILEAAYgAQYhgMYigXCAgUQABjvBcICCBAAGKIEGIkFmAMAiAYBkAYIkgcFMTguMTGgB8yDArIHBTE2LjExuAeTFcIHCDAuOC4xNy40yAeOAYAIAA&sclient=gws-wiz-serp&safe=active&ssui=on&mstk=AUtExfCPDGi0AySVy0GYV2_XA1UZrKZugifGkV6wPpEg5pw_CxjB8CwBFrTNUk2z4e12rEkJhUIIGzkUWw-mamoFPKZx3f7G7sn3Koek4iNvJ3F5mg4SRxH9AXIyHyWx0DrZQMGthNpwKRo-Rgswgtm1XcfFb4YQlPD3XOpd2wnDzESzHOOi9m0WwDYKHY2GsSSzOpbgN-yMXurJr8_V8jnyTHwEebjfN2G6RSCV6caJAgTapEohx7KgAzBl5H8gyqf6myX_mZWQhyhtcDXYzmaIpLUStYyv5URHG8ynQxqdC5HpVA&csui=3) (235/45R18) tires

Thanks in advance for any ideas.",1,0,https://www.reddit.com/r/TeslaLounge/comments/1rvhwhr/2025_tesla_m3lr_rwd_highland_car_shaking_starting/,https://www.reddit.com/r/TeslaLounge/comments/1rvhwhr/2025_tesla_m3lr_rwd_highland_car_shaking_starting/,1773686011.0,2026-03-16 18:33:31,RavenLunatik9,1rvhwhr
EI,EscritoresBrasil,capítulo 10 de Flora Nakuã: o destino cruzado,"Ato X . O destino cruzado

• A dissociação de Freijó

Flora: Pai, precisamos te perguntar uma coisa. O senhor já sabia que Thales tem um dom? Por favor, não minta!

Freijó fala uma verdade, mas alternativa: Eu sei, Neguinha. É verdade, ele é um rapaz com vários dons e atributos morais: é puro de coração, um homem dedicado, e nos faz rir até quando estamos cabisbaixos. É deveras especial para todos nós em Caájara, e principalmente pro Mordomo da natureza.

(Flora queria falar logo de imediato, mas não pôde interromper seu pai de forma brusca. Ela levantou o dedo, baixinho, indicando querer falar algo.)

Flora: Sim Senhor, isso também, mas eu não falo apenas de um dom moral, Ele possui um dom astral assim como eu, papai! É uma audição apurada igual ao meu barômetro, só que um pouco mais longe, e ainda visualiza tudo o que vibra o ar. Estávamos no campo e Thales ouviu exatamente duas pessoas conversando tramóia no mato e meu barômetro não sentiu isso até eu chegar mais perto.

Thales: Sim, e eu disse a ela que pode ter a ver com o fato do meu avô ter partido igual a sua esposa, Senhor. O que acha?

Freijó, porém não realçava nenhuma surpresa quanto a isso, até depois de falar sobre os espias que Thalles ouviu no mato, Flora percebe algo em seu semblante e diz:

Flora: Papai, desculpe a franqueza e a ousadia, mas eu sinto que o senhor está escondendo algo da gente. E é um trauma doloroso de muito tempo…

• Conflitos antigos

Freijó: [Quebrantado] É, tem razão, na verdade a minha intriga no começo era exatamente com ele.

Thales: [Agoniado] Eu paizão?! O que eu fiz com o senhor? Se te ofendi de alguma forma, ou te fiz algo que eu não me lembre, me desculpa. O senhor sabe que o Nakuã astral que reside em Flora e agora em mim é meu juíz e advogado!

Freijó: Ei, tá tudo bem! Não se trata disso! É algo que você precisa saber sobre a guerra e o vulgo “Fazendeiro ruim” que oprimia nosso povo.

Thales: Ah, que alívio! Mas a história mesmo eu já sei de có, Dona Senhorinha já me contou umas 10 vezes em suas aulas. Mas por que o senhor enfatizou o termo “vulgo”? Ele tinha nome?

Freijó: É por esse outros motivos que ela não pôde lhe contar tudo, pois não deixei! Eu é que te peço perdão por não ter dito antes. Guiné disse que isso mexeria com o fluxo do tempo também, por isso excluímos esse nome.

Flora (Perplexa) diz: Isso o quê, pai? o nome desse homem é tão delicado assim? Porque eu sinto sua ansiedade te consumindo de verdade, e não é de hoje. Por favor, diga de uma vez! Eu também contei a ele sobre o plano do cortejo.

Freijó concorda: Certo, filha… Thales Bandeira, meu genro amado, lembra quando te fiz várias perguntas pessoais a você quando chegou aqui? Na verdade, eu queria saber da possível relação que você poderia ter com a linhagem do inimigo. E o que eu temia, de fato, foi confirmado.

Thales: (Assustado) Como assim, Senhor? Eu, carregando laços sanguíneos do inimigo? Isso nunca!

Freijó: Calma! Se até hoje ainda te chamo de ""meu filho"", é porque naquele momento antes de te conhecer, eu mantinha uma hipótese equivocada sobre você, já que estava sendo usado. Mas vai, deixe-me terminar!
Bem, você disse ter ouvido a história do conflito entre Caájara e Serra do Pinhal, certo? O meu filho não sabe o peso que o seu sobrenome, ""Bandeira"" carrega e representa para nós?

Thales: Sabe que até achei uma certa similaridade que coincidência; a ""Serra do Pinhal"" com a chácara que era do nosso avô Ambrósio, mas não sei por que o nome da minha família estaria envolvido em guerra.

• O dilema familiar

A comoção com a inocência de Thales era o que tornava a declaração de Freijó ainda mais difícil. Ele respira fundo e diz.

Freijó: O nome do tal Fazendeiro que oprimia Caájara era... Ambrósio Bandeira! isso mesmo, o seu avô era quem vivia em conflito conosco!

Thales: [pálido, suando frio] fala: Não é possível! deve haver algum engano! O vovô Ambrósio nunca foi de guerra, ao contrário, ele quem me ensinou a aguardar princípios de respeito à natureza e a ser o homem honrado que sou hoje! 

Freijó [emotivo]: Você está certo, meu filho, é muito gratificante saber disso, até porque seu avô Ambrósio nunca te contaria isso e com razão. quer saber por quê?

Freijó respira fundo novamente e diz: Lá pela década de 40; um pouco antes de seu pai, Ambrósio raramente comandava as tropas em campo, por causa de seu problema com artrite e outras complicações da velhice, mas o velho era tão ruim que ainda nos incomodava à paisana de sua própria chácara, pagando caçadores corruptos em busca da cura para ele aqui em Caájara.
Agora, sim, tocamos num ponto crucial: podemos falar algo relacionado ao seu dom.
A pureza que quebra a maldição “Bandeira”

Thales: (Triste e confuso) Não sabia que o passado do meu avô era tão sombrio. Mas o que ele tem a ver com esse dom que eu tenho? Deixa eu adivinhar, o vovô também se conectou ao seu instinto aqui em Caájara assim como eu, foi isso?

Freijó: Não foi bem assim, na verdade o elixir Zoe era uma poção que nós protegemos há séculos, guardando o único frasco para a chegada de Nakuã; Flora foi o recipiente vivo, perfeito e seguro para suportar carga, porque não há impureza nela. Desde então prometemos nunca mais replicar ou nem mesmo tocar no assunto da mesma forma; para todos os efeitos, isso é uma lenda! 

Thales: Ainda não entendo, como meu avô despertou a Zoe e se vocês não deram a ele?

Freijó: Você já deve ter lido essa parte; em que ele realmente surrupiou os materiais de Caájara e ele ainda conseguiu replicar a Zoe; que de fato curou todos os seus problemas de velhice, incluindo a sua virilidade e fecundidade naquela época.

E com a cura da artrite, aí que o velho pretendia usar seu novo vigor contra nós como se fosse uma besta com velocidade de uma onça como é contada na história. 

Thales: Então era por isso que sempre que ele lutava por ódio ou lazer, o seu coração entrava em curto com a energia pura da Zoe?

Freijó: Isso mesmo! E a essência da mesma foi passada para o seu pai que cresceu como um canal nulo da Zoe, porque ele corrompeu sua inocência presenciando a vida dupla de Ambrósio; como pai de família e criminoso ao mesmo tempo, e agora com a sua perdição no trabalho. Naquele tempo seu pai, Tarcísio, não era assim, ele era o nosso amigão do peito. Seus pais só foram embora daquela chácara, para se isolarem da maldade de Ambrósio, pois sua mãe, Talita, que já tinha Melissa de 5 anos, também estava prestes a conceber você; preservando assim sua inocência.

• A adoção fraterna

Thales: emotivo e impressionado diz: Uau! meus dois pais eram amigos?! Pena que não foi do vovô Ambrósio também, para mim ele era um cara nota 1000! Mas eu entendi o seu ponto, paizão; o ódio em si é realmente reimoso pro coração, ainda mais com a Zoe no sangue.
…Ah, por isso que a minha avó me dizia que antes do meu pai nascer, ele passou a se animar com ela, mesmo na velhice. E esses 20 anos depois que eu nasci, ele se tornou carinhoso conosco para não viver em curto com a Zoe, foi isso? Hum, faz sentido agora!

Freijó: Exatamente, filho! Mas olha, por ruim que ele fosse na época, eu nunca negaria a cura a seu avô, sabe disso, né? O ódio de Ambrósio por nós ainda perdurou por todo esse tempo até vocês nascerem. E se eu doasse a Zoe de bandeja pra ele, a culpa de sua morte por sobrecarga, iria recair sobre mim, porque ele era viciado na adrenalina de ser ruim.

 Eu só sei que naquele dia o Mordomo; Nakuã astral que habitava a árvore sagrada de Acácia; não emanava mais nenhum sinal de maldade vindo de lá. E pensamos que o velho Ambrósio teria batido as botas, ou que alguém lhe teria “cancelado seu CPF” com ""cosquinhas” na goela dele com canivete enferrujado.

Freijó: Foi então que minha esposa Relva em seu instinto espiritual dizia que "" não só ele está vivo, como também sinto duas vidas habitando aquela chácara junto com ele"". Ela tinha confiança de que seus pais te colocariam em um bom caminho, e você seguiu!

Eu também desejei algo em voz alta, que eu queria conhecer a pessoa que deu fim a essa guerra. Só depois que você apareceu aqui Thales, Guiné enfim pôde me contar abertamente de sua convivência pura com seu avô na infância.

Sinceramente, eu esperava tudo, menos por isso! Não foi o justiceiro armado, e nem uma paz repentina: era pelos netos que aquele coração de pedra se derreteu! E o destino do universo Nakuã nos proporcionou esse encontro.

Seu espírito, que já era puro, se conectou ao Instinto Nakuã de Flora, ampliando ainda mais esse seu dom de forma benéfica.
Você, Thales Bandeira; foi escolhido antes de nascer, e agora vocês farão o que a minha força não pôde fazer; serás usado como instrumento de justiça contra aquilo que realmente cega o mundo.

(Thales se emociona em abraços junto a Flora) Thales: olha paizão, Deu até um upgrade na minha cabeça.
Mas quanto a Mel? A Flor me disse que ela não é perversa, e também teria chance de redenção.

continua... ",1,0,https://www.reddit.com/r/EscritoresBrasil/comments/1rvhvb2/capítulo_10_de_flora_nakuã_o_destino_cruzado/,https://www.reddit.com/r/EscritoresBrasil/comments/1rvhvb2/capítulo_10_de_flora_nakuã_o_destino_cruzado/,1773685940.0,2026-03-16 18:32:20,Fit_Elderberry_9959,1rvhvb2
EI,crtgaming,Pictures of my CTX VL950,"Got this for free. Posted asking for computer hardware on facebook and somebody came by with an old Pentium IIIe PC, some speakers, and this monitor, acting like the monitor was the least likely part to want.

Had to find a GPU to display so it's running off my Radeon HD8350 as a display adapter while my RTX 2060 does the rendering. It's been my favorite monitor and until emulation started having issues with vsync causing lag I would have all my emulation on there, but it's pretty good for Minecraft and Mindustry.

Sorry if the images aren't very good, I tried.

I would like some help figuring out why my model has a different front panel design than the other listings I found online.",5,0,https://www.reddit.com/gallery/1rvht0v,https://www.reddit.com/r/crtgaming/comments/1rvht0v/pictures_of_my_ctx_vl950/,1773685813.0,2026-03-16 18:30:13,tycraft2001,1rvht0v
EI,HiTMAN,This music hits different nowadays ;),,1,1,https://i.redd.it/mprmgwjdagpg1.jpeg,https://www.reddit.com/r/HiTMAN/comments/1rvhs2f/this_music_hits_different_nowadays/,1773685755.0,2026-03-16 18:29:15,NovelMountain3330,1rvhs2f
EI,Gehalt,Ausstehende Gehaltsanpassung,"Hey, 

ich stehe vor meiner ersten Gehaltsanpassung  nach Abschluss der Ausbildung vor einem Jahr und zeitgleich vor einer Beförderung mit mehr Verantwortung.

Ich habe mir vorgenommen dieses Jahr aus meinem Elternhaus auszuziehen und meine erste eigene Wohnung zu beziehen. 
Hierfür habe ich meine Kostenseite zum Jahreswechsel unter die Lupe genommen und unnötige Dinge gestrichen.
Weil ich im Moment nicht fix weiß, welches Budget mir letzten Endes monatlich zur Verfügung stehen wird ist meine Wohnungssuche derzeit auf Eis gelegt.

Das ist für mich doppelt belastend, weil die Situation für mich neu ist und mich etwas Verunsichert. 
Zum nächsten Monatsgehalt möchte ich gern mein bereits aufgebessert Gehalt bekommen, um mehr Planungssicherheit zu haben. 
Mein Chef wartet bisher ab, obwohl aktiv von ihm eine Gehaltserhöhung in nicht bekannter Höhe ""angekündigt"" wurde. 

Kann ich ihm eine Email schreiben, mit der Bitte um zeitnahe Gespräche/Angebote oder kommt das blöd an bzw. Bringt mich in eine schlechtere Verhandlungsposition? 


",1,0,https://www.reddit.com/r/Gehalt/comments/1rvhs0e/ausstehende_gehaltsanpassung/,https://www.reddit.com/r/Gehalt/comments/1rvhs0e/ausstehende_gehaltsanpassung/,1773685751.0,2026-03-16 18:29:11,IcyPace1616,1rvhs0e
EI,SampleSize,Would you like to find new sporty plans in Copenhage? (for every Copenhage citizen),"Hey!

I’m researching a **new paddle boarding activity around the canals and waterfront of Copenhagen**, and I made a **quick 5-minute survey**.

If you like water sports, new plans in the city, or just enjoy helping random people on Reddit with their projects, I’d really appreciate your input.

👉 Link: [https://docs.google.com/forms/d/e/1FAIpQLSf9pzTy9dY11Ho-RNO2J1YitEiDQpdVtasDcWIO9RHuhWt1lw/viewform?usp=header](https://docs.google.com/forms/d/e/1FAIpQLSf9pzTy9dY11Ho-RNO2J1YitEiDQpdVtasDcWIO9RHuhWt1lw/viewform?usp=header)

It’s quick, easy, and might help bring more fun activities to the canals. Thanks in advance! 🌊",1,1,https://www.reddit.com/r/SampleSize/comments/1rvhrd9/would_you_like_to_find_new_sporty_plans_in/,https://www.reddit.com/r/SampleSize/comments/1rvhrd9/would_you_like_to_find_new_sporty_plans_in/,1773685714.0,2026-03-16 18:28:34,twentytwo_twentytwo,1rvhrd9
EI,pranks,Dogs are very smart  [PRANKS],,28,2,https://v.redd.it/cvw664kk9gpg1,https://www.reddit.com/r/pranks/comments/1rvhnwx/dogs_are_very_smart_pranks/,1773685509.0,2026-03-16 18:25:09,hazydreameri,1rvhnwx
