bank,subreddit,title,selftext,score,num_comments,url,permalink,created_utc,created_date,author,id
EI,taoism,"What Daoists wear - the Dao Jiao fushi 道教服飾 ""Daoist Ritual Clothing""","Taoist clothing is a visible marker of Taoist identity.

 Ritual clothing not only inherits from [Han Chinese](https://en.wikipedia.org/wiki/Han_Chinese) [Hanfu](https://en.wikipedia.org/wiki/Hanfu) but also show clear Taoist cultural meaning. 

The decoration found on the clothes are deeply influenced by Chinese culture.

These designs reflect traditional Taoist cosmology including 

[Taoist pantheon](https://en.wikipedia.org/wiki/Chinese_gods_and_immortals) (e.g. [Yudi](https://en.wikipedia.org/wiki/Jade_Emperor), the [Sanqing](https://en.wikipedia.org/wiki/Three_Pure_Ones), [Yuanshi Tianzun](https://en.wikipedia.org/wiki/Yuanshi_Tianzun), [Lingbao Tianzun](https://en.wikipedia.org/wiki/Lingbao_Tianzun), [Daode Tianzun](https://en.wikipedia.org/wiki/Daode_Tianzun) who is the deified [Laozi](https://en.wikipedia.org/wiki/Laozi)[ ](https://en.wikipedia.org/wiki/Laozi)

the [Eight Immortals](https://en.wikipedia.org/wiki/Eight_Immortals)

the [Eight Trigrams](https://en.wikipedia.org/wiki/Bagua) 

the [Twenty-eight Lunar Mansions](https://en.wikipedia.org/wiki/Twenty-Eight_Mansions) and 

the 12 animals of the [Chinese zodiac](https://en.wikipedia.org/wiki/Chinese_zodiac)

They can also be decorated with animals which are related to [Chinese mythology](https://en.wikipedia.org/wiki/Chinese_mythology), 

legends and stories, such as the [crane bird](https://en.wikipedia.org/wiki/Crane_in_Chinese_mythology) which represents transcendence. 

They can also be decorated with auspicious symbols, such as [dragons](https://en.wikipedia.org/wiki/Chinese_dragon), butterflies, bats, clouds.

  
[Daoist Clothes - Gallery](https://www.google.com/search?q=taoist+clothes&sca_esv=f57e32243c3fb4a2&udm=2&biw=2287&bih=847&sxsrf=ANbL-n7Y2M0g68jjgGHkOGQONZfd4CH7xQ%3A1773674037997&ei=NR64aeW_PK2E9u8PvaPV0Qc&ved=0ahUKEwilru3X2qSTAxUtgv0HHb1RNXoQ4dUDCBI&uact=5&oq=taoist+clothes&gs_lp=Egtnd3Mtd2l6LWltZyIOdGFvaXN0IGNsb3RoZXMyBxAAGIAEGBMyCBAAGBMYBRgeMggQABgTGAgYHjIIEAAYExgIGB5IsBJQmghYkg1wAXgAkAEAmAFWoAGaAaoBATK4AQPIAQD4AQGYAgKgAlzCAgkQABiABBgTGAqYAwCIBgGSBwEyoAe8ArIHATG4B1nCBwMwLjLIBwOACAA&sclient=gws-wiz-img)

",3,0,https://en.wikipedia.org/wiki/Daojiao_fushi,https://www.reddit.com/r/taoism/comments/1rvc8o6/what_daoists_wear_the_dao_jiao_fushi_道教服飾_daoist/,1773674106.0,2026-03-16 15:15:06,fleischlaberl,1rvc8o6
EI,snappisensuroimat0n,Ilmastonmuutoksen kieltäminen?,"Semmoset setit sit sieltä :D

Ehkä hieman turha postaus, mutta itseä ainakin ihmetyttää, kuinka tietämätöntä/piittaamatonta porukkaa on. Ja vielä se, että postaat jotain tällästä omalla naamalla ja nimellä? Kerrot julkisesti, kuinka syötät lapsellesi foliohattujuttuja? :D

Joo eikai siinä sitte🫣

Tsemppiä kaikille opettajille, jotka joutuu kuuntelemaan näiden vanhempien juttuja🙏",11,11,https://www.reddit.com/gallery/1rvc86v,https://www.reddit.com/r/snappisensuroimat0n/comments/1rvc86v/ilmastonmuutoksen_kieltäminen/,1773674075.0,2026-03-16 15:14:35,TotallyNotMe069,1rvc86v
EI,DemonSchoolIrumakun,Iruma kun extras no 1,,11,2,https://www.reddit.com/gallery/1rvc5dj,https://www.reddit.com/r/DemonSchoolIrumakun/comments/1rvc5dj/iruma_kun_extras_no_1/,1773673900.0,2026-03-16 15:11:40,darksoul757,1rvc5dj
EI,Fire,Evaluating the value of your Time in the FIRE movement.,"How does this group evaluate how much their time is worth? A lot of people in this group earn a high income, and so it could reasonable be said ""their time is worth a lot of money"" but given the general frugal nature if this group (my self included) there is a tendency not to spend when it can be avoided. But at some point this has to create inefficiency. EI, your hourly or hourly equivalent is $60/hr, but you choose to take an 1hr and 15 mins on the buses to save $15 on a 15 min uber. How do people in this group evaluate this type of time vs money question?

  This question was inspired by a work trip that sent me \~1hr out of Paris and I had one free day to explore Paris. There was a choice between an Uber or public transit, the Uber would cost me $60 more then public transit but save me 90 minutes. Normally, I wouldn't spend $40/hr to a convenience, but given how limited my time was in a place I really wanted to see, it seem like a silly choice to wait my time in that place to save a small amount of money. And that made me wounder how other like minded people thinks about the same idea. ",1,3,https://www.reddit.com/r/Fire/comments/1rvc2d5/evaluating_the_value_of_your_time_in_the_fire/,https://www.reddit.com/r/Fire/comments/1rvc2d5/evaluating_the_value_of_your_time_in_the_fire/,1773673720.0,2026-03-16 15:08:40,TomorrowPlenty9205,1rvc2d5
EI,TypologyJunction,What do you think?,"I fully realize there’s some contradictions here, but life’s contradictory and paradoxical. 

Also, I’ve included some extra typology as well, just because. On the moral alignment, I find the 5x5 alignment system to be much more colorful and nuanced than the usual setup, so I’ve used that instead. 

Regarding the Jungian functions, I’ve arranged them to show shadow functions and to signify my own sense of showing a considerable amount of ENTJ-\*ishness\*. I admit to having some difficulty around this, but after much self-study, reflection and mental ‘hither and thither-ring’, I’d say I lean more into ENTP in the end.

Jungian function key: **Bolded** — highly or noticeably developed function; 𝚄̲𝚗̲𝚍̲𝚎̲𝚛̲𝚕̲𝚒̲𝚗̲𝚎̲𝚍̲ — moderately developed *function; *Italicized — shadow function; No notation — underdeveloped function, or little to no development ",0,5,https://i.redd.it/47gvlj0kafpg1.jpeg,https://www.reddit.com/r/TypologyJunction/comments/1rvc243/what_do_you_think/,1773673705.0,2026-03-16 15:08:25,Other_Sir2813,1rvc243
EI,snappisensuroimat0n,Mitä mieltä bettina peltoniemen sisällöstä nykyään?,saa poistaa jos ei kuulu tänne mut onks se vaan mä vai onko toi bettina ihan todella ärsyttävä nykyää ja joteki menny viime aikoina tosi oudoksi sen jutut,7,12,https://www.reddit.com/r/snappisensuroimat0n/comments/1rvbzof/mitä_mieltä_bettina_peltoniemen_sisällöstä_nykyään/,https://www.reddit.com/r/snappisensuroimat0n/comments/1rvbzof/mitä_mieltä_bettina_peltoniemen_sisällöstä_nykyään/,1773673554.0,2026-03-16 15:05:54,sirkkeliii,1rvbzof
EI,snappijuorut,Alisa ja sometauko part: 28616,"No ei kait siinä, 24h päästä nähää taas🫡",9,2,https://i.redd.it/8dl2p0k0afpg1.jpeg,https://www.reddit.com/r/snappijuorut/comments/1rvbz77/alisa_ja_sometauko_part_28616/,1773673523.0,2026-03-16 15:05:23,Jakkiiiii,1rvbz77
EI,drawing,Real cars or toy cars?,,1,2,https://i.redd.it/wp0cblev9fpg1.jpeg,https://www.reddit.com/r/drawing/comments/1rvbyf7/real_cars_or_toy_cars/,1773673476.0,2026-03-16 15:04:36,mocew1995,1rvbyf7
EI,BusinessBookLessons,Instant Business Validation Technique From Million Dollar Weekend,"https://preview.redd.it/gbsispg7izog1.png?width=1792&format=png&auto=webp&s=453898c478fbc177ce86dfa02f9fcd80a294ecd4

# you must agree that in business The only opinion that matters in business is the customer’s.

Friends, experts, and random people may doubt your idea—but none of their opinions validate a business. **Only customers paying for the solution does.**

Instead of spending months planning, a customer-first entrepreneur focuses on three things:

1. Find a **real customer problem**
2. Offer a **possible solution**
3. **Validate that people will pay**

If customers pay → the idea works.  
If they don’t → adjust quickly.

**A relatable example:**  
If someone wants to start a cold coffee stall near a college, instead of investing immediately they could simply ask students:

>

If people pre-order or say yes consistently, the demand is validated.

**Key takeaway:**

>

Real businesses are validated by **customers with money, not opinions.**",1,0,https://www.reddit.com/r/BusinessBookLessons/comments/1rvbveu/instant_business_validation_technique_from/,https://www.reddit.com/r/BusinessBookLessons/comments/1rvbveu/instant_business_validation_technique_from/,1773673288.0,2026-03-16 15:01:28,thefarhanmansuri,1rvbveu
EI,bicla,Problema garantie - achizitie ebike second hand.,"Sunt pe punctul de a cumpara un ebike (Bosch g5). M-am uitat la cateva anunturi pe olx cu biciclete aproape noi, cumparate de primii proprietari de la magazine legit din Romania.

In anunt scrie la fiecare ca bicicleta e in garantie.

Am vorbit cu un vanzator care zicea ca a cumparat de la Bikeexpert, ca are toate actele si ca bicicleta e in garantie.

Am sunat azi de curiozitate la Bikeexpert sa ma asigur ca voi beneficia de garantie chiar daca nu exista un contract intre mine si ei. Si surpriza, garantia se pierde in momentul in care se schimba proprietarul, deci nu e transmisibila. 

Eu nici nu ma pot baza pe cel care mi-o vinde ca ma va ajuta cu medierea intre mine si magazin, in cazul in care apar defecte de fabricatie (cadrul e de carbon, de aici si temerile mele).

Aveti vreo experienta similara? Adica nu ati beneficiat de garantie pt ca nu voi ati achizitionat bicicleta, chiar daca aveati toate documentele de la primul proprietar?

PS: probabil voi opta pt una noua, intr-un final, mai slab dotata, dar sa stau linistit.",3,5,https://www.reddit.com/r/bicla/comments/1rvbus5/problema_garantie_achizitie_ebike_second_hand/,https://www.reddit.com/r/bicla/comments/1rvbus5/problema_garantie_achizitie_ebike_second_hand/,1773673254.0,2026-03-16 15:00:54,Equal_Beat3778,1rvbus5
EI,HistoryBooks,What to do with dad's books.,"Hey there, my dad past earlier this year, and my mom is left with 9 packed bookshelves. He loved the world wars with emphasis on airplanes, as used these books to research and paint models. My mom would like to sell or donate them to someone/somewhere that will appreciate them. I'm trying to avoid putting each up individually on ebay. It's not about the money, we just don't want to throw them out. Anyone have any suggestions?",5,10,https://www.reddit.com/gallery/1rvbtbp,https://www.reddit.com/r/HistoryBooks/comments/1rvbtbp/what_to_do_with_dads_books/,1773673174.0,2026-03-16 14:59:34,dadsbooks,1rvbtbp
EI,mitosyleyendas,Beta de app iOS de Primera Era,"Hola, me llego este link a una beta de una app para iPhone donde se pueden ver las cartas de primera era con sus distintas versiones, buscarlas, crear mazos, ver la bandlist actualizada y varias otras opciones.  
Link: [Oraculo PE](https://testflight.apple.com/join/9seP5DDP)  
Codigo: 9seP5DDP

Dijeron en el grupo que estaban trabajando en la de Android igual y que la compartieran nomas",2,0,https://www.reddit.com/gallery/1rvbrzo,https://www.reddit.com/r/mitosyleyendas/comments/1rvbrzo/beta_de_app_ios_de_primera_era/,1773673090.0,2026-03-16 14:58:10,Character_Brother463,1rvbrzo
EI,Blacklibrary,Don't lose hope and check your local store,*Second picture is my todays pick.,30,10,https://www.reddit.com/gallery/1rvbni5,https://www.reddit.com/r/Blacklibrary/comments/1rvbni5/dont_lose_hope_and_check_your_local_store/,1773672818.0,2026-03-16 14:53:38,Vladuch,1rvbni5
EI,OnePieceTCG,The full card list of ST30! Img Cr: @LeeZ_1111,,10,3,https://www.reddit.com/gallery/1rvbjse,https://www.reddit.com/r/OnePieceTCG/comments/1rvbjse/the_full_card_list_of_st30_img_cr_leez_1111/,1773672583.0,2026-03-16 14:49:43,OrangeSamuraiD,1rvbjse
EI,EDH,Eldrazi Degenerate Deck Help,"So I was able to get the Eldrazi precon at a decent price months ago and never really got around to upgrading it. I played it recently and the precon just felt... bad. 

I do like the Eldrazi lore, art style, stompy creatures, etc etc so I wanted to really upgrade this deck and change it around a bunch. 

I added the titans in the deck and it's full degenerate playstyle. My question is how does the deck look upgraded?

Do cards like Last March of the Ents do anything here since it doesn't really support casting triggers? Am I missing any great cards or do I have anything in the deck that doesn't belong? 



This is my first colorless deck so I'm not sure if the mana base works out too and I was considering all the Urza lands. Thank you all for the help!

  
[https://moxfield.com/decks/JtlO7ovKtEiVaxJF7c0j\_g](https://moxfield.com/decks/JtlO7ovKtEiVaxJF7c0j_g)",1,7,https://www.reddit.com/r/EDH/comments/1rvbj03/eldrazi_degenerate_deck_help/,https://www.reddit.com/r/EDH/comments/1rvbj03/eldrazi_degenerate_deck_help/,1773672532.0,2026-03-16 14:48:52,Far-Chair3597,1rvbj03
EI,mildyinteresting,These billboards advertising a tourist trap 4 1/2 hours in the opposite direction,,49,30,https://i.redd.it/yssg7fnm6fpg1.jpeg,https://www.reddit.com/r/mildyinteresting/comments/1rvbgpj/these_billboards_advertising_a_tourist_trap_4_12/,1773672387.0,2026-03-16 14:46:27,Snap_PuzzleTime,1rvbgpj
EI,NortheastBlues,🚨BREAKING: Chelsea have been fined £10.75m by the Premier League and handed a one-year transfer ban suspended for two years ⚠️🤕,"This has been issued for breaching Premier League rules related to financial reporting, third-party investment and youth development during the Roman Abramovich era.

The club have also received an immediate 9-month academy transfer ban, plus a 1-year first-team transfer ban (suspended for two years).",2,4,https://i.redd.it/wd5jeyqa6fpg1.png,https://www.reddit.com/r/NortheastBlues/comments/1rvbewx/breaking_chelsea_have_been_fined_1075m_by_the/,1773672276.0,2026-03-16 14:44:36,Davy_wavey,1rvbewx
EI,u_Repulsive_Mind1319,Is this my youtube   https://www.youtube.com/channel/UC2_LJMfUb41iwKPmhu8ljVA,,1,0,https://i.redd.it/wbegdas56fpg1.jpeg,https://www.reddit.com/r/u_Repulsive_Mind1319/comments/1rvbeiz/is_this_my_youtube_httpswwwyoutubecomchanneluc2/,1773672251.0,2026-03-16 14:44:11,Repulsive_Mind1319,1rvbeiz
EI,Suomi,Tekoäly & teknologinen työttömyys,"Olen huomannut, että todella monelle on lähes mahdoton käsittää, miten tekoäly oikeasti ""vie"" työpaikkoja. Joko tekoäly vie kaikilta työt tai sitten ei keneltäkään. Ja jos vie keneltäkään, niin kaikkien pitäisi nähdä se samalla tavalla: olitpa kokenut tai yrittämässä saada jalkaa oven väliin vastavalmistuneena.

[Tässä](https://digitaleconomy.stanford.edu/app/uploads/2025/12/CanariesintheCoalMine_Nov25.pdf) eräs tutkimus >!EDIT: jenkeistä!!<, jonka johtopäätös oli, että tekoäly ei vie työpaikkoja koodareilta. Samaisessa tutkimuksessa on kuitenkin nämä graafit:

https://preview.redd.it/mg2250s3vepg1.png?width=618&format=png&auto=webp&s=6b39f2947a6617a89541620126d766f4166e0970

Trendi on selkeä: 2022 tapahtui *jotain*, jonka jälkeen varsinkin niiden aloittelevien työntekijöiden paikat lähtivät kasvusta laskuun. Huomatkaa myös, että tämä trendi ei ole näkynyt yhtä selkeästi kokeneemmilla työntekijöillä, joiden arvelen täälläkin selittävän miten tekoäly ei uhkaa omaa työkuvaa.

Tämä on eri asia kuin se, että tekoäly korvaa pysyvästi työvoimaa. Notkahdus junnukoodaajien työllistymisessä ei vielä näkyisi kansantaloudellisesti mitenkään. Toisaalta jos tätä alkaa tapahtumaan useassa alassa ja mahd. myös monimutkaisemmissa työtehtävissä, niin ongelmasta voi tulla kansantaloudellisesti merkittävä.

Tähän varmasti joku tulee sanomaan, että tämä ei todista mitään jne. Tosiasiassa kuitenkin tilanne on muuttunut. Jos teknologinen työttömyys on alkamassa, se näyttäisi juuri tältä: yksittäisten alojen entry-tason työpaikat alkaa hiipumaan tavalla, jota on hankala selittää esim. suhdanteella tai muilla rakenteellisilla tekijöillä.

Tällä hetkellä ainoa todellinen argumentti teknologisen työttömyyden uhkaa vastaan on aina viimekädessä redusoitavissa muotoon: ""[Ei niin ole ennenkään tapahtunut, niin miksi nyt tapahtuisi?](https://www.weforum.org/stories/2024/08/why-ai-will-not-lead-to-a-world-without-work/)""

Argumentti on sinänsä ihan ok, ettet voi oikein sanoa juuta tai jaata turvautumatta lopulta ideologiseen uskoon. Mutta asiantuntijaluokalla on kuitenkin selkeä vinouma uskoa, ettei ongelmaa tule. Johtunee osin esim. siitä, että nykyinen kansantaloustiede ei edes kestäisi kyseisen teknologisen työttömyyden implikaatioita.

On myös erillinen aihe se, että miten yhteiskunta kestää siirtymän vaikka oletettaisiin, että lopulta ne työpaikat jostain ilmestyy. Miten esimerkiksi ihmiset täällä suhtautuu siihen, että pahimmillaan opiskeltu kandi + maisteri alalle, jonka piti työllistyä hyvin, mutta nyt pitääkin opiskella jotain uutta käsienheiluttelualaa vähintään 2-3v ilman, että valtio haluaa tukea sinua siinä ja opintolainavelan kanssa samalla kun priorisoidaan kouluttamattomia hauissa? Mutta tästä saisi ihan täysin toisen langan tehtyä.

Pieni boonus: oikeistolaisessa maailmankuvassa yritykset eivät muuta tee, kuin katso yksikkötyökustannuksia ja globaalinen pääoma liikkuu aina sinne, missä ne ovat pienempiä. Samaiset ihmiset kuitenkin väittävät vakavissaan, että yritykset eivät tee kaikkeansa vähentääkseen näitä yksikkötyökustannuksia tekoälyn voimin, vaan kehittävät jatkuvasti lisää sellaista työtä, johon tarvitaan juuri ihmisiä.",5,17,https://www.reddit.com/r/Suomi/comments/1rvbe25/tekoäly_teknologinen_työttömyys/,https://www.reddit.com/r/Suomi/comments/1rvbe25/tekoäly_teknologinen_työttömyys/,1773672221.0,2026-03-16 14:43:41,dulcetcigarettes,1rvbe25
EI,askberliners,Looking for a restaurant in Berlin that serves a very specific Chinese dish (金丝爆豆) pls help,"For weeks I’ve been craving a dish I had at a restaurant in NRW. With a lot of detective work I’ve found the Chinese name: 金丝爆豆 (or something like it?). It’s basically a  “salad” with fried potato sticks, peanuts, onions, cilantro and a sugary, sour, salty, spicy sauce. Maybe the swarm intelligence of Reddit can help me finally to satisfy my craving? ",6,4,https://i.redd.it/pf7tip6v5fpg1.jpeg,https://www.reddit.com/r/askberliners/comments/1rvbcny/looking_for_a_restaurant_in_berlin_that_serves_a/,1773672131.0,2026-03-16 14:42:11,Brunobebe,1rvbcny
EI,PlasticModelKits,Question: Selling Kits,"Hi! I have many kits that are partially built and I really need to downsize. Any advice on the best way to sell them? 

So far I've tried FB marketplace with a big discount but no luck... ",1,2,https://i.redd.it/ldw975ik5fpg1.jpeg,https://www.reddit.com/r/PlasticModelKits/comments/1rvbb03/question_selling_kits/,1773672027.0,2026-03-16 14:40:27,bruhhcat,1rvbb03
EI,sportscardsforsale,$12 baseball lot! Machado is an image variation :),,0,0,https://i.redd.it/3am3u5s75fpg1.jpeg,https://www.reddit.com/r/sportscardsforsale/comments/1rvb93m/12_baseball_lot_machado_is_an_image_variation/,1773671909.0,2026-03-16 14:38:29,Chenoea93,1rvb93m
EI,Wera,[NTD] They have gathered to welcome a new family member,,11,0,https://i.redd.it/sfd5ylwc4fpg1.jpeg,https://www.reddit.com/r/Wera/comments/1rvb92o/ntd_they_have_gathered_to_welcome_a_new_family/,1773671907.0,2026-03-16 14:38:27,vs40at,1rvb92o
EI,snappijuorutofftopic,Mielenterveys tw,"Heips, halusin tulla tänne avautuu vähä, ehkä se helpottaa oloa

Oon siis jo 3v kohta kärsiny mt ongelmista. Mulla diagnosoitiin ahdistuneisuushäiriö ja sit samalla paniikkihäiriö. Sain lääkkeet ahdistuneisuushäiriöön (sertaliiniä syön joka päivä ja ketipinoria otan aina tarvittaessa, niinkuin määrätty), ja osastolla oon ton 3 vuoden aikana ollu 2 kertaa. Oon siis sellane joka pitää kaiken sisällää, ja aina se joka esittää että kaikki ois fine,vaikka oikeesti käyn pään sisäl kaikkee läpi. Ja mulla aina ollu tosi vaikee puhua mun ongelmista, entiiä mitä siinä pelkään? Ehkä että oon epäonnistunu, ja oon saanu monee kertaa kuulla sitä että ei ois susta uskonu tms. Oon siis parikymppinen,  ja tuntuu et mun pitäs osata toimia näissä tilanteissa ja hankkia lisääapua. Mutta samalla mietin tosi paljon mun vanhempia, oon niiden kans varsinki äidin kanssa tosi läheinen, ja se on joutunu kattoo aiemmat vuodet kui pohjalla oon ollu ja se on ollu iha avuton mun kanssa. Nii jotenki läheisille puhuminen on vaikeeta,kavereille puhun jonkin verran ku he käy pikkase samoja asioita mun kanssa läpi.  Noin vähä yli vuos sitte kesällä mulla oli nii paha olla enkä nähny muuta ratkasua ku yrittää im. No siinä en ikävä kyllä onnistunu ja laitettii sit osatohoitoo koko kesäksi. Ja jouduin 4 vuotta sitte raiskauksen kohteeksi, siitä kyllä läheiset tietoisia, mutta esim ku olin osastolla en uskaltanu kertoa, mua kaduttaa se vieläki, ja se edellee tänä päivänä vaikuttaa muhun,samoiten ku lapsuuden traumat ja paljon muut jutut. Viimene kolaus oli se ku erosin yli 2 vuoden suhteesta aika vasta , tuntuu et oon vaa aivan hukassa enkä osaa elää elämää ilman toista. Mulla jatkuvasti paha olla, töihi meneminen tuntuu iha hirveeltä, mut pakolla pakotan itteni sinne menemään. Sit ku palaan kotia yksin, sama paska vaa taas alkaa, ahdistaa iha sikana,tekis mieli satuttaa itteään tai vetää vaa yliannostus. Mut tiedän etten pystyis itteään tappamaan, koska tavallaa haluan elää mut sit samaa aikaa en jaksa. Mua jotenki hävettää et voin näin huonosti, vaikka tiiän ettei se oo mun vika eikä tarvi hävetä . Oon miettiny et soittaisin vaikka päivystyksee tai johoki, ja kertoisin rehellisesti kui loppu oon ja mitä kaikkee pään sisällä käyn läpi ja mietin. Mut jotenki mun mieli vaa sanoo että ÄLÄ soita pärjäät kyllä.  Tuntuu et kohta oon vaa iha loppu  ja en jaksa yhtää mitää..

Entiiä  mitä tällä kirjotuksella haen takaa, mut toivon et jos joku joka tätä lukee kärsis tai on kokenu vastaavaa tilannetta, nii miten ootte toiminu tai mitä ootte ylipäätää tehny. Toivon ettei tää sais ilkeitä kommentteja, ku tää oli tosi vaikee ylipäätää ees kirjottaa tänne. :/",1,1,https://www.reddit.com/r/snappijuorutofftopic/comments/1rvb717/mielenterveys_tw/,https://www.reddit.com/r/snappijuorutofftopic/comments/1rvb717/mielenterveys_tw/,1773671784.0,2026-03-16 14:36:24,Least_Service9398,1rvb717
EI,Hair_Transplants,Hairline design feedback and crown density,"Well, my time has come. Tomorrow I have my surgery with Dr. Ratchathorn of Absolute Hair Clinic.

I just finished my pre-op consultation. I have a few questions for you guys:

\- Would you change anything about the placement of the hairline?

\- Would you change anything about the distribution of grafts between the frontal, mid and crown section?

\- We estimated a density for the frontal third of 45cm2. Will that be dense enough to look similar to native hair?

\- We estimated a density of 20-25cm2. This will not look like native. On a scale of 1-10, 1 being bald and 10 being native density, how bald will that look?

Thank you for taking the time to respond. Would mean a lot to me. Pretty nervous about the whole ordeal.",2,0,https://www.reddit.com/gallery/1rvb4u2,https://www.reddit.com/r/Hair_Transplants/comments/1rvb4u2/hairline_design_feedback_and_crown_density/,1773671647.0,2026-03-16 14:34:07,HT-Journey-NL,1rvb4u2
EI,CHAMANISMO,🔥El Poder de NO Justificarse - Maquiavelo,,1,0,https://youtube.com/watch?v=n6g3wUl_wJ0&si=ILKneZz_eRmBCdWU,https://www.reddit.com/r/CHAMANISMO/comments/1rvb3po/el_poder_de_no_justificarse_maquiavelo/,1773671578.0,2026-03-16 14:32:58,pensarlibre,1rvb3po
EI,snappijuorut,Lassi,Lassia ei saa onnitella😂,23,12,https://v.redd.it/g7ktjwoz3fpg1,https://www.reddit.com/r/snappijuorut/comments/1rvb2iz/lassi/,1773671503.0,2026-03-16 14:31:43,Organic-Variation918,1rvb2iz
EI,LeagueOfMemes,"Okay Riot, Stop trolling me in Mayhem pls with these augments",,0,4,https://i.redd.it/rehjb3yn3fpg1.png,https://www.reddit.com/r/LeagueOfMemes/comments/1rvb0td/okay_riot_stop_trolling_me_in_mayhem_pls_with/,1773671396.0,2026-03-16 14:29:56,__Blues__,1rvb0td
EI,Tampere,Tampere Taco - Info,"Joku kyseli joskus että mistä saa Tampereella meksikolaista ruokaa. Aattelin jakaa informatiivisessa mielessä, ei mainoksena

https://facebook.com/events/s/bad-hompres-pop-up/1628564544844020/",4,5,https://www.reddit.com/r/Tampere/comments/1rvazc4/tampere_taco_info/,https://www.reddit.com/r/Tampere/comments/1rvazc4/tampere_taco_info/,1773671306.0,2026-03-16 14:28:26,OttoAbnormal,1rvazc4
