bank,subreddit,title,selftext,score,num_comments,url,permalink,created_utc,created_date,author,id
ENBD,UAE,"Unable to sign in Al Hilal, ENBD & Emirates Islamic app","Is anyone facing issues with logging in the bank apps? While trying it says wrong credentials or you are not eligible. While resetting password it is showing wrong DOB or card number.

Any suggestions on how to resolve this?",0,4,https://www.reddit.com/r/UAE/comments/1rwtgws/unable_to_sign_in_al_hilal_enbd_emirates_islamic/,https://www.reddit.com/r/UAE/comments/1rwtgws/unable_to_sign_in_al_hilal_enbd_emirates_islamic/,1773806284.0,2026-03-18 03:58:04,Ok-Thought1191,1rwtgws
ENBD,UAE,Talabat credit card got rejected and approved later,"Recently, I have applied my first talabat credit card and my application got rejected three times in a row when I contact the bank, they ask the salary account from which bank, which is Mashreq  my case so they informed that ADCB is unable to verify salary transaction of Mashreq due to internal issues, even though the salary is more than 5K so I have shifted my salary to ENBD for a month and application got approved instantly my advice to you if you want to apply credit card use the below for benefit for both or text me. I can help youout you can get 80,000 TouchPoints,Use ZAYO6ZVW4 or click on link

https://www.adcb.com/mib/general/member-get-member?Promocode=ZAYO6ZVW4",0,0,https://www.reddit.com/r/UAE/comments/1rwhvqx/talabat_credit_card_got_rejected_and_approved/,https://www.reddit.com/r/UAE/comments/1rwhvqx/talabat_credit_card_got_rejected_and_approved/,1773778210.0,2026-03-17 20:10:10,im_zayaan,1rwhvqx
ENBD,3Dprinting,Help: Odd Top Layer Issue,"I have a [Folger Tech Prusa i3 RepRap](https://www.treatstock.com/machines/item/194-folgertech-2020-i3) desktop 3d printer that I have had since \~2016. I have slowly been tinkering with and tweaking my slicer settings and the officially released [Marlin Firmware](https://drive.google.com/drive/u/0/folders/0B9b1NbuMK524fldIWWVCa0xfSXAtZmttcDhrbjBMeFNWcENBdVUzWnhtWDZ2YWdHVXpoUXM?resourcekey=0-f1LaECCF6osAy1Ac0SYnWg) that came with the build, and now I have it to where it can print D&D minis at decent resolution. However, there is one issue that I have never been able to solve: the printer gives up right at the end of printing the top layer if the top layer is flat. This doesn't happen on other solid layers or curved surfaces (perhaps because the layers get small and other settings override the normal print settings?), just flat top layers. I have tried everything I can think of to fix it, but I have never seen anyone else with the same issue and AI has been no help either. I have tried adding custom Gcode to the end of a print just to trick the printer into thinking it is still going, but whether by my own lack of skill with Gcode or some other cause, that did not solve it either. I would appreciate any and all help with regards to this strange issue.

[One of my earliest prints: a cord bundle holder for my headphones. Note how the bottom right  portion of the peg is unfinished.](https://preview.redd.it/xdtf4q63wnpg1.jpg?width=3072&format=pjpg&auto=webp&s=843a2a2bb41482511d8372430e2bbade7c0a972e)

[Most recent 3d print: a mahjong tile. Bottom left is unfinished.](https://preview.redd.it/y54fxq63wnpg1.jpg?width=3072&format=pjpg&auto=webp&s=48c83aad0a758132a62e743217c2119aec54d6f7)

[One of my largest prints. Bottom left region of top layer \(the curved piece is an insert\) is unfinished.](https://preview.redd.it/9z5g5r63wnpg1.jpg?width=3072&format=pjpg&auto=webp&s=0a67b3cb4e8a40dce16f27c6385d289f3419b427)

",1,2,https://www.reddit.com/r/3Dprinting/comments/1rwhsq5/help_odd_top_layer_issue/,https://www.reddit.com/r/3Dprinting/comments/1rwhsq5/help_odd_top_layer_issue/,1773778034.0,2026-03-17 20:07:14,Alert_Pin_2056,1rwhsq5
ADCB,Hasan_Piker,"I live just a few minutes from Dubai Airport, and my whole bed was shaking from what sounded like around 20 missiles launched by Iran 10 minutes ago, i think all were intercepted but the shockwaves from the explosions are so damn scary",,179,28,https://i.redd.it/0jif1okcjopg1.jpeg,https://www.reddit.com/r/Hasan_Piker/comments/1rwl9oc/i_live_just_a_few_minutes_from_dubai_airport_and/,1773785625.0,2026-03-17 22:13:45,LumpyAnalyst,1rwl9oc
ADIB,Bolehland,We Malaysians getting evil day by day,"Why such evil behaviour, wishing for the plane crash?",26,42,https://www.reddit.com/gallery/1rx3l8j,https://www.reddit.com/r/Bolehland/comments/1rx3l8j/we_malaysians_getting_evil_day_by_day/,1773839730.0,2026-03-18 13:15:30,Venkie2Maybach,1rx3l8j
ADIB,u_Logical_Lab_494,What to Look for in the Best Bank in UAE,"Finding the [**best bank in UAE**](https://www.adib.ae/) starts with understanding your needs. Discover important factors such as account flexibility, online banking, service quality, and financial tools that can help you manage your money better.",1,0,https://www.reddit.com/r/u_Logical_Lab_494/comments/1rwy1bz/what_to_look_for_in_the_best_bank_in_uae/,https://www.reddit.com/r/u_Logical_Lab_494/comments/1rwy1bz/what_to_look_for_in_the_best_bank_in_uae/,1773822017.0,2026-03-18 08:20:17,Logical_Lab_494,1rwy1bz
EI,BeautyViners,Vine self care,On day 5 in the hospital with my 4yo and I decided to do a vine mask to pamper myself. At that very moment the doctor came in to talk so got to have a serious convo looking like that one gif from the office 😅. Btw loving the ckd face wash and d’alba spray (still have to write this review). The tooth tabs and face lotion are also vine ,8,2,https://i.redd.it/tbf9zc3ysupg1.jpeg,https://www.reddit.com/r/BeautyViners/comments/1rxdcpn/vine_self_care/,1773861494.0,2026-03-18 19:18:14,yardie-takingupspace,1rxdcpn
EI,snappisensuroimat0n,Kenenkään ei pitäis joutua pelkäämään käydä kaupassa.,"Musta tuntuu, että Lassi ei oikein itsekään tiedä, mitä välillä puhuu kehitysvamman takia, ja hakee selvästi hyväksyntää muilta päästäkseen porukkaan. **(Kaikkea ei kuitenkaan voi laittaa vamman piikkiin ja se ei silti poista vastuuta omista teoista!!)** Väkivalta ei silti ole koskaan ratkaisu, eikä kenenkään pitäisi joutua pelkäämään kotoa poistumista tai kaupassa käymistä.",17,4,https://www.reddit.com/r/snappisensuroimat0n/comments/1rxdc7k/kenenkään_ei_pitäis_joutua_pelkäämään_käydä/,https://www.reddit.com/r/snappisensuroimat0n/comments/1rxdc7k/kenenkään_ei_pitäis_joutua_pelkäämään_käydä/,1773861464.0,2026-03-18 19:17:44,cprincessa,1rxdc7k
EI,WeissSchwarz,Bonney manga Trade for higher end sps,"Looking to trade my Bonney manga for a higher end sp from azur lane 1/2 or NIKKE.

**(Preferably New Jersey sp vol 2)**",1,0,https://i.redd.it/rt20kc6usupg1.jpeg,https://www.reddit.com/r/WeissSchwarz/comments/1rxdc3t/bonney_manga_trade_for_higher_end_sps/,1773861458.0,2026-03-18 19:17:38,Usual_Bluejay_3889,1rxdc3t
EI,snappijuorutofftopic,Moppiasiaa!,"Suositelkaa mulle oikeesti hyvää moppia mikä ei levitä sitä likaa ympäriinsä! Mulla on ollut semmonen spray moppi, ja itsellä koira talous niin karvaa ja pihalta tassuista tullut kuraa on pitkin ja poikin lattioita… olen miettinyt sellaista turbo Smart mutta siitäkin oli niin ristiriitaisia mielipiteitä. Mietin kanssa sähkömoppia sitä Philips one up 5000, mutta siitäkin oli huonoja arvosteluja sillä pitäisi kuulemma viruttaa välillä…",1,4,https://www.reddit.com/r/snappijuorutofftopic/comments/1rxdbp7/moppiasiaa/,https://www.reddit.com/r/snappijuorutofftopic/comments/1rxdbp7/moppiasiaa/,1773861431.0,2026-03-18 19:17:11,Middle-Visual-694,1rxdbp7
EI,NovelNewsOnly,Please help find a free link for this novel!,,1,1,https://www.reddit.com/gallery/1rxdbh2,https://www.reddit.com/r/NovelNewsOnly/comments/1rxdbh2/please_help_find_a_free_link_for_this_novel/,1773861418.0,2026-03-18 19:16:58,Desperate_Breath2710,1rxdbh2
EI,YourGoodNovelFix,Please help me find a free link for this novel!,,1,0,https://www.reddit.com/gallery/1rxd9wo,https://www.reddit.com/r/YourGoodNovelFix/comments/1rxd9wo/please_help_me_find_a_free_link_for_this_novel/,1773861326.0,2026-03-18 19:15:26,Desperate_Breath2710,1rxd9wo
EI,imaginarymapscj,Japanes Central America and South America and Caribbean.,,2,1,https://www.reddit.com/gallery/1rxd8py,https://www.reddit.com/r/imaginarymapscj/comments/1rxd8py/japanes_central_america_and_south_america_and/,1773861259.0,2026-03-18 19:14:19,Fuzzy-Panda-7818,1rxd8py
EI,PrimeiraLiga,Já são conhecidos os árbitros da 27.ª jornada da Liga Betclic: António Nobre no Sp. Braga-FC Porto - Arbitragem - Jornal Record,"Eis os árbitros nomeados:

Benfica-V. Guimarães

Árbitro: Luís Godinho
Assistentes: Rui Teixeira e Gonçalo Freire
4.º árbitro: Luís Filipe
VAR: Manuel Mota
AVAR: Paulo Miranda

Sp. Braga-FC Porto

Árbitro: António Nobre
Assistentes: Nélson Pereira e Francisco Pereira
4.º árbitro: Gustavo Correia
VAR: Tiago Martins
AVAR: Pedro Mota

Alverca-Sporting

Árbitro: João Pinheiro
Assistentes: Bruno Jesus e Luciano Maia
4.º árbitro: Bruno Vieira
VAR: João Malheiro Pinto
AVAR: Pedro Sancho",1,1,https://www.record.pt/futebol/arbitragem/detalhe/ja-sao-conhecidos-os-arbitros-da-27-jornada-da-liga-betclic-antonio-nobre-no-sp-braga-fc-porto,https://www.reddit.com/r/PrimeiraLiga/comments/1rxd8f0/já_são_conhecidos_os_árbitros_da_27ª_jornada_da/,1773861241.0,2026-03-18 19:14:01,AloneInTheDark321,1rxd8f0
EI,PharsaphobiaROBLOX,Susie Skin for burning,"I WILL NOT REST UNTIL WE HAVE A COUPLE UT/DR SKINS!  
[kris where the hell are we](https://ultraabox.github.io/#u5N0AKris%20where%20the%20hell%20are%20wenc01s0k42l0ie0Ct2wa7g0Uj0jr1Okk48kk0OU00000000000000000000000000i20000011000000o344455253333T7v0ou07f020o515500q070Oa4ad040H_SJ5JJFAAAkAAAh8IcE0c0T5v0oua0f060m92hc1ea2k02f30re00q8740O07ad370H_QiBy9asq99900h0E0c0T1v0wu01f173q875eaE00Oa3ed230A0F0B9Q4444Pe850R0000E2c06257cT0v0hu00f1a0q472V0O039d040wr1h0y00000000000010000000E3c0070702T7v0zu07f030t71772f500qEL041990l62d12g90010700O03ad040HT-SRJJJJIAAAAAh0IaE5c0c11c27c3700b2T0v0lu00f0000q050kc0d0a0wp1h0y10000oz8000oOZ000000E1701aT0v0lu00f0000q051gc0d0a0wq1h0y10000kXJ000l0-000000E1701aT0v0uu00f0000qg4000ad040wv1h0y00000000000EO1000000E0c0T0v0uu00f0000qg401Aad040ww1h0y00000000000EO1000000E0c0T0v0Kui3f0000q040O0d030ws1h0y000000000003zX000000E0c0T0v0Lu00f0000q050O02d0a0wD1h0y5000000000031X000000E0c0T0v0yu00f0000q041dad0a0wA1h0y500000000000yE000000E0c0T0v0yu00f0000q041dad040wB1h0y500000000005VH000000E0c0T0v0xu00f0000q040rcd040wu1h0y50000000000vXj000000E0c0Tav0pu0af0000q00d040E0c0b2c8Mz2c8Mz2c8My248wx248gx248hA6gp1Bct2lbkJiRcqVU0000000000000000000000000000sgh144o000gF2AagM000000004gO54cxg14cxg000000csy000000000000000000000000000000xAa000y600000000y60004aoVM000008iFqM00000w408xA28p000000y6g8yC0003EiFq6dq007fx6jVQE000000000000000000020g1w80o0000000000000000000000000000000000000248wx248gx248hA6gp1Bct2lbkJiRcqVU00000000000004ggx648gx24924agx248gFw4agx248gFw0248k8gw8gxgx200248wx248gz0012BaoFiD0012BaoFiD000x24gx2248h24808x268gx248g000000000000000000000000036co8gxcoNw028gMy488x28gxi48gx2500xi48gx25000000000000000000g044001000g06400100og16400100og000000000000000y248Mx248gx8gxi48gx37g0xi48gx37g00p2THFAuIpoKaAQkMJg9cnkSkWrgbxxSBaqy5NhFyWBaj5FnNcnBFVIFTBkbCCODjq1sbWg0rSUn5eqkFcmBKYNvfTfrkV-5PjpjFJ0KeXiBd-5NjCBaj5Fo_clJDjWsFQ5FAuozb5QHSj5SGCjDjarjqkFJazj5RakCbnzeUL6-2piD39kOBapjqretdFkUFiANmSbFPC2P2-ueusJOxkOAWpjqrit1tDAVj5VDbvhu4ZJiT2ZjakFBdFJakSBjyB0FyQpjCbUMUJiD6qCiDjaqMriBdgGdczRakDiTKtuR6kmIyyMArjcnlJfzj8dqe9xlm2twGp7GCmbKiKC5G19yWCQDjq19AuotFiCU2UFUiDitb7pJcFTcnGQO_rLPjrcnvLtbSoJv7NYYfoDUp2YaritdE5UZSBarsbyDzat9QKuDU-NuLxK-ZdcNtmAJIIzRWnwk0vAKYvlVUY2YqratdE5VbXiBdO5NhFyWBaj5F01P5V_PrW7agnddBeCQ2UnQw0TJMKasQFioJbtVy-vKuSFPYbCCODjq1stSBarYbyDdakCbiN-oHreDQVjEbj8YN6mbFnICbJlcDeCkSCQFjql6CbGkFcmL6tNudY4OBe6iFBakOCQSsWriFNiB9yJInjDc5C5YYsYVrB2FB9QOCQSAW2Xf9OCbPem-yY9XqBK5WCkFjarjqkFJaD5a1j5EODcnNxNqBecRcBeCkRwSBaqxkqp7GkFeBLsWZGcEJp55x8SCoKHqv6CgqQsj2GI4X1kOflcInsBtcbk2j5RdFeCQ2j8YMXiBdM5NjMBeAWmePqpjKoLlFB-TvCCSoK_uWnINq-fzVUuNfMO5UkSAWrgbNXJakSUn5f6kWjFsZfNZyZv3tZWqpyWJ9rpp7ERLlzvizEutwJcWvcEUcQxf8lFDB-5C4IqpvFP1lJcFQHF1SCsHAGkVA0gS3gIulqpKWJFWJcWvvTKyXbMfGI_osjC2JVBt8bQBiw6g03od2NVnGJFWZcfMq92vwg04WtK1HVu191k4kQIwQF9xo89cnhFCXEkNtaFlAqZ6AFGUK0ECbG2GUmByV6aomy4CoKyFFp1xsumgLafOxYIRH5CLhFumqulhsNtcbo2jcn84qoKECHEXFB-xkOflQVtRHUjERqRyPhPcYQby4sVT4zX_iQBuLmj8Z5cnjFQGoJwldngS4T0wbFZesZtAqp7EQGqpjGlANt6AhRNldn5SEFyXaCNVEWkF6ChWZuGCkWRtcnhF4tcljlNtCLn4P5TidcnkjlQZYOISrap7EFyWteBj5H2FGW6hldneDQbw0jPJcn8FGU8aCnW5j8Zn8OkRsn8Rj5QWdmR8Od709VUn48UwCoKyhFyVaBFaZuIChWaoKDjFkNr0GqKxIljlPnQd6Lj5Rlm0GRbBW_lFlqda6HlXlqRnFSqaNxqmBA62gzRyJkFB-MXVh5mdbiQIwM4UNURpHFBeGCsvH9yWeEFRbJKFlKQGtmBnGRqBKPrIkGB5n2QIzSGFAuzhFQODh9DaWhQZcnnlbdeFmJgdmBlEQEiJnwaR-LjIQlz2QJb8c1OfByJkFB-Mj5Ta8GNFqmBA6ZecudmqWpjGFD7WOoKzGatiXrGlrJaDlFlWJmFrISX5aFhlMJb8ZGGp7EQqtcFQipOKAte096CbCy1Igk3q5EyQ1kOD1QAOfkwtHh5ABsCRswRQaCHD4W4puCq-hJiBcniHRXlAmybg5kRszQt9BeT0FyU2ybj5Oyp7GQPzZ6nZSFiDL5yDjG2Qhq0GpjGSaWoKN0yM0Khj8ZaHASNVGqt9TYFj5Ol6Dkw1q8KMkQIwM82oKRrJM5omMaIomBFp1JEhUTmHQO_oufG8GNFqmBA60D6f5b5rOGCsvH9yWeEFRbJGZmIlWBqHoHkGtGLsHQGB5jlOfqGChWd6DopjEPk4S6hWcsBaD79hOe66sHGNFyXazpJlaZCTlFlqdaZmHSGROLjIQlz2QJb8dLQkOfoHlaoKKFRHtyFpJQGtmBsGRqBGPqIkGB5n2QIzSGFAuzhFQODh9DaWhQYFj5SqlmRv5EyFAuwFFp1wg4NtC0ITWMJwloMJbiO38syChXtqLjbZwCbLQhlziQJb8d-soYkIlAODljefRANt7kkWBSRuHmaZiJlIlGleRnKlWliyFGV7Jlj8Z6zjIcFQpG2r38Z6eiBjzAEV733elRoQNtBhISGBuPrGQGJ6BuHlXlqVnFSqaNxqmBA6TWap7IlGBcnnkWRKNkISWleHiKlqJiRpJmaliyHxqmhXlkOfhEQWpjEAPBt8WutOCbCqL1gdAmyaChW61AsFGRqJiGsjkGlaBgmyaFFp1A8FyWN7j8ZshMh70ySxoaFgG4s2aCkWKiBeVGkGtoUCFkGlawJ4nx2en8M00FAuwj5QAMJ8b9kIA5GKAeFxpbpkpn23rxpaBAwJRJZj2Omxg6GPuS2Olb91rDtrIb9rayCtfGQOf8ANthcb91paBAwJBIJA5AJBhJpvtxpaBAwJBIJA5AJxiRCpSgmiFp8bprbp1pbpkrKtSgmiFp8bprbp1pbpkt9AWBaBiPmrJkIBhJpfcVmTCcBqFQXJ6Bjd7h9CXF9BeKCnWOpyXuhYQsQVFNdczQANtuLnHladDD62Fxp8b9kIA5JJ4R4b9razrPuT2Olb91qzJZh2OmXJWHdXob9kIA5KtRKMIBIGapQ-Hj8ZMCbG9xrEmiFp8bprbp1pbpkrmnTomiFp8bprbp1pbokJpCtA5AGmi2SmOSgmiSl6XDtA5AGmi2SmOSgmiSl7ipeFiFkIRCXlb9krmjPelJVz9mGteXhFkPhQipKWipjHFB-ICoKTAvd7deqsjYF9yWZuLmGkqn8zPI5czPc8W0J0mxgEk2ewbg5Eka6w8W0J0mxgE9yW52xg5Eka1HYw8W0J0mxgE9B-wsvEa52xgEka6wEka2pjEka538q0YL0096yhGipjE8OK0Ghj8r3o4v4dxI1u8r3oid8mg5S2h78sMj5Qa52wtf8-UsMXwbP3or0zUxIdwbN3C52xgDBZ2xgEiZcLQ2-wnQ2-xbW1vgbW1uCbEka52nV0LO52xgefEka52hZMXxT0nK6MS17N3or0ny6MS005czQx7g5E2Qa51cngEka0J2xgduhQa0J2whQ1kODgbYxg5Ek2ewbA2ehV2wbgE4t0n87pOf8k1q50zE2V0LO50mxg8W0Kg8M00BWoKAhFAuwbA1sxgE4ug8YwbA1sxgQ17A2f82V0n8ka17A2f82V0n8kd0hV0zO0Kg5O50WuhQ2ewhQ2ewhQ2ewhQ2ex8W17g8W17geDB-g8YwbA1sxgE4ug8YwbA1sxg00apWfF9QWpQ-xeDjata0w81cLM00087_WwK4gk1AG4t0bg2Qa52w8W0mw5Eka03g2ew5E1q52wEex5chAxgEk0J2xg6NO0hQ0J0bgEka0VPg2ew8W0zE2ew8W0zE2ew9d08W0zE2ew8W0mw5E1q0mw9d08W0zE2ew8W0zE2ew8W0AQ0zE2ew8W0zE1q0mw5E1q0AQ0YY00|https://file.garden/aPp0sOiXOW2r36cc/Piano%202%20-%20001.wav|https://file.garden/aPp0sOiXOW2r36cc/Piano%203%20-%20002.wav|https://file.garden/aPp0sOiXOW2r36cc/PC98%20rude%20buster%20guitar|!p!https://file.garden/aPp0sOiXOW2r36cc/powerkickL|!p!https://file.garden/aPp0sOiXOW2r36cc/powersnare%20L|!p!https://file.garden/aPp0sOiXOW2r36cc/GS%20HIP%20HOP%20-%20909%20Cr%20cym.wav|!r48!https://file.garden/aPp0sOiXOW2r36cc/korgslap%20L|!r48!https://file.garden/aPp0sOiXOW2r36cc/korgslap%20R|!p!https://file.garden/aPp0sOiXOW2r36cc/GS%20HIP%20HOP%20-%20909%20kick%202.wav|!p!https://file.garden/ZRCk3b561lnfW8rp/TR-808%20-%20Elect%20sn2(L).wav|!p!https://file.garden/ZRCk3b561lnfW8rp/TR-808%20-%20Elect%20sn2(R).wav|!p!https://file.garden/aPp0sOiXOW2r36cc/GS%20HIP%20HOP%20-%20909%20Closed%20HH2.wav|!p!https://file.garden/aPp0sOiXOW2r36cc/GS%20HIP%20HOP%20-%20909%20Opened%20HH.wav|!p!https://file.garden/aPp0sOiXOW2r36cc/sc55%20clap|!p!https://file.garden/aPp0sOiXOW2r36cc/sc55%20fat%20snare)",1,0,https://www.reddit.com/gallery/1rxd46a,https://www.reddit.com/r/PharsaphobiaROBLOX/comments/1rxd46a/susie_skin_for_burning/,1773860989.0,2026-03-18 19:09:49,Lanky-Raspberry1203,1rxd46a
EI,bugs,[Android] app automatically shows as device language (version 2026.11.0),,1,0,https://www.reddit.com/gallery/1rxd3ae,https://www.reddit.com/r/bugs/comments/1rxd3ae/android_app_automatically_shows_as_device/,1773860935.0,2026-03-18 19:08:55,Niksu95,1rxd3ae
EI,luftablassen,WARUM BIN ICH SO PEINLICH,"Mein Kassierer und ich haben immer kurz Smalltalk und jedes Mal freue ich mich ihn zu sehen und er sich auch.

Heute war ich ausnahmsweise mal geschminkt & er hat mich einfach nicht erkannt.

Wollte aber trotzdem kurz schnacken. 
Also hab ich ihn angesprochen „Können Sie mir sagen wo das Rindfleisch ist.“ 

Dann hat er mich erkannt, wir haben unseren wöchentlichen smalltalk gehalten & er meinte dann „du musst mich nicht siezen gell.“


WIESO BIN ICH SO CRINGEEEEEEEE WIESO SIEZE ICH IHN

Aber wir haben von beiden Seiten aus immer so Mega akward Smalltalk Situationen. Und denken sicher beide jetzt noch stundenlang drüber nach.
Eig will ich ihn nur mal nach der Schicht abpassen und zusammen ein Eis essen. Er ist einfach so ein lieber. Aber weil ich absolut unfähig bin Beziehungen zu führen wird’s am Ende eh nichts und es fickt mich so ab 😭😭😭😭",3,5,https://www.reddit.com/r/luftablassen/comments/1rxd2tu/warum_bin_ich_so_peinlich/,https://www.reddit.com/r/luftablassen/comments/1rxd2tu/warum_bin_ich_so_peinlich/,1773860909.0,2026-03-18 19:08:29,Active_One3955,1rxd2tu
EI,Burberry,Legit check,"Need some help verifying if this coat is legit, authentic or not",1,1,https://www.reddit.com/gallery/1rxd24s,https://www.reddit.com/r/Burberry/comments/1rxd24s/legit_check/,1773860869.0,2026-03-18 19:07:49,hxllxw_,1rxd24s
EI,bluraycollection,Complete Vestron Video Collectors Series 37/37,"Hey all! As my very first Reddit post, here’s a sexy little snapshot of my complete Vestron Video Collectors Series from Lionsgate.

So many great titles, I’d say some of my favorites are Dagon, Chopping Mall, Slaughter High, Extreme Prejudice, May, but you really can’t go wrong here.

Who else is a fan?",2,0,https://i.redd.it/y9s68y51rupg1.jpeg,https://www.reddit.com/r/bluraycollection/comments/1rxd1ty/complete_vestron_video_collectors_series_3737/,1773860849.0,2026-03-18 19:07:29,MarcsMovieVault,1rxd1ty
EI,pchelp,Help fixing ASUS laptop,"I have an ASUS laptop with a constant black screen. This has been happening for a week or two and it usually comes back to life after a quick power reset but now it will not display anything on the screen (power is good, fans are spinning, keyboard is lit up). Below are details

ASUS TUF gaming laptop model: FX505DY

 

7ish years old

DIAGNOSTICS I TRIED: 

power reset (hold power button for 30 seconds then plug charger back in and turn on) NOTE:this worked the first 3 times and not anymore

Graphics card reset (windows+ctrl+shift+B)

Bios startup? (Power on while holding ctrl+R)

Checked screen light to ensure it’s on/max brightness

Plugged in HDMI cord to TV (HDMI was working with Xbox and once plugged into the laptop nothing displayed on the tv)

Drained the battery, opened the case, unplugged the battery, took both RAM sticks out and reseated them in each others spot, plugged battery back in.

NOTE: When this first started happening, it worked from simple power cycles and would work flawlessly for the whole day. I would turn the laptop off before bed and then again the same issue the next morning and now it’s not working at all.

QUESTIONS: 

Am I missing a crucial step on getting the screen on?

Is my GPU bad and need replacement even though it’s worked flawlessly all week when I was able to get the screen to display?

Bad screen? If so how to test?

I did notice a windows update one of the days it was working and just postponed it but that shouldnt so to speak update while blocking me from seeing anything on the laptop right?

Is there a way to check BIOS or whatever it is without HDMI nor screen working?

I don’t mind buying parts to fix as I don’t want to throw away a $1k laptop that was working 2 days ago but I clearly am unsure on how to go about further diagnostics. TIA for any information!",3,4,https://i.redd.it/ypmhngfwqupg1.jpeg,https://www.reddit.com/r/pchelp/comments/1rxd12n/help_fixing_asus_laptop/,1773860805.0,2026-03-18 19:06:45,KraZyy0237,1rxd12n
EI,w204,Water in fuse box causing weird issues,"No crank no start 

I had a esl issue replaced my eis as well

Anytime i connect the battery and insert the key i get all normal functions until i turn the key to the start position I hear a single click, dash goes dark and my washer fluid sprays until i disconnect the battery. When i popped the hood i noticed the fuse box cover had a crack in it. Popped it open and saw the washer fluid in it.

What are my options ",1,0,https://www.reddit.com/r/w204/comments/1rxd03j/water_in_fuse_box_causing_weird_issues/,https://www.reddit.com/r/w204/comments/1rxd03j/water_in_fuse_box_causing_weird_issues/,1773860746.0,2026-03-18 19:05:46,LeatherPay4599,1rxd03j
EI,AnimeAnonymous,Which anime from the upcoming season do you recommend watching?,,1,1,https://i.redd.it/taac0z2kqupg1.jpeg,https://www.reddit.com/r/AnimeAnonymous/comments/1rxcz48/which_anime_from_the_upcoming_season_do_you/,1773860690.0,2026-03-18 19:04:50,NikiLove16,1rxcz48
EI,fulbo,Una humilde interpretación musical de este honorable clásico de las tribunas del fulbo argentino (versión bostera en mi caso),,3,3,https://www.youtube.com/watch?v=W0EPWYoBxcU,https://www.reddit.com/r/fulbo/comments/1rxcyy1/una_humilde_interpretación_musical_de_este/,1773860681.0,2026-03-18 19:04:41,TheRealLardin,1rxcyy1
EI,banidinaplicatiiRO,900 LEI Bonus de Bun Venit: Raiffeisen (600 lei) și ING (300 lei) - Martie 2026,"Salutare! Dacă vrei să scapi de comisioane bancare și să primești bani cash direct în cont, ambele bănci mari din România au campanii masive de recomandare acum. Iată cum poți lua bonusurile:

 1. Raiffeisen Bank – 600 LEI Bonus Total

•⁠  ⁠100 LEI: Îi primești rapid dacă deschizi contul online + un cont de economii gratuit în aceeași lună.

•⁠  ⁠500 LEI: Primești câte 100 lei pe lună (timp de 5 luni) dacă faci minim 10 plăți cu cardul pe lună (orice sumă, chiar și o pâine).

\*   Link înscriere: [https://cloud.email.raiffeisen.ro/mgmp?=Y0w2bYfvzyVcg3ytO5lFDw%3d%3d](https://cloud.email.raiffeisen.ro/mgmp?=Y0w2bYfvzyVcg3ytO5lFDw%3d%3d)

 2. ING Bank – 300 LEI Bonus Total

•⁠  ⁠Pachetul Free@ING are zero comisioane de administrare și retragere .

•⁠  ⁠300 LEI: Primești câte 100 lei/lună în primele 3 luni .

•⁠  ⁠PAS CRITIC: După ce deschizi contul, intră în aplicația Home'Bank la secțiunea „Bazar” și rezervă oferta de bun venit. Apoi fă minim o plată lunară .

\*   Link înscriere: [http://ing.ro/lp/mgm-recomandare?code=biancac54593r](http://ing.ro/lp/mgm-recomandare?code=biancac54593r)

De ce merită ambele? Ambele bănci oferă comision 0 dacă încasezi venitul la ei sau faci plăți zilnice. Practic, ești plătit pentru cheltuielile pe care le-ai face oricum.

 Dacă aveți întrebări, scrieți-mi în privat!",1,0,https://www.reddit.com/r/banidinaplicatiiRO/comments/1rxcxfi/900_lei_bonus_de_bun_venit_raiffeisen_600_lei_și/,https://www.reddit.com/r/banidinaplicatiiRO/comments/1rxcxfi/900_lei_bonus_de_bun_venit_raiffeisen_600_lei_și/,1773860591.0,2026-03-18 19:03:11,KingDrEN,1rxcxfi
EI,dankindianmemes,W stats,,4,1,https://i.redd.it/vi711lt4qupg1.jpeg,https://www.reddit.com/r/dankindianmemes/comments/1rxcwop/w_stats/,1773860548.0,2026-03-18 19:02:28,notaprotagnist,1rxcwop
EI,HotWheels,Independance Blvd Va Beach 💥💥💥,came across Dave’ shop while grabbin coffee.  TT is fire irl.,2,0,https://i.redd.it/n1soqn8upupg1.jpeg,https://www.reddit.com/r/HotWheels/comments/1rxcuvn/independance_blvd_va_beach/,1773860450.0,2026-03-18 19:00:50,Busy_Professor_1124,1rxcuvn
